Subject,Band,SkillArea,ComponentText,Keywords
English,Level 6,Reading and Viewing,"When reading and viewing, students engage with a range of different types of texts for meaning.","engage,meaning,read,texts,view"
English,Level 6,Reading and Viewing,"They read by integrating phonic, morphemic and vocabulary knowledge; grammatical knowledge such as complex sentences and adverb groups; and knowledge of the multiple uses of commas.","knowledge,read,sentences,use,vocabulary"
English,Level 6,Reading and Viewing,"When demonstrating understanding of texts, students explore and compare characters and events, and information and ideas, from different historical, cultural or social contexts to build literal and inferred meanings.","build,compare,explore,ideas,information,meaning,texts,understand"
English,Level 6,Reading and Viewing,"They explain how different types of texts, both print and digital, adapt text structures and language features for specific purposes. They explain the effects of imagery and sound devices in texts. They explain how still images, moving images and sound create point of view.","adapt,create,explain,images,language,purpose,texts,view"
English,Level 6,Writing,"When creating written and spoken texts for specific purposes and audiences, students explore ideas and experiment with textual details from texts, and include appropriate multimodal elements. They edit their texts using an agreed set of criteria and explore editing choices.","audience,edit,experiment,explore,ideas,purpose,texts"
English,Level 6,Writing,"They use text structures, including repetition, to create sequence and cohesion, sentence structure to expand ideas, and punctuation to create clarity.","create,ideas,punctuation,use"
English,Level 6,Writing,"They use vivid, emotive vocabulary. They experiment with language features and literary devices.","experiment,language,use,vocabulary"
English,Level 6,Writing,"They write legibly and fluently for sustained periods. They spell new and technical words using phonic, morphemic and grammatical knowledge.","knowledge,words,write"
English,Level 7,Speaking and Listening,"When interacting with others, students explore specialist and technical vocabulary and use language to express social identities.","explore,express,interact,language,use,vocabulary"
English,Level 7,Speaking and Listening,"They discuss and present ideas, including about texts. They explore the language of evaluation and substantiation.","discuss,explore,ideas,language,present,texts"
English,Level 7,Speaking and Listening,"When speaking to an audience, students deliver structured spoken texts, selecting text types appropriate for purpose and audience, including multimodal or digital elements. They demonstrate an understanding of formal language and use appropriate features of voice.","audience,deliver,demonstrate,language,purpose,select,speak,texts,understand,use,voice"
English,Level 7,Reading and Viewing,"When reading and viewing, students engage with a range of different types of texts for meaning.","engage,meaning,read,texts,view"
English,Level 7,Reading and Viewing,"They engage with vocabulary and grammatical knowledge, and the ways that different sentence structures extend and explain ideas, how accurate use of tense creates clarity and how punctuation supports meaning.","create,engage,explain,ideas,knowledge,meaning,punctuation,use,vocabulary"
English,Level 7,Reading and Viewing,"When demonstrating understanding of texts, students explain ways that characters, settings and events combine and create meaning in texts from different historical, cultural or social contexts. They develop opinions about texts through explorations of how literary devices and language features, and still and moving images and sound, create characters, settings and events. They explain and summarise ideas drawn from texts.","create,develop,explain,ideas,images,language,meaning,texts,understand"
English,Level 7,Reading and Viewing,"They describe how texts, including print and digital, are structured for different purposes. They explain how literary devices create meaning and aesthetic qualities. They explore how perspective is created through still images, moving images and sound.","create,describe,explain,explore,images,meaning,purpose,texts"
English,Level 7,Writing,"When creating written and spoken texts, students convey ideas and information to a specific audience. They select textual details from texts appropriate for purpose, and include appropriate multimodal or digital elements. They review and edit their own and others’ texts and reflect on these processes.","audience,edit,ideas,information,purpose,reflect,review,select,texts,view"
English,Level 7,Writing,"They use text structures that build sequence and cohesion in a text; grammar, including sentence structures, to achieve clarity; and punctuation to support meaning.","build,grammar,meaning,punctuation,use"
English,Level 7,Writing,They use vocabulary that builds specialist and technical knowledge. They experiment with language features and literary devices they have encountered in texts.,"build,experiment,knowledge,language,texts,use,vocabulary"
English,Level 7,Writing,They use spelling rules and knowledge of word origins to spell unfamiliar words.,"knowledge,spelling,use,words"
English,Level 8,Speaking and Listening,"When interacting with others, students explore academic vocabulary and use language to support relationships and roles.","explore,interact,language,use,vocabulary"
English,Level 8,Speaking and Listening,They explore and challenge the various meanings in text through discussions with others. They explore rhetorical and literary devices when evaluating and substantiating.,"discuss,explore,meaning"
English,Level 8,Speaking and Listening,"When speaking to an audience, students deliver structured spoken texts, selecting text types appropriate for purpose and audience, including multimodal or digital elements. They use language to suit formal and informal contexts, and appropriate features of voice.","audience,deliver,language,purpose,select,speak,texts,use,voice"
English,Level 8,Reading and Viewing,"When reading and viewing, students engage with a range of different types of texts for meaning.","engage,meaning,read,texts,view"
English,Level 8,Reading and Viewing,"They engage with vocabulary and grammatical knowledge, and the ways that different clause structures add information, the effects of nominalisation and how punctuation supports meaning.","engage,information,knowledge,meaning,punctuation,use,vocabulary"
English,Level 8,Reading and Viewing,"When demonstrating understanding of texts, students identify and explain intertextual references, issues and points of view from diverse historical, cultural and social contexts. They explore opinions about texts through explorations of how literary devices and language features, and still and moving images and sound, influence the reader’s response to represented values. They analyse and evaluate the ways that ideas are organised in texts.","analyse,evaluate,explain,explore,ideas,identify,images,language,present,read,texts,understand,view"
English,Level 8,Reading and Viewing,"They explain how texts, including print, digital and hybrid, are structured for different purposes. They explore how literary devices, including imagery, create meaning and aesthetic qualities. They explore how still images, moving images and sound use intertextual references to create meaning.","create,explain,explore,images,meaning,purpose,texts,use"
English,Level 8,Writing,"When creating written and spoken texts, students select and expand on ideas and experiment with language features and literary devices for purpose and effect, and include appropriate multimodal or digital elements. They review and edit their own and others’ texts and reflect on these processes.","edit,experiment,ideas,language,purpose,reflect,review,select,texts,view"
English,Level 8,Writing,They use evidence and substantiation to create cohesion; structure to create sequence; grammar to add information and expand ideas; and punctuation to support meaning.,"create,grammar,ideas,information,meaning,punctuation,use"
English,Level 8,Writing,"They use vocabulary typical of academic texts, including nominalisation. They experiment with language features and literary devices for effect.","experiment,language,texts,use,vocabulary"
English,Level 8,Writing,They use spelling rules and word origins to learn and accurately spell new words.,"spelling,use,words"
English,Level 9,Speaking and Listening,"When interacting with others, students explore vocabulary of mood and style and use language to strengthen relationships and roles.","explore,interact,language,use,vocabulary"
English,Level 9,Speaking and Listening,They discuss opinions on texts. They use evaluative and substantiative language to express individual views.,"discuss,express,language,texts,use,view"
English,Level 9,Speaking and Listening,"When speaking to an audience, students deliver structured spoken texts, selecting text types appropriate for purpose and audience, including multimodal or digital elements. They demonstrate different levels of formality in their language choice and use appropriate features of voice.","audience,deliver,demonstrate,language,purpose,select,speak,texts,use,voice"
English,Level 9,Reading and Viewing,"When reading and viewing, students engage with a range of different types of texts for meaning.","engage,meaning,read,texts,view"
English,Level 9,Reading and Viewing,"They engage with vocabulary and grammatical knowledge, including the ways that sentence structures are varied for creative effect and how punctuation supports citation and reference.","engage,knowledge,punctuation,vocabulary"
English,Level 9,Reading and Viewing,"When demonstrating understanding of texts, students discuss their responses to texts from diverse historical, cultural and social contexts, and they compare initial and subsequent impressions. They explore different responses, including personal impressions. They analyse how language and/or still and moving images and sound represent values, beliefs and attitudes and are used to shape audiences’ preferences. They analyse the relationship between text structures, language features, literary devices and intertextual connections.","analyse,audience,compare,discuss,explore,images,language,preferences,present,texts,understand,use"
English,Level 9,Reading and Viewing,"They explore how authors adapt and experiment with texts, including print, digital and hybrid, according to purpose. They analyse how literary devices, including poetic features, create meaning and aesthetic qualities. They analyse how symbols in still and moving images, and sound effects, create meaning.","adapt,analyse,create,experiment,explore,images,meaning,purpose,texts"
English,Level 9,Writing,"When creating written and spoken texts, students present ideas through a point of view and/or a voice. They experiment with textual elements and include appropriate multimodal or digital elements. They review and edit their own and others’ texts for clarity and control and reflect on these processes.","edit,experiment,ideas,present,reflect,review,texts,view,voice"
English,Level 9,Writing,"They experiment with text structures for cohesion and sequence, vary grammar for creative effect and use punctuation to condense and link ideas.","experiment,grammar,ideas,punctuation,use,vary"
English,Level 9,Writing,"They use vocabulary that contributes to style, mood and tone. They use language features and literary devices to create hybrid texts.","create,language,texts,use,vocabulary"
English,Level 9,Writing,They explore standard and non-standard spelling for creative effect.,"explore,spelling"
English,Level 10,Speaking and Listening,"When interacting with others, students use an expanded vocabulary and distinguish inclusive and exclusive language.","interact,language,use,vocabulary"
English,Level 10,Speaking and Listening,They discuss and present opinions about texts. They explore language that reveals views and values.,"discuss,explore,language,present,texts,view"
English,Level 10,Speaking and Listening,"When speaking to an audience, students deliver structured spoken texts, selecting text types appropriate for purpose and audience, including multimodal or digital elements. They experiment with formality in their language and use appropriate features of voice.","audience,deliver,experiment,language,purpose,select,speak,texts,use,voice"
English,Level 10,Reading and Viewing,"When reading and viewing, students engage with a range of different types of texts for meaning.","engage,meaning,read,texts,view"
English,Level 10,Reading and Viewing,"They engage with vocabulary and grammatical knowledge, and the ways that sentence structures, syntax and punctuation express ideas.","engage,express,ideas,knowledge,punctuation,vocabulary"
English,Level 10,Reading and Viewing,"When demonstrating understanding of texts, students analyse and evaluate representations from diverse historical, cultural and social contexts, and compare initial and subsequent impressions. They synthesise their own interpretations of a text, and evaluate how literary devices, and still and moving images and sound, represent values, beliefs and attitudes. They evaluate the connections between text structures, language features, literary devices and intertextual references.","analyse,compare,evaluate,images,interpret,language,present,synthesise,texts,understand"
English,Level 10,Reading and Viewing,"They analyse and evaluate the structures of texts, including print, digital and hybrid, according to purpose. They compare the use of voice as a device to evoke emotion and to create aesthetic qualities. They evaluate the features of still images, moving images and sound and their effects on representation.","analyse,compare,create,evaluate,images,present,purpose,texts,use,voice"
English,Level 10,Writing,"When creating written and spoken texts, students use a sustained voice and reflect on challenging or complex ideas or issues. They select appropriate textual elements for purpose and audience, and include appropriate multimodal or digital elements. They review, edit and refine their own and others’ texts and reflect on these processes.","audience,edit,ideas,purpose,refine,reflect,review,select,texts,use,view,voice"
English,Level 10,Writing,"They vary and experiment with text structures, grammar and punctuation to create and maintain cohesion and sequence.","create,experiment,grammar,punctuation,vary"
English,Level 10,Writing,"They use vocabulary with precision for purpose. They select, adapt and apply language features and literary devices, and use a sustained voice.","adapt,apply,language,purpose,select,use,vocabulary,voice"
English,Level 10,Writing,They use standard and non-standard spelling appropriate for purpose and audience.,"audience,purpose,spelling,use"
