Subject,Band,SkillArea,ComponentText,Keywords
English,Foundation A,Speaking and Listening,"When interacting with others, students use their preferred communication modality to express immediate needs. They briefly engage in shared attention and use their preferred communication modality to attract attention or continue an action.","attention,communication,engage,express,interact,modality,use"
English,Foundation A,Speaking and Listening,They use their preferred communication modality to demonstrate preferences through the acceptance or rejection of familiar objects or activities.,"communication,demonstrate,modality,preferences,use"
English,Foundation A,Reading and Viewing,"When listening to and/or viewing print and digital texts, students engage with a range of different types of texts and respond by attending to and exploring images, sounds and/or sensory experiences related to texts.","attend,engage,images,listen,respond,sounds,texts,view"
English,Foundation A,Reading and Viewing,They demonstrate interest in texts and engage for brief periods when having a book or other text read to them.,"demonstrate,engage,read,texts"
English,Foundation A,Reading and Viewing,"They respond to letters and their sounds, and to vocabulary used in reference to objects and activities that are familiar or of personal interest.","letters,respond,sounds,use,vocabulary"
English,Foundation A,Writing,"When creating texts, students demonstrate short periods of shared attention and participate in the joint construction of text.","attention,construct,demonstrate,participate,texts"
English,Foundation A,Writing,They manipulate a range of tools to make marks.,manipulate
English,Foundation B,Speaking and Listening,"When interacting with others, students communicate using their preferred communication modality. They can reliably accept or reject objects, actions or events.","communicate,communication,interact,modality"
English,Foundation B,Speaking and Listening,"Students attend and respond to interactions consistently. They use single objects, gestures, symbols or words to express ideas related to their immediate environment.","attend,express,ideas,interact,respond,use,words"
English,Foundation B,Reading and Viewing,"When listening to and/or viewing print and digital texts, students engage with a range of different types of texts and identify an event in a story.","engage,identify,listen,texts,view"
English,Foundation B,Reading and Viewing,"They recognise familiar images, letters and words in their environment.","images,letters,recognise,words"
English,Foundation B,Reading and Viewing,"When demonstrating understanding of texts, students use their preferred communication modality to communicate single ideas or concepts without elaboration or detail.","communicate,communication,ideas,modality,texts,understand,use"
English,Foundation B,Reading and Viewing,"Students identify how text is organised for navigation by using features of a text, such as the appropriate orientation and turning pages.",identify
English,Foundation B,Writing,"When co-creating and sharing short texts, students recount ideas by identifying an image, character or event in a preferred or known text.","ideas,identify,texts"
English,Foundation B,Writing,Students express ideas using their preferred communication modality.,"communication,express,ideas,modality"
English,Foundation B,Writing,They participate in writing by intentionally making marks and repeating movements using writing tools and materials.,participate
English,Foundation C,Speaking and Listening,"When interacting with others, students initiate and respond to communication using learnt vocabulary to express ideas and describe activities or experiences. Using their preferred communication modality, students use interaction skills, such as attending and responding, using short phrases to express ideas.","attend,communication,describe,express,ideas,interact,modality,respond,use,vocabulary"
English,Foundation C,Speaking and Listening,"They use short phrases to request, accept or reject objects, actions or events, using their preferred communication modality.","communication,modality,use"
English,Foundation C,Reading and Viewing,"When listening to and/or viewing print and digital texts, students engage with a range of different types of texts, and identify and comment on events and characters in a story.","engage,identify,listen,texts,view"
English,Foundation C,Reading and Viewing,"They recognise and name familiar images, some letters and their sounds, and words in a variety of situations and contexts at school.","images,letters,recognise,sounds,texts,words"
English,Foundation C,Reading and Viewing,"When demonstrating understanding of texts, students respond to simple questions by using their preferred communication modality to express ideas or comment without elaboration or detail.","communication,express,ideas,modality,respond,texts,understand"
English,Foundation C,Reading and Viewing,Students identify how text is organised for navigation by turning one page at a time and differentiating between words and images in print.,"identify,images,words"
English,Foundation C,Writing,"When co-creating and sharing short texts, students retell ideas by sequencing images.","ideas,images,texts"
English,Foundation C,Writing,Students express ideas using their preferred communication modality.,"communication,express,ideas,modality"
English,Foundation C,Writing,They participate in writing by using writing tools and materials to create letter-like symbols.,"create,participate"
English,Foundation D,Speaking and Listening,"When interacting with others, students initiate and sustain interactions, responding using learnt vocabulary and phrasing, using their preferred communication modality.","communication,interact,modality,respond,vocabulary"
English,Foundation D,Speaking and Listening,"They use phrases to communicate interests, preferences and ideas.","communicate,ideas,preferences,use"
English,Foundation D,Speaking and Listening,"When communicating to an audience in familiar or structured situations, students present an idea or retell a story or event, using phrases to express ideas.","audience,express,ideas,present"
English,Foundation D,Reading and Viewing,"When listening to and/or viewing a range of print and digital text types, students recognise, comment on and share feelings about settings, characters and events.","listen,recognise,view"
English,Foundation D,Reading and Viewing,"They replicate rhythms and sounds patterns, blend and segment one-syllable words, read some consonant-vowel-consonant (CVC) words and decode a small number of familiar words. They demonstrate knowledge of some phoneme–grapheme correspondences.","blend,demonstrate,knowledge,read,respond,segment,sounds,words"
English,Foundation D,Reading and Viewing,"When demonstrating understanding of texts, students use comprehension strategies, such as connecting, predicting and questioning. They identify that images, letters, sounds and words contribute to meaning.","identify,images,letters,meaning,sounds,texts,understand,use,words"
English,Foundation D,Reading and Viewing,"Students identify how types of text, in print, digital and multimodal format, are organised for purpose and navigation. They demonstrate knowledge of key elements of the sequence and structure of a text.","demonstrate,identify,knowledge,purpose"
English,Foundation D,Writing,"When creating and sharing short texts, students retell stories and report information using familiar symbols, letters and words.","information,letters,texts,words"
English,Foundation D,Writing,"They participate in shared editing processes, applying knowledge of capital letters and spacing between words.","apply,edit,knowledge,letters,participate,words"
English,Foundation D,Writing,"They identify and select symbols, signs and letters to create a text. They independently form some letters, and group clusters of marks or letters that are separated by spaces to make words that convey meaning.","create,identify,letters,meaning,select,words"
English,Foundation D,Writing,They use some phoneme–grapheme correspondences and form some familiar words.,"respond,use,words"
English,Foundation D,Writing,They create images that represent ideas and show features that are understood by others.,"create,ideas,images,present"
English,Foundation,Speaking and Listening,"When interacting with others, students explore vocabulary used in familiar contexts and how language changes in different contexts.","explore,interact,language,texts,use,vocabulary"
English,Foundation,Speaking and Listening,They share thoughts and preferences.,preferences
English,Foundation,Speaking and Listening,"When speaking to an audience, students deliver short spoken texts, including retelling stories and reporting events, using features of voice.","audience,deliver,speak,texts,voice"
English,Foundation,Reading and Viewing,"When listening, reading and viewing, students engage with a range of different types of texts, including decodable and authentic texts, using developing phonic knowledge.","develop,engage,knowledge,listen,read,texts,view"
English,Foundation,Reading and Viewing,"They blend, segment and manipulate phonemes in one-syllable words, and use knowledge of letters and sounds to read consonant-vowel-consonant (CVC) words. They read some high-frequency words and identify boundary punctuation.","blend,identify,knowledge,letters,manipulate,punctuation,read,segment,sounds,use,words"
English,Foundation,Reading and Viewing,"When demonstrating understanding of texts, students identify and make connections between characters, settings and events and their own feelings and thoughts.","identify,texts,understand"
English,Foundation,Reading and Viewing,"They identify how types of texts, both print and digital, are organised for purpose and navigation. They compare how textual elements other than language, such as images and sounds, can contribute to meaning.","compare,identify,images,language,meaning,purpose,sounds,texts"
English,Foundation,Writing,"When creating and sharing short texts, students retell stories and report information, using familiar words and images where appropriate. They share in simple editing processes.","edit,images,information,texts,words"
English,Foundation,Writing,"They use words, phrases and punctuation, including capital letters and full stops, from familiar contexts and texts, and from their learning.","letters,punctuation,texts,use,words"
English,Foundation,Writing,They form letters and spell most consonant-vowel-consonant (CVC) words.,"letters,words"
English,Level 1,Speaking and Listening,"When interacting with others, students understand the vocabulary of curriculum area topics and use language, facial expressions and gestures when requesting, exclaiming and commanding. They use turn-taking skills.","express,interact,language,understand,use,vocabulary"
English,Level 1,Speaking and Listening,They explore language to express preferences and opinions.,"explore,express,language,preferences"
English,Level 1,Speaking and Listening,"When speaking to an audience, students deliver short spoken texts, engaging with personal or learnt topics, using features of voice.","audience,deliver,speak,texts,voice"
English,Level 1,Reading and Viewing,"When listening, reading and viewing, students engage with a range of different types of texts, including decodable and authentic texts, using developing phonic knowledge.","develop,engage,knowledge,listen,read,texts,view"
English,Level 1,Reading and Viewing,"They blend, segment and manipulate words with one and 2 syllables. They read an increasing number of high-frequency words and understand boundary punctuation.","blend,manipulate,punctuation,read,segment,understand,words"
English,Level 1,Reading and Viewing,"When demonstrating understanding of texts, students discuss characters, settings, events and images, and make connections between texts and their personal experiences. They begin to build their understanding of literal and inferred meanings. They identify how types of texts, both print and digital, are organised for purpose and navigation. They compare how textual elements other than language, such as images and sounds, can contribute to meaning in texts.","build,compare,discuss,identify,images,language,meaning,purpose,sounds,texts,understand"
English,Level 1,Writing,"When creating short written and spoken texts, students use narrative and informative text structures; incorporate some detail from previously encountered texts, learnt topics or topics of interest; and include appropriate multimodal elements. They re-read their texts and complete simple edits.","edit,read,texts,use"
English,Level 1,Writing,They select learning area or topic-specific vocabulary.,"select,vocabulary"
English,Level 1,Writing,"They write words using unjoined lower-case and upper-case letters. They spell most one- and 2-syllable words with common letter patterns and common grammatical morphemes, and an increasing number of high-frequency words. They apply boundary punctuation.","apply,letters,punctuation,words,write"
English,Level 2,Speaking and Listening,"When interacting with others, students apply learnt vocabulary and vary language choices depending on context, actively listen to others, and extend their own ideas.","apply,ideas,interact,language,listen,vary,vocabulary"
English,Level 2,Speaking and Listening,They explore the language of appreciation and provide reasons for preferences.,"explore,language,preferences"
English,Level 2,Speaking and Listening,"When speaking to an audience, students deliver short spoken texts, engaging with topics for a familiar audience and appropriate for purpose, using features of voice.","audience,deliver,purpose,speak,texts,voice"
English,Level 2,Reading and Viewing,"When reading and viewing, students engage with a range of different types of texts for meaning.","engage,meaning,read,texts,view"
English,Level 2,Reading and Viewing,"They read using phonic, morphemic and vocabulary knowledge; grammatical knowledge such as compound sentences, noun and verb groups; and knowledge of punctuation.","knowledge,punctuation,read,sentences,vocabulary"
English,Level 2,Reading and Viewing,They read some unfamiliar words and most high-frequency words.,"read,words"
English,Level 2,Reading and Viewing,"When demonstrating understanding of texts, students discuss and compare connections between characters, settings and events, and draw on their knowledge of context to build literal and inferred meanings. They express personal preferences for particular texts.","build,compare,discuss,express,knowledge,meaning,preferences,texts,understand"
English,Level 2,Reading and Viewing,"They describe how different types of texts across the curriculum, both print and digital, are organised for purpose and navigation. They understand that elements other than language – such as images and sounds – can multiply meanings in texts.","describe,images,language,meaning,purpose,sounds,texts,understand"
English,Level 2,Writing,"When creating short written and spoken texts, including stories to inform, express an opinion, explore an idea or narrate for audiences, students use ideas and details from previously encountered texts, learnt topics or topics of interest, and include appropriate multimodal elements. They re-read their texts and edit for improvement.","audience,edit,explore,express,ideas,read,texts,use"
English,Level 2,Writing,"They use narrative and informative text structures to organise their own texts, and they use grammar and punctuation to create links.","create,grammar,punctuation,texts,use"
English,Level 2,Writing,They begin to make deliberate choices when applying learnt vocabulary.,"apply,vocabulary"
English,Level 2,Writing,They write words using consistently legible unjoined lower-case and upper-case letters. They spell words with regular spelling patterns and use phonic and morphemic knowledge to attempt to spell words with less common patterns.,"knowledge,letters,spelling,use,words,write"
English,Level 3,Speaking and Listening,"When interacting with others, students extend topic-specific and appropriate vocabulary and use cooperation strategies and interaction skills to contribute to discussions.","discuss,interact,use,vocabulary"
English,Level 3,Speaking and Listening,They explore the language of evaluation and emotion.,"explore,language"
English,Level 3,Speaking and Listening,"When speaking to an audience, students deliver short spoken texts, exploring topics and text types, including multimodal or digital elements, and using features of voice.","audience,deliver,speak,texts,voice"
English,Level 3,Reading and Viewing,"When reading and viewing, students engage with a range of different types of texts for meaning.","engage,meaning,read,texts,view"
English,Level 3,Reading and Viewing,"They read using phonic, morphemic and vocabulary knowledge; grammatical knowledge such as subject–verb agreement and tense; and knowledge of apostrophe use.","knowledge,read,use,vocabulary"
English,Level 3,Reading and Viewing,They read multisyllabic words with more complex letter patterns.,"read,words"
English,Level 3,Reading and Viewing,"When demonstrating understanding of texts, they discuss connections between the experiences of characters in texts and their own personal experiences to build literal and inferred meanings. They share personal preferences for texts.","build,discuss,meaning,preferences,texts,understand"
English,Level 3,Reading and Viewing,"They explore how different types of texts across the curriculum, both print and digital, use different structures for purpose and navigation. They identify literary devices, such as rhythm and onomatopoeia, and describe how images and sound can extend meaning.","describe,explore,identify,images,meaning,purpose,texts,use"
English,Level 3,Writing,"When creating written and spoken texts to inform, narrate, explain or argue, students use ideas and details from previously encountered texts, learnt topics or topics of interest, and they include appropriate multimodal elements. They re-read their texts and edit for meaning, structure and grammatical choices.","edit,explain,ideas,meaning,read,texts,use"
English,Level 3,Writing,"They use text structures to begin to develop paragraphs for different purposes. They use grammar and punctuation to appropriately represent processes and connections, including using modal verbs.","develop,grammar,present,punctuation,purpose,use"
English,Level 3,Writing,"They extend their use of topic-specific vocabulary, such as technical words, and adopt and adapt language features from texts.","adapt,language,texts,use,vocabulary,words"
English,Level 3,Writing,"They write texts using letters that are joined, accurately formed and consistent in size. They spell multisyllabic words using phonic and morphemic knowledge, and high-frequency words.","knowledge,letters,texts,words,write"
English,Level 4,Speaking and Listening,"When interacting with others, students use an expanded vocabulary and language to develop relationships in different contexts.","develop,interact,language,texts,use,vocabulary"
English,Level 4,Speaking and Listening,"They share and extend ideas and information. They differentiate between the language of opinion, facts and feelings.","ideas,information,language"
English,Level 4,Speaking and Listening,"When speaking to an audience, students deliver structured spoken texts, exploring topics and text types, including multimodal or digital elements. They use language suitable to context, and appropriate features of voice.","audience,deliver,language,speak,texts,use,voice"
English,Level 4,Reading and Viewing,"When reading and viewing, students engage with a range of different types of texts for meaning.","engage,meaning,read,texts,view"
English,Level 4,Reading and Viewing,"They read by integrating phonic, morphemic and vocabulary knowledge; grammatical knowledge such as the use of clauses and phrases to provide details and indicate relationships; and knowledge of punctuation for dialogue.","knowledge,punctuation,read,use,vocabulary"
English,Level 4,Reading and Viewing,"When demonstrating understanding of texts, students consider storylines, ideas and relationships between characters to build literal and inferred meanings. They describe the effects of text structures and language features. They share opinions about texts.","build,describe,ideas,language,meaning,texts,understand"
English,Level 4,Reading and Viewing,"They explore how different types of texts across the curriculum, both print and digital, are organised into characteristic stages for purpose and navigation. They describe how literary devices, such as wordplay, shape meaning. They explore the framing and composition of still images and moving images and the use of sound.","describe,explore,images,meaning,purpose,texts,use"
English,Level 4,Writing,"When creating written and spoken texts for a small range of purposes and audiences, students adapt ideas and details from texts, learnt topics or topics of interest, and include appropriate multimodal elements. They edit their texts to improve content and structure.","adapt,audience,edit,ideas,purpose,texts"
English,Level 4,Writing,"They use text structures to sequence and connect ideas and to develop paragraphs. They use grammar and punctuation to create relationships, including through the use of tense.","create,develop,grammar,ideas,punctuation,use"
English,Level 4,Writing,"They expand their vocabulary, such as through using synonyms and antonyms, and they use adverbial phrases to build meaning. They explore language features, including wordplay.","build,explore,language,meaning,use,vocabulary"
English,Level 4,Writing,"They write texts using clearly formed joined letters with developing fluency. They spell words, including multisyllabic and multimorphemic words with irregular spelling patterns, using phonic, morphemic and grammatical knowledge.","develop,fluency,knowledge,letters,spelling,texts,words,write"
English,Level 5,Speaking and Listening,"When interacting with others, students use vocabulary precisely and select language for social purposes and roles, to clarify meaning and make connections.","interact,language,meaning,purpose,select,use,vocabulary"
English,Level 5,Speaking and Listening,They extend their discussion beyond bare assertions and account for differing opinions and authoritative sources.,discuss
English,Level 5,Speaking and Listening,"When speaking to an audience, students deliver structured spoken texts, exploring topics and text types, including multimodal or digital elements. They select language for a specific purpose and use appropriate features of voice.","audience,deliver,language,purpose,select,speak,texts,use,voice"
English,Level 5,Reading and Viewing,"When reading and viewing, students engage with a range of different types of texts for meaning.","engage,meaning,read,texts,view"
English,Level 5,Reading and Viewing,"They read by integrating phonic, morphemic and vocabulary knowledge, and grammatical knowledge such as complex sentences and the use of clauses for effect.","knowledge,read,sentences,use,vocabulary"
English,Level 5,Reading and Viewing,"When demonstrating understanding of texts, students identify textual aspects that represent details about historical, cultural and social contexts. They describe how texts convey feelings, mood, actions and ideas to build literal and inferred meanings. They evaluate information and ideas in texts. They explain how different types of texts, both print and digital, are organised into characteristic stages for purpose. They discuss the effects of imagery and sound devices in texts. They explain how the sequence of still images, and moving images and sound, create or affect meaning.","build,create,describe,discuss,evaluate,explain,ideas,identify,images,information,meaning,present,purpose,texts,understand"
English,Level 5,Writing,"When creating written and spoken texts for specific purposes and audiences, students develop ideas and adapt textual details drawn from texts and include appropriate multimodal elements. They edit their texts using an agreed set of criteria.","adapt,audience,develop,edit,ideas,purpose,texts"
English,Level 5,Writing,"They use text structures, including paragraphs, to create prominence and build sequence and cohesion. They use grammar and punctuation, including complex sentences to provide additional information and description.","build,create,grammar,information,punctuation,sentences,use"
English,Level 5,Writing,"They use precise vocabulary, such as specialist and technical terms. They experiment with language features, including figurative language.","experiment,language,use,vocabulary"
English,Level 5,Writing,"They write legibly and fluently. They spell new and unfamiliar words using phonic, morphemic and grammatical knowledge.","knowledge,words,write"
English,Level 6,Speaking and Listening,"When interacting with others, students use vivid vocabulary, select language to acknowledge formality and social distance, and use appropriate strategies such as paraphrasing and questioning.","interact,knowledge,language,select,use,vocabulary"
English,Level 6,Speaking and Listening,They explore objective and subjective language and identify bias.,"explore,identify,language"
English,Level 6,Speaking and Listening,"When speaking to an audience, students deliver structured spoken texts, exploring topics and text types, including multimodal or digital elements. They select language appropriate for purpose and audience and use appropriate features of voice.","audience,deliver,language,purpose,select,speak,texts,use,voice"
