SubjectArea,Subject,Band,Unit,UnitASCode,AreaofStudy,Outcome,OutcomeCode,ExampleType,ContentType,ExampleText,ParentText,URLTitle,URL,Sequence
Humanities,Sociology,Year 12,Unit 3,VCESOU3AS2,Area of Study 2 - Ethnicity,Outcome 2,VCESOU3AS2O2KK,Activity,Bullet,Amar 'fought to find his place' in Australia. Now he's the nation's local hero,"Study a teacher-provided range of articles that explore cultural practices in Australia. Analyse each example as to how responses to cultural practices may prevent or enable a sense of belonging and inclusion in Australia's multicultural society.
Suggested resources:",,,14
Humanities,Sociology,Year 12,Unit 3,VCESOU3AS2,Area of Study 2 - Ethnicity,Outcome 2,VCESOU3AS2O2KK,Activity,Bullet,Want to be culturally sensitive? Start by saying my name right,"Study a teacher-provided range of articles that explore cultural practices in Australia. Analyse each example as to how responses to cultural practices may prevent or enable a sense of belonging and inclusion in Australia's multicultural society.
Suggested resources:",,,15
Humanities,Sociology,Year 12,Unit 3,VCESOU3AS2,Area of Study 2 - Ethnicity,Outcome 2,VCESOU3AS2O2KS,Activity,Bullet,"Create a large poster or infographic to describe an ethnic group in Australia and display around the classroom.
The poster should include:",,,,16
Humanities,Sociology,Year 12,Unit 3,VCESOU3AS2,Area of Study 2 - Ethnicity,Outcome 2,VCESOU3AS2O2KK,Activity,Bullet,Overview of the how the ethnic group identifies itself,"Create a large poster or infographic to describe an ethnic group in Australia and display around the classroom.
The poster should include:",,,17
Humanities,Sociology,Year 12,Unit 3,VCESOU3AS2,Area of Study 2 - Ethnicity,Outcome 2,VCESOU3AS2O2KK,Activity,Bullet,Images of material and non-material culture,"Create a large poster or infographic to describe an ethnic group in Australia and display around the classroom.
The poster should include:",,,18
Humanities,Sociology,Year 12,Unit 3,VCESOU3AS2,Area of Study 2 - Ethnicity,Outcome 2,VCESOU3AS2O2KK,Activity,Bullet,"Faith, traditions and / or customs.","Create a large poster or infographic to describe an ethnic group in Australia and display around the classroom.
The poster should include:",,,19
Humanities,Sociology,Year 12,Unit 3,VCESOU3AS2,Area of Study 2 - Ethnicity,Outcome 2,VCESOU3AS2O2KK,Activity,Bullet,Create a consent form for primary research into the experience of a particular ethnic group in Australia.,,,,20
Humanities,Sociology,Year 12,Unit 3,VCESOU3AS2,Area of Study 2 - Ethnicity,Outcome 2,VCESOU3AS2O2KK,Activity,Bullet,"Use Google forms to create a survey that adheres to ethical guidelines to collect information about an ethnic group in Australia.
Include the following:",,,,21
Humanities,Sociology,Year 12,Unit 3,VCESOU3AS2,Area of Study 2 - Ethnicity,Outcome 2,VCESOU3AS2O2KK,Activity,Bullet,Privacy and confidentiality of data,"Use Google forms to create a survey that adheres to ethical guidelines to collect information about an ethnic group in Australia.
Include the following:",,,22
Humanities,Sociology,Year 12,Unit 3,VCESOU3AS2,Area of Study 2 - Ethnicity,Outcome 2,VCESOU3AS2O2KK,Activity,Bullet,Informed consent,"Use Google forms to create a survey that adheres to ethical guidelines to collect information about an ethnic group in Australia.
Include the following:",,,23
Humanities,Sociology,Year 12,Unit 3,VCESOU3AS2,Area of Study 2 - Ethnicity,Outcome 2,VCESOU3AS2O2KK,Activity,Bullet,Voluntary participation.,"Use Google forms to create a survey that adheres to ethical guidelines to collect information about an ethnic group in Australia.
Include the following:",,,24
Humanities,Sociology,Year 12,Unit 3,VCESOU3AS2,Area of Study 2 - Ethnicity,Outcome 2,VCESOU3AS2O2KK,DetailedExample,Paragraph,Exploring Australia's ethnic diversity compared to other countries through research questions,,,,25
Humanities,Sociology,Year 12,Unit 3,VCESOU3AS2,Area of Study 2 - Ethnicity,Outcome 2,VCESOU3AS2O2KK,DetailedExampleStep,Paragraph,"Using the questions below, students individually research one of the following countries to make a comparison with ethnic diversity with Australia.",,,,26
Humanities,Sociology,Year 12,Unit 3,VCESOU3AS2,Area of Study 2 - Ethnicity,Outcome 2,VCESOU3AS2O2KK,DetailedExampleStep,Bullet,Greece,,,,27
Humanities,Sociology,Year 12,Unit 3,VCESOU3AS2,Area of Study 2 - Ethnicity,Outcome 2,VCESOU3AS2O2KK,DetailedExampleStep,Bullet,Switzerland,,,,28
Humanities,Sociology,Year 12,Unit 3,VCESOU3AS2,Area of Study 2 - Ethnicity,Outcome 2,VCESOU3AS2O2KK,DetailedExampleStep,Bullet,Singapore,,,,29
Humanities,Sociology,Year 12,Unit 3,VCESOU3AS2,Area of Study 2 - Ethnicity,Outcome 2,VCESOU3AS2O2KK,DetailedExampleStep,Bullet,Israel,,,,30
Humanities,Sociology,Year 12,Unit 3,VCESOU3AS2,Area of Study 2 - Ethnicity,Outcome 2,VCESOU3AS2O2KK,DetailedExampleStep,Bullet,Korea,,,,31
Humanities,Sociology,Year 12,Unit 3,VCESOU3AS2,Area of Study 2 - Ethnicity,Outcome 2,VCESOU3AS2O2KK,DetailedExampleStep,Bullet,Egypt,,,,32
Humanities,Sociology,Year 12,Unit 3,VCESOU3AS2,Area of Study 2 - Ethnicity,Outcome 2,VCESOU3AS2O2KK,DetailedExampleStep,Bullet,China,,,,33
Humanities,Sociology,Year 12,Unit 3,VCESOU3AS2,Area of Study 2 - Ethnicity,Outcome 2,VCESOU3AS2O2KK,DetailedExampleStep,Bullet,Indonesia,,,,34
Humanities,Sociology,Year 12,Unit 3,VCESOU3AS2,Area of Study 2 - Ethnicity,Outcome 2,VCESOU3AS2O2KK,DetailedExampleStep,Bullet,Japan,,,,35
Humanities,Sociology,Year 12,Unit 3,VCESOU3AS2,Area of Study 2 - Ethnicity,Outcome 2,VCESOU3AS2O2KK,DetailedExampleStep,Bullet,Canada,,,,36
Humanities,Sociology,Year 12,Unit 3,VCESOU3AS2,Area of Study 2 - Ethnicity,Outcome 2,VCESOU3AS2O2KK,DetailedExampleStep,Bullet,Colombia,,,,37
Humanities,Sociology,Year 12,Unit 3,VCESOU3AS2,Area of Study 2 - Ethnicity,Outcome 2,VCESOU3AS2O2KK,DetailedExampleStep,Bullet,United States of America,,,,38
Humanities,Sociology,Year 12,Unit 3,VCESOU3AS2,Area of Study 2 - Ethnicity,Outcome 2,VCESOU3AS2O2KK,DetailedExampleStep,Bullet,United Kingdom,,,,39
Humanities,Sociology,Year 12,Unit 3,VCESOU3AS2,Area of Study 2 - Ethnicity,Outcome 2,VCESOU3AS2O2KK,DetailedExampleStep,Bullet,France,,,,40
Humanities,Sociology,Year 12,Unit 3,VCESOU3AS2,Area of Study 2 - Ethnicity,Outcome 2,VCESOU3AS2O2KK,DetailedExampleStep,Bullet,Mexico,,,,41
Humanities,Sociology,Year 12,Unit 3,VCESOU3AS2,Area of Study 2 - Ethnicity,Outcome 2,VCESOU3AS2O2KK,DetailedExampleStep,Paragraph,Answer the following research questions:,,,,42
Humanities,Sociology,Year 12,Unit 3,VCESOU3AS2,Area of Study 2 - Ethnicity,Outcome 2,VCESOU3AS2O2KK,DetailedExampleStep,Bullet,What proportion of the population were born in that country?,,,,43
Humanities,Sociology,Year 12,Unit 3,VCESOU3AS2,Area of Study 2 - Ethnicity,Outcome 2,VCESOU3AS2O2KK,DetailedExampleStep,Bullet,What proportion of the population were born overseas?,,,,44
Humanities,Sociology,Year 12,Unit 3,VCESOU3AS2,Area of Study 2 - Ethnicity,Outcome 2,VCESOU3AS2O2KK,DetailedExampleStep,Bullet,What proportion of the population have at least one parent born overseas?,,,,45
Humanities,Sociology,Year 12,Unit 3,VCESOU3AS2,Area of Study 2 - Ethnicity,Outcome 2,VCESOU3AS2O2KK,DetailedExampleStep,Bullet,What is / are the official language(s) of the country?,,,,46
Humanities,Sociology,Year 12,Unit 3,VCESOU3AS2,Area of Study 2 - Ethnicity,Outcome 2,VCESOU3AS2O2KK,DetailedExampleStep,Paragraph,"Make a comparison between Australia's ethnic diversity and the ethnic diversity of the chosen country, using statistics.",,,,47
Humanities,Sociology,Year 12,Unit 3,VCESOU3AS2,Area of Study 2 - Ethnicity,Outcome 2,VCESOU3AS2O2KK,DetailedExampleStep,Paragraph,Suggested sources:,,,,48
Humanities,Sociology,Year 12,Unit 3,VCESOU3AS2,Area of Study 2 - Ethnicity,Outcome 2,VCESOU3AS2O2KK,DetailedExampleStep,Bullet,CIA World Factbook,,,,49
Humanities,Sociology,Year 12,Unit 3,VCESOU3AS2,Area of Study 2 - Ethnicity,Outcome 2,VCESOU3AS2O2KK,DetailedExampleStep,Bullet,Australian Bureau of Statistics: 2021 Census,,,,50
Humanities,Sociology,Year 12,Unit 3,VCESOU3AS2,Area of Study 2 - Ethnicity,Outcome 2,VCESOU3AS2O2KK,DetailedExampleStep,Paragraph,Provide evidence and acknowledge sources.,,,,51
Humanities,Sociology,Year 12,Unit 4,VCESOU4,,,,,UnitHeading,Unit 4,,,,1
Humanities,Sociology,Year 12,Unit 4,VCESOU4AS1,Area of Study 1 - Community,Outcome 1,,,OutcomeHeading,Outcome 1,,,,1
Humanities,Sociology,Year 12,Unit 4,VCESOU4AS1,Area of Study 1 - Community,Outcome 1,,,OutcomeDescription,Analyse the experience of community generally and analyse and evaluate a specific community.,,,,2
Humanities,Sociology,Year 12,Unit 4,VCESOU4AS1,Area of Study 1 - Community,Outcome 1,,,SectionHeading,Examples of learning activities,,,,3
Humanities,Sociology,Year 12,Unit 4,VCESOU4AS1,Area of Study 1 - Community,Outcome 1,VCESOU4AS1O1KK,Activity,Bullet,"Brainstorm the communities that students are a part of, answering the following questions:",,,,4
Humanities,Sociology,Year 12,Unit 4,VCESOU4AS1,Area of Study 1 - Community,Outcome 1,VCESOU4AS1O1KK,Activity,Bullet,"Do you belong to any groups that share common interests, lifestyles, or identities?","Brainstorm the communities that students are a part of, answering the following questions:",,,5
Humanities,Sociology,Year 12,Unit 4,VCESOU4AS1,Area of Study 1 - Community,Outcome 1,VCESOU4AS1O1KK,Activity,Bullet,What values or norms do you share?,"Brainstorm the communities that students are a part of, answering the following questions:",,,6
Humanities,Sociology,Year 12,Unit 4,VCESOU4AS1,Area of Study 1 - Community,Outcome 1,VCESOU4AS1O1KK,Activity,Bullet,"How do people interact with each other (for example: face to face, ICT)?","Brainstorm the communities that students are a part of, answering the following questions:",,,7
Humanities,Sociology,Year 12,Unit 4,VCESOU4AS1,Area of Study 1 - Community,Outcome 1,VCESOU4AS1O1KS,Activity,Bullet,How do you define your boundaries (i.e. who can be a part of the community)?,"Brainstorm the communities that students are a part of, answering the following questions:",,,8
Humanities,Sociology,Year 12,Unit 4,VCESOU4AS1,Area of Study 1 - Community,Outcome 1,VCESOU4AS1O1KK,Activity,Bullet,Create a table comparing Tnnies' theory of Community and Michel Maffesoli's theory of neo-tribes. The table could be split into the traditional and contemporary components of each theory.,,,,9
Humanities,Sociology,Year 12,Unit 4,VCESOU4AS1,Area of Study 1 - Community,Outcome 1,VCESOU4AS1O1KK,Activity,Bullet,"Conduct a class debate, one group arguing in favour of Tnnies' argument that modern society is more individualistic, and the other arguing against it. Allow time to prepare the arguments, and think about the strengths and weaknesses of each position.",,,,10
Humanities,Sociology,Year 12,Unit 4,VCESOU4AS1,Area of Study 1 - Community,Outcome 1,VCESOU4AS1O1KK,Activity,Bullet,"Complete a case study of one particular form of social media and analyse the impact this platform has had on the experience of community for the people who use it. 
The case study should include aspects such as the specifics of the social media platform (for example: how users engage with the platform, positive and negative impacts on the experience of community generally).",,,,11
Humanities,Sociology,Year 12,Unit 4,VCESOU4AS1,Area of Study 1 - Community,Outcome 1,VCESOU4AS1O1KK,Activity,Bullet,"View two or three short documentaries on a range of communities. While viewing, consider factors that influence feelings of belonging, such as participation, how the group uses ICT, the effects of economic, social and political factors, and of geographical characteristics on members' experience. An example of a video to watch is the What is LARPing documentary.",,,,12
Humanities,Sociology,Year 12,Unit 4,VCESOU4AS1,Area of Study 1 - Community,Outcome 1,VCESOU4AS1O1KK,Activity,Bullet,"Research a local community and detail the various geographical characteristics of that community that impact its members experience. For each characteristic, provide an outline of how it specifically impacts experience (positive / negative, includes / excludes). 
Geographical characteristics could be related to proximity and accessibility, climate, scenic quality, landforms and natural resources, or built features such as community centres or other relevant characteristics.",,,,13
Humanities,Sociology,Year 12,Unit 4,VCESOU4AS1,Area of Study 1 - Community,Outcome 1,VCESOU4AS1O1KK,Activity,Bullet,"Design interview questions for a case study investigating the experience of a specific community. Ensure questions meet the ethical guidelines required for sociological research as outlined by TASA, including the following:",,,,14
Humanities,Sociology,Year 12,Unit 4,VCESOU4AS1,Area of Study 1 - Community,Outcome 1,VCESOU4AS1O1KK,Activity,Bullet,Privacy and confidentiality of data,"Design interview questions for a case study investigating the experience of a specific community. Ensure questions meet the ethical guidelines required for sociological research as outlined by TASA, including the following:",,,15
Humanities,Sociology,Year 12,Unit 4,VCESOU4AS1,Area of Study 1 - Community,Outcome 1,VCESOU4AS1O1KK,Activity,Bullet,Informed consent,"Design interview questions for a case study investigating the experience of a specific community. Ensure questions meet the ethical guidelines required for sociological research as outlined by TASA, including the following:",,,16
Humanities,Sociology,Year 12,Unit 4,VCESOU4AS1,Area of Study 1 - Community,Outcome 1,VCESOU4AS1O1KK,Activity,Bullet,Voluntary participation.,"Design interview questions for a case study investigating the experience of a specific community. Ensure questions meet the ethical guidelines required for sociological research as outlined by TASA, including the following:",,,17
Humanities,Sociology,Year 12,Unit 4,VCESOU4AS1,Area of Study 1 - Community,Outcome 1,VCESOU4AS1O1KK,Activity,Bullet,Create a digital case study of a specific community in Australia or another country.,,,,18
Humanities,Sociology,Year 12,Unit 4,VCESOU4AS1,Area of Study 1 - Community,Outcome 1,VCESOU4AS1O1KK,DetailedExample,Paragraph,Create a digital case study of a specific community in Australia or another country,,,,19
Humanities,Sociology,Year 12,Unit 4,VCESOU4AS1,Area of Study 1 - Community,Outcome 1,VCESOU4AS1O1KK,DetailedExampleStep,Paragraph,Checklist for topic approval,,,,20
Humanities,Sociology,Year 12,Unit 4,VCESOU4AS1,Area of Study 1 - Community,Outcome 1,VCESOU4AS1O1KK,DetailedExampleStep,Paragraph,Does the community meet the criteria?,,,,21
Humanities,Sociology,Year 12,Unit 4,VCESOU4AS1,Area of Study 1 - Community,Outcome 1,VCESOU4AS1O1KS,DetailedExampleStep,Bullet,Can students apply the sociological definition of community to the group?,,,,22
Humanities,Sociology,Year 12,Unit 4,VCESOU4AS1,Area of Study 1 - Community,Outcome 1,VCESOU4AS1O1KK,DetailedExampleStep,Bullet,Are students able to connect with the community?,,,,23
Humanities,Sociology,Year 12,Unit 4,VCESOU4AS1,Area of Study 1 - Community,Outcome 1,VCESOU4AS1O1KK,DetailedExampleStep,Bullet,Does it use ICT?,,,,24
Humanities,Sociology,Year 12,Unit 4,VCESOU4AS1,Area of Study 1 - Community,Outcome 1,VCESOU4AS1O1KK,DetailedExampleStep,Bullet,"Has the community been impacted by political, economic or social changes and geographical characteristics?",,,,25
Humanities,Sociology,Year 12,Unit 4,VCESOU4AS1,Area of Study 1 - Community,Outcome 1,VCESOU4AS1O1KK,DetailedExampleStep,Bullet,Are there varying perspectives or conflicts within the community? (For example: feelings of exclusion / inclusion),,,,26
Humanities,Sociology,Year 12,Unit 4,VCESOU4AS1,Area of Study 1 - Community,Outcome 1,VCESOU4AS1O1KK,DetailedExampleStep,Bullet,Do community members meet face to face as well as through online platforms?,,,,27
Humanities,Sociology,Year 12,Unit 4,VCESOU4AS1,Area of Study 1 - Community,Outcome 1,VCESOU4AS1O1KK,DetailedExampleStep,Paragraph,Task,,,,28
Humanities,Sociology,Year 12,Unit 4,VCESOU4AS1,Area of Study 1 - Community,Outcome 1,VCESOU4AS1O1KK,DetailedExampleStep,Paragraph,Students complete the following information.,,,,29
Humanities,Sociology,Year 12,Unit 4,VCESOU4AS1,Area of Study 1 - Community,Outcome 1,VCESOU4AS1O1KK,DetailedExampleStep,Paragraph,Name of Community:,,,,30
Humanities,Sociology,Year 12,Unit 4,VCESOU4AS1,Area of Study 1 - Community,Outcome 1,VCESOU4AS1O1KK,DetailedExampleStep,Paragraph,Nature of the group:,,,,31
Humanities,Sociology,Year 12,Unit 4,VCESOU4AS1,Area of Study 1 - Community,Outcome 1,VCESOU4AS1O1KK,DetailedExampleStep,Bullet,Reasons this group can be classified as a community,,,,32
Humanities,Sociology,Year 12,Unit 4,VCESOU4AS1,Area of Study 1 - Community,Outcome 1,VCESOU4AS1O1KK,DetailedExampleStep,Bullet,Geographic closeness,,,,33
Humanities,Sociology,Year 12,Unit 4,VCESOU4AS1,Area of Study 1 - Community,Outcome 1,VCESOU4AS1O1KK,DetailedExampleStep,Bullet,Regular contact,,,,34
Humanities,Sociology,Year 12,Unit 4,VCESOU4AS1,Area of Study 1 - Community,Outcome 1,VCESOU4AS1O1KK,DetailedExampleStep,Bullet,Mutual interests and / or shared ideology,,,,35
Humanities,Sociology,Year 12,Unit 4,VCESOU4AS1,Area of Study 1 - Community,Outcome 1,VCESOU4AS1O1KK,DetailedExampleStep,Bullet,Where the community is located,,,,36
Humanities,Sociology,Year 12,Unit 4,VCESOU4AS1,Area of Study 1 - Community,Outcome 1,VCESOU4AS1O1KK,DetailedExampleStep,Bullet,Who the members of the group are,,,,37
Humanities,Sociology,Year 12,Unit 4,VCESOU4AS1,Area of Study 1 - Community,Outcome 1,VCESOU4AS1O1KK,DetailedExampleStep,Paragraph,How the community uses ICT:,,,,38
Humanities,Sociology,Year 12,Unit 4,VCESOU4AS1,Area of Study 1 - Community,Outcome 1,VCESOU4AS1O1KK,DetailedExampleStep,Paragraph,What impact ICT has had on the community:,,,,39
Humanities,Sociology,Year 12,Unit 4,VCESOU4AS1,Area of Study 1 - Community,Outcome 1,VCESOU4AS1O1KK,DetailedExampleStep,Bullet,What are the positives and negatives of the use of ICT for the community?,,,,40
Humanities,Sociology,Year 12,Unit 4,VCESOU4AS1,Area of Study 1 - Community,Outcome 1,VCESOU4AS1O1KK,DetailedExampleStep,Bullet,In what ways have ICT impacted the experience of community for members?,,,,41
Humanities,Sociology,Year 12,Unit 4,VCESOU4AS1,Area of Study 1 - Community,Outcome 1,VCESOU4AS1O1KK,DetailedExampleStep,Paragraph,Factors that may have influenced feelings of belonging for community members:,,,,42
Humanities,Sociology,Year 12,Unit 4,VCESOU4AS1,Area of Study 1 - Community,Outcome 1,VCESOU4AS1O1KK,DetailedExampleStep,Paragraph,Table recording the influence on feelings of belonging including the specific factors:,,,,43
Humanities,Sociology,Year 12,Unit 4,VCESOU4AS1,Area of Study 1 - Community,Outcome 1,VCESOU4AS1O1KK,DetailedExampleStep,Paragraph,Does everyone in the community share the same perspective about their experiences? Is there any conflict?,,,,44
Humanities,Sociology,Year 12,Unit 4,VCESOU4AS1,Area of Study 1 - Community,Outcome 1,VCESOU4AS1O1KK,DetailedExampleStep,Bullet,Provide at least two perspectives from members of the community. Provide quotes that could be used to support the research.,,,,45
Humanities,Sociology,Year 12,Unit 4,VCESOU4AS1,Area of Study 1 - Community,Outcome 1,VCESOU4AS1O1KK,DetailedExampleStep,Paragraph,How did you follow ethical methodology when you obtained information about this community?,,,,46
Humanities,Sociology,Year 12,Unit 4,VCESOU4AS1,Area of Study 1 - Community,Outcome 1,VCESOU4AS1O1KK,DetailedExampleStep,Bullet,Voluntary participation,,,,47
Humanities,Sociology,Year 12,Unit 4,VCESOU4AS1,Area of Study 1 - Community,Outcome 1,VCESOU4AS1O1KK,DetailedExampleStep,Bullet,Informed consent,,,,48
Humanities,Sociology,Year 12,Unit 4,VCESOU4AS1,Area of Study 1 - Community,Outcome 1,VCESOU4AS1O1KK,DetailedExampleStep,Bullet,Privacy and the confidentiality of data,,,,49
Humanities,Sociology,Year 12,Unit 4,VCESOU4AS2,Area of Study 2 - Social movements and social change,Outcome 2,,,OutcomeHeading,Outcome 2,,,,1
Humanities,Sociology,Year 12,Unit 4,VCESOU4AS2,Area of Study 2 - Social movements and social change,Outcome 2,,,OutcomeDescription,Analyse the nature and purpose of social movements and evaluate their influence on social change.,,,,2
Humanities,Sociology,Year 12,Unit 4,VCESOU4AS2,Area of Study 2 - Social movements and social change,Outcome 2,,,SectionHeading,Examples of learning activities,,,,3
Humanities,Sociology,Year 12,Unit 4,VCESOU4AS2,Area of Study 2 - Social movements and social change,Outcome 2,VCESOU4AS2O2KK,Activity,Bullet,"Create a glossary of key terms and definitions, such as types of social movements, stages of social movements, types of power, social change and civil disobedience.",,,,4
Humanities,Sociology,Year 12,Unit 4,VCESOU4AS2,Area of Study 2 - Social movements and social change,Outcome 2,VCESOU4AS2O2KK,Activity,Bullet,"Construct a matrix (as indicated below) comparing and contrasting the different types of power. 
Label the matrix: who has changed (top), how much social change (side)",,,,5
Humanities,Sociology,Year 12,Unit 4,VCESOU4AS2,Area of Study 2 - Social movements and social change,Outcome 2,VCESOU4AS2O2KK,Activity,Bullet,Include who is changed and how much change occurs in that type of movement.,,,,6
Humanities,Sociology,Year 12,Unit 4,VCESOU4AS2,Area of Study 2 - Social movements and social change,Outcome 2,VCESOU4AS2O2KK,Activity,Bullet,"View Erica Chenoweth's Ted Talk on non-violent civil resistance. In small groups, create a visual presentation on an example of a social movement that has used nonviolent forms of civil disobedience to achieve social change.",,,,7
Humanities,Sociology,Year 12,Unit 4,VCESOU4AS2,Area of Study 2 - Social movements and social change,Outcome 2,VCESOU4AS2O2KK,Activity,Bullet,"Investigate different forms of power, such as reward, coercive, referent, legitimate, expert and informational power.",,,,8
Humanities,Sociology,Year 12,Unit 4,VCESOU4AS2,Area of Study 2 - Social movements and social change,Outcome 2,VCESOU4AS2O2KK,Activity,Bullet,"Consider an overview of a range of types of social movements (alternative, reformative, redemptive, revolutionary). Identify each movement according to type, considering how much change took place and who is changed.",,,,9
Humanities,Sociology,Year 12,Unit 4,VCESOU4AS2,Area of Study 2 - Social movements and social change,Outcome 2,VCESOU4AS2O2KK,Activity,Bullet,"Create an annotated timeline of the Stop Barossa Gas (Tiwi Islands, Australia) Movement, indicating how it progressed through each stage of a social movement (emergence, coalescence, bureaucratisation). Useful sources:",,,,10
Humanities,Sociology,Year 12,Unit 4,VCESOU4AS2,Area of Study 2 - Social movements and social change,Outcome 2,VCESOU4AS2O2KK,Activity,Bullet,Stop Barossa Gas,"Create an annotated timeline of the Stop Barossa Gas (Tiwi Islands, Australia) Movement, indicating how it progressed through each stage of a social movement (emergence, coalescence, bureaucratisation). Useful sources:",,,11
Humanities,Sociology,Year 12,Unit 4,VCESOU4AS2,Area of Study 2 - Social movements and social change,Outcome 2,VCESOU4AS2O2KK,Activity,Bullet,Tiwi say no to Barossa,"Create an annotated timeline of the Stop Barossa Gas (Tiwi Islands, Australia) Movement, indicating how it progressed through each stage of a social movement (emergence, coalescence, bureaucratisation). Useful sources:",,,12
Humanities,Sociology,Year 12,Unit 4,VCESOU4AS2,Area of Study 2 - Social movements and social change,Outcome 2,VCESOU4AS2O2KK,Activity,Bullet,"Consider reasons (e.g. success, failure, repression) that a social movement may go into decline. Create a poster with the allocated reason for decline and select a specific movement to focus on. Provide details of the stage of decline, the meaning of that specific reason for decline, and link the movement's decline to this.",,,,13
Humanities,Sociology,Year 12,Unit 4,VCESOU4AS2,Area of Study 2 - Social movements and social change,Outcome 2,VCESOU4AS2O2KK,Activity,Bullet,"View a documentary on the Stop Adani movement: How Australians are Fighting Against Controversial Carmichael Coal Mine
While viewing, consider the following:",,,,14
Humanities,Sociology,Year 12,Unit 4,VCESOU4AS2,Area of Study 2 - Social movements and social change,Outcome 2,VCESOU4AS2O2KK,Activity,Bullet,The nature and purpose of the social movement,"View a documentary on the Stop Adani movement: How Australians are Fighting Against Controversial Carmichael Coal Mine
While viewing, consider the following:",,,15
Humanities,Sociology,Year 12,Unit 4,VCESOU4AS2,Area of Study 2 - Social movements and social change,Outcome 2,VCESOU4AS2O2KK,Activity,Bullet,How power is exercised by the social movement,"View a documentary on the Stop Adani movement: How Australians are Fighting Against Controversial Carmichael Coal Mine
While viewing, consider the following:",,,16
Humanities,Sociology,Year 12,Unit 4,VCESOU4AS2,Area of Study 2 - Social movements and social change,Outcome 2,VCESOU4AS2O2KK,Activity,Bullet,Current stage of the social movement,"View a documentary on the Stop Adani movement: How Australians are Fighting Against Controversial Carmichael Coal Mine
While viewing, consider the following:",,,17
Humanities,Sociology,Year 12,Unit 4,VCESOU4AS2,Area of Study 2 - Social movements and social change,Outcome 2,VCESOU4AS2O2KK,Activity,Bullet,How power is used by the social movement's opposition in an attempt to prevent it from achieving its desired social changes,"View a documentary on the Stop Adani movement: How Australians are Fighting Against Controversial Carmichael Coal Mine
While viewing, consider the following:",,,18
