SubjectArea,Subject,Band,Unit,UnitASCode,AreaofStudy,Outcome,OutcomeCode,ExampleType,ContentType,ExampleText,ParentText,URLTitle,URL,Sequence
Humanities,Sociology,Year 12,Unit 4,VCESOU4AS2,Area of Study 2 - Social movements and social change,Outcome 2,VCESOU4AS2O2KK,Activity,Bullet,The influences of the social movement on social change with consideration given to the work of Erica Chenoweth.,"View a documentary on the Stop Adani movement: How Australians are Fighting Against Controversial Carmichael Coal Mine
While viewing, consider the following:",,,19
Humanities,Sociology,Year 12,Unit 4,VCESOU4AS2,Area of Study 2 - Social movements and social change,Outcome 2,VCESOU4AS2O2KK,Activity,Paragraph,"Construct an infographic to represent your findings and then conduct a class discussion on the nature and purpose of the Stop Adani movement, with reference to examples from the documentary.",,,,20
Humanities,Sociology,Year 12,Unit 4,VCESOU4AS2,Area of Study 2 - Social movements and social change,Outcome 2,VCESOU4AS2O2KK,Activity,Bullet,"With reference to a specific social movement of choice, investigate its current stage plan and write an extended response discussing the interrelationship between the social movement's nature, purpose and stage and its ability to generate or resist change.",,,,21
Humanities,Sociology,Year 12,Unit 4,VCESOU4AS2,Area of Study 2 - Social movements and social change,Outcome 2,VCESOU4AS2O2KK,DetailedExample,Paragraph,Investigating different forms of power for a podcast / videocast,,,,22
Humanities,Sociology,Year 12,Unit 4,VCESOU4AS2,Area of Study 2 - Social movements and social change,Outcome 2,VCESOU4AS2O2KK,DetailedExampleStep,Paragraph,"Students investigate how social movements and their oppositions use reward, coercive, referent, legitimate, expert and informational power to influence social change.",,,,23
Humanities,Sociology,Year 12,Unit 4,VCESOU4AS2,Area of Study 2 - Social movements and social change,Outcome 2,VCESOU4AS2O2KK,DetailedExampleStep,Paragraph,Instructions:,,,,24
Humanities,Sociology,Year 12,Unit 4,VCESOU4AS2,Area of Study 2 - Social movements and social change,Outcome 2,VCESOU4AS2O2KK,DetailedExampleStep,Paragraph,In small groups consider one form of power per group. Then create a podcast or videocast on their allocated form of power.,,,,25
Humanities,Sociology,Year 12,Unit 4,VCESOU4AS2,Area of Study 2 - Social movements and social change,Outcome 2,VCESOU4AS2O2KK,DetailedExampleStep,Paragraph,Include in the investigation:,,,,26
Humanities,Sociology,Year 12,Unit 4,VCESOU4AS2,Area of Study 2 - Social movements and social change,Outcome 2,VCESOU4AS2O2KK,DetailedExampleStep,Bullet,Definition of the form of power,,,,27
Humanities,Sociology,Year 12,Unit 4,VCESOU4AS2,Area of Study 2 - Social movements and social change,Outcome 2,VCESOU4AS2O2KK,DetailedExampleStep,Bullet,Overview a social movement that has used the form of power,,,,28
Humanities,Sociology,Year 12,Unit 4,VCESOU4AS2,Area of Study 2 - Social movements and social change,Outcome 2,VCESOU4AS2O2KK,DetailedExampleStep,Bullet,How the use of power by the social movements impacted social change,,,,29
Humanities,Sociology,Year 12,Unit 4,VCESOU4AS2,Area of Study 2 - Social movements and social change,Outcome 2,VCESOU4AS2O2KK,DetailedExampleStep,Bullet,What and / or who has changed as a result of use of power,,,,30
Humanities,Sociology,Year 12,Unit 4,VCESOU4AS2,Area of Study 2 - Social movements and social change,Outcome 2,VCESOU4AS2O2KK,DetailedExampleStep,Paragraph,Students also respond to the following:,,,,31
Humanities,Sociology,Year 12,Unit 4,VCESOU4AS2,Area of Study 2 - Social movements and social change,Outcome 2,VCESOU4AS2O2KK,DetailedExampleStep,Bullet,Can the movement's use of power be linked to nonviolent forms of civil disobedience to achieve social change? Why / Why not?,,,,32
Humanities,Sociology,Year 12,Unit 4,VCESOU4AS2,Area of Study 2 - Social movements and social change,Outcome 2,VCESOU4AS2O2KK,DetailedExampleStep,Bullet,Who is the opposition to the social movement?,,,,33
Humanities,Sociology,Year 12,Unit 4,VCESOU4AS2,Area of Study 2 - Social movements and social change,Outcome 2,VCESOU4AS2O2KK,DetailedExampleStep,Bullet,How has the movement's opposition responded to the example of power discussed above? Consider what form(s) of power the opposition has used to resist social change.,,,,34
Humanities,Sociology,Year 12,Unit 4,VCESOU4AS2,Area of Study 2 - Social movements and social change,Outcome 2,VCESOU4AS2O2KS,DetailedExampleStep,Bullet,Evaluate the social movement and its opposition's influence on social change.,,,,35
