SubjectArea,Subject,Band,AssessmentType,AssessmentInformationDetails,AssessmentYears,UnitASCode,ExamReportCode,EQCode,SectionCode,StrategyType,ExamQuestion,ResponseSource,Content,Example,Sequence
Science,Environmental Science,Year 12,Final Exam,Post Exam Report,2024,,VCEESERB,VCEES24EQB8,VCEESERBCM,,Question 8f,ExaminerCommentary,Wind is a renewable and sustainable resource.,,124
Science,Environmental Science,Year 12,Final Exam,Post Exam Report,2024,,VCEESERB,VCEES24EQB8,VCEESERBCM,,Question 8f,ExaminerCommentary,Using wind turbines reduces the use of fossil fuels and therefore environmental impacts related to mining them.,,125
Science,Environmental Science,Year 12,Final Exam,Post Exam Report,2024,,VCEESERB,VCEES24EQB8,VCEESERBCM,,Question 8f,ExaminerCommentary,Using wind turbines reduces the use of fossil fuels and therefore greenhouse gas emissions / the rate of global warming.,,126
Science,Environmental Science,Year 12,Final Exam,Post Exam Report,2024,,VCEESERB,VCEES24EQB8,VCEESERBCM,,Question 8f,ExaminerCommentary,Arguments given against using wind turbines included:,,127
Science,Environmental Science,Year 12,Final Exam,Post Exam Report,2024,,VCEESERB,VCEES24EQB8,VCEESERBCM,,Question 8f,ExaminerCommentary,The potential injury or harm to birds and bats from flying into turbine blades,,128
Science,Environmental Science,Year 12,Final Exam,Post Exam Report,2024,,VCEESERB,VCEES24EQB8,VCEESERBCM,,Question 8f,ExaminerCommentary,The noise and visual disturbance to locals from turbines,,129
Science,Environmental Science,Year 12,Final Exam,Post Exam Report,2024,,VCEESERB,VCEES24EQB8,VCEESERBCM,,Question 8f,ExaminerCommentary,"The wind is not constant or reliable so some form of backup energy will be required, which may involve burning a fossil fuel such as diesel",,130
Science,Environmental Science,Year 12,Final Exam,Post Exam Report,2024,,VCEESERB,VCEES24EQB8,VCEESERBCM,,Question 8f,ExaminerCommentary,"The impact of the construction of turbines on the local habitat, such as clearing vegetation",,131
Science,Environmental Science,Year 12,Final Exam,Post Exam Report,2024,,VCEESERB,VCEES24EQB8,VCEESERBCM,,Question 8f,ExaminerCommentary,"The extraction/processing of materials to create turbines involves mining, which leads to environmental disturbance and the production of greenhouse gases.",,132
Science,Environmental Science,Year 12,Final Exam,Post Exam Report,2025,,VCEESER,,VCEESERAH,,,,Section A: Multiple-choice questions,,0
Science,Environmental Science,Year 12,Final Exam,Post Exam Report,2025,,VCEESERA,,VCEESERACM,,Section A - General Comments,ExaminerCommentary,The table below indicates the percentage of students who chose each option. Grey shading and bold text indicate the correct answer.,,1
Science,Environmental Science,Year 12,Final Exam,Post Exam Report,2025,,VCEESER,,VCEESERBH,,,,Section B: Section B,,0
Science,Environmental Science,Year 12,Final Exam,Post Exam Report,2025,,VCEESERB,VCEES25EQB1,VCEESERBCM,,Question 1a,ExaminerCommentary,Therefore:,,1
Science,Environmental Science,Year 12,Final Exam,Post Exam Report,2025,,VCEESERB,VCEES25EQB1,VCEESERBCM,,Question 1a,ExaminerCommentary,Simpson's Index of Diversity:,,2
Science,Environmental Science,Year 12,Final Exam,Post Exam Report,2025,,VCEESERB,VCEES25EQB1,VCEESERBCM,,Question 1a,ExaminerCommentary,D = 1 - (612 / 1122),,3
Science,Environmental Science,Year 12,Final Exam,Post Exam Report,2025,,VCEESERB,VCEES25EQB1,VCEESERBCM,,Question 1a,ExaminerCommentary,D = 1 - 0.545,,4
Science,Environmental Science,Year 12,Final Exam,Post Exam Report,2025,,VCEESERB,VCEES25EQB1,VCEESERBCM,,Question 1a,ExaminerCommentary,D = 0.454,,5
Science,Environmental Science,Year 12,Final Exam,Post Exam Report,2025,,VCEESERB,VCEES25EQB1,VCEESERBLR,LimitedStrategies,Question 1a,ExaminerCommentary,"Most students were able to correctly complete the calculation using the figures provided in the table. Many students rounded the diversity figure to two decimal places (0.45), which was acceptable. Some responses did not subtract 0.545 from 1 to get the final Simpson's Index of Diversity figure and were therefore incomplete.",,6
Science,Environmental Science,Year 12,Final Exam,Post Exam Report,2025,,VCEESERB,VCEES25EQB1,VCEESERBCM,,Question 1a,ExaminerCommentary,Students needed to demonstrate their understanding of the Simpson's Index calculation by correctly processing the figures and interpreting what the results indicate about species diversity.,,7
Science,Environmental Science,Year 12,Final Exam,Post Exam Report,2025,,VCEESERB,VCEES25EQB1,VCEESERBER,EnhancedStrategies,Question 1b,ExaminerCommentary,"An understanding of both 'species richness' and 'relative abundance' and how they applied to the data given in the table was required to successfully answer this question. Higher-scoring responses correctly explained that species richness is the number of different species (five in this example) and that relative abundance is the proportion of each species in relation to the total number of individuals of all species (i.e. how spread or even these species numbers are). To be awarded full marks, students needed to refer to the data. For example, high-scoring responses identified that there was a poor level of relative abundance with large numbers of the exotic tussock grass (25 individuals) compared to low numbers of the other grass and insect species (with only two individuals of each).",,8
Science,Environmental Science,Year 12,Final Exam,Post Exam Report,2025,,VCEESERB,VCEES25EQB1,VCEESERBLR,LimitedStrategies,Question 1b,ExaminerCommentary,"Common errors included failing to use any data to support the explanations and simply providing definitions without further explanations. There was also confusion about the term relative abundance, with some responses stating only that there were 'abundant numbers' or that the abundance was 34 (i.e. the total number of individuals).",,9
Science,Environmental Science,Year 12,Final Exam,Post Exam Report,2025,,VCEESERB,VCEES25EQB1,VCEESERBER,EnhancedStrategies,Question 1c,ExaminerCommentary,"This question required both knowledge of the Convention on International Trade in Endangered Species of Wild Fauna and Flora (CITES) treaty and a supported evaluation on whether it should apply to the park. Generally speaking, using the CITES treaty was not the appropriate method of protecting the park because it is an international treaty that covers the trade in endangered species rather than a local park. However, responses with well-supported evaluation that argued either way were given high marks. Some higher-scoring responses explained that there was no evidence of trade or that any species were endangered. Others argued that while some form of protection was required due to low species diversity of 0.45, the park would be better protected under the Environment Protection and Biodiversity Conservation Act (a more applicable form of legislation than CITES). Not all students demonstrated an understanding of how the CITES treaty applies to the protection of threatened species.",,10
Science,Environmental Science,Year 12,Final Exam,Post Exam Report,2025,,VCEESERB,VCEES25EQB1,VCEESERBER,EnhancedStrategies,Question 1d,ExaminerCommentary,"Knowledge of the mark-recapture technique for estimating population size was required to answer this question, and not all students were able to indicate this in their explanation. Higher-scoring responses explained that the technique involves capturing a number of organisms, marking them in some way, releasing them, and then attempting to recapture individuals. The number of captured and recaptured individuals can then be used to estimate the population size.",,11
Science,Environmental Science,Year 12,Final Exam,Post Exam Report,2025,,VCEESERB,VCEES25EQB1,VCEESERBER,EnhancedStrategies,Question 1d,ExaminerCommentary,"Having explained that the technique involves some disturbance to the organisms, higher-scoring responses also discussed the ethical implications, highlighting that capturing, handling and marking organisms could cause stress or harm, and noting that these species were often endangered, so capturing them could pose a further risk to the population. Students went on to explain that if the organisms were handled with as much care as possible, released quickly and safely, and the resulting population information is used to help support conservation efforts or scientific research, then the technique could be considered ethical.",,12
Science,Environmental Science,Year 12,Final Exam,Post Exam Report,2025,,VCEESERB,VCEES25EQB1,VCEESERBCM,,Question 1d,ExaminerCommentary,"A balanced discussion around the ethics of mark-recapture, along with a clear indication of the technique, was required to be awarded full marks.",,13
Science,Environmental Science,Year 12,Final Exam,Post Exam Report,2025,,VCEESERB,VCEES25EQB2,VCEESERBCM,,Question 2a,ExaminerCommentary,"The most likely International Union for Conservation of Nature (IUCN) conservation category was 'vulnerable'. The information stated that the status had been recently upgraded to 'near threatened', which indicates that the risk of extinction for the southern pygmy perch species had increased. 'Vulnerable' is the next highest category after 'near threatened'. An understanding of the categories in the IUCN classification system was required. Many students incorrectly stated 'endangered' or 'critically endangered', which were less likely than 'vulnerable'. 'Threatened', which is not an IUCN category, was also a common incorrect answer.",,14
Science,Environmental Science,Year 12,Final Exam,Post Exam Report,2025,,VCEESERB,VCEES25EQB2,VCEESERBER,EnhancedStrategies,Question 2b,ExaminerCommentary,"Competition refers to the struggle for limited resources within an ecosystem, and responses needed to make this idea clear to be awarded full marks. Higher-scoring responses explained that the invasive fish species made fewer resources available because they took away food, or used up the limited breeding spaces, from the perch population. A common error made by some students was to describe the impact of predation on perch by introduced fish species.",,15
Science,Environmental Science,Year 12,Final Exam,Post Exam Report,2025,,VCEESERB,VCEES25EQB2,VCEESERBER,EnhancedStrategies,Question 2c,ExaminerCommentary,"As part of this question, two different management strategies were listed. Students were asked to describe a relevant action for each strategy that could have been taken before the successful reintroduction of the perch took place. 'Restoration of habitat' refers to restoring the function of the habitat back to its original, undegraded state. High-scoring responses stated this and then went on to describe how this could be done. Many students identified that replanting dense reed beds and replacing driftwood pieces, as well as restoring water flows, would achieve this. In describing actions related to 'captive breeding', responses needed to make this concept clear by stating that this strategy should take place in a safe, controlled environment, free from competition with the managed mating of genetically diverse perch (usually from different populations) to improve both total numbers and the genetic diversity of the species. Not all students were able to give some relevant description to both of the strategies (especially a clear idea of what captive breeding involves).",,16
Science,Environmental Science,Year 12,Final Exam,Post Exam Report,2025,,VCEESERB,VCEES25EQB2,VCEESERBER,EnhancedStrategies,Question 2d,ExaminerCommentary,"Part of the question required students to clearly define the term 'regulating service'. Higher-scoring responses stated that these services are the benefits humans receive from the regulation of ecosystem processes, such as climate control, water purification, soil fertility and - as applies to this question - the control of pest species. The information given in the stem stated that the perch provided a natural method of pest control by consuming mosquito larvae, and most students could identify this as a regulating service.",,17
Science,Environmental Science,Year 12,Final Exam,Post Exam Report,2025,,VCEESERB,VCEES25EQB2,VCEESERBLR,LimitedStrategies,Question 2e,ExaminerCommentary,"In both parts of question 2e., responses needed to focus on the key element of the question, that is the collection and measurement of the genetic diversity of the perch population. A common error was to simply focus on why population data and measurement were important (i.e. that conservationists needed to know how many fish there were and whether total numbers were growing or declining).",,18
Science,Environmental Science,Year 12,Final Exam,Post Exam Report,2025,,VCEESERB,VCEES25EQB2,VCEESERBER,EnhancedStrategies,Question 2e,ExaminerCommentary,"High-scoring responses identified that the original data was collected to provide a baseline of the genetic diversity, which would be used to determine the effectiveness of the reintroduction program and monitor any changes in genetic diversity. For example, this could be used to give an initial understanding of any genetic issues or problems within the species or identify any suitable breeding individuals or groups (based on variations in genetics).",,19
Science,Environmental Science,Year 12,Final Exam,Post Exam Report,2025,,VCEESERB,VCEES25EQB2,VCEESERBER,EnhancedStrategies,Question 2e,ExaminerCommentary,"Focusing on the genetic diversity issue was again the key to successfully answering part ii. The basic reason why conservationists measured the genetic diversity of the perch after the reintroduction program was to determine whether there had been an increase or decrease in this diversity. High-scoring responses then went on to explain how this would give an indication of factors related to the resilience or resistance of the population to environmental change and/or disease. It could also reflect problems related to inbreeding, with smaller, inbred populations more likely to become extinct. This genetic information would provide the conservationist data which could be used to evaluate the effectiveness of the program and provide further direction to their conservation efforts.",,20
Science,Environmental Science,Year 12,Final Exam,Post Exam Report,2025,,VCEESERB,VCEES25EQB3,VCEESERBCM,,Question 3a,ExaminerCommentary,"While an understanding of the sustainability principles of 'efficiency of resource use' and 'intergenerational equity' was required, an important part of the question stated that the explanation of the meaning of each should be 'in the context' of the change from cattle farming to organic market gardening. Responses that did not score highly provided basic definitions of each and gave a simple link to some land-use changes outlined in the stem. In this type of question, it is important that students use the information provided and discuss how the sustainability principles may apply to the given scenario.",,21
Science,Environmental Science,Year 12,Final Exam,Post Exam Report,2025,,VCEESERB,VCEES25EQB3,VCEESERBER,EnhancedStrategies,Question 3a,ExaminerCommentary,"High-scoring responses provided a statement answering the first part of question; that the conversion to organic farming from cattle grazing does clearly demonstrate both sustainability principles. They went on to describe why this was the case by discussing how the 'efficiency of resource use' was a focus by using the land and water resources sustainably and minimising negative environmental impacts on the soil, creek and local biodiversity. By reducing the use of chemicals and using compost and manures the farm is using fewer resources to create more value, while producing less waste. The 'intergenerational equity' principle was related to the change in land-use of farming methods that increased biodiversity, stream health, soil nutrient levels and quality, which provided suitable resources for the current generation but also meant that the present generation should pass these natural resources with sufficient environmental quality on to future generations.",,22
Science,Environmental Science,Year 12,Final Exam,Post Exam Report,2025,,VCEESERB,VCEES25EQB3,VCEESERBER,EnhancedStrategies,Question 3a,ExaminerCommentary,"It was important to justify this discussion for full marks. Justification of the change from cattle farming to organic market gardening could have included that the cattle farming was not sustainable (that the land was very degraded and that this degradation would continue if there was no change in management practices) so the change to organic market gardening was important because the farm now meets the needs of the present generation (by producing organic foods for consumers) without compromising the needs of future generations. By recycling resources (compost and manures), limiting soil erosion, using minimal water for irrigation and increasing biodiversity, the land would be in an improved state and was therefore a more efficient use of resources.",,23
Science,Environmental Science,Year 12,Final Exam,Post Exam Report,2025,,VCEESERB,VCEES25EQB3,VCEESERBER,EnhancedStrategies,Question 3b,ExaminerCommentary,"This question was successfully answered in one of two ways by students. As stated in the study design, various factors can influence responsible decision-making, including diverse stakeholder values, knowledge and priorities. In this case, the question asked that the values and priorities that have influenced the farming family in the organic market garden's development be discussed. High-scoring responses identified that the key value was related to improving the quality of the environment on which their farm was established because they prioritised growing healthy, organic food in a way that returned the degraded ecosystem 
to health.",,24
Science,Environmental Science,Year 12,Final Exam,Post Exam Report,2025,,VCEESERB,VCEES25EQB3,VCEESERBCM,,Question 3b,ExaminerCommentary,Other students focused their answer on the value systems listed in the study design. They stated that the family's values were ecocentric because they valued the health of the environment (both living and non-living aspects) and prioritised land-use changes to return the health of the ecosystem as a whole. Because this focus was on the total environmental health of the farm (both the biotic and abiotic aspects) it was more than biocentrism (which a number of students incorrectly gave as their answer).,,25
Science,Environmental Science,Year 12,Final Exam,Post Exam Report,2025,,VCEESERB,VCEES25EQB3,VCEESERBER,EnhancedStrategies,Question 3c,ExaminerCommentary,"In using the concept of a cost-benefit analysis, students needed to indicate suitable environmental and economic examples that would result from the change in land-use from cattle grazing to organic market gardening. By completing the four spaces in the table, students were generally able to identify environmental benefits such as the increased biodiversity of the area, less erosion and improved soil fertility, and the reduced use of chemical fertilisers. Economic costs listed included the costs involved in buying and replanting endemic plants, the increased price of organic herbs and vegetables to consumers and the expense of methods to improve soil and biologically control pests. Economic benefits stated were the income gained by the family from the sale of organic produce, the employment opportunities in the local community and the reduced costs by not purchasing chemicals. Many students found it difficult to correctly identify an environmental cost involved in changing from the cattle farm to market gardening. High-scoring responses identified that because the cattle grazing land was converted into organic farming land that an environmental cost could be the chance to restore the whole area to its former natural ecosystem. Other students correctly identified another cost as the loss of native habitat because the reduced yield from organic farming requires more land to be turned over to market gardening to produce enough food to be profitable and to meet the needs of consumers.",,26
Science,Environmental Science,Year 12,Final Exam,Post Exam Report,2025,,VCEESERB,VCEES25EQB3,VCEESERBLR,LimitedStrategies,Question 3c,ExaminerCommentary,A common error resulted from students focusing on the costs and benefits of just cattle grazing (e.g. income from the sale of beef was given as an economic benefit) rather than the change in land use to organic market gardening.,,27
Science,Environmental Science,Year 12,Final Exam,Post Exam Report,2025,,VCEESERB,VCEES25EQB3,VCEESERBER,EnhancedStrategies,Question 3d,ExaminerCommentary,"First, a correct explanation of the meaning of 'anthropocentrism' was required to answer this question. That is the belief that human beings are the central or most important entity on the planet and that all other organisms and resources are secondary to human needs and purposes. Second, an evaluation of the suggestion that the family is demonstrating an anthropocentric focus was also required. Many responses identified that at a basic level the production of food is simply using the land and water resources for the benefit of humans (and for an income for the family), which could therefore be seen as an anthropocentric focus. However, high-scoring responses then went on to acknowledge that their focus on improving the state of the land, water, plants and animals shows they are considering other factors and don't consider themselves superior or separate from nature, which is more than just anthropocentrism. Some students also identified this as ecocentrism, but this was not required for full marks to be awarded.",,28
Science,Environmental Science,Year 12,Final Exam,Post Exam Report,2025,,VCEESERB,VCEES25EQB4,VCEESERBCM,,Question 4a,ExaminerCommentary,"A number of questions in the examination required a clear knowledge of key terminology and basic concepts from the study design. Sometimes the correct answer requires a straight definition, while other questions require students to apply their understanding of the term to describe, explain or evaluate different situations or examples. Students would benefit from practising approaching both types of responses to develop their skills in clearly defining terms, as well as applying them correctly to various circumstances or scenarios.",,29
Science,Environmental Science,Year 12,Final Exam,Post Exam Report,2025,,VCEESERB,VCEES25EQB4,VCEESERBER,EnhancedStrategies,Question 4a,ExaminerCommentary,"Question 4a. asked for the meaning of term 'validity' to be stated and then applied to the collection of global air quality data by the Kennaook/Cape Grim (KCG) air monitoring station. Higher-scoring responses stated that validity involves ensuring that the data collected measures what the researcher intended it to measure. In this example, by excluding data points that came across the land, local sources of air pollution would be excluded from the data set and therefore only global air quality is being measured (which is what the scientists were intending to measure).",,30
Science,Environmental Science,Year 12,Final Exam,Post Exam Report,2025,,VCEESERB,VCEES25EQB4,VCEESERBLR,LimitedStrategies,Question 4a,ExaminerCommentary,"Common errors stemmed from a confused understanding of the term 'validity'. Incorrect answers referred to validity variously as being correct or accurate measurements, or measurements without bias, or measurements that were precise and contained no errors.",,31
Science,Environmental Science,Year 12,Final Exam,Post Exam Report,2025,,VCEESERB,VCEES25EQB4,VCEESERBCM,,Question 4a,ExaminerCommentary,Students should develop a clear understanding of the scientific terminology listed in the study design (including those terms described on pages 16 to 19) and practise applying them to different scientific investigations that relate to the Environmental Science study area.,,32
Science,Environmental Science,Year 12,Final Exam,Post Exam Report,2025,,VCEESERB,VCEES25EQB4,VCEESERBER,EnhancedStrategies,Question 4b,ExaminerCommentary,The question required students to use the carbon dioxide data from the KCG monitoring station to calculate the percentage increase in carbon dioxide. The initial concentration in 1974 was 329 ppm and this had increased to 421 ppm by 2024. Students were required to show their working for full marks to be awarded. The correct calculation was:,,33
Science,Environmental Science,Year 12,Final Exam,Post Exam Report,2025,,VCEESERB,VCEES25EQB4,VCEESERBCM,,Question 4b,ExaminerCommentary,(421 - 329) / 329 = 0.2796,,34
Science,Environmental Science,Year 12,Final Exam,Post Exam Report,2025,,VCEESERB,VCEES25EQB4,VCEESERBCM,,Question 4b,ExaminerCommentary,0.2796 x 100 = 27.96% increase,,35
Science,Environmental Science,Year 12,Final Exam,Post Exam Report,2025,,VCEESERB,VCEES25EQB4,VCEESERBCM,,Question 4b,ExaminerCommentary,"Many students rounded this up to 28%, which was an acceptable answer. A level of basic mathematical skill is part of the Environmental Science study area and students should be familiar with how to complete these calculations.",,36
Science,Environmental Science,Year 12,Final Exam,Post Exam Report,2025,,VCEESERB,VCEES25EQB4,VCEESERBER,EnhancedStrategies,Question 4c,ExaminerCommentary,"When asked to 'refer to the graph' it is expected that students would use specific data from the graph. High-scoring responses clearly reviewed the graph, focused on the change from 1800 onwards and used the correct figures and units. For example, there was a clear change from a level of ~275 ppb in 1800 to a rapid increase to over 335 ppb after 2000. Common errors were to discuss the whole graph and/or simply describe that there had been a rapid increase in concentration without the use of any years or figures quantifying 
this change.",,37
