SubjectArea,Subject,Band,AssessmentType,AssessmentInformationDetails,AssessmentYears,UnitASCode,ExamReportCode,EQCode,SectionCode,StrategyType,ExamQuestion,ResponseSource,Content,Example,Sequence
Science,Environmental Science,Year 12,Final Exam,Post Exam Report,2024,,VCEESER,,VCEESERAH,,,,Section A: Multiple-choice questions,,0
Science,Environmental Science,Year 12,Final Exam,Post Exam Report,2024,,VCEESERA,,VCEESERACM,,Section A - General Comments,ExaminerCommentary,The table below indicates the percentage of students who chose each option. Grey shading and bold text indicate the correct answer.,,1
Science,Environmental Science,Year 12,Final Exam,Post Exam Report,2024,,VCEESER,,VCEESERBH,,,,Section B: Section B,,0
Science,Environmental Science,Year 12,Final Exam,Post Exam Report,2024,,VCEESERB,VCEES24EQB1,VCEESERBER,EnhancedStrategies,Question 1a,ExaminerCommentary,"One of the practical techniques used to assess species diversity, as listed in the study design, is the collection of data using grids, transects and quadrats. Higher-scoring responses clearly explained why grid sampling was used rather than transect sampling to measure insect diversity at the two sites. Examples of good responses:",,1
Science,Environmental Science,Year 12,Final Exam,Post Exam Report,2024,,VCEESERB,VCEES24EQB1,VCEESERBER,EnhancedStrategies,Question 1a,ExaminerCommentary,Grid sampling is effective when sampling large areas and monitors changes in spatial variability over a site.,,2
Science,Environmental Science,Year 12,Final Exam,Post Exam Report,2024,,VCEESERB,VCEES24EQB1,VCEESERBER,EnhancedStrategies,Question 1a,ExaminerCommentary,Transect sampling is better used to monitor changes across linear distance or along a line.,,3
Science,Environmental Science,Year 12,Final Exam,Post Exam Report,2024,,VCEESERB,VCEES24EQB1,VCEESERBCM,,Question 1a,ExaminerCommentary,Examples of when transects would be used included:,,4
Science,Environmental Science,Year 12,Final Exam,Post Exam Report,2024,,VCEESERB,VCEES24EQB1,VCEESERBER,EnhancedStrategies,Question 1a,ExaminerCommentary,Measuring species change due to succession from the coast further inland or changes due to the increase (or decrease) in altitude,,5
Science,Environmental Science,Year 12,Final Exam,Post Exam Report,2024,,VCEESERB,VCEES24EQB1,VCEESERBER,EnhancedStrategies,Question 1a,ExaminerCommentary,"Measuring changes related to differences in abiotic factors, such as temperature, soil pH or moisture, between different habitats or over a linear distance.",,6
Science,Environmental Science,Year 12,Final Exam,Post Exam Report,2024,,VCEESERB,VCEES24EQB1,VCEESERBCM,,Question 1a,ExaminerCommentary,Clear reasoning showed that these students understood the difference between the two techniques (often because they had used these techniques in the field).,,7
Science,Environmental Science,Year 12,Final Exam,Post Exam Report,2024,,VCEESERB,VCEES24EQB1,VCEESERBCM,,Question 1a,ExaminerCommentary,"This was one of the questions that was not answered well by many students. In some of the incorrect responses, students:",,8
Science,Environmental Science,Year 12,Final Exam,Post Exam Report,2024,,VCEESERB,VCEES24EQB1,VCEESERBER,EnhancedStrategies,Question 1a,ExaminerCommentary,Did not understand that both transects and grids can be used to collect population data for both flora and fauna,,9
Science,Environmental Science,Year 12,Final Exam,Post Exam Report,2024,,VCEESERB,VCEES24EQB1,VCEESERBER,EnhancedStrategies,Question 1a,ExaminerCommentary,Tried to relate the use of grids and transects to the mobility (or lack of) of particular organisms,,10
Science,Environmental Science,Year 12,Final Exam,Post Exam Report,2024,,VCEESERB,VCEES24EQB1,VCEESERBER,EnhancedStrategies,Question 1a,ExaminerCommentary,Argued about transects collecting data that was more or less biased than grid sampling,,11
Science,Environmental Science,Year 12,Final Exam,Post Exam Report,2024,,VCEESERB,VCEES24EQB1,VCEESERBER,EnhancedStrategies,Question 1a,ExaminerCommentary,Argued that using grids was easier than using transects or provided better access to the site,,12
Science,Environmental Science,Year 12,Final Exam,Post Exam Report,2024,,VCEESERB,VCEES24EQB1,VCEESERBER,EnhancedStrategies,Question 1a,ExaminerCommentary,Tried to use points from a 2023 exam question about the edge effect and grid sampling.,,13
Science,Environmental Science,Year 12,Final Exam,Post Exam Report,2024,,VCEESERB,VCEES24EQB1,VCEESERBCM,,Question 1b,ExaminerCommentary,Therefore:	Simpson's Index of Diversity:,,14
Science,Environmental Science,Year 12,Final Exam,Post Exam Report,2024,,VCEESERB,VCEES24EQB1,VCEESERBCM,,Question 1b,ExaminerCommentary,D = 1 − 1260 / 7832,,15
Science,Environmental Science,Year 12,Final Exam,Post Exam Report,2024,,VCEESERB,VCEES24EQB1,VCEESERBCM,,Question 1b,ExaminerCommentary,D = 1 − 0.161,,16
Science,Environmental Science,Year 12,Final Exam,Post Exam Report,2024,,VCEESERB,VCEES24EQB1,VCEESERBCM,,Question 1b,ExaminerCommentary,D = 0.839,,17
Science,Environmental Science,Year 12,Final Exam,Post Exam Report,2024,,VCEESERB,VCEES24EQB1,VCEESERBCM,,Question 1b,ExaminerCommentary,"Most students were able to correctly complete the calculation using the figures from the table as shown above. Many students rounded up the diversity figure to 0.84, although this was not necessary. Some incomplete answers forgot to subtract 0.161 from 1 to get the final Simpson's Index of Diversity figure.",,18
Science,Environmental Science,Year 12,Final Exam,Post Exam Report,2024,,VCEESERB,VCEES24EQB1,VCEESERBCM,,Question 1c,ExaminerCommentary,"Having calculated a Simpson's Index of Diversity (SID) figure in the previous question, better responses used this data to compare the diversity of the two areas. The urban park SID was 0.56 compared with the golf course SID of 0.84; therefore, this means that golf course has a higher diversity (0.28 higher) than the urban park.",,19
Science,Environmental Science,Year 12,Final Exam,Post Exam Report,2024,,VCEESERB,VCEES24EQB1,VCEESERBCM,,Question 1d,ExaminerCommentary,Two reasons that suggested why ground-nesting bees might survive better on a golf course compared to an urban park were required. Correct ideas focused on the difference in native vegetation and human disturbance between the two areas and included:,,20
Science,Environmental Science,Year 12,Final Exam,Post Exam Report,2024,,VCEESERB,VCEES24EQB1,VCEESERBCM,,Question 1d,ExaminerCommentary,Native vegetation on the golf course provides appropriate food sources for native bees whereas exotic plants do not.,,21
Science,Environmental Science,Year 12,Final Exam,Post Exam Report,2024,,VCEESERB,VCEES24EQB1,VCEESERBCM,,Question 1d,ExaminerCommentary,Native vegetation on the golf course provides suitable nesting sites whereas exotic plants do not.,,22
Science,Environmental Science,Year 12,Final Exam,Post Exam Report,2024,,VCEESERB,VCEES24EQB1,VCEESERBCM,,Question 1d,ExaminerCommentary,Pesticides that harm bees are used in urban parks as part of management whereas they are not used on golf courses.,,23
Science,Environmental Science,Year 12,Final Exam,Post Exam Report,2024,,VCEESERB,VCEES24EQB1,VCEESERBCM,,Question 1d,ExaminerCommentary,Nests are disturbed by humans when leaf litter is cleared in urban parks but not when rough areas are left on golf courses.,,24
Science,Environmental Science,Year 12,Final Exam,Post Exam Report,2024,,VCEESERB,VCEES24EQB1,VCEESERBCM,,Question 1d,ExaminerCommentary,"Many lowerer-scoring responses simply gave general statements such as 'humans kill bees in parks' or 'bees like native plants' or repeated, word for word, information from the stem.",,25
Science,Environmental Science,Year 12,Final Exam,Post Exam Report,2024,,VCEESERB,VCEES24EQB1,VCEESERBCM,,Question 1e,ExaminerCommentary,Most students were able to state two reasons why it is important to maintain insect populations in ecosystems. The ideas included:,,26
Science,Environmental Science,Year 12,Final Exam,Post Exam Report,2024,,VCEESERB,VCEES24EQB1,VCEESERBCM,,Question 1e,ExaminerCommentary,Their role in the process of pollination,,27
Science,Environmental Science,Year 12,Final Exam,Post Exam Report,2024,,VCEESERB,VCEES24EQB1,VCEESERBCM,,Question 1e,ExaminerCommentary,Their role as seed dispersal agents,,28
Science,Environmental Science,Year 12,Final Exam,Post Exam Report,2024,,VCEESERB,VCEES24EQB1,VCEESERBCM,,Question 1e,ExaminerCommentary,Their role as food sources for other species or as part of a food chain / food web,,29
Science,Environmental Science,Year 12,Final Exam,Post Exam Report,2024,,VCEESERB,VCEES24EQB1,VCEESERBCM,,Question 1e,ExaminerCommentary,Their role as detritivores and how they contribute to soil development.,,30
Science,Environmental Science,Year 12,Final Exam,Post Exam Report,2024,,VCEESERB,VCEES24EQB1,VCEESERBCM,,Question 1e,ExaminerCommentary,Incorrect responses commented on the part bees play in the breakdown of leaf litter and waste (but bees are not detritivores).,,31
Science,Environmental Science,Year 12,Final Exam,Post Exam Report,2024,,VCEESERB,VCEES24EQB1,VCEESERBLR,LimitedStrategies,Question 1f,ExaminerCommentary,"Overall, this question was not well answered by many students. There was a lack of understanding of the term 'validity' and many of the lower-scoring responses jumbled the concepts of accuracy, reliability and validity. Correct responses acknowledged that validity relates to the ability of an experiment to test or measure what it set out to. Because the CO2 traps are less effective in trapping smaller insects, this would not show the diversity of all insects (the researchers would only trap larger insects) and would therefore not be a valid study. It originally set out to test the numbers of all insects and because of this limitation would be less valid.",,32
Science,Environmental Science,Year 12,Final Exam,Post Exam Report,2024,,VCEESERB,VCEES24EQB1,VCEESERBER,EnhancedStrategies,Question 1g,ExaminerCommentary,"Given the information provided on how insect diversity data was collected, to provide a complete response, students needed to clearly evaluate whether or not this study adhered to ethical guidelines and develop their reasoning. Higher-scoring responses focused on explaining that for research to be considered ethical, the collection of insects should minimise the harm and suffering of the organisms, the insects should not be killed, and scientists should only trap the minimal numbers needed. Based on this, some students presented reasoning that the study was ethical because the insects were released after they had recovered from the anaesthetic and were not killed, the anaesthetic did not stress the insects, and they were collected across the site using grid sampling so only minimal numbers were caught to give population figures. Other students argued that the research was not ethical because the trapping would cause some harm to the insects, they would suffer (or may even die) when being held in a trap, or that there was no evidence that minimal numbers were targeted during the research. Both approaches demonstrated an understanding of ethical principles in scientific fieldwork and research. Some students tried to use the term 'non-maleficence' in their response without making it clear what this principle meant in the context of this research.",,33
Science,Environmental Science,Year 12,Final Exam,Post Exam Report,2024,,VCEESERB,VCEES24EQB2,VCEESERBCM,,Question 2a,ExaminerCommentary,"Information was provided about the behaviour and distribution of Australian sea lions, including a map showing their current and historical range. The map indicated that this species is endemic to the southern half of Australia, a fact that not many students recognised. The key idea that most students gave was that because there has been a significant reduction in the sea lions' range (they no longer exist in Victorian and Tasmanian waters), this would contribute to their classification as endangered. Incorrect responses did not focus on the part of the question about 'how the range of the sea lion ... contributed to this classification' and discussed general points about decreasing population size, over-hunting by Europeans or simply gave a definition of 'endangered'.",,34
Science,Environmental Science,Year 12,Final Exam,Post Exam Report,2024,,VCEESERB,VCEES24EQB2,VCEESERBCM,,Question 2b,ExaminerCommentary,An understanding of the IUCN classification system meant that suitable responses recognised that management teams would be aiming to have the classification changed to 'vulnerable'. Better student responses explained this by commenting that 'vulnerable' indicates an improvement in population numbers and therefore the sea lion numbers would have increased and would be at a lower risk of extinction. Incorrect responses tried to argue that having the classification changed to 'critically endangered' would be the management team's aim because it would equate to greater protection for the species. It is a false argument to aim to let the population size decrease to a more critical stage (i.e. closer to extinction) and then begin to do something about trying to save the sea lion species.,,35
Science,Environmental Science,Year 12,Final Exam,Post Exam Report,2024,,VCEESERB,VCEES24EQB2,VCEESERBCM,,Question 2c,ExaminerCommentary,"Most students understood the connection between small population numbers and a decrease in genetic diversity. Better responses then went on to explain that a lack of genetic diversity would mean the sea lion population is less likely to have a natural resistance to a new disease. With less resistance, more sea lions could die, thereby further reducing already small numbers.",,36
Science,Environmental Science,Year 12,Final Exam,Post Exam Report,2024,,VCEESERB,VCEES24EQB2,VCEESERBCM,,Question 2c,ExaminerCommentary,"Incorrect responses tried to use an explanation based on the idea that the sea lions, with a reduced range, would all be breeding in the one area and any new disease would quickly spread through the population. It should be understood from the information that there are still 66 breeding colonies that are found from the north of Perth in Western Australia through to the east of Adelaide in South Australia (a lengthy coastline of around 10 000 kilometres).",,37
Science,Environmental Science,Year 12,Final Exam,Post Exam Report,2024,,VCEESERB,VCEES24EQB2,VCEESERBCM,,Question 2d,ExaminerCommentary,"The question asked for students to circle one of the two listed threats to the sea lion population and then explain a management strategy to address this particular threat. In relation to the threat of 'over-exploitation of prey', better responses explained how placing restrictions on the harvest of fish and shellfish (especially on commercial fishing) would allow for an increase in the food supply. Students who circled 'reduction in land-based habitat due to erosion' identified strategies such as:",,38
Science,Environmental Science,Year 12,Final Exam,Post Exam Report,2024,,VCEESERB,VCEES24EQB2,VCEESERBCM,,Question 2d,ExaminerCommentary,"Putting in place protected areas and preventing humans from entering these reserves, allowing for vegetation to recover",,39
Science,Environmental Science,Year 12,Final Exam,Post Exam Report,2024,,VCEESERB,VCEES24EQB2,VCEESERBCM,,Question 2d,ExaminerCommentary,The restoration of habitat by employing methods to revegetate eroded areas and stabilise soil,,40
Science,Environmental Science,Year 12,Final Exam,Post Exam Report,2024,,VCEESERB,VCEES24EQB2,VCEESERBCM,,Question 2d,ExaminerCommentary,The construction of sea walls or barriers to protect coastlines from wave erosion and allow dunes/shorelines to stabilise and plants to grow. This method would likely require ramps or steps of some description to allow sea lions access to the shore.,,41
Science,Environmental Science,Year 12,Final Exam,Post Exam Report,2024,,VCEESERB,VCEES24EQB2,VCEESERBLR,LimitedStrategies,Question 2d,ExaminerCommentary,"Translocation of sea lion colonies to an area with suitable habitat without erosion or with a more plentiful amount of prey (depending on which threat was circled) were other suitable management strategies. Incorrect responses discussed the use of captive breeding, which might increase population numbers but would not address either of the two given threats. Other lower-scoring responses misread the threat 'over-exploitation of prey' and wrote answers related to 'by prey'. They incorrectly discussed issues about sea lion numbers declining because they were being eaten by predators as prey.",,42
Science,Environmental Science,Year 12,Final Exam,Post Exam Report,2024,,VCEESERB,VCEES24EQB2,VCEESERBCM,,Question 2e,ExaminerCommentary,"In general, part of this question was well answered by many students. They identified a variety of limitations related to the study of polyfluoroalkyl substances (PFAS) in sea lions. These included:",,43
Science,Environmental Science,Year 12,Final Exam,Post Exam Report,2024,,VCEESERB,VCEES24EQB2,VCEESERBCM,,Question 2e,ExaminerCommentary,The focus of the study was PFAS levels in younger animals and not all ages of sea lions,,44
Science,Environmental Science,Year 12,Final Exam,Post Exam Report,2024,,VCEESERB,VCEES24EQB2,VCEESERBCM,,Question 2e,ExaminerCommentary,The study only collected data from colonies in South Australia and did not include samples from Western Australia,,45
Science,Environmental Science,Year 12,Final Exam,Post Exam Report,2024,,VCEESERB,VCEES24EQB2,VCEESERBCM,,Question 2e,ExaminerCommentary,Data was collected from only 28 sea lion pups (i.e. a small sample size).,,46
Science,Environmental Science,Year 12,Final Exam,Post Exam Report,2024,,VCEESERB,VCEES24EQB2,VCEESERBLR,LimitedStrategies,Question 2e,ExaminerCommentary,"Many students failed to understand that the key limitation impacting on the scientists' ability to draw a conclusion was that the study did not assess whether there was a link between PFAS levels and the pups' deaths. It could not be concluded there was a cause-and-effect relationship between the levels and the deaths, and there could be other reasons for the deaths. Appropriate further testing would be required to draw a conclusion regarding the decline in sea lion numbers.",,47
Science,Environmental Science,Year 12,Final Exam,Post Exam Report,2024,,VCEESERB,VCEES24EQB2,VCEESERBCM,,Question 2f,ExaminerCommentary,The sea lions should be protected in terms of 'cultural services' for the Wirangu people because the survival of the sea lion impacts on the non-material benefits the community receives from the species. Better responses identified factors related to:,,48
Science,Environmental Science,Year 12,Final Exam,Post Exam Report,2024,,VCEESERB,VCEES24EQB2,VCEESERBCM,,Question 2f,ExaminerCommentary,The cultural significance the sea lions have for these important stakeholders,,49
Science,Environmental Science,Year 12,Final Exam,Post Exam Report,2024,,VCEESERB,VCEES24EQB2,VCEESERBCM,,Question 2f,ExaminerCommentary,Supporting the community's sense of place and cultural identity,,50
Science,Environmental Science,Year 12,Final Exam,Post Exam Report,2024,,VCEESERB,VCEES24EQB2,VCEESERBCM,,Question 2f,ExaminerCommentary,How the species provides spiritual enrichment and aesthetic experiences.,,51
Science,Environmental Science,Year 12,Final Exam,Post Exam Report,2024,,VCEESERB,VCEES24EQB2,VCEESERBLR,LimitedStrategies,Question 2f,ExaminerCommentary,"Lower-scoring responses directly rewrote points from the stem, such as stating that the sea lions should be protected because 'the Wirangu are the traditional custodians' and 'they are their spiritual totem'.",,52
Science,Environmental Science,Year 12,Final Exam,Post Exam Report,2024,,VCEESERB,VCEES24EQB3,VCEESERBCM,,Question 3,ExaminerCommentary,"This question is based on an environmental science case study, a proposal to mine a public reserve for tailings left behind after gold mining last century, with the aim of then restoring the site to a better state. This type of question aims to allow students to apply their knowledge and understanding of environmental management and sustainability principles (as outlined in Unit 3, Area of Study 2).",,53
Science,Environmental Science,Year 12,Final Exam,Post Exam Report,2024,,VCEESERB,VCEES24EQB3,VCEESERBCM,,Question 3a,ExaminerCommentary,"Better responses to this question clearly explained both of the required sustainability principles in the context of the proposal. 'In context' refers to not just providing a basic definition but explaining how it applies to the case study. In this scenario, 'efficiency of resource use' refers to extracting useful resources (i.e. gold, mercury, sand) from the tailings material that is otherwise regarded as waste, while trying to minimise the negative impacts on the creek valley. This type of explanation clearly demonstrates an understanding of the principle rather than just stating 'It is the practice of using resources in a way that maximises output while minimising waste and not impacting negatively on the environment'. Similarly, the principle of 'conservation of biodiversity and ecological integrity' was well demonstrated when students wrote about how the proposal aimed to try to restore the previous ecosystems and improve on the current ecological state. Better responses acknowledged that the current environmental health was very poor (e.g. 59% exotic vegetation, 1-2 metres of tailings covering the original creek valley, toxic heavy metal tailings) and that a restoration plan would help to improve the ongoing ecological integrity of the public reserve.",,54
Science,Environmental Science,Year 12,Final Exam,Post Exam Report,2024,,VCEESERB,VCEES24EQB3,VCEESERBER,EnhancedStrategies,Question 3a,ExaminerCommentary,"Many students did not take note of the two command terms used in the question: 'evaluate' and 'justify'. As part of preparing for any VCE examination, students should have a clear understanding of what different command terms mean and how each should be addressed. Definitions of command terms are published on the VCAA website. Higher-scoring responses were able to justify that the proposal would meet the nominated sustainability principles because the restoration was based on the already highly disturbed and degraded state of the creek valley, the amount of weed species and issues around toxic heavy metals. Many students acknowledged that there would be some initial disturbance but over the five-year plan, the public reserve would eventually be in a much better ecological state and the community would benefit from resources that would otherwise be regarded as waste. The integrity of the site has been destroyed by previous mining activities; therefore, a plan to restore it and remove introduced species is an effort to positively address sustainability issues.",,55
Science,Environmental Science,Year 12,Final Exam,Post Exam Report,2024,,VCEESERB,VCEES24EQB3,VCEESERBCM,,Question 3b,ExaminerCommentary,Most students were able to identify that the extraction of gold prior to the 1920s did not demonstrate the principle of intergenerational equity. Responses with a suitable explanation that demonstrated their understanding of 'intergenerational equity' (i.e. fairness or justice between generations) included:,,56
Science,Environmental Science,Year 12,Final Exam,Post Exam Report,2024,,VCEESERB,VCEES24EQB3,VCEESERBCM,,Question 3b,ExaminerCommentary,"A damaged and altered environment, as well as harmful waste, was left behind by the early miners to be dealt with by the current generation.",,57
Science,Environmental Science,Year 12,Final Exam,Post Exam Report,2024,,VCEESERB,VCEES24EQB3,VCEESERBCM,,Question 3b,ExaminerCommentary,The cost of environmental repair and restoration is being borne by the current generation rather than being absorbed by past generations.,,58
Science,Environmental Science,Year 12,Final Exam,Post Exam Report,2024,,VCEESERB,VCEES24EQB3,VCEESERBCM,,Question 3b,ExaminerCommentary,"Gold resources were extracted and depleted in the past, and therefore there are limited resources available for future generations.",,59
Science,Environmental Science,Year 12,Final Exam,Post Exam Report,2024,,VCEESERB,VCEES24EQB3,VCEESERBCM,,Question 3c,ExaminerCommentary,Most students were able to give at least one reason for an environmental effects statement (EES) helping to support responsible decision-making. Higher-sciring responses provided two points. Suitable responses included:,,60
Science,Environmental Science,Year 12,Final Exam,Post Exam Report,2024,,VCEESERB,VCEES24EQB3,VCEESERBCM,,Question 3c,ExaminerCommentary,"As part of the review and approval process, the EES would help identify any potential issues or risks.",,61
Science,Environmental Science,Year 12,Final Exam,Post Exam Report,2024,,VCEESERB,VCEES24EQB3,VCEESERBCM,,Question 3c,ExaminerCommentary,It could be used to help develop strategies or management plans to address and minimise any possible impacts.,,62
Science,Environmental Science,Year 12,Final Exam,Post Exam Report,2024,,VCEESERB,VCEES24EQB3,VCEESERBCM,,Question 3c,ExaminerCommentary,It can inform discussion by stakeholders who can then express viewpoints on the proposal to feed into the decision-making process.,,63
Science,Environmental Science,Year 12,Final Exam,Post Exam Report,2024,,VCEESERB,VCEES24EQB3,VCEESERBCM,,Question 3c,ExaminerCommentary,It helps to make proponents more accountable for the plan.,,64
