SubjectArea,Subject,Band,AssessmentType,AssessmentInformationDetails,AssessmentYears,UnitASCode,ExamReportCode,EQCode,SectionCode,StrategyType,ExamQuestion,ResponseSource,Content,Example,Sequence
Science,Environmental Science,Year 12,Final Exam,Post Exam Report,2025,,VCEESERB,VCEES25EQB4,VCEESERBCM,,Question 4c,ExaminerCommentary,"Students were required to state what caused the changes in atmospheric nitrous oxide levels both before and after 1800. Most students were able to identify factors relevant to the dramatic increase in nitrous oxide levels post-1800 and usually described one contribution from the burning of fossil fuels and biomass waste, industrial processes (e.g. the production of nitric acid), or the various sources from agricultural production (e.g. the increased use of nitrogen fertilisers, soil cultivation and the use of animal manures).",,38
Science,Environmental Science,Year 12,Final Exam,Post Exam Report,2025,,VCEESERB,VCEES25EQB4,VCEESERBER,EnhancedStrategies,Question 4c,ExaminerCommentary,The causes of fluctuations in the nitrous oxide levels prior to 1800 were less well identified. Higher-scoring responses were able to identify natural fluctuations in the nitrogen cycle due to climate variations (warmer and cooler periods in the past) or the impacts of volcanic eruptions (which do not emit much nitrous oxide but may impact on climate conditions).,,39
Science,Environmental Science,Year 12,Final Exam,Post Exam Report,2025,,VCEESERB,VCEES25EQB4,VCEESERBLR,LimitedStrategies,Question 4d,ExaminerCommentary,"Global warming potential (GWP) is a measure of how much heat a greenhouse gas contributes to warming the atmosphere over a specified time period, relative to the same amount of carbon dioxide. This point needed to be made clear and then related to the given GWP of 273 for nitrous oxide. What this means is that one unit of nitrous oxide will absorb 273 times more heat energy than a unit of carbon dioxide over 20 years. Common errors were to simple state that it was the potential to warm earth or an indication of how much of the gas there is, or how long it will last, in the atmosphere.",,40
Science,Environmental Science,Year 12,Final Exam,Post Exam Report,2025,,VCEESERB,VCEES25EQB4,VCEESERBCM,,Question 4e,ExaminerCommentary,"The interactions between solar energy that is absorbed, re-emitted and reflected by atmospheric gases and other matter, including the albedo effect, are a key element in the scientific understanding of the natural greenhouse effect and climate change. Overall, the level of understanding demonstrated in responses to this question was low.",,41
Science,Environmental Science,Year 12,Final Exam,Post Exam Report,2025,,VCEESERB,VCEES25EQB4,VCEESERBER,EnhancedStrategies,Question 4e,ExaminerCommentary,"Few students provided a complete answer sufficient for full marks. The key to answering this question was identifying that the relevant form of solar radiation is visible light, which largely passes through the atmosphere (although some is scattered by clouds and dust particles) and reaches Earth where it is mostly absorbed by Earth's surface. This absorbed visible light is then re-emitted as infrared radiation back into the atmosphere, where it is partially absorbed by greenhouse gases. These gases then emit the infrared radiation in all directions, both outward toward space and downward toward Earth, which then helps to warm Earth. This reradiated infrared increases Earth's surface temperature, helping to maintain an environment that is able to support life.",,42
Science,Environmental Science,Year 12,Final Exam,Post Exam Report,2025,,VCEESERB,VCEES25EQB4,VCEESERBLR,LimitedStrategies,Question 4e,ExaminerCommentary,"Lower-scoring responses often confused ideas about the forms of radiation, with many describing global warming being caused by the incoming solar infrared (rather than visible light reemitted as infrared), or discussed irrelevant points about ultraviolet radiation and the ozone layer. Others could not name the relevant forms of solar radiation and inaccurately discussed wavelengths. This was one of several questions where careful reading and targeted responses were required, and many students did not address the specific points required.",,43
Science,Environmental Science,Year 12,Final Exam,Post Exam Report,2025,,VCEESERB,VCEES25EQB5,VCEESERBLR,LimitedStrategies,Question 5a,ExaminerCommentary,"The term 'uncertainty' is defined in the study design as 'the range of values in which the true value is expected to lie'. In this case, the optimal growing temperature for cotton was given as 28 degrees Celsius, with a degree of uncertainty of ±2 degrees Celsius. This indicates that the ideal growing temperature for cotton (the true value) lies between 26 and 30 degrees Celsius. Less than a quarter of students were able to correctly describe what was meant by the term 'uncertainty'. Common errors included simply describing 'uncertainty' as lacking certainty, evidence, knowledge or agreement about the ideal growing temperature. This was another example of a question where many students were unclear about the meaning of a term from the study design and how it applies to the data.",,44
Science,Environmental Science,Year 12,Final Exam,Post Exam Report,2025,,VCEESERB,VCEES25EQB5,VCEESERBER,EnhancedStrategies,Question 5b,ExaminerCommentary,"Students were required to use the information provided about the implications of findings from climate change modelling to determine future risks to the cotton growing industry in Australia. Most students were able to suggest at least one clear risk linked to possible changes in climate, although two were required. High-scoring responses included risks such as:",,45
Science,Environmental Science,Year 12,Final Exam,Post Exam Report,2025,,VCEESERB,VCEES25EQB5,VCEESERBER,EnhancedStrategies,Question 5b,ExaminerCommentary,"An increase in the frequency of high temperature days of more than 35 °C can lead to increased flower loss and a decreasing yield from plants, causing the industry to lose income.",,46
Science,Environmental Science,Year 12,Final Exam,Post Exam Report,2025,,VCEESERB,VCEES25EQB5,VCEESERBER,EnhancedStrategies,Question 5b,ExaminerCommentary,"An increase in evaporation and transpiration can increase the need for more watering, or cause wilting and death of cotton plants due to lack of water.",,47
Science,Environmental Science,Year 12,Final Exam,Post Exam Report,2025,,VCEESERB,VCEES25EQB5,VCEESERBER,EnhancedStrategies,Question 5b,ExaminerCommentary,No significant increase in seasonal rainfall can lead to an increased need for irrigation and cause death due to lack of water in hot conditions.,,48
Science,Environmental Science,Year 12,Final Exam,Post Exam Report,2025,,VCEESERB,VCEES25EQB5,VCEESERBER,EnhancedStrategies,Question 5b,ExaminerCommentary,"An increase in average seasonal temperatures may be higher than the optimal growing temperature for cotton and therefore can hinder growth by damaging basic metabolic processes (such as photosynthesis and respiration), increasing stress and disrupting the growth of cotton plants.",,49
Science,Environmental Science,Year 12,Final Exam,Post Exam Report,2025,,VCEESERB,VCEES25EQB5,VCEESERBLR,LimitedStrategies,Question 5b,ExaminerCommentary,"Lower-scoring responses did not clearly link the specific climate information with a risk to the cotton industry, and simply stated that a change to the climate would stop cotton growing.",,50
Science,Environmental Science,Year 12,Final Exam,Post Exam Report,2025,,VCEESERB,VCEES25EQB5,VCEESERBCM,,Question 5c,ExaminerCommentary,"Students were generally able to explain the importance of the Northern Territory Government gaining Aboriginal people's perspective on the growing of cotton in their local area. High-scoring answers acknowledged that they are significant stakeholders with a valuable perspective on land use, as well as having a long connection to the land as traditional custodians. Others described the cultural significance and spiritual connection to the land Aboriginal people have, as well as holding a deep knowledge of the land, seasons and ecosystems.",,51
Science,Environmental Science,Year 12,Final Exam,Post Exam Report,2025,,VCEESERB,VCEES25EQB5,VCEESERBCM,,Question 5d,ExaminerCommentary,"The information given in this question states that the Intergovernmental Panel on Climate Change (IPCC) has indicated with high confidence that sustainable land management practices can contribute to reducing the negative impacts of climate change. This level of IPCC confidence rating suggests there is a significant amount of evidence or research based on using scientific modelling, as well as a consensus of agreement between scientists, that sustainable land management practices can contribute to reducing the impacts of climate change. This indicates the importance of sustainable land management practices for cotton growers into the future.",,52
Science,Environmental Science,Year 12,Final Exam,Post Exam Report,2025,,VCEESERB,VCEES25EQB5,VCEESERBCM,,Question 5d,ExaminerCommentary,"Most students were able to acknowledge the importance of sustainable land management practices when growing cotton, but many responses could not outline what the confidence rating referred to. Simple statements that the IPCC are very confident does not demonstrate an understanding of the IPCC confidence rating climate projection guidelines.",,53
Science,Environmental Science,Year 12,Final Exam,Post Exam Report,2025,,VCEESERB,VCEES25EQB6,VCEESERBCM,,Question 6a,ExaminerCommentary,"The correct sequence of energy transformations when biomass is combusted in a power plant to produce electricity is: chemical > thermal (heat) > mechanical/kinetic > electrical. Some students incorrectly described the energy in biomass simply as 'potential', which was not specific enough, as biomass energy is chemical energy, not gravitational potential energy. The transformation of the biomass during combustion in the furnace produces thermal kinetic energy (or heat), not just 'kinetic' energy.",,54
Science,Environmental Science,Year 12,Final Exam,Post Exam Report,2025,,VCEESERB,VCEES25EQB6,VCEESERBCM,,Question 6b,ExaminerCommentary,Many students were able to apply the correct formula to correctly calculate the efficiency of the biofuel power plant using the data provided:,,55
Science,Environmental Science,Year 12,Final Exam,Post Exam Report,2025,,VCEESERB,VCEES25EQB6,VCEESERBCM,,Question 6b,ExaminerCommentary,The figures given meant that:,,56
Science,Environmental Science,Year 12,Final Exam,Post Exam Report,2025,,VCEESERB,VCEES25EQB6,VCEESERBLR,LimitedStrategies,Question 6b,ExaminerCommentary,"Students were asked to show their working in reaching the correct figure of 35 per cent to gain both marks for this question. Some students were unable to correctly complete the basic mathematical calculation including percentage change and, in this case, energy efficiency.",,57
Science,Environmental Science,Year 12,Final Exam,Post Exam Report,2025,,VCEESERB,VCEES25EQB6,VCEESERBER,EnhancedStrategies,Question 6c,ExaminerCommentary,"Students were required to compare the environmental impact of using biomass energy and coal in terms of the carbon cycle. As listed in the study design, an understanding of 'carbon sequestration in land and water that results in short-term (less than 100 years) and long-term (more than 1000 years) changes in the carbon cycle' is part of the focus on using different energy sources and climate change. The first point that most students were able to use in the comparison was to acknowledge that both biomass and coal produce carbon dioxide when combusted, but that biomass is regarded as more carbon neutral. High-scoring responses then focused on comparing the differences in terms of the carbon cycle, that is, when growing biomass takes carbon out of the atmosphere (through plant photosynthesis) and releases this again when burnt (carbon is cycling through the environment in the short term). Whereas coal, when burnt, releases large amounts of fossilised carbon (that has been stored for millions of years) and this is disrupting the carbon cycle by releasing carbon faster than it can be absorbed or sequestered (and therefore contributing to climate change).",,58
Science,Environmental Science,Year 12,Final Exam,Post Exam Report,2025,,VCEESERB,VCEES25EQB6,VCEESERBCM,,Question 6d,ExaminerCommentary,"Most students were able to identify one risk of growing energy crops for biomass fuel, and many then adequately described the potential impact this risk might have on the local environment. Examples of correct responses included a risk such as:",,59
Science,Environmental Science,Year 12,Final Exam,Post Exam Report,2025,,VCEESERB,VCEES25EQB6,VCEESERBCM,,Question 6d,ExaminerCommentary,Deforestation of ecosystems that impact negatively by reducing biodiversity and species habitats,,60
Science,Environmental Science,Year 12,Final Exam,Post Exam Report,2025,,VCEESERB,VCEES25EQB6,VCEESERBCM,,Question 6d,ExaminerCommentary,Carbon emissions from turning the soil and removing plants increasing climate change,,61
Science,Environmental Science,Year 12,Final Exam,Post Exam Report,2025,,VCEESERB,VCEES25EQB6,VCEESERBCM,,Question 6d,ExaminerCommentary,Depletion of soil nutrients and water sources due to the growing requirements of biomass crops,,62
Science,Environmental Science,Year 12,Final Exam,Post Exam Report,2025,,VCEESERB,VCEES25EQB6,VCEESERBCM,,Question 6d,ExaminerCommentary,Loss of biodiversity due to the growth of biomass crops as monocultures.,,63
Science,Environmental Science,Year 12,Final Exam,Post Exam Report,2025,,VCEESERB,VCEES25EQB6,VCEESERBLR,LimitedStrategies,Question 6e,ExaminerCommentary,"In general, this question was not well answered, with many responses showing a poor understanding of base load energy. Base load is the minimum amount of electricity a power grid needs to generate continuously to meet a constant, 24-hour, 7-days-a-week electricity demand. This needed to be correctly and fully stated as part of the evaluation of the ability of biomass to supply the Northern Rivers region with electricity. Many lower-scoring responses did not provide an evaluation supported by relevant reasoning.",,64
Science,Environmental Science,Year 12,Final Exam,Post Exam Report,2025,,VCEESERB,VCEES25EQB6,VCEESERBCM,,Question 6e,ExaminerCommentary,"An evaluation could be given in support of or against the ability of biomass to supply a base load to the community. It required some level of discussion with support, such as that biomass would be able to supply a constant supply of combustible fuel to generate continuous electricity if enough land was given over to the production of organic material. Other acceptable answers argued that biomass could not supply a continuous supply for 60,000 homes because it is unlikely that the average number of people per home would be five (i.e. 300,000 people in 60,000 homes), therefore more homes (with various businesses and industries) would need more electrical energy than two biomass power plants could supply.",,65
Science,Environmental Science,Year 12,Final Exam,Post Exam Report,2025,,VCEESERB,VCEES25EQB7,VCEESERBCM,,Question 7a,ExaminerCommentary,"A table was provided to allow students to circle the correct classifications for nuclear energy in terms of its source and renewability. Most students correctly circled non-fossil and non-renewable, however, many incorrect responses identified nuclear energy as a fossil fuel.",,66
Science,Environmental Science,Year 12,Final Exam,Post Exam Report,2025,,VCEESERB,VCEES25EQB7,VCEESERBER,EnhancedStrategies,Question 7b,ExaminerCommentary,"The level of understanding of nuclear energy and how it is generated varied considerably among students. Higher-scoring responses clearly explained that the production of electricity from a nuclear reactor is not a major source of greenhouse gas emissions (although some emissions occur during mining, construction and transport to produce nuclear fuel/energy). The key implication of this is that by replacing fossil fuels with nuclear energy it could reduce the impact of the enhanced greenhouse effect.",,67
Science,Environmental Science,Year 12,Final Exam,Post Exam Report,2025,,VCEESERB,VCEES25EQB7,VCEESERBCM,,Question 7b,ExaminerCommentary,"In terms of reliability, nuclear energy is able to provide a reliable source of electrical energy that can operate continuously regardless of weather conditions and sunlight (it is not intermittent like solar and wind). The implications of this are that nuclear energy can be used and controlled to provide a suitable base load (rather than peak) for a large population.",,68
Science,Environmental Science,Year 12,Final Exam,Post Exam Report,2025,,VCEESERB,VCEES25EQB7,VCEESERBCM,,Question 7c,ExaminerCommentary,"In order to calculate the total costs involved in building and operating a nuclear reactor and a wind farm over an 80-year period, students were required to use the data provided in the table. The basic calculations needed to account for the life span of each system are:",,69
Science,Environmental Science,Year 12,Final Exam,Post Exam Report,2025,,VCEESERB,VCEES25EQB7,VCEESERBCM,,Question 7c,ExaminerCommentary,"Nuclear = 5 billion + (600 million x 80) = $53,000 million",,70
Science,Environmental Science,Year 12,Final Exam,Post Exam Report,2025,,VCEESERB,VCEES25EQB7,VCEESERBCM,,Question 7c,ExaminerCommentary,"Wind = (500 million x 4 + 450 million x 80) = $38,000 million",,71
Science,Environmental Science,Year 12,Final Exam,Post Exam Report,2025,,VCEESERB,VCEES25EQB7,VCEESERBCM,,Question 7c,ExaminerCommentary,"Based on these figures (having noted that the wind farms need to be replaced every 20 years), wind farms are less costly over the 80-year period. Not all students were able to correctly calculate these costs.",,72
Science,Environmental Science,Year 12,Final Exam,Post Exam Report,2025,,VCEESERB,VCEES25EQB7,VCEESERBCM,,Question 7c,ExaminerCommentary,"The major factor that should be considered when evaluating nuclear power against wind generation had to be the safe disposal of the radioactive nuclear waste and/or the possible release of harmful radiation into the environment from a nuclear reactor meltdown. Not many students understood this danger or could not explain this factor clearly. Many students gave answers that related to factors already considered in parts a., b. and ci, such as comparing the renewability or the reliability of wind and nuclear, when the question clearly stated that these factors should not be considered.",,73
Science,Environmental Science,Year 12,Final Exam,Post Exam Report,2025,,VCEESERB,VCEES25EQB8,VCEESERBER,EnhancedStrategies,Question 8a,ExaminerCommentary,"The question asked for a suitable hypothesis to be stated for the experiment that was outlined in the stem. A hypothesis is a clear statement (usually a prediction) that indicates a relationship between an independent and dependent variable (one that can be tested). Higher-scoring responses predicted that the box insulated with the highest R value material (or box 3 covered by natural wool batts) will retain higher levels of heat over the 30-minute period. Other correct answers wrote that the box insulated with the lowest R value material would lose the most heat over the 30 minutes of testing. Some incorrect answers discussed factors such as the water temperature increasing over time, or that the students were trying to measure and calculate R values.",,74
Science,Environmental Science,Year 12,Final Exam,Post Exam Report,2025,,VCEESERB,VCEES25EQB8,VCEESERBCM,,Question 8b,ExaminerCommentary,"The dependent variable that most students correctly identified is the loss of heat (or change in temperature) from the water in the beaker. To be awarded the mark, students needed to be clear that it was the water temperature that was being measured (not the temperature of the box or the air). The most common incorrect answer given was the R value of the insulation (which is the independent variable in the experiment).",,75
Science,Environmental Science,Year 12,Final Exam,Post Exam Report,2025,,VCEESERB,VCEES25EQB8,VCEESERBCM,,Question 8c,ExaminerCommentary,"Most students predicted that box 1 (plain plywood) would lose the highest amount of heat over the 30 minutes and justified this choice by identifying that this box had the lowest R value, which meant that it would lose heat faster (or that the other boxes had insulation with a higher R value would therefore retain heat for longer).",,76
Science,Environmental Science,Year 12,Final Exam,Post Exam Report,2025,,VCEESERB,VCEES25EQB8,VCEESERBCM,,Question 8d,ExaminerCommentary,"This question required students to have a correct understanding of what a systematic error is (as opposed to a random or personal error). Many students jumbled these error terms together and described any experimental errors rather than a systematic one. Systematic errors affect the accuracy of a measurement. Systematic errors cause readings to differ from the true value by a consistent amount each time a measurement is made, so that all the readings are shifted in one direction from the true value (as defined in the study design). The accuracy of measurements subject to systematic errors cannot be improved by simply repeating those measurements.",,77
Science,Environmental Science,Year 12,Final Exam,Post Exam Report,2025,,VCEESERB,VCEES25EQB8,VCEESERBER,EnhancedStrategies,Question 8d,ExaminerCommentary,"A systematic error associated with using the temperature probe would be an error that causes measurements to consistently deviate from the true value in the same direction. This could be due to faulty equipment (e.g. badly constructed box) or the incorrect calibration of the probe (which many students identified). Higher-scoring responses then suggested how this error could have been prevented, for example by checking each probe to ensure that it is not faulty and/or calibrating it against a known, accurately calibrated temperature probe.",,78
Science,Environmental Science,Year 12,Final Exam,Post Exam Report,2025,,VCEESERB,VCEES25EQB8,VCEESERBCM,,Question 8e,ExaminerCommentary,"Most students explained that insulation with a higher R value would help to maintain a more even temperature throughout the home (for both heating and cooling) because less heat from the outside could enter during summer, and less heat could escape from inside the house during winter. This consistently decreases energy demands by the householder (reducing personal energy consumption because people did not have to use their heaters or air conditioners as much).",,79
Science,Environmental Science,Year 12,Final Exam,Post Exam Report,2025,,VCEESERB,VCEES25EQB8,VCEESERBER,EnhancedStrategies,Question 8f,ExaminerCommentary,"A variety of ideas were suggested to explain how the builder could maximise the insulation efficiency of the home in terms of heating and cooling, with the most common being that the builder should use insulation with the highest R value possible to maintain temperatures within the house. Higher-scoring responses then went on to suggest other key ideas to improve the efficiency of the house such as using underfloor insulation (as well as roof and wall) or double-glazed windows. Some students suggested ideas related to the albedo effect (e.g. the choice of lighter paint colours to reflect heat and keep the home cooler).",,80
