SubjectArea,Subject,Band,AssessmentType,AssessmentInformationDetails,AssessmentYears,UnitASCode,ExamReportCode,EQCode,SectionCode,StrategyType,ExamQuestion,ResponseSource,Content,Example,Sequence
Science,Environmental Science,Year 12,Final Exam,Post Exam Report,2024,,VCEESERB,VCEES24EQB3,VCEESERBLR,LimitedStrategies,Question 3d,ExaminerCommentary,"Overall, this question was not well answered. Many responses gave an incorrect interpretation of the precautionary principle, confusing it with conducting a risk assessment or a cost-benefit analysis. Other lower-scoring responses stated that the principle required the proponents to be 'cautious' or just stop any negative environmental impacts. Higher-scoring students clearly understood that the precautionary principle refers to a lack of certainty around potential harmful environmental impacts (due to insufficient scientific information) and therefore means the proposal should not go ahead until more data is collected and potential impacts are determined. The question asked how the principle should be applied to any proposal to mine the tailings. In this case, there was a lack of evidence to establish the risk levels of extracting tailings and any potential impacts from this, and therefore more scientific research was required. Before the proposal could proceed, the mining company should be required to provide evidence that the environmental damage caused by removing material would be minimal and present plans for how the environment would be returned to its original state.",,65
Science,Environmental Science,Year 12,Final Exam,Post Exam Report,2024,,VCEESERB,VCEES24EQB3,VCEESERBLR,LimitedStrategies,Question 3e,ExaminerCommentary,Most students were able to identify one beneficial and one harmful effect of the proposal. Beneficial impacts on the lithosphere included reshaping the creek valley to its original landscape or removing toxic heavy metal chemicals from the soil. The most commonly stated harmful impact on the hydrosphere was that harmful heavy metals could be released from the soil when disturbed and enter the creek waters via the run-off. Less successful responses made comments about harm or benefits on flora and fauna (rather than soil or water).,,66
Science,Environmental Science,Year 12,Final Exam,Post Exam Report,2024,,VCEESERB,VCEES24EQB4,VCEESERBCM,,Question 4a,ExaminerCommentary,"Students were asked to explain the meaning of the term 'albedo effect' and most responses explained the basic concept that it is a measure of how much solar radiation a surface reflects (or absorbs). Others stated that it is the fraction of solar energy reflected from Earth back into space measured on a scale from zero (absorbs all radiation) to 1 (reflects all radiation). Better responses went on to explain that this relates to the urban heat island effect because the darker-coloured surfaces found in cities absorb more radiation (or reflect less radiation) than lighter surfaces. Since urban environments have more dark surfaces (such as buildings, roads and carparks) compared with the surrounding rural areas, this leads to a greater localised warming, which is the urban heat island effect.",,67
Science,Environmental Science,Year 12,Final Exam,Post Exam Report,2024,,VCEESERB,VCEES24EQB4,VCEESERBLR,LimitedStrategies,Question 4b,ExaminerCommentary,"This question required a correct understanding of what the Intergovernmental Panel on Climate Change (IPCC) confidence rating scale involves. Better responses stated that the confidence rating refers to 'how plausible or likely or probable' the projected range of climate change is for a given emission scenario. They then went on to explain that a particular confidence level is based on the evidence (which could be the type, amount or consistency of the data), the quality of the computer climate models or the degree of scientific agreement that the projection will produce. Many lower-scoring responses confused confidence with the idea of how 'accurate or valid' the projection was or simply stated 'how confident the IPCC are of their prediction'.",,68
Science,Environmental Science,Year 12,Final Exam,Post Exam Report,2024,,VCEESERB,VCEES24EQB4,VCEESERBLR,LimitedStrategies,Question 4c,ExaminerCommentary,Better answers responded to the question of why green roofs and vertical gardens would be classified as a new technology by explaining that this method is using previously unused or recently developed building methods and designs to have an impact (reduction) on atmospheric greenhouse gas levels. Less successful responses did not specifically indicate how greenhouse gas levels would be impacted but rather focused on the effect of this new technology on climate change in general. Better responses made it clear that the plants (in the vertical gardens and green roofs) would absorb carbon dioxide when photosynthesising and therefore could assist with carbon sequestration in a localised environment. This would reduce the levels of this key greenhouse gas (carbon dioxide) in the atmosphere.,,69
Science,Environmental Science,Year 12,Final Exam,Post Exam Report,2024,,VCEESERB,VCEES24EQB4,VCEESERBCM,,Question 4d,ExaminerCommentary,"Many students did not have a clear idea of the difference between mitigation and adaptation strategies used in an effort to manage climate change, and overall this question was not well answered. Better responses explained that mitigation strategies are focused on making the impacts of climate change less severe by reducing or preventing greenhouse gas emissions, and that adaptation strategies involve taking actions to prevent or manage the damage greenhouse gas emissions cause by adjusting to the effects of climate change. Most of these students then went on to explain that the strategy is an adaptation option because at a local level vertical gardens and rooftop greening is being used to help cool the surrounding area (i.e. adjusting to climate change effects) and is not directly aimed at reducing greenhouse gas emissions. Others successfully argued that it could be viewed as a mitigation option because more plantings in the urban environment reduce carbon dioxide levels because plants act as carbon sinks.",,70
Science,Environmental Science,Year 12,Final Exam,Post Exam Report,2024,,VCEESERB,VCEES24EQB5,VCEESERBER,EnhancedStrategies,Question 5a,ExaminerCommentary,"The main role carbon dioxide plays in the greenhouse effect is that it absorbs and re-emits infrared radiation in the atmosphere. Not all students made this point clear in their answers. Higher-scoring responses went on to identify that human activities have caused the enhanced greenhouse effect by adding increased levels of carbon dioxide and disrupting the carbon cycle. With more infrared radiation being trapped, there is an increased warming of the atmosphere (known as the enhanced greenhouse effect).",,71
Science,Environmental Science,Year 12,Final Exam,Post Exam Report,2024,,VCEESERB,VCEES24EQB5,VCEESERBCM,,Question 5b,ExaminerCommentary,"Two major greenhouse gases needed to be identified. Most students correctly stated methane and either nitrous oxide, ozone or chlorofluorocarbons (CFCs). Incorrect responses gave water vapour or carbon dioxide despite the question asking for greenhouse gases other than these two.",,72
Science,Environmental Science,Year 12,Final Exam,Post Exam Report,2024,,VCEESERB,VCEES24EQB5,VCEESERBCM,,Question 5c,ExaminerCommentary,The table provided space for students to write one environmental advantage and one disadvantage of using hempcrete rather than concrete in housing construction. Acceptable advantages included:,,73
Science,Environmental Science,Year 12,Final Exam,Post Exam Report,2024,,VCEESERB,VCEES24EQB5,VCEESERBCM,,Question 5c,ExaminerCommentary,Hempcrete provides for carbon sequestration as the hemp plant grows.,,74
Science,Environmental Science,Year 12,Final Exam,Post Exam Report,2024,,VCEESERB,VCEES24EQB5,VCEESERBCM,,Question 5c,ExaminerCommentary,Less greenhouse gases (or carbon dioxide) are emitted when hempcrete is used instead of concrete.,,75
Science,Environmental Science,Year 12,Final Exam,Post Exam Report,2024,,VCEESERB,VCEES24EQB5,VCEESERBCM,,Question 5c,ExaminerCommentary,Hempcrete is a renewable and sustainable building resource.,,76
Science,Environmental Science,Year 12,Final Exam,Post Exam Report,2024,,VCEESERB,VCEES24EQB5,VCEESERBCM,,Question 5c,ExaminerCommentary,"Less mining for ingredients, including sand, gravel and stone, is required; therefore, the environment is less disrupted.",,77
Science,Environmental Science,Year 12,Final Exam,Post Exam Report,2024,,VCEESERB,VCEES24EQB5,VCEESERBLR,LimitedStrategies,Question 5c,ExaminerCommentary,The environmental disadvantages given focused on the land clearing required to grow hemp crops and the resulting degradation or loss of natural habitat. Other disadvantages given were the impacts from the use of chemical fertilisers and pesticides or the use of farm machinery that results in fossil fuel combustion (and releases carbon dioxide). Lower-scoring responses gave economic or social advantages or disadvantages rather than environmental ones.,,78
Science,Environmental Science,Year 12,Final Exam,Post Exam Report,2024,,VCEESERB,VCEES24EQB5,VCEESERBCM,,Question 5d,ExaminerCommentary,"The graph clearly shows a large increase in carbon dioxide emissions from around 1945 onwards. The reasons for this were the rapid growth of the global population after World War II and the increased reliance on cement as a building material. Most students were able to identify the link between the growth in human population, which has resulted in increased levels of industrialisation and urbanisation, and the requirement for more cement to make the concrete used in infrastructure projects.",,79
Science,Environmental Science,Year 12,Final Exam,Post Exam Report,2024,,VCEESERB,VCEES24EQB6,VCEESERBCM,,Question 6a,ExaminerCommentary,"Based on an understanding of the term 'renewable', better responses explained that because the Sun is the source of solar energy it cannot be depleted and will not run out. The idea that a renewable resource is derived from sources that are replenished at a higher rate than they are consumed was correctly used by many students. Incorrect responses discussed points about how solar panels operate or described how solar energy comes from a natural source (which is a true statement but does not make it renewable).",,80
Science,Environmental Science,Year 12,Final Exam,Post Exam Report,2024,,VCEESERB,VCEES24EQB6,VCEESERBCM,,Question 6b,ExaminerCommentary,Most students were able to identify a relevant stakeholder and describe the knowledge they bring to the issue of electrical energy supply and use. For example:,,81
Science,Environmental Science,Year 12,Final Exam,Post Exam Report,2024,,VCEESERB,VCEES24EQB6,VCEESERBCM,,Question 6b,ExaminerCommentary,Energy companies have technical knowledge of how the electricity grid operates and its current limitations.,,82
Science,Environmental Science,Year 12,Final Exam,Post Exam Report,2024,,VCEESERB,VCEES24EQB6,VCEESERBCM,,Question 6b,ExaminerCommentary,"Home owners have knowledge of their own energy consumption requirements and patterns of usage, and can make adjustments to when appliances are used and what appliances they have.",,83
Science,Environmental Science,Year 12,Final Exam,Post Exam Report,2024,,VCEESERB,VCEES24EQB6,VCEESERBCM,,Question 6c,ExaminerCommentary,"Many students did not focus on the last part of the question 'could improve the reliability of the electricity grid'. Rather than focus on grid reliability, they discussed general points related to energy efficiency, including the energy lost through transmission lines (which relates to previous exam questions and not this specific question). An understanding of the extent to which different energy sources can supply current and projected base and peak load energy needs, what the difference between base and peak load is, and how the electricity grid supplies energy to consumers were not well demonstrated in general.",,84
Science,Environmental Science,Year 12,Final Exam,Post Exam Report,2024,,VCEESERB,VCEES24EQB6,VCEESERBER,EnhancedStrategies,Question 6c,ExaminerCommentary,"Higher-scoring responses responses discussed how remotely managing electricity resources and appliances through a virtual power plant (VPP) would reduce demand by remotely turning off appliances when they were not needed, which would reduce the peak load on the grid and mean less energy was wasted. Correct responses also discussed how controlling supply by remotely turning on power-generating resources would mean more electricity could enter into the grid (especially during peak times). By controlling 'supply and/or demand' the grid would experience a reduced risk of blackouts or power outages, leading to better control over the availability of energy and fewer malfunctions due to insufficient power.",,85
Science,Environmental Science,Year 12,Final Exam,Post Exam Report,2024,,VCEESERB,VCEES24EQB6,VCEESERBCM,,Question 6d,ExaminerCommentary,Many students were able to explain that 'intragenerational equity' is the sharing and protection of environmental resources with equal access for the current generation. Improving the efficiency of the electricity grid would allow all members of the population to have access to reliable electricity supplies and mean that energy resources are shared equally throughout the current generation. Incorrect responses confused 'intragenerational equity' with 'intergenerational equity'.,,86
Science,Environmental Science,Year 12,Final Exam,Post Exam Report,2024,,VCEESERB,VCEES24EQB7,VCEESERBCM,,Question 7a,ExaminerCommentary,Students were usually able to calculate the energy efficiency of the coal-fired power station using the figures provided and showed their working as follows.,,87
Science,Environmental Science,Year 12,Final Exam,Post Exam Report,2024,,VCEESERB,VCEES24EQB7,VCEESERBCM,,Question 7a,ExaminerCommentary,19 000 / 52 500 = 0.3619,,88
Science,Environmental Science,Year 12,Final Exam,Post Exam Report,2024,,VCEESERB,VCEES24EQB7,VCEESERBCM,,Question 7a,ExaminerCommentary,0.3619 × 100 = 36.19% (or 36.2%),,89
Science,Environmental Science,Year 12,Final Exam,Post Exam Report,2024,,VCEESERB,VCEES24EQB7,VCEESERBCM,,Question 7b,ExaminerCommentary,Most students correctly identified the form of energy found in coal as either potential or chemical. Some correctly gave both. Incorrect responses given included kinetic energy and heat energy.,,90
Science,Environmental Science,Year 12,Final Exam,Post Exam Report,2024,,VCEESERB,VCEES24EQB7,VCEESERBLR,LimitedStrategies,Question 7c,ExaminerCommentary,"The range of responses given to this question indicated a wide variation in the depth of understanding of the carbon cycle and how the combustion of fossil fuels impacts on key processes in the cycle. The question asked about the impact of the combustion of coal on the carbon cycle; many students incorrectly focused on the impact on global warming. In better responses, students clearly understood that the combustion of coal releases carbon dioxide into the atmosphere. This then impacts on the carbon cycle by creating a greater level of carbon dioxide in the atmosphere, which cannot be returned to long-term sinks at the same rate. Coal takes millions of years to form and results in the long-term storage of carbon, but by mining and burning coal we are changing this equilibrium. Many lower-scoring responses simply stated that the cycle would be unbalanced or discussed how it would allow plants to photosynthesise more (without understanding the role that limiting factors play in photosynthesis).",,91
Science,Environmental Science,Year 12,Final Exam,Post Exam Report,2024,,VCEESERB,VCEES24EQB7,VCEESERBLR,LimitedStrategies,Question 7d,ExaminerCommentary,"Based on the information given, students were generally able to state one rehabilitation strategy that was mechanical and one that was biological (although lower-scoring responses confused the two).",,92
Science,Environmental Science,Year 12,Final Exam,Post Exam Report,2024,,VCEESERB,VCEES24EQB7,VCEESERBCM,,Question 7d,ExaminerCommentary,Mechanical strategies included:,,93
Science,Environmental Science,Year 12,Final Exam,Post Exam Report,2024,,VCEESERB,VCEES24EQB7,VCEESERBLR,LimitedStrategies,Question 7d,ExaminerCommentary,The movement of topsoil by machinery,,94
Science,Environmental Science,Year 12,Final Exam,Post Exam Report,2024,,VCEESERB,VCEES24EQB7,VCEESERBLR,LimitedStrategies,Question 7d,ExaminerCommentary,The construction of physical erosion-control measures such as placing logs or rocks to limit run-off,,95
Science,Environmental Science,Year 12,Final Exam,Post Exam Report,2024,,VCEESERB,VCEES24EQB7,VCEESERBLR,LimitedStrategies,Question 7d,ExaminerCommentary,"The removal of old mining infrastructure such as mining equipment, roads and powerlines",,96
Science,Environmental Science,Year 12,Final Exam,Post Exam Report,2024,,VCEESERB,VCEES24EQB7,VCEESERBLR,LimitedStrategies,Question 7d,ExaminerCommentary,Building and placing nesting boxes in the area.,,97
Science,Environmental Science,Year 12,Final Exam,Post Exam Report,2024,,VCEESERB,VCEES24EQB7,VCEESERBCM,,Question 7d,ExaminerCommentary,Biological strategies included:,,98
Science,Environmental Science,Year 12,Final Exam,Post Exam Report,2024,,VCEESERB,VCEES24EQB7,VCEESERBLR,LimitedStrategies,Question 7d,ExaminerCommentary,The collection and spreading of native seeds,,99
Science,Environmental Science,Year 12,Final Exam,Post Exam Report,2024,,VCEESERB,VCEES24EQB7,VCEESERBLR,LimitedStrategies,Question 7d,ExaminerCommentary,The direct planting of tube-stock to revegetate the site,,100
Science,Environmental Science,Year 12,Final Exam,Post Exam Report,2024,,VCEESERB,VCEES24EQB7,VCEESERBLR,LimitedStrategies,Question 7d,ExaminerCommentary,The removal of weed species.,,101
Science,Environmental Science,Year 12,Final Exam,Post Exam Report,2024,,VCEESERB,VCEES24EQB7,VCEESERBLR,LimitedStrategies,Question 7e,ExaminerCommentary,"Most students were able to understand that the rehabilitation of the coal mine displayed ecocentrism, but often failed to make the meaning of this term clear in their responses. Ecocentrism recognises the health of the ecosphere as being of central importance. Better responses focused on valuing all living and non-living things, including Earth's ecosystems, natural processes and organisms, while de-emphasising the importance of humans. Common errors were made by simply stating that ecocentrism focuses on 'protecting ecosystems' or incorrectly discussing the importance of protecting living things (flora and fauna), which is a biocentric approach.",,102
Science,Environmental Science,Year 12,Final Exam,Post Exam Report,2024,,VCEESERB,VCEES24EQB7,VCEESERBCM,,Question 7e,ExaminerCommentary,"The other part of the question required students to explain how the rehabilitation of the mine site would display ecocentrism. This is achieved by addressing the damage to the area caused by humans, with the aim of restoring all environmental aspects and the integrity of the ecosystem as a whole. This included how the rehabilitation considered factors that affect the whole ecosystem by addressing multiple issues, such as soil quality, and provision of water and habitats for wildlife and native flora.",,103
Science,Environmental Science,Year 12,Final Exam,Post Exam Report,2024,,VCEESERB,VCEES24EQB8,VCEESERBCM,,Question 8a,ExaminerCommentary,Most students were able to correctly list two aims of the students' investigation. Suitable responses included:,,104
Science,Environmental Science,Year 12,Final Exam,Post Exam Report,2024,,VCEESERB,VCEES24EQB8,VCEESERBCM,,Question 8a,ExaminerCommentary,Recording wind speed measurements at the site,,105
Science,Environmental Science,Year 12,Final Exam,Post Exam Report,2024,,VCEESERB,VCEES24EQB8,VCEESERBCM,,Question 8a,ExaminerCommentary,Recording wind speed directions at the site,,106
Science,Environmental Science,Year 12,Final Exam,Post Exam Report,2024,,VCEESERB,VCEES24EQB8,VCEESERBCM,,Question 8a,ExaminerCommentary,Identifying if the winds are strong enough to generate electricity,,107
Science,Environmental Science,Year 12,Final Exam,Post Exam Report,2024,,VCEESERB,VCEES24EQB8,VCEESERBCM,,Question 8a,ExaminerCommentary,Comparing wind speeds at different heights (i.e. 10 and 20 metres),,108
Science,Environmental Science,Year 12,Final Exam,Post Exam Report,2024,,VCEESERB,VCEES24EQB8,VCEESERBCM,,Question 8a,ExaminerCommentary,Identifying if there is enough wind for the farmer to rely on wind power,,109
Science,Environmental Science,Year 12,Final Exam,Post Exam Report,2024,,VCEESERB,VCEES24EQB8,VCEESERBCM,,Question 8a,ExaminerCommentary,Measuring wind speed variations over a 10-month period.,,110
Science,Environmental Science,Year 12,Final Exam,Post Exam Report,2024,,VCEESERB,VCEES24EQB8,VCEESERBLR,LimitedStrategies,Question 8a,ExaminerCommentary,The most common errors were to state that the students were aiming to test the different-sized wind turbines or which turbine produces the most electrical energy. The students did not collect this wind turbine and energy output data.,,111
Science,Environmental Science,Year 12,Final Exam,Post Exam Report,2024,,VCEESERB,VCEES24EQB8,VCEESERBCM,,Question 8b,ExaminerCommentary,Students were required to use the wind speed data provided in the table to identify patterns in monthly average wind speeds. Suitable responses included:,,112
Science,Environmental Science,Year 12,Final Exam,Post Exam Report,2024,,VCEESERB,VCEES24EQB8,VCEESERBCM,,Question 8b,ExaminerCommentary,Wind speeds were consistently higher at 20 metres (average of 5.5 metres per second) compared to 10 metres (average of 4.6 metres per second).,,113
Science,Environmental Science,Year 12,Final Exam,Post Exam Report,2024,,VCEESERB,VCEES24EQB8,VCEESERBCM,,Question 8b,ExaminerCommentary,Wind speeds are slightly greater at both heights between August and November.,,114
Science,Environmental Science,Year 12,Final Exam,Post Exam Report,2024,,VCEESERB,VCEES24EQB8,VCEESERBCM,,Question 8b,ExaminerCommentary,"Wind speeds are slightly lower in the April-June period; for example, between 4.2 and 4.3 metres per second at 10 metres.",,115
Science,Environmental Science,Year 12,Final Exam,Post Exam Report,2024,,VCEESERB,VCEES24EQB8,VCEESERBCM,,Question 8b,ExaminerCommentary,"Winds are reasonably consistent across the 10-month period, with a range of only 0.8 metres per second at both heights.",,116
Science,Environmental Science,Year 12,Final Exam,Post Exam Report,2024,,VCEESERB,VCEES24EQB8,VCEESERBLR,LimitedStrategies,Question 8c,ExaminerCommentary,"To calculate how much energy the farm would require in a year, most students correctly multiplied the average number of kilowatt hours required per day (86 kW h) by 365 (days in a year). The correct answer is 31 390 kW h. Working out was not required. The most common error made was multiplying this answer, 31 390, by 24 (the number of hours in the day) to get 753 360 kilowatts.",,117
Science,Environmental Science,Year 12,Final Exam,Post Exam Report,2024,,VCEESERB,VCEES24EQB8,VCEESERBCM,,Question 8d,ExaminerCommentary,"Given the figure calculated in the previous question (31 390 kW h) and an accurate reading of the 'Variation in wind turbine energy output with annual average wind speed' graph, students should have noted that a single 20 kW turbine could create enough total energy (around 32 000-33 000 kW h) because the average wind speed was 5.5 metres per second at a height of 20 metres. The 5 kW and 10 kW turbines would not generate the total amount of energy required, and it would be unlikely that the farm owners would put multiple turbines across the site (due to cost and other factors).",,118
Science,Environmental Science,Year 12,Final Exam,Post Exam Report,2024,,VCEESERB,VCEES24EQB8,VCEESERBCM,,Question 8d,ExaminerCommentary,"Based on this data, wind could provide a suitable energy source but in justifying this many students did not acknowledge the limitation of wind turbines - they are an intermittent source of energy. Therefore, the farm would need some sort of storage system (i.e. batteries) or other energy option / backup system for when there was no wind or to supplement the total energy output.",,119
Science,Environmental Science,Year 12,Final Exam,Post Exam Report,2024,,VCEESERB,VCEES24EQB8,VCEESERBCM,,Question 8d,ExaminerCommentary,"Incorrect answers often used the highest figures from the graph that the wind turbines would produce, for example, a 20 kW turbine with an average annual wind speed of 8.5 metres per second would produce 80 000 kW h per year.",,120
Science,Environmental Science,Year 12,Final Exam,Post Exam Report,2024,,VCEESERB,VCEES24EQB8,VCEESERBER,EnhancedStrategies,Question 8e,ExaminerCommentary,"Many of the responses to this question demonstrated a lack of understanding of the scientific term 'repeatability' and how to apply it to this particular example. Higher-scoring responses noted that although there is a closeness of agreement between both the students' and the bureau's wind speed readings, it does not show repeatability because they have not been recorded under the same conditions of measurement. For example, they have different locations, different observers, different procedures and different anemometers.",,121
Science,Environmental Science,Year 12,Final Exam,Post Exam Report,2024,,VCEESERB,VCEES24EQB8,VCEESERBCM,,Question 8f,ExaminerCommentary,Most students were able to state one environmentally based argument for and one against the use of wind turbines on the farm.,,122
Science,Environmental Science,Year 12,Final Exam,Post Exam Report,2024,,VCEESERB,VCEES24EQB8,VCEESERBCM,,Question 8f,ExaminerCommentary,Arguments presented in favour of using wind turbines included:,,123
