Term,Definition,CrossReferences,ImageFiles,Subject
Acute angle,[See: angle],angle,,Mathematics
Addition (sum),"Addition is one of the basic operations of arithmetic and algebra and involves the combination of 2 or more quantities using the [FORMULA] operator. Simple examples could include [FORMULA] or . The inverse operation of addition is subtraction.

Addition may be defined more formally depending on the context. For example:

  • for natural numbers, addition may be defined in terms of counting

addition of real numbers may be modelled using lengths of joined, distinct line segments on a number line

for sets, if [FORMULA] represents the number of elements of a set , and sets [FORMULA] and [FORMULA] are disjoint sets (that is, they have no elements in common), then: 
.

the addition of 2 fractions is defined by using a common denominator, for example: .

See also: fraction, inverse operations, number line, subtraction",fraction; inverse operations; number line; subtraction,,Mathematics
Addition facts,Addition facts are the results associated with the sums of pairs of natural numbers from 0 to 9. They are foundational to arithmetic.,,,Mathematics
Additive,"An additive is a situation or relationship that involves addition, subtraction or both: for example, giving change from a simple money transaction.",,,Mathematics
Adjacent,"The term adjacent has several meanings depending on the mathematical context. For example, in a graph (network), 2 vertices (nodes) are adjacent if they are joined by an edge. In geometry, 2 lines are adjacent if they meet at a common vertex and 2 faces in a shape are said to be adjacent if they meet at a common edge. Two fractions are adjacent if the difference between these 2 fractions is a fraction with a unit numerator (a numerator of one): for example, and [FORMULA] are adjacent since [FORMULA] .

See also: adjacent angle, edge, unit fraction",adjacent angle; edge; unit fraction,,Mathematics
Adjacent angle,"Two angles at a point are called adjacent if they share a common ray and a common vertex and lie on opposite sides of the common ray. In the diagram, the angles ∠AOC and ∠BOC are adjacent.",,"adjacent_angle_1.png,adjacent_angle_2.png",Mathematics
Algebra,"Algebra may be considered as the process of manipulating variables and constants in a mathematical expression according to fixed laws, properties or rules (for example, simplifying an expression or solving an equation). Alternatively, algebra may refer more broadly to a mathematical structure whose elements and operations satisfy a given collection of laws, and the abstract study of this structure.

See also: algebraic expression, algebraic term, variable",algebraic expression; algebraic term; variable,,Mathematics
Algebraically,"Carrying out a process symbolically using variables, constants, operations and rules is carrying it out algebraically.",,,Mathematics
Algebraic expression,"An algebraic expression is formed by combining numbers and algebraic symbols using arithmetic operations. The expression is constructed unambiguously according to the conventions and rules of algebra. For example, [FORMULA] is an algebraic expression, while [FORMULA] is not a properly formed expression.",,,Mathematics
Algebraic fraction,"An algebraic fraction is a fraction in which both the numerator and denominator are algebraic expressions. For example, [FORMULA]  and [FORMULA] are algebraic fractions.",,,Mathematics
Algebraic term,"An algebraic term is a simple algebraic expression that is often combined with other terms using operations, to form a more complicated algebraic expression. For example, [FORMULA] and [FORMULA] are terms of the quadratic expression , while [FORMULA] and [FORMULA]  [FORMULA] are terms of the expression [FORMULA] .

See also: algebraic expression, quadratic expression",algebraic expression; quadratic expression,,Mathematics
Algorithm,"An algorithm is a process that can be carried out systematically, using a well-defined set of instructions, to perform a particular task or solve a type of problem. Examples of mathematical algorithms include processes for tasks such as ordering a set of numbers from smallest to largest, multiplying many-digit decimal numbers, factorising linear expressions, determining which of 2 fractions is larger, bisecting an angle, or calculating the mean of a set of numbers.",,,Mathematics
Algorithmic thinking,"Algorithmic thinking is the type of thinking required to design, test and evaluate problem-solving processes in a systematic way, using algorithms.

See also: algorithm",algorithm,,Mathematics
Allied angle,[See: co-interior angle],co-interior angle,,Mathematics
Alternate angle,"Consider a transversal (line) intersecting a pair of lines (which may or may not be parallel). Angles that are formed at the intersection of these lines with the transversal, within the two lines, and on opposite sides of the transversal, are called alternate angles.

An example of 2 alternate angles are the angles [FORMULA] and [FORMULA] in the following diagram.

If the pair of lines intersected by the transversal are parallel, then the pair of alternate angles will both be the same size. Conversely, if the 2 alternate angles are the same size, then the 2 lines that are intersected by the transversal are parallel. The angles [FORMULA] and [FORMULA] (where [FORMULA] ) in the diagram below, demonstrate this property.

See also: angle, transversal, parallel",angle; transversal; parallel,,Mathematics
Angle,"An angle is the figure formed by 2 rays sharing a common endpoint, called the vertex of the angle. An angle is typically indicated using an arc and labelled with a letter. Letters used are commonly either Roman, such as [FORMULA] or Greek, such as [FORMULA] (alpha), [FORMULA] (beta), (gamma) and [FORMULA] (theta).

If the vertex point is labelled as well as a point on each of the rays, these can also be used to indicate an angle. For example, the angle AOB, with vertex O, is written ∠AOB and is shown in the diagram below:

Imagine that the ray OB is rotated about the point O until it lies along OA. The amount of turning is called a measure of the angle AOB.

There are 3 common measures of angle:

fraction of a full turn (where one full turn or revolution is 360 degrees or 2π radian)

degree

radian.

Angles are also classified according to their angle measure. An angle with size α is:

acute if 0° < α < 90°

a right angle if α = 90°

obtuse if 90° < α < 180°

a straight angle if α = 180°

reflex if 180° < α < 360°

a revolution (full rotation) if α = 360°.

Possible diagrammatic representations of each type are in the table below.

See also: alternate angle, complementary angles, co-interior angle, corresponding angles, degree, radian, ray, revolution, right angle, straight angle, supplementary angles, vertex",alternate angle; complementary angles; co-interior angle; corresponding angles; degree; radian; ray; revolution; right angle; straight angle; supplementary angles; vertex,"angle_1.png,angle_2.png",Mathematics
Angle of elevation and angle of depression,"When an observer looks at an object that is higher than the horizontal, the angle between the line of sight and the horizontal is called the angle of elevation.

When an observer looks at an object that is lower than the horizontal, the angle between the line of sight and the horizontal is called the angle of depression.

See also: angle",angle,"angle_of_elevation_and_angle_of_depression_1.png,angle_of_elevation_and_angle_of_depression_2.png,angle_of_elevation_and_angle_of_depression_3.png,angle_of_elevation_and_angle_of_depression_4.png,angle_of_elevation_and_angle_of_depression_5.png,angle_of_elevation_and_angle_of_depression_6.png",Mathematics
Angles at a point,The sum of the angles with vertices at a common point in the plane is equivalent to 4 right angles or 360 degrees. This spatial fact can be applied to determine the size of missing angles.,,angles_at_a_point_1.png,Mathematics
Angles on a straight line,The sum of the angles that form a straight line is equivalent to 2 right angles or 180 degrees. This spatial fact can be applied to determine the size of missing angles.,,angles_on_a_straight_line_1.png,Mathematics
Approximate/approximation,"To approximate, or make/use an approximation, is to obtain or state a value to a particular accuracy. For example, the fraction   provides an approximate value for the irrational real number . Rounded correct to 4 decimal places,  has the value 3.1429, while [FORMULA] has the value 3.1416. These values are themselves decimal approximations to  and [FORMULA] respectively because they have been rounded.

Approximation may be used in a range of mathematical contexts. For example, in geometry, while it is not possible to trisect any angle exactly using only a compass and ruler, it is possible to approximate such a trisection with reasonable accuracy.

See also: estimation",estimation,,Mathematics
Arc,"A part of a circle’s circumference is called an arc.

See also: circle",circle,,Mathematics
Area,"The amount of interior space bounded by the perimeter of a shape. In the plane, area is the measure of ‘material’ needed to completely cover a given two-dimensional figure, shape or region. This region may be contained within a shape (such as a polygon or circle) or bound by graphs of relations in the plane.

Some useful formulas for area, defined in terms of linear variables associated with a shape, include the following.",,,Mathematics
Array,"An array is an ordered collection of objects or numbers. For example, the following is a triangular array of dots:

A rectangular array of numbers is also called a matrix (plural: matrices). For example, the following matrix represents the fitness ratings on a scale of 0–100 for 3 students measured in each of 4 school terms (students would be represented by the row, their fitness score for each term would be recorded in the columns):",,array_1.png,Mathematics
Associative,"An operation is associative if the result of applying the operation to any 3 elements of an expression is the same regardless of which pair of elements (without changing their order) is combined first.

Addition and multiplication are associative on the set of natural numbers, for example:

4 + (7 + 5) = 4 + 12 = 16 and (4 + 7) + 5 = 11 + 5 = 16

2 × (3 × 4) = 2 × 12 = 24 and (2 × 3) × 4 = 6 × 4 = 24

Subtraction and division are not associative on the set of natural numbers. For example:

10 − (4 − 2) = 10 − 2 = 8 but (10 − 4) − 2 = 6 − 2 = 4

24 ÷ (12 ÷ 2) = 24 ÷ 6 = 4 but (24 ÷ 12) ÷ 2 = 2 ÷ 2 = 1

See also: associative laws",associative laws,,Mathematics
Associative laws,"In general, the associative laws (properties) for addition and multiplication of real numbers state respectively that for all real numbers ,  and :

and",,,Mathematics
Assumption,"An assumption is a proposition (a statement or assertion) that is taken as being true with respect to a given context. For example, in a modelling problem to design a seating arrangement in a theatre, it may be assumed that the height of the people watching the movie is no greater than 200 cm. This is reasonable given the context.",,,Mathematics
Asymptote,"An asymptote is a line or curve that closely approaches a given curve but does not meet it. For example, the graph below shows the 2 asymptotes [FORMULA] and [FORMULA] (in red) for the function .",,"asymptote_1.emf,asymptote_2.emf",Mathematics
Average,[See: mean],mean,,Mathematics
Axis (plural: axes),"An axis is a line that a curve, figure or function is drawn relative to. The plural of axis is axes. A commonly used set of axes are the 2 perpendicular Cartesian axes (normally labelled as [FORMULA] and ) that allow points and curves to be defined on the Cartesian plane.

See also: Cartesian plane",Cartesian plane,,Mathematics
Back-to-back stem-and-leaf plot,[See: stem-and-leaf plot (stemplot)],stem-and-leaf plot (stemplot),,Mathematics
Bar chart,[See: column graph],column graph,,Mathematics
Base,"A base is a number that is the ‘building block’ for a given number system. The choice of base determines the representation of numbers in that system. The most common bases used are binary and hexadecimal (base 2 and base 16, used for computing), octal (base 8) and decimal (base 10). An example of a decimal number is:

An example of a binary number is . Converted to decimal, this would be:",,,Mathematics
Base-10,"Base-10 is a number system that uses the digits 0–9 and the value of the digit is determined by its face value and its place value: for example, [FORMULA] and .",,,Mathematics
Bernoulli trial,"A Bernoulli trial is a trial where there is a probability [FORMULA] of success and [FORMULA] of failure (sometimes also referred to as ) in any given trial.

An example could be the probability of an even number when rolling a dice. For every trial, the probability of success . The probability of failure (.

Note that the probabilities for success and failure add to 1 since .

See also: probability, trial",probability; trial,,Mathematics
Bias (statistics),"In statistics, bias is a measure being systematically moved away from the true value, leading to overestimating or underestimating that value.",,,Mathematics
Bimodal data,"A data set is said to have a bimodal distribution if it has 2 modes. The term bimodal is also used if the graph of the distribution has 2 distinct ‘peak’ values, as shown in the histogram below:

See also: mode",mode,bimodal_data_1.jpg,Mathematics
Bivariate data,[See: data],data,,Mathematics
Box-and-whisker plot,"A box-and-whisker plot is a graphical display of a five-number summary (the minimum value, the lower quartile Q1, the median, the upper quartile Q3 and the maximum value).

In a box-and-whisker plot, the ‘box’ covers the interquartile range (IQR = Q3 – Q1), with ‘whiskers’ reaching out from each end of the box to indicate maximum and minimum values in the data set (formally, any data values a distance greater than 1.5 × IQR from the median are represented as individual data points). A vertical line in the box is used to indicate the location of the median.

The box-and-whisker plot below has been constructed from the five-number summary of the resting pulse rates of 17 students.

The term ‘box-and-whisker plot’ is commonly abbreviated to ‘box plot’.

See also: five-number summary",five-number summary,"box_and_whisker_plot_1.png,box_and_whisker_plot_2.png,box_and_whisker_plot_3.png",Mathematics
Box plot,[See: box-and-whisker plot],box-and-whisker plot,,Mathematics
Branch (programming),"A branch occurs in a computer program, which leads to different instructions being followed depending on a state at that branch point (for example, true or false, a variable reaching a certain magnitude): that is, a decision is made. Examples of branching and decisions may be visualised more easily in a flow chart.

See also: flow chart",flow chart,,Mathematics
Capacity,"Capacity is a term used to describe how much a container will hold. It is often used in relation to the volume of fluids. Units of capacity (volume of fluids or gases) include litres (L) and millilitres (mL). For example, the boot capacity of a typical hatchback car would be around 390 litres.",,,Mathematics
Cartesian coordinate system,"The position of any point in the Cartesian plane can be represented by an ordered pair of numbers . These ordered pairs are called the coordinates of the point. This is called the Cartesian coordinate system.

The point with coordinates (4, 2) has been plotted on the Cartesian plane shown. The coordinates of the origin are (0, 0).

The Cartesian plane is divided into 4 regions, called quadrants, by the axes and origin of the coordinate system:

the point (4, 2) is in the first quadrant (top right)

the point (–4, 2) is in the second quadrant (top left)

the point (–4, –2) is in the third quadrant (bottom left)

the point (4, –2) is in the fourth quadrant (bottom right)

See also: Cartesian plane",Cartesian plane,cartesian_coordinate_system_1.png,Mathematics
Cartesian plane,"Two intersecting number lines are taken intersecting at right angles at their origins to form the axes of the coordinate system. The plane is then divided into 4 quadrants by these perpendicular axes called the -axis (horizontal line) and the -axis (vertical line). This plane is called the Cartesian plane.

See also: Cartesian coordinate system",Cartesian coordinate system,,Mathematics
Categorical variable,"A categorical variable takes values from sets that are not numerical.

For example, blood group is a categorical variable; its values are A, B, AB or O. So too is construction type of a house; its values might be brick, concrete, timber or steel.

Categories may have numerical labels too: for example, for the variable postcode the category labels would be numbers such as 3787, 5623, 2016, etc., but these labels have no numerical significance. It makes no sense, for example, to use these numerical labels to calculate the average postcode in Australia.

See also: numerical data",numerical data,,Mathematics
Census,"A census collects information about the whole of a population.

See also: population",population,,Mathematics
Chance and likelihood,"The relative frequency of an event is the chance or likelihood of the event occurring. This may be expressed qualitatively using terms such as: impossible, no chance, not likely, an even chance, odds-on, likely, a certainty.

Relative frequencies may also be expressed quantitatively using numbers on a scale from 0 (impossible) to 1 (certain). These numerical values are often expressed as fractions such as , ratios such as 2:3, decimals such as 0.87 or percentages such as 40%.

See also: probability",probability,,Mathematics
Chance experiment (trial),A chance experiment is an investigation process that involves planning and conducting a repeatable experiment involving chance where more than one possible outcome may occur. Experiments can be single or multi-step and results can vary across trials.,,,Mathematics
Chord,"A chord is a line segment (interval) joining 2 points on the circumference of a circle. In the diagram below, the line segment QP is a chord.

A chord is also a line segment joining 2 points on a curve:

See also: circumference, diameter, line segment",circumference; diameter; line segment,"chord_1.png,chord_2.gif",Mathematics
Circle,"A circle is the set of all points in the plane that are a fixed distance (the radius) from a given point (the centre of the circle).  Sometimes ‘circle’ is used to refer to the closed curve, as in the circumference of a circle. At other times, it is used to refer to the entire shape: that is, the region including both the boundary and its interior.

A circle with centre O and radius OA of length r is shown in the following diagram.

A circle can be constructed with a compass or dynamic geometry software, given the centre and radius of the circle, or 3 points that the circle passes through.

See also: chord, diameter, radius",chord; diameter; radius,circle_1.png,Mathematics
Circumference,"The circumference of a circle is also used to refer to the measure of its perimeter. If the diameter or the radius of a circle is known, then its circumference is calculated as:

circumference =   diameter = 2    radius

For example, using   3.14, the circumference of a backyard swimming pool with a 4-metre diameter is approximately 12.56 metres.

For a rough underestimate, the value of  can be taken to be approximately 3. In this case the corresponding rough estimate for the circumference of the pool would be 3  4 = 12 metres.

The circumference of a circle with unit radius is 2  6.28 units.

See also: circle, perimeter",circle; perimeter,,Mathematics
Closure,"The result of carrying out an operation on an element of a set, or elements of a set, is also an element of that set. This is called closure.

For example, multiplication is closed on the set of natural numbers, because the result of multiplying any pair of natural numbers is also a natural number. Division is not closed on natural numbers, since 9 and 2 are both natural numbers but the result of dividing 9 by 2 is not a natural number. This is because , and [FORMULA] is a decimal fraction, not a natural number.",,,Mathematics
Coding,"Coding is a process by which algorithms are represented for implementation. For computers, this is done using a coding language such as block coding, C++, JavaScript, Python or Wolfram Language.

See also: implementation",implementation,,Mathematics
Co-domain,[See: domain],domain,,Mathematics
Coefficient,"A coefficient is a constant that multiplies variables raised to positive integer powers. For example, in the expression [FORMULA] , the variables are [FORMULA] and [FORMULA] and the coefficient is .

See also: constant",constant,,Mathematics
Co-interior angle,"Consider a transversal (line) intersecting a pair of lines (which may or may not be parallel). Angles that are formed at the intersection of these lines with the transversal, within the 2 lines, and on the same side of the transversal, are called co-interior (allied) angles.

An example of 2 co-interior angles are the angles [FORMULA] and [FORMULA] shown in the following diagram:

Note that the angles [FORMULA] and [FORMULA] would also be co-interior angles, but not the angles [FORMULA] and [FORMULA] because they are on different sides of the transversal. The angles [FORMULA] and [FORMULA] would, however, be alternate angles.

If the pair of lines intersected by the transversal are parallel, then the sum of the angle measures of the 2 co-interior angles is 180. Conversely, if the sum of the angle measures of the two co-interior angles is 180, then the 2 lines intersected by the transversal are parallel. For example, in the diagram below, angle .

See also: angle, alternate angle, parallel, transversal",angle; alternate angle; parallel; transversal,,Mathematics
Column graph,"A column graph is a graph used in statistics for organising and displaying categorical data.

To construct a column graph, equal-width rectangular bars are constructed for each category with height equal to the observed frequency of the category as shown in the example below, which displays the hair colours of 27 students.

Column graphs are frequently called bar graphs or bar charts. In a bar graph or chart, the bars can be either vertical or horizontal, but are never joined (there is always a gap left between them).

See also: categorical variable",categorical variable,"column_graph_1.png,column_graph_2.png",Mathematics
Common factor,"A common factor (or common divisor) of a set of numbers or algebraic expressions is a factor of each element of that set. For example, is a common factor of {24, 54, 66} as 6 divides evenly into each of these numbers, and 3 is a common factor of [FORMULA] for the same reason.

Note that [FORMULA] is a common factor of [FORMULA] because 
 and

See also: algebraic expression",algebraic expression,,Mathematics
Commutative,"An operation is commutative if the result of applying the operation to any 2 elements of a set is the same, regardless of the order of the elements. Addition and multiplication are commutative on the set of natural numbers. For example:

6 + 12 = 12 + 6 = 18 and 6 × 12 = 12 × 6 = 72

However, subtraction and division are not commutative. For example:

6 − 12 = − 6 but 12 − 6 = 6 and 6 ÷ 12 = [FORMULA]  but 12 ÷ 6 = 2.

See also: commutative laws",commutative laws,,Mathematics
Commutative laws,"In general, the commutative laws (properties) for addition and multiplication of real numbers state that for all real numbers [FORMULA] and , [FORMULA] and , respectively.

See also: commutative",commutative,,Mathematics
Complement (set),"The set of all elements not in a given set with respect to the universal set for a particular context or situation is the complement set.

For example, if the universal set in a particular situation is taken to be the letters of the alphabet, the complement to the set of vowels is the rest of the alphabet. If the universal set in a particular situation is taken to be the set of numbers {1, 2, 3, 4, 5, 6, 7, 8, 9, 10}, then the complement to [FORMULA] = {4, 5, 6} is the set {1, 2, 3, 7, 8, 9, 10}. The complement of [FORMULA] is written as , or . So here we could write{1, 2, 3, 7, 8, 9, 10}.

See also: element, set",element; set,,Mathematics
Complementary angles,"Two adjacent angles that form a right angle are said to be complementary angles: that is, the sum of the angle measures in degrees of complementary angles is 90. An example of 2 complementary angles is shown below:

See also: adjacent, angle",adjacent; angle,"complementary_angles_1.png,complementary_angles_2.png",Mathematics
Complementary events,"Events [FORMULA] and [FORMULA] are complementary events, if [FORMULA] and [FORMULA] are mutually exclusive and 
 where [FORMULA] is the probability of event [FORMULA] and [FORMULA] the probability of event . For example, [FORMULA] and [FORMULA] are complementary events if [FORMULA] is the probability of rolling a 3 on a dice and [FORMULA] the probability of not rolling a 3. This is because .",,,Mathematics
Complex shapes and objects,A complex shape is a closed shape comprising a number of plane shapes. Complex objects are composed of simpler objects.,,complex_shapes_and_objects_1.png,Mathematics
