Term,Definition,CrossReferences,ImageFiles,Subject
Order,"Order is a relation that describes the location of elements in a set with respect to each other. These elements may be totally ordered or partially ordered.

For example, the set of natural numbers is totally ordered by the relation ‘less than or equal to’ since, for any 2 natural numbers [FORMULA] and , exactly one of the following is true: 
, [FORMULA] or . Similarly, the set of students in a class can be totally ordered with respect to their height using the relation ‘less than or equal to’.

However, the set of people at a school fair is only partially ordered by the relation ‘is a parent of’ since there will likely be many pairs of people who are not each other’s parent, such as siblings.",,,Mathematics
Order of operations,"The order of operations is a set of conventions for evaluating arithmetic expressions that involve several operations. In general brackets (parentheses) can be used to provide priority, otherwise the order of operations from left to right is exponents (powers, indices), then multiplication/division then addition/subtraction. For example, in , the division is performed first and the expression becomes . If the convention is ignored and the operations are performed in order, a different result of 6.5 is obtained.

See also: addition, division, index, multiplication, subtraction",addition; division; index; multiplication; subtraction,,Mathematics
Ordinal categorical data,"Ordinal categorical data is categorical data that has a ranking or order, such as Likert scales, clothing sizes, or placegetters in a race.

See also: data",data,,Mathematics
Ordered pair,"An ordered pair is a special type of set of 2 elements for which order is significant. For example, the co-ordinates in the Cartesian plane (3,4) represent the point where [FORMULA] and . Grid references used on a map are also examples of an ordered pair.

See also: Cartesian co-ordinate system, grid reference",Cartesian co-ordinate system; grid reference,,Mathematics
Outlier,"An outlier is a data value that appears to stand out from the other members of the data set by being unusually high or low. The most effective way of identifying outliers in a data set is to graph the data.

For example, in the following list of ages of a group of 10 people, 
{ 12, 12, 13, 13, 13, 13, 13, 14, 14, 14, 24 }, 24 would be considered to be a possible outlier.

As a rule of thumb, a value that is more than 1.5 interquartile ranges less than the lower quartile, or greater than the upper quartile, is a possible outlier.

See also: data, interquartile range (IQR)",data; interquartile range (IQR),"outlier_1.png,outlier_2.png,outlier_3.png",Mathematics
Parabola,"The graph of [FORMULA] is called a parabola. The point [FORMULA] is called the vertex of the parabola and the -axis () is the axis of symmetry of the parabola called simply the axis.

Some other parabolas are the graphs of [FORMULA] where . More generally, every parabola is similar to the graph of .",,parabola_1.png,Mathematics
Parallel,"Two lines are parallel if they have no points of intersection in the plane, and the same gradient (slope) in the coordinate plane. The symbol || is often used to mean one ray or line segment is parallel to another. For example, the 2 lines below are parallel:

For a geometric figure such as the parallelogram shown below, different numbers of arrow heads may be used to denote sets of lines that are parallel. For example, the pair of lines BA and CD are a parallel pair (2 arrowheads on each) while AD and BC are another parallel pair (one arrowhead on each). Note that BA is not parallel to AD, for example.",,parallel_1.png,Mathematics
Parallel box-and-whisker plots,"Parallel box-and-whisker plots are used to visually compare the five-number summaries of 2 or more data sets. The term ‘parallel box-and-whisker plot’ is commonly abbreviated to ‘parallel boxplot’.

For example, a parallel box-and-whisker plot below can be used to compare the five-number summaries for the pulse rates of 19 students before and after gentle exercise.

Note that the box plot for pulse rates after exercise shows the pulse rate of 146 as a possible outlier. This is because the distance of this data point above the upper is more than 1.5 times the interquartile range.

See also: interquartile range (IQR), outlier",interquartile range (IQR); outlier,"parallel_box_and_whisker_plots_1.png,parallel_box_and_whisker_plots_2.png,parallel_box_and_whisker_plots_3.png,parallel_box_and_whisker_plots_4.png",Mathematics
Parallelogram,"A parallelogram is a quadrilateral whose opposite sides are parallel. The quadrilateral ABCD shown below is a parallelogram because BA || CD and AD || BC.

Properties of a parallelogram

The opposite angles of a parallelogram are equal.

The opposite sides of a parallelogram are equal.

The diagonals of a parallelogram bisect each other.

See also: parallel",parallel,parallelogram_1.png,Mathematics
Parameters,Parameters are a factor for which a specific value defines a condition or constraint for a function or relation.,,,Mathematics
Partition,"To partition is to divide into separate parts that together constitute the whole. For example, the letters of the alphabet can be partitioned into vowels and consonants, the set of natural numbers can be partitioned into those with remainder 0, 1 or 2 on division by 3.

In the early years it commonly refers to the ability to think about numbers as made up of 2 parts, for example, 10 is 8 and 2. In later years it refers to dividing both continuous and discrete quantities into equal parts.",,,Mathematics
Part-part-whole reasoning,"Part-part-whole reasoning is a model used to recognise relationships between a whole number and its parts: for example, [FORMULA] or .",,,Mathematics
Percentage,"A percentage is a ratio to 100 or a fraction whose denominator is 100. For example, [FORMULA] percent (written as ) is the percentage whose value is .

Similarly, 40 as a percentage of 250 is .",,,Mathematics
Percentile,"The percentile is the value that corresponds to a cumulative frequency of [FORMULA]  for a sample size.

The first quartile () is the 25th percentile, the second quartile (the median or ) is the 50th percentile, and the third quartile () is the 75th percentile. The maximum value of a data set is the 100th percentile (all other values are less than this).

For example, for a sample of 4 students (), the students heights in cm are found to be 150, 152, 156 and 167. The median value of 154 is the 50th percentile as 50% of the data values (2 values) are smaller than this since [FORMULA]  (.

See also: interquartile range",interquartile range,,Mathematics
Perfect square,"A number is a perfect square if it is the square of an integer or rational number. For example, 169 is a perfect square as 132 = 169. Similarly, 0.81 is a perfect square since (9/10)2 = 0.81. Perfect squares can also be represented pictorially; for example, the perfect squares 1, 4, 9 and 16 could be shown using the arrays:

See also: array, square number",array; square number,,Mathematics
Perimeter,The perimeter of a plane figure is the length of its boundary.,,,Mathematics
Periodic,‘Periodic’ means appearing or occurring at regular intervals. The function [FORMULA] is periodic because it has-intercepts that occur periodically at each integer multiple of .,,,Mathematics
Perpendicular,"Two lines, rays, line segments, vectors, planes or other quantities are considered perpendicular if they intersect at a 90° angle (a right angle).

In the diagram below, the line segments BD and BC are perpendicular, while the line segments AB and BC are parallel.

See also: angle, parallel",angle; parallel,,Mathematics
Pi,"Pi is the name of the Greek letter , that is used to denote the ratio of the circumference of any circle to its diameter.

The number [FORMULA] is irrational as the digits in the continued decimal expansion of π do not have any recurring pattern. The approximate value of , correct to 2 decimal places is 3.14, and 22/7 is a reasonably accurate fraction approximation to π. The decimal expansion for [FORMULA] to 100 significant figures is:

3.141592653589793238462643383279502884197169399375105820974944592307816406286208998628034825342117068…

There is a very long history of attempts to estimate [FORMULA] accurately. One of the early successes was due to Archimedes (287–212 BC) who showed that . The decimal expansion of [FORMULA] has now been calculated to at least the first [FORMULA] places.

See also: circle, circumference, diameter, irrational number",circle; circumference; diameter; irrational number,,Mathematics
Picture graph,"A picture graph is a statistical graph for organising and displaying categorical data.

See also: categorical data, data display",categorical data; data display,picture_graph_1.png,Mathematics
Place value,"Place value is the value of a digit as determined by its position in a number relative to the ones (or units) place. For integers, the ones place is occupied by the rightmost digit in the number.

For example, in the number 2 594.6 the 4 denotes 4 ones, the 9 denotes 90 ones or 9 tens, the 5 denotes 500 ones or 5 hundreds, the 2 denotes 2000 ones or 2 thousands, and the 6 denotes [FORMULA] of a one or 6 tenths.",,,Mathematics
Planar graph,A planar graph is a connected graph that is drawn within a plane whose edges do not cross.,,planar_graph_1.png,Mathematics
Platform,"The platform is the means by which an algorithm is implemented. This may be a mechanical device, a program running on a computer using a particular programming language, or an activity carried out by a person or robot.

See also: implementation",implementation,,Mathematics
Platonic solid,"The 5 platonic solids (shown below) are: the tetrahedron (4 equilateral triangles as faces), the cube (6 squares as faces), the octahedron (8 equilateral triangles as faces), the dodecahedron (12 regular pentagons as faces), and the icosahedron (20 equilateral triangles as faces). They are solid shapes with faces that are made of regular polygons that tessellate with an equal number of faces at each vertex. Images of each platonic solid are shown below.

See also: face, net, polygon",face; net; polygon,"platonic_solid_1.emf,platonic_solid_2.emf,platonic_solid_3.emf,platonic_solid_4.emf,platonic_solid_5.emf",Mathematics
Point,"Point is a representation of a location in space that has zero dimensions. Lines, curves, shapes, surfaces and objects are constructed from sets of points. Points in the Cartesian plane are specified by coordinates. Point is an undefined term in geometry.

See also: undefined term",undefined term,,Mathematics
Polygon,"The word ‘polygon’ literally means ‘many sides’. A polygon is a simple (no lines crossing) closed (all lines need to join to enclose a region) plane figure with sides formed by straight lines. For example, triangles, quadrilateral, pentagons and hexagons are polygons.

Polygons with all sides of equal length, and all angles between adjacent sides equal, are said to be regular polygons. Examples of regular polygons are shown below.

If all sides are not of equal length, and all angles not of equal measure, the polygon is an irregular polygon. Polygons may also be described as concave if they have any interior angles greater than 180° and convex if all interior angles are less than 180°.

The triangle below could be described as an irregular convex polygon. The second shape is an example of an irregular concave polygon (hexagon).

See also: angle",angle,,Mathematics
Polyhedron,"A polyhedron is a three-dimensional shape whose faces are adjacent polygons. For example, a pyramid is a polyhedron but a cone is not a polyhedron (part of a cone is a curved surface that is not a polygon).

A convex polyhedron is a finite region bounded by planes, in the sense that the region lies entirely on one side of the plane. The polyhedron shown below is a pyramid with a square base. It has 5 vertices, 8 edges and 5 faces. It is a convex polyhedron.

The figure below is an example of a non-convex polyhedron.

See also: adjacent, polygon",adjacent; polygon,"polyhedron_1.png,polyhedron_2.png",Mathematics
Population,"A population is the complete or universal set for a given context or situation. For example, we could consider the Australian population with respect to an election, or the population of wombats in Victoria.

A census collects information about the whole population.",,,Mathematics
Positive integer,[See: non-negative integer],non-negative integer,,Mathematics
Power (exponent or index),[See: See index],See index,,Mathematics
Power set,[See: set],set,,Mathematics
Primary data,[See: data],data,,Mathematics
Prime factor,[See: factor],factor,,Mathematics
Prime factorisation,"Prime factorisation is the decomposition of a composite number into the product of the prime numbers that divide evenly into it (factors). The prime factorisation for 18 could be [FORMULA] or, in index form, . The process of this factorisation can be represented using a factor tree.

See also: composite number, factor, factor tree, prime number",composite number; factor; factor tree; prime number,,Mathematics
Prime number,"A prime number is a natural number greater than 1 that has exactly 2 distinct factors, 1 and itself.

The number 1 is not a prime number (it has only one distinct factor), nor is the number 8, as it has 4 distinct factors {1, 2, 4, 8}. The number 2 is the only even prime number.

The set of the first 100 prime numbers is:

{2, 3, 5, 7, 11, 13, 17, 19, 23, 29, 31, 37, 41, 43, 47, 53,  59, 61, 67, 71, 73, 79, 83, 89, 97, 101, 103, 107, 109,  113, 127, 131, 137, 139, 149, 151, 157, 163, 167, 173,  179, 181, 191, 193, 197, 199, 211, 223, 227, 229, 233, 239, 241, 251, 257, 263, 269, 271, 277, 281, 283, 293, 307, 311, 313, 317, 331, 337, 347, 349, 353, 359, 367, 373, 379, 383, 389, 397, 401, 409, 419, 421, 431, 433, 439, 443, 449, 457, 461, 463, 467, 479, 487, 491, 499, 503, 509, 521, 523, 541}

There is no known function for generating the sequence of prime numbers, although there are algorithms for identifying whether a number is prime or not, such as the Sieve of Eratosthenes.

See also: natural numbers",natural numbers,,Mathematics
Prism,"A prism is a convex polyhedron that has 2 congruent and parallel polygonal faces and all its remaining faces are parallelograms. A prism is named according to these two congruent faces: for example, a triangular prism (2 triangular faces) or a rectangular prism.

A right prism is a convex polyhedron that has 2 congruent and parallel faces and all its remaining faces are rectangles. A prism that is not a right prism is often called an oblique prism. Some examples of prisms are shown below.

Note that a cylinder is not a prism because the circular ends are not polygonal (a circle is not a polygon).

See also: polygon",polygon,prism_1.png,Mathematics
Probability,"The probability of an event is a number between 0 and 1 (inclusive) that indicates the chance of something happening. For example, the probability that the sun will come up tomorrow is 1, the probability that a fair coin will come up ‘heads’ when tossed is 0.5, while the probability of someone being physically present in Adelaide and Brisbane at exactly the same time is zero.",,,Mathematics
Problem posing and solving,"Problem posing and solving is a two-part process. First, formulating a problem in such a way that it is amenable to mathematical analysis. Second, the application of mathematical reasoning to the development of a solution (or solutions) to a given problem.",,,Mathematics
Procedure,[See: algorithm],algorithm,,Mathematics
Product,"A product is the result of multiplying together 2 or more numbers or algebraic expressions. For example, [FORMULA] is the product of [FORMULA] and [FORMULA] since , and [FORMULA] is the product of [FORMULA] and 
 because .

See also: factor, multiplication",factor; multiplication,,Mathematics
Programming language,"A programming language is any language used to provide instructions for a computer to follow. Programming languages can be used to create computer programs that automate a given algorithm. Many programming languages exist, including python, C++ and Fortran. Using a programming language to create a program is called coding.

See also: implementation",implementation,,Mathematics
Proof,"A proof is a mathematical argument that demonstrates whether or not a proposition is true. A mathematical statement that has been proved is called a theorem.

See also: proposition, theorem",proposition; theorem,,Mathematics
Proportion,"A proportion is an equivalent ratio. Corresponding elements of 2 sets are in proportion if there is a constant ratio. For example, the circumference and diameter of a circle are in proportion because for any circle, the ratio of their lengths is the constant .

See also: ratio",ratio,,Mathematics
Proposition,"A proposition is a mathematical statement: for example, ‘2 is a prime number’ or ‘8 is greater than 3’.",,,Mathematics
Pyramid,"A pyramid is a convex polyhedron with a polygonal base and triangular sides that meet at a point called the vertex. The pyramid is named according to the shape of its base.

See also: polygon, polyhedron",polygon; polyhedron,pyramid_1.png,Mathematics
Pythagoras’ theorem,"Consider a right-angled triangle where , [FORMULA] and [FORMULA] are the lengths of the sides of the triangle, such that [FORMULA] is the length of the side opposite the right angle (the hypotenuse) as shown below.

For any such right-angled triangle, Pythagoras’ theorem states:

The square of the hypotenuse of a right-angled triangle equals the sum of the squares of the lengths of the other 2 sides, that is, c2 = a2 + b2.

For example, in a right-angled triangle with sides of length 3, 4 and 5, Pythagoras’ theorem is demonstrated because .

The converse is also true. That is, if c2 = a2 + b2 in a triangle ABC, then ∠C is a right angle.

See also: angle, hypotenuse",angle; hypotenuse,"pythagoras_theorem_1.png,pythagoras_theorem_2.png",Mathematics
Quadrant,[See: Cartesian coordinate system],Cartesian coordinate system,,Mathematics
Quadratic equation,"The general quadratic equation in one variable is , for constants [FORMULA] and where .

The solutions to this equation (roots) are given by the quadratic formula:

or the equivalent alternative form:

See also: coefficient, constant, monomial, polynomial, term, zero",coefficient; constant; monomial; polynomial; term; zero,,Mathematics
Quadratic expression,"A quadratic expression or function contains one or more of the terms in which the variable is raised to the second power, but no variable is raised to a higher power. Examples of quadratic expressions include [FORMULA] and .",,,Mathematics
Quadratic formula,[See: quadratic equation],quadratic equation,,Mathematics
Quadrilateral,"A quadrilateral is a four-sided polygon. The square is a regular quadrilateral (all sides and angles equal). Other well-known examples of a quadrilateral include the rectangle, the kite and the trapezium.

See also: polygon",polygon,,Mathematics
Quantile (statistics),Quantiles are values that divide a frequency distribution into equal groups. Common quantiles include quartiles (4 groups) and percentiles (100 groups).,,,Mathematics
Quantile (probability),Quantiles are partitioning values that divide the range of the probability distribution into continuous intervals with equal probabilities.,,,Mathematics
Quartile,"Quartiles are the values that divide an ordered data set into 4 (approximately) equal parts. It is only possible to divide a data set into exactly 4 equal parts when the number of data of values is a multiple of 4.

There are 3 quartiles. The first, the lower quartile (Q1) divides off (approximately) the lower 25% of data values. The second quartile (Q2) is the median. The third quartile, the upper quartile (Q3), divides off (approximately) the upper 25% of data values.

Percentiles are the values that divide an ordered data set into 100 (approximately) equal parts. It is only possible to divide a data set into exactly 100 equal parts when the number of data values is a multiple of one hundred.

There are 99 percentiles. Within the above limitations, the first percentile divides off the lower 1% of data values. The second, the lower 2% and so on. In particular, the lower quartile (Q1) is the 25th percentile, the median is the 50th percentile and the upper quartile is the 75th percentile.

See also: interquartile range (IQR)",interquartile range (IQR),,Mathematics
Quotient,"A quotient is the result of dividing one number or algebraic expression by another.

See also: division, remainder",division; remainder,,Mathematics
Quotition,"Quotition division is to identify how many parts are present when the whole is divided. For example, 15 people need to cross a river in boats that hold 3 people. How many boats are needed?

Quotition division and partition division provide complementary perspectives when developing ideas around grouping. For example, quotition identifies how many parts are generated by grouping, whereas partitioning identifies groups by magnitude.

For example, 12 = 2 + 3 + 7.

Quotition – 12 can be split into 3 groups.

Partition – The 3 groups are of magnitudes 2, 3 and 7.",,,Mathematics
Radian,"A radian is a measure of angle where one revolution of a unit circle from a fixed point corresponds to [FORMULA] radians. Thus, as a measure of angle, 180 degrees is equivalent to π radian, hence 1 radian is exactly [FORMULA] degrees or approximately 57.3 degrees.

See also: degree, pi",degree; pi,,Mathematics
Radius,"In the circle below, the line segment OA (interval OA) is called a radius of the circle.

See also: circle",circle,radius_1.png,Mathematics
Random event,A random (chance) event is an event that is not predictable.,,,Mathematics
Random number,"A random number is one whose value is governed by chance; for example, the number of dots showing when a fair die is tossed. The value of a random number cannot be predicted in advance.",,,Mathematics
Random number generator,"A true random number generator will produce random numbers based on some natural random physical process (for example, radioactive decay).

The [FORMULA] digit of the decimal expansion of a rational number is not random since these numbers can be predicted in advance. Selecting an arbitrary sequence of digits in the decimal expansion of an irrational real number can be used as a random number generator since the decimal expansion have no repetition. For example, the decimal expansion of pi, , could be used for this purpose.

Pseudo-random numbers are computer-generated random numbers found using an algorithm.

See also: random number",random number,,Mathematics
Random sample,"A subset of the population chosen such that every element of the population has an equal chance of being selected (that is, their selection is governed by chance). A random number generator, for example, could be used to select this random sample.

See also: random, random number generator",random; random number generator,,Mathematics
Random variable,"A random variable [FORMULA] is a function that assigns real numbers to events.

See also: event, random, real number, sample space, variable",event; random; real number; sample space; variable,,Mathematics
Range (relation),"A relation is a correspondence between 2 sets. When one of the sets is specified as the set of elements to which the correspondence is made, this set is called the co-domain of the relation. The subset of the co-domain to which elements of the domain are actually matched up, is called the range of the relation.

For example, if a correspondence is formed between the students in a class and their favourite colour, the students would be a natural choice for the domain of relation. The range corresponds to the actual set of favourite colours of the students. The co-domain is the set of all possible colours, not just the favourites of the class of students.

The range of a relation is, in general, a subset of its co-domain.

See also: domain",domain,,Mathematics
Range (statistics),"The range is the difference between the largest and smallest observations in a data set.

The range can be used as a measure of spread in a data set. It is sensitive to outliers and should be interpreted with care.

For example, for the set of data {2, 3, 4, 5, 6, 10, 12}, the range is",,,Mathematics
Rate,"A rate compares 2 quantities measured in different units. For example, the ratio of distance to time, known as speed, is a rate because distance and time are measured in different units (such as kilometres and hours). The value of the rate depends on the units in which the quantities are expressed.",,,Mathematics
Ratio,"A ratio compares magnitudes of sets, quantities of the same kind or algebraic expressions. It is often used as a comparison [FORMULA] of the size of 2 (or more) quantities relative to each other. For example, the ratio of the length of a side of a square to the length of a diagonal is [FORMULA] that is, ..

See also: fraction",fraction,,Mathematics
