Term,Definition,CrossReferences,ImageFiles,Subject
Infinite,"The set of natural numbers N = {0, 1, 2, 3 ...} is an example of an infinite set. There are many examples of infinite sets, the set of all prime numbers is an infinite set (there is no largest prime number).

The set of natural numbers, N, is an example of an infinite set that has a smallest element, 0, but no largest element. The set of integers Z = {... −3, −2, −1, 0, 1, 2, 3 ...} is an example of an infinite set that has no smallest or largest element.

The set {0.9, 0.99, 0.999, 0.9999, ... , 1} is an example of an infinite set that has both a smallest element, 0.9, and a largest element, 1.

It is not possible for the elements of any infinite set to be put in a one-to-one correspondence with the elements of a set of the form {0, 1, 2, 3, ... ,  } where  is a natural number.

See also: correspondence, natural numbers",correspondence; natural numbers,,Mathematics
Informal unit,"An informal unit is one where the value is decided on in a given context: for example, the use of a pace to measure distance or the use of a cupped hand to measure capacity of rice for a meal (irregular informal units). An informal unit may also be regular, such as the use of paperclips to measure length or a drinking glass to measure a small amount of a substance (capacity). Informal units are not part of a standardised system of units for measurement.",,,Mathematics
Integer,An integer is an element of the infinite set of numbers .,,,Mathematics
Intercept (graphs),"The point at which a curve or function crosses an axis or other curve in the plane is an intercept. Specifically,

the [FORMULA] -intercept is the point at which a curve crosses the -axis (), and

the [FORMULA] -intercept is the point at which a curve crosses the -axis ().

See also: x-axis, y-axis",x-axis; y-axis,,Mathematics
Interior angle,"For polygons, angles formed by 2 adjacent side within the polygon are interior angles.

Interior angles are also the 4 angles formed when a transversal cuts through 2 straight lines. The angles formed at the intersection of the transversal and the 2 lines, and located between the 2 lines, are the interior angles.

See also: polygon, transversal",polygon; transversal,,Mathematics
Interpolation,"Interpolation is working within known data to make predictions between these data values: for example, working between 2 known points on a graph to predict a value in between these points.",,,Mathematics
Interquartile range (IQR),"The interquartile range (IQR) is a measure of the spread within a numerical data set. It is equal to the upper quartile (Q3) minus the lower quartile (Q1): that is, IQR = Q3 – Q1.

The IQR is the width of an interval that contains the middle 50% (approximately) of the data values. To be exactly 50%, the sample size must be a multiple of 4.

See also: five-number summary, numerical data",five-number summary; numerical data,,Mathematics
Intersection (set),"Given 2 sets A and B, their intersection, written A ∩ B, is the set of all elements common to both sets. If A and B have no elements in common, their intersection is the empty set { }. For example, if A = { a , b , d , z } and B = { a , c , x , y , z } then A ∩ B = { a , z }; however, if C = { m , n } then A ∩ C = { }.",,,Mathematics
Interval (in R),"An interval is a continuous subset of the real number line: for example ‘the set of all real numbers greater than or equal to 10’ that can also be written as [FORMULA] or simply as [FORMULA] when it is assumed that [FORMULA] is a real number. Alternatively, the interval notation [10, ) can be used.

Similarly, the interval between –1.5 and 2.3 not inclusive of these 2 values can be specified as [FORMULA] or simply as [FORMULA] when it is assumed that [FORMULA] is a real number. The corresponding interval notation is (–1.5, 2.3).",,,Mathematics
Invariance,"Invariance is the property of not changing under a process such as transformation: for example, the points on a mirror line are invariant under the transformation of reflection in that mirror line. If a person touches a mirror with their finger, then the point of contact will be invariant under reflection in the mirror; all other points on their image will have left- and right-hand senses reversed.

See also: transformation",transformation,,Mathematics
Inverse,"For each element of a set, its inverse with respect to a given operation defined on the set is the element in the set that, when they are combined using the operation, results in the identity element. For example, the inverse of the integer + 4 with respect to the operation of addition is the integer −4 since + 4 + (−4) = 0 and −4 + (+ 4) = 0 (with zero being the additive identity). The inverse of the rational number   with respect to the operation of multiplication is the rational number   since  (where 1 is the multiplicative identity).

See also: identity, inverse machine",identity; inverse machine,,Mathematics
Inverse machine,"An inverse machine is a function machine that applies inverse operations to an input when compared to the original function machine.

For example, for a function machine that takes an input and multiplies it by 2 for the output, the inverse machine would take an input and divide by 2 for the output. This could be represented by the diagram below:

See also: function machine, inverse",function machine; inverse,,Mathematics
Inverse operation,"An inverse operation is an operation in arithmetic that undoes the effect of another operation. Multiplication and division are inverse operations, as are addition and subtraction.",,,Mathematics
Investigation,An investigation is an exploration of a situation or context.,,,Mathematics
Irrational number,"A number that cannot be expressed as a fraction in the form , where  and  are integers and  is non-zero, is an irrational number. The decimal form of such numbers does not terminate, and is non-recurring, that is, there is no finite sequence of digits that repeats itself.

For example,  is part of the decimal expansion of an irrational real number. Numbers such as [FORMULA] , the golden ratio , and  are examples of irrational numbers.

See also: decimal",decimal,,Mathematics
Irregular polygon,"A polygon with not all sides or angles equal is an irregular polygon.

See also: angle, polygon",angle; polygon,,Mathematics
Irregular object,An object that has faces of varying shapes is an irregular object. Contrast with a regular object such as a cube.,,irregular_object_1.png,Mathematics
Irregular shape,A shape with sides of varying lengths is an irregular shape. Contrast with a regular shape such as a rhombus or equilateral triangle.,,irregular_shape_1.png,Mathematics
Isometry,[See: transformation],transformation,,Mathematics
Iteration,"The repetition of a process a specified number of times, or until a condition is satisfied, is the process of iteration. This may be achieved by using loops, for example. An example of iteration could be subtracting 4 from 27 6 times, or subtracting 4 from 27 until the result is less than 4. For the second example, a flow chart could illustrate this:

See also: flow chart",flow chart,iteration_1.png,Mathematics
Karnaugh map,"A Karnaugh map is a diagram consisting of a small number of non-overlapping (mutually exclusive) rectangles used to indicate the relationship between elements of a set and given properties or attributes. When 2 properties or attributes are involved, the corresponding Karnaugh map is also called a two-way table.

Suppose a set of attribute blocks has several shapes (squares, circles, triangles and hexagons) of various colours (red, blue, yellow), size (small, large) and thickness (thin, thick).  If we consider the properties red (colour) and square (shape), then any of the blocks from the set will satisfy exactly one of the following 4 combinations of these 2 properties: it is red and square; it is red and not square; it is not red and square; it is not red and not square. This can be represented diagrammatically using a Karnaugh map, where each attribute block is place in exactly one of the 4 regions as shown below:

Note that the properties of size and thickness are not represented in this diagram. Each of the shapes shown could be small or large, thick or thin. If, for example, a third property such as thickness (thin, thick) were to be considered then the previous Karnaugh map could be modified to have 8 regions as follows:",,"karnaugh_map_1.gif,karnaugh_map_2.gif",Mathematics
Kite,"A kite is a quadrilateral with 2 pairs of adjacent sides equal.

A kite may be convex (as shown in the diagram above left) or non-convex (as shown above right). The axis of each kite is shown.

See also: adjacent, axis, polygon, reflection",adjacent; axis; polygon; reflection,kite_1.png,Mathematics
Line,"A line is a basic or undefined geometric object that is taken as a given. Intuitively, lines model what is perceived visually as straight. Lines have one dimension and extend indefinitely in the plane. They have the relation to points that any 2 distinct points lie on a unique line that is said to pass through and contain the 2 points. A ruler or straight edge is used to draw part of a line.

See also: line segment, undefined term",line segment; undefined term,,Mathematics
Line graphs,Line graphs are graphs that represent the changing relationship between 2 variables. They use lines to connect individual data points and are generally used to show how something changes over time.,,line_graphs_1.png,Mathematics
Line segment,"If A and B are 2 points on a line, the part of the line between and including A and B is called a line segment or interval. The distance AB is a measure of the size or length of AB.

Any point A on a line divides the line into 2 pieces called rays. The ray AP is that ray that contains the point P (and the point A). The point A is called the vertex of the ray and it lies on the ray.

See also: line, ray",line; ray,"line_segment_1.png,line_segment_2.png",Mathematics
Line symmetry,"Line symmetry is a type of symmetry where if you were to fold the shape about this line it would map onto itself exactly, forming a mirror image.",,line_symmetry_1.png,Mathematics
Linear equation,"A linear equation is an equation involving just linear terms, that is, polynomials of degree 1. The general form of a linear equation in one variable is : for example,

See also: equation, variable",equation; variable,,Mathematics
Linear expression,"A linear expression is an expression involving only variables to the power 1, and constants: for example, , [FORMULA] .",,,Mathematics
Linear inequalities,Linear inequalities are inequalities that involve linear expressions and contain one of the inequality signs: either [FORMULA] or .,,,Mathematics
Location,Location is a description of position with respect to some fixed reference.,,,Mathematics
Location (statistics),"In statistics, a measure of location is a single number that can be used to indicate a central or ‘typical value’ within a set of data. The most commonly used measures of location are the mean and the median, although the mode is also sometimes used for this purpose.",,,Mathematics
Logarithm,"The logarithm of a positive number [FORMULA] is the power to which a given number , called the base, must be raised in order to produce the number . The logarithm of , to the base [FORMULA] is denoted by . Algebraically: .

For example, [FORMULA] because , and [FORMULA] because .",,,Mathematics
Logarithmic scales,Logarithmic scales are scales where successive endpoint values of intervals increase by a constant factor (multiplicatively). Contrast with linear scales in which the increase is a constant amount.,,logarithmic_scales_1.png,Mathematics
Logic,Logic is reasoning where one proposition is deduced from other propositions according to the given rules of inference.,,,Mathematics
Lowest common multiple (lcm),"Given any 2 natural numbers, their lowest common multiple is the smallest natural number that they both divide exactly. This is not necessarily their product. For example, the lcm of 6 and 9 is 18, since 3 × 6 = 18 and 2 × 9 = 18, but 6 × 9 = 54. The lcm of 2 numbers may be found by listing the multiples of both numbers and finding the first common multiple. For example, the first 4 multiples of 6 are: 6, 12, 18 and 24, while the first 4 multiples of 9 are: 9, 18, 27 and 36. The first (lowest) multiple in common is 18.

The lcm is used, for example, in the operation of addition and subtraction of fractions and to identify equivalent fractions with the same denominator.

See also: natural number",natural number,,Mathematics
Magnitude,"Magnitude is the size or absolute value of a number: for example, both +5 and –5 have magnitude 5. The magnitude of certain numbers can only be approximated to a given accuracy, for example the magnitude of the number π, correct to 2 decimal places, is 3.14.",,,Mathematics
Many-to-one correspondence,[See: correspondence],correspondence,,Mathematics
Mass,"The mass of an object measures how much matter the object contains. The SI unit for mass is the kilogram (kg). Mass does not change with a change in gravitational acceleration, as weight does. An object will have the same mass on Earth as on the Moon where the gravitational acceleration is much less.

See also: weight",weight,,Mathematics
Mathematical modelling,"Mathematical modelling is a mathematical process involving the identification of a real-world problem, formulating and finding a solution to the problem mathematically using knowledge and understanding of mathematical concepts, structures and relationships, interpreting and communicating the mathematical solution(s) in terms of the situation. As students mathematical modelling skills become more sophisticated, they begin to consider assumptions, choose variables, justify decisions and evaluate the effectiveness of the model.",,,Mathematics
Mean,"Also called the average. The sum of values in a data set divided by the total number of values in the data set. For example, if a data set consists of the values [FORMULA] then the mean [FORMULA] is defined as:

For example, for the following list of 5 numbers { 2, 3, 3, 6, 8 } the mean equals .

See also: median",median,,Mathematics
Measure,"A measure is a record of the magnitude of an attribute (such as weight, length, time, and likelihood) associated with an object or event.

See also: magnitude",magnitude,,Mathematics
Measure of centre (central tendency),"Measure of centre is a statistic that is used to represent a data set. There are 3 common measure of centre for a data set: mode (the most common value), median (the middle value) and the mean (the sum of all the values divided by the number of values).

See also: mean, median, mode",mean; median; mode,,Mathematics
Measure of turn,Measure of turn is measurement of rotation from an initial starting position. A turn can be a fraction of a circle (quarter turn) or complete rotation (revolution). It can be directional (clockwise or anti-clockwise).,,,Mathematics
Median,"The median is the value in a set of ordered data that divides the data into 2 equal parts. It is frequently called the ‘middle value’. Where the number of observations is odd, the median is simply the middle value. For an even set of elements, the mode is taken to be the average of the 2 middle values. For example, the median of the numbers 1, 3, 4, 5, 7 is 4, while the median for 1, 3, 4, 5 is the average of the 2 middle values, that is (3 + 4) ÷ 2 = 3.5.

The median provides a measure of location of a data set that is suitable for both symmetric and skewed distributions and is also less sensitive to outliers than the mean.

See also: mean, outlier, skewness",mean; outlier; skewness,,Mathematics
Mensuration formulas,"Mensuration formulas define the measure of one quantity as a function of other quantities using an algebraic formula. For example, the area, , of a circle radius, , is defined by the mensuration formula  and the average speed, , of a moving object that travels a distance  in time  is defined by the formula  .

See also: For selected specific formulas, see: volume, area",For selected specific formulas; see: volume; area,,Mathematics
Midpoint,"The midpoint M of a line segment (interval) AB is the point that divides the segment into 2 equal parts.

Let A(x1, y1) be points in the Cartesian plane. Then the midpoint M of line segment AB has coordinates . This can be seen from the congruent triangles below.",,midpoint_1.png,Mathematics
Mixed numeral,"A mixed numeral is a form of representation of a rational number (also called a mixed fraction or mixed number) composed of an integer and a proper fraction, i.e. a fraction with a smaller numerator than denominator: for example, .",,,Mathematics
Mode,"The mode is the most frequently occurring value in a set of data. There can be more than one mode. When there are 2 modes, the data set is said to be bimodal. The mode is sometimes used as a measure of location.

See also: bimodal, multimodal",bimodal; multimodal,,Mathematics
Modelling,"Modelling is using mathematical concepts, structures and relationships to describe and characterise, or model, a situation in a way that captures its essential features.",,,Mathematics
Multimodal data,"Multimodal data is data with a distribution that has more than one mode.

See also: mode",mode,,Mathematics
Multiple,"A multiple of a number is the product of that number and an integer. A multiple of a real number [FORMULA] is any number that is a product of [FORMULA] and an integer. For example, [FORMULA] and -10.5 are multiples of [FORMULA] because [FORMULA] and .",,,Mathematics
Multiplication,"For positive natural numbers, the multiplication of [FORMULA] and [FORMULA] may be considered adding a number [FORMULA] to itself [FORMULA] times, or the number [FORMULA] to itself [FORMULA] times (since multiplication is a commutative operation).

The multiplicative operator in algebra is the symbol , called the multiplication sign. The multiplication [FORMULA] may also be represented [FORMULA] or . The result of the multiplication [FORMULA] is called the product, while the numbers [FORMULA] and [FORMULA] are factors of this product. Multiplication is also both an associative and distributive operation.

Multiplication can also be defined in other mathematical contexts: for example with matrices, but the precise definition for the action of the multiplication operator will vary.

See also: associative, commutative, distributive, multiples, multiplicative situations",associative; commutative; distributive; multiples; multiplicative situations,,Mathematics
Multiplication facts,"Multiplication facts are the results associated with the products of pairs of natural numbers from 0 to 9, associated with reasons. They are foundational to arithmetic.",,,Mathematics
Multiplicative situations,"Multiplicative situations are problems or contexts that involve multiplication (or division). Calculating the number of seats in a theatre that has 30 rows of 24 seats, finding equivalent fractions, and working with ratios and percentages, are all multiplicative situations.",,,Mathematics
Natural number,"A natural number is an element of the infinite set of numbers N = {0, 1, 2, 3 ...}. Natural numbers are sometimes also referred to as counting numbers. An even natural number is an element of the set {0, 2, 4, 6 ...}. An odd natural number is an element of the set {1, 3, 5, 7 ...}.

In some references, the number 0 is not included in the set of natural numbers; however, it is useful to include 0 to correspond to the number of elements in an empty set, or a count of none.

See also: even number, number, odd number",even number; number; odd number,,Mathematics
Negative number,"A real number [FORMULA] is a negative number if . The set of negative integers, and is sometimes referred to as ‘the negative counting numbers’.

Negative numbers may be rational or irrational. For example, the number [FORMULA] is a negative real number that is also a rational number. [FORMULA] The solutions of the equation [FORMULA] are [FORMULA]  and [FORMULA] . The solution is a negative real number that is also irrational.

See also: irrational number, rational number",irrational number; rational number,,Mathematics
Net,"A net is a plane figure that can be folded to form a polyhedron. More specifically, it is a two-dimensional representation of a three-dimensional object, comprising joined shapes that can be folded to form the object.

There are nets for polyhedra, cylinders and cones, and net for approximations of a sphere. One possible net for a cube is shown below:",,"net_1.png,net_2.png,net_3.png",Mathematics
Network,"A network is a set of points (vertices or nodes), some of which are joined by lines or curves (edges) that sometimes enclose regions (faces) is a network. Networks are used to represent relationships involving connectedness: for example, road networks, a family tree or the edges lining a tennis court.

See also: vertex",vertex,,Mathematics
Node,"A node is a vertex in a network.

See also: network",network,,Mathematics
Non-negative integer,"Also called the positive integer, the non-negative integer is an element of the infinite set of numbers [FORMULA] = {1, 2, 3 ...}.

See also: integer",integer,,Mathematics
Normal distribution,"Normal distribution is the distribution for a random variable that has a characteristic bell-shaped curve. Variables such as height and IQ typically have a normal type distribution.

See also: distribution, variable",distribution; variable,,Mathematics
Number,"[See: integer, irrational number, natural number, rational number]",integer; irrational number; natural number; rational number,,Mathematics
Number line,A number line gives a pictorial representation of real numbers. Part of a number line showing the integers is given below:,,number_line_1.png,Mathematics
Number sentence,"A number sentence is an equation or inequality, using numbers, common symbols and operations. A number sentence may be used to represent a situation. For example, the total number of pets I own if I have 3 cats and one dog could be shown using 3 + 1 = 4, . [FORMULA] and

See also: equation, inequality, operation",equation; inequality; operation,,Mathematics
Numeral,"A numeral is the designation of a number in a given language; for example, the number ‘three’ is designated by the Hindu-Arabic numeral 3, the Roman numeral III, and the Chinese numeral 三.",,,Mathematics
Numerator,"The numerator is the term [FORMULA] in a fraction [FORMULA] , where [FORMULA] and [FORMULA] are integers and . For example, the numerator of [FORMULA]  is . If an object is divided into [FORMULA] equal parts, then the fraction [FORMULA] represents [FORMULA] of these parts taken together. For example, if a line segment is divided into [FORMULA] equal parts, each of those parts is one-fifth of the whole and 3 of these parts taken together corresponds to the fraction​ .

See also: fraction",fraction,,Mathematics
Numerical data,"Numerical data is data associated with a numerical variable.

See also: numerical variable",numerical variable,,Mathematics
Numerical variable,"Numerical variables are variables whose values are numbers, and for which arithmetic processes such as adding and subtracting, or calculating an average, make sense.

A discrete numerical variable is a numerical variable, each of whose possible values is separated from the next by a definite ‘gap’. Common numerical variables often have the numbers {0, 1, 2, 3…} as possible values. Other examples could include prices measured in dollars and cents, the number of children in a family or the number of days in a month.

See also: numerical data",numerical data,,Mathematics
Object,"An object is a solid or three-dimensional skeletal representation composed of a number of faces, edges, vertices or closed surfaces, such as a prism, pyramid, cylinder or sphere. The term three-dimensional shape is also used.",,,Mathematics
Observed frequency,[See: frequency],frequency,,Mathematics
Obtuse angle,[See: angle],angle,,Mathematics
Odd number,"An odd number is an integer that is not divisible by 2. The odd numbers are
 .

See also: natural number",natural number,,Mathematics
One-to-one correspondence,[See: correspondence],correspondence,,Mathematics
Online tools,"Online tools are digital hardware, software, platforms and resources that are connected and support communications between users. Examples of online tools include websites for online shopping and fitness apps.",,,Mathematics
Operation,"An operation is the process of combining numbers or expressions. In the primary years, operations include addition, subtraction, multiplication and division. In later years, operations include substitution and composition.",,,Mathematics
Opposite angle,[See: vertically opposite angle],vertically opposite angle,,Mathematics
