Term,Definition,CrossReferences,ImageFiles,Subject
Empirical data,"Data derived from observation, measurement or experiment is called empirical data.",,,Mathematics
Empty set,"The empty set { } is the set containing no elements and is sometimes represented by the special symbol Ø.

See also: set, universal set",set; universal set,,Mathematics
Enlargement (dilation),"An enlargement is a transformation that scales up (or down) a figure in which the corresponding lengths in the transformed figure are in proportion to the original figure. The relative positions of points are unchanged and the 2 figures are similar.

In the diagram below, triangle A′B′C′ is the image of triangle ABC under the enlargement with enlargement factor 2 and centre of enlargement O.

See also: similar",similar,enlargement_dilation_1.png,Mathematics
Equal sharing,"Equal sharing means dividing a collection, shape or object into equal parts.",,,Mathematics
Equally likely outcomes,"Equally likely outcomes occur with the same probability. For example, in tossing a fair coin, the outcome ‘head’ and the outcome ‘tail’ are equally likely. In this situation, we would express this as .",,,Mathematics
Equation,"An equation is a mathematical expression that includes the ‘=’ symbol. Equations are used to assign a value to a pro-numeral: for example, . They may also be used to define the rule of a function: for example, , where whatever value  takes,  is 2 times  plus 3. Third, an equation may be used to specify conditions that must be satisfied by the value of a variable; for example, if , then  for this statement to be true.

See also: expression",expression,,Mathematics
Equivalence,"Two statements or propositions are understood to be equivalent if they are both true or both false. That is, the conditions that make one true make the other true as well, and the conditions that make one false make the other false as well.",,,Mathematics
Equivalent fractions,"Two fractions [FORMULA] and [FORMULA] are equivalent if they have the same simplest (reduced) form. For example, [FORMULA] and [FORMULA] are equivalent fractions because the reduced form for both fractions is [FORMULA] : that is, [FORMULA] .

Conversely, for any fraction in simplest form, an equivalent fraction is one whose numerator and denominator are both a common integer multiple of that fraction. For example, an equivalent fraction of    is  , which has a common integer multiple of 3.

For each fraction expressed in simplest form, an equivalence class (or family of equivalent fractions) can be generated by successively multiplying its numerator and denominator by the natural numbers (excluding zero). For example, for the fraction , the corresponding family is: .",,,Mathematics
Error,Error is the difference between an actual value and its measured or estimated value and is defined as:,,,Mathematics
Estimate,"To estimate is to form an approximate value for a quantity. For example, a painter could estimate how many litres of paint would be required to paint a given room.",,,Mathematics
Estimate (statistics),"In statistical terms, an estimate is information about a population extrapolated from a sample of the population.

For example, the mean number of decayed teeth in a randomly selected group of eight-year-old children is an estimate of the mean number of decayed teeth in eight-year-old children in Australia.",,,Mathematics
Estimation,Estimation is the skill of conceptualising and mentally manipulating numbers or measurements to find an approximate answer. The capacity to make reasonable adjustments to estimates is essential in estimating.,,,Mathematics
Euler’s formula,"Euler’s formula is a relation between the number of faces, vertices and edges of any polyhedron. It is written , where [FORMULA] is the number of faces, [FORMULA] the number of vertices and [FORMULA] the number of edges.",,,Mathematics
Evaluate,"To evaluate is to calculate or find a value: for example, when substituting values into a formula. Evaluating the expression when [FORMULA] gives .",,,Mathematics
Even number,"An integer is even if it is divisible by 2. The even natural numbers are

See also: integer, natural number",integer; natural number,,Mathematics
Event,"An event is a subset of the sample space for a random experiment.

For example, the set of outcomes from tossing 2 coins is { HH, HT, TH, TT }, where H represents a ‘head’ and T a ‘tail’. For example, if A is the event ‘at least one head is obtained’, then A = { HT, TH, HH }.

Two events A and B are mutually exclusive if one is incompatible with the other: that is, if they cannot be simultaneous outcomes in the same chance experiment. For example, when a fair coin is tossed twice, the events ‘HH’ and ‘TT’ cannot occur at the same time and are, therefore, mutually exclusive.

In a Venn diagram, as shown below, mutually exclusive events do not overlap.

See also: Venn diagram, probability, sample space",Venn diagram; probability; sample space,,Mathematics
Example,"An instance where a proposition or conjecture is true. For example, the number 6 provides an example of a number that is both even and a multiple of 3.

See also: proposition, conjecture",proposition; conjecture,,Mathematics
Expanded notation,"Expanded notation is a way of representing a number, separating each digit and representing it in an additive number sentence to show each digit’s place value, for example, .",,,Mathematics
Expected frequencies,Expected frequencies is the number of times that a particular event or outcome is predicted to occur using theoretical probability.,,,Mathematics
Explanatory variable (stats),[See: variable],variable,,Mathematics
Exponent,"The exponent (index or power) of a number or algebraic expression is the power to which the latter is be raised. For example, for [FORMULA]  the index is 3. For [FORMULA]  the index is .

In general, if [FORMULA] is a positive real number and [FORMULA] and [FORMULA] are positive integers then 
.

See also: exponent laws, logarithm",exponent laws; logarithm,,Mathematics
Exponent laws,"Exponent laws are rules for manipulating exponents (indices). They include:

See also: exponent",exponent,,Mathematics
Exponential function,"An exponential function is a function comprising a constant raised to the power of the variable; that is, [FORMULA] where [FORMULA] is a constant and [FORMULA] the variable, for example, .",,,Mathematics
Expression,"An expression is two or more numbers or variables connected by operations. For example, , , [FORMULA] are all expressions. Expressions do not include an equal sign.",,,Mathematics
Extrapolation,"Extrapolation is working beyond known data to make predictions: for example, working past the last known point on a graph to predict a value beyond this point.",,,Mathematics
Face/s,"A face is a bounded surface: a bounded region in a network, or on a three-dimensional shape or object.

See also: adjacent, polyhedron",adjacent; polyhedron,,Mathematics
Factor,"A factor (number) is a natural number that divides exactly into another given natural number. For example, 2 is a factor of 12, since . More generally, a factor (algebraic) of a given algebraic expression is a number or algebraic term that divides exactly into the given expression. For example, the factors of the linear expression [FORMULA] are 3 and [FORMULA] since . Similarly, [FORMULA]  and [FORMULA] are factors of [FORMULA] since .

The set of all factors of a given number is called its factor set. The factor set of 12 is {1, 2, 3, 4, 6, 12}. The elements of a factor set are often grouped in pairs. Thus, the set of factor pairs of 12 is {{1, 12}, {2, 6}, {3, 4}, {4, 3}, {6, 2}, {12, 1}}.

A prime factor of a natural number [FORMULA] is a factor of [FORMULA] that is a prime number, for example, the prime factors of [FORMULA] are {2, 3, 5, 11}. Prime factors can be found using a factor tree.

See also: divisible, factor tree",divisible; factor tree,,Mathematics
Factor tree,"A factor tree breaks down a number into its prime factors. An example of a possible factor tree for the number 18 is shown below (prime factors occur at the end of each branch):

It can be seen from the factor tree that the prime factorisation of .

See also: factor",factor,,Mathematics
Factor set,[See: factor],factor,,Mathematics
Factorial,"factorial (written [FORMULA] is the number formed by the product of a given natural number with all the natural numbers less than it. For example, to find the value for 4 factorial we have 
4! = 4 × 3 × 2 × 1 = 24. In general, for [FORMULA] factorial:",,,Mathematics
Factorise,"To factorise a number or algebraic expression is to express it as a product of simpler terms.

For example, , [FORMULA] and .",,,Mathematics
Finite,"The set {a , b , c , d , e} is an example of a finite set. The set of all people alive on a given day is a very large but finite set. The cardinal number of a finite set is a natural number; that is, the elements of any finite set can be put in a one-to-one correspondence with the elements of a set of the form {0, 1, 2, 3, ... , n } where n is a natural number.",,,Mathematics
Five-number summary,"A five-number-summary is a method for summarising a data set using 5 statistics: the minimum value, the lower quartile , the median , the upper quartile [FORMULA] and the maximum value.

For example, for the set of data {2, 3, 4, 5, 6, 10, 12}, we have: median = 5, , , maximum = 12 and minimum = 2.

See also: box-and-whisker plot, interquartile range, range",box-and-whisker plot; interquartile range; range,,Mathematics
Flow chart,A flow chart is a diagram that shows a sequence of steps (may be used to represent an algorithm). The flow chart below shows a process of classifying numbers as even or odd:,,,Mathematics
Formal unit,"A unit whose value is fixed by agreement is a formal unit. For example, the litre is a formal unit of capacity for fluids, and the hour is a formal unit of time.",,,Mathematics
Fraction,"A fraction is a number of the form [FORMULA]  where [FORMULA] is an integer and [FORMULA] is a non-zero integer. [FORMULA] If [FORMULA] and [FORMULA] are both positive integers, a fraction can be modelled by dividing a unit length into [FORMULA] equal parts and collecting [FORMULA] multiples of these parts. For example, [FORMULA]  refers to 3 of 5 equal parts of the whole, taken together.

For the fraction [FORMULA]  is called the numerator and [FORMULA] is called the denominator. The horizontal line separating the numerator from the denominator is called the vinculum. [FORMULA] Sometimes a fraction is written on a single line as / in which case the diagonal line is referred to as a solidus.

A fraction [FORMULA] is said to be a proper fraction if [FORMULA] and an improper fraction otherwise. For example, [FORMULA] is a proper fraction while [FORMULA] is an improper fraction.

A fraction is said to be expressed in simplest form if its numerator and denominator have no common factor other than 1. For example, [FORMULA] is expressed in simplest form (because the highest common factor of 3 and 5 is 1), but [FORMULA]  is not in simplest form, since 3 is a common factor of both 6 and 12, as is 6 (the hcf). [FORMULA]  would be expressed in simplest form as [FORMULA] .

The rules for the algebraic combination of fractions are given by

See also: highest common factor (hcf), rational number",highest common factor (hcf); rational number,,Mathematics
Frequency,"Frequency, or observed frequency, is the number of times that a particular value occurs in a data set. For grouped data, it is the number of observations that lie in that group or class interval.

Relative frequency is given by the ratio [FORMULA] , where [FORMULA] is the frequency of occurrence of a particular data value or group of data values in a data set and [FORMULA] is the number of data values in the data set.

An expected frequency is the number of times that a particular event is expected to occur when a chance experiment is repeated a number of times. If the experiment is repeated [FORMULA] times, and on each of those times the probability that the event occurs is , then the expected frequency of the event is . For example, suppose that a fair coin is tossed 5 times and the number of heads showing recorded. Then the expected frequency of ‘heads’ is 5/2 since . This example shows that the expected frequency is not necessarily an observed frequency, which in this case is one of the numbers 0, 1, 2, 3, 4 or 5.

See also: frequency distribution, frequency table",frequency distribution; frequency table,,Mathematics
Frequency distribution,"A frequency distribution is the division of a set of observations into a number of classes, together with a listing of the number of observations (the frequency) in that class.

Frequency distributions can be displayed in tabular or graphical form.",,,Mathematics
Frequency table,"A frequency table lists the frequency (number of occurrences) of observations in different ranges, called class intervals. The frequency distribution of the heights (in cm) of a sample of 42 people is displayed in the frequency table below:

Notice that the class intervals do not overlap (so the number 160, for example, is only counted in one class, not 2). The data in this frequency table could be represented by a histogram.

A two-way frequency table is commonly used for displaying the two-way frequency distribution that arises when a group of individuals or things are categorised according to 2 criteria.

For example, the two-way table below displays the two-way frequency distribution that arises when 27 children are categorised according to hair type (straight or curly) and hair colour (red, brown, blonde, black) could be below (also recording gender):

We can see, for example, that there are 2 students with red hair (1 straight and 1 curly) and 12 students with brown hair (8 straight and 4 curly).

The information in a two-way frequency table can also be displayed graphically using a side-by-side column graph.

See also: histogram, side-by-side column graph",histogram; side-by-side column graph,,Mathematics
Function,"A function is a correspondence (map or relation) between the elements of 2 sets where each element in the first set is mapped to exactly one corresponding element in the second set. A function is either a one-to-one correspondence or a many-to-one correspondence.

The functions most commonly encountered in elementary mathematics are real functions of real variables. For such functions, the domain and co-domain are sets of real numbers.

Functions are usually defined by a formula for [FORMULA] in terms of . For example, the formula , defines the ‘squaring function’ that maps each real number [FORMULA] to its square .

Functions, broadly speaking, have 2 types of variables:

dependent variable: The variable associated with the range of a relation. For a function  with rule ,  is the dependent variable.

independent variable: The variable associated with the domain of a relation. For a function  with rule ,  is the independent variable.

See also: correspondence, domain, range, variable",correspondence; domain; range; variable,,Mathematics
Function machine,"A function machine is an algorithmic process that takes an input, applies an operation (or operations) and results in an output. A simple diagrammatical representation is below:

For example, a function machine and an accompanying table of values could be:

This could be represented by the rule [FORMULA] where [FORMULA] is the input and [FORMULA] the output.

See also: function, inverse machine",function; inverse machine,function_machine_1.png,Mathematics
Geometric patterns,Geometric patterns are patterns formed by a series of shapes. They may be repeating or growing patterns that change in predicted ways that can be generalised. Tessellations are geometric patterns formed by transforming shapes.,,,Mathematics
"Golden ratio (phi, )","Consider 2 quantities [FORMULA] and , where . The golden ratio (represented by the Greek letter phi [FORMULA] ) is the irrational number whose value is given by the proportion when the ratio of the 2 quantities [FORMULA] is the same as the ratio of their sum to the larger of the 2 quantities: 
that is,

This can be shown geometrically in the figure below. The golden ratio is given by the proportion
AC : AB = AB : BC where A and C are the endpoints of a line segment and B is the point on the line segment between A and C such that AC : AB = AB : BC.

It is called the golden ratio as it is believed to represent a proportion of lengths that is aesthetically attractive to the human eye in art and design contexts. It also appears in some patterns in nature. The exact value of [FORMULA] is   [FORMULA] = [FORMULA]  and its approximate value is 1.618 correct to 3 decimal places.

The decimal expansion for   to 100 significant figures is:

1.618033988749894848204586834365638117720309179805762862135448622705260462818902449707207204189391137.

The digits in this decimal expansion do not display any recurring pattern, a property that distinguishes irrational numbers from rational numbers.

See also: irrational number",irrational number,,Mathematics
Gradient,"If [FORMULA] and points [FORMULA] are points in the plane where [FORMULA] – [FORMULA] ≠ 0, the gradient of the line segment (interval) AB is given by

AB = [FORMULA] =

This is illustrated in the diagram below:

The gradient of a line is the gradient of any line segment that the line contains.

See also: line, line segment",line; line segment,gradient_1.png,Mathematics
Graph,"A graph is a visual representation of data or functions. Cartesian graphs of functions and relations are plots of ordered pairs of values () that represent the function, or relation, relative to the [FORMULA] and coordinate axes and the fixed origin (0, 0). Statistical graphs include dot plots, box and whisker plots, bar graphs and histograms.

See also: Cartesian coordinate system",Cartesian coordinate system,,Mathematics
Greatest common divisor (gcd),[See: highest common factor (hcf)],highest common factor (hcf),,Mathematics
Greatest common factor (gcf),[See: highest common factor (hcf)],highest common factor (hcf),,Mathematics
Grid coordinate system,The grid coordinate system is a system for referencing location within a space using labelled horizontal and vertical grid lines. Locations are defined using a set of coordinates that indicate points in the plane where 2 grid lines meet.,,grid_coordinate_system_1.png,Mathematics
Grid reference,"Most commonly used to refer to the alpha-numeric coordinates used to locate a position on a grid or map. In the grid below, Tarneit is found at grid reference B4.",,grid_reference_1.png,Mathematics
Grouping,"Grouping is a process of partitioning a set into subsets according to a given criterion: for example, a class of students according to eye colour. Equal grouping means each subset has the same number of elements.",,,Mathematics
Growing pattern,"A growing pattern is a pattern where each term is either an increase or a decrease on the previous term. Change from term to term is predictable if the pattern is growing additively, multiplicatively or exponentially.",,,Mathematics
Growth,"Growth is a measure of the increase in value of the dependent variable of a function as the value of the independent variable increases: for example, the length of a spring when weights are added.",,,Mathematics
Guided statistical investigation,"A guided statistical investigation is a teacher-led, scaffolded approach to the statistical investigation process including collecting, representing and analysing data, interpreting and communicating results.",,,Mathematics
Heuristic,"The word heuristic comes from the Greek verb meaning ‘to discover’. In mathematics, a heuristic technique (often shorted to heuristic) refers to any of a number of different ways to go about solving a problem, learning and discovering. Heuristics can refer to the study or practice of these methods.",,,Mathematics
Highest common factor (hcf),"Also called the greatest common divisor (gcd) or greatest common factor (gcf), the highest common factor (hcf) of a given set of natural numbers is the common divisor of the set that is greater than each of the other common divisors. For example, since [FORMULA] and [FORMULA] are the common factors of 24, 54 and 66, this means that 6 is the highest common factor.

Any fraction can be expressed in simplest terms by dividing its numerator and denominator by their highest common factor.

See also: fraction",fraction,,Mathematics
Histogram,"A histogram is a statistical graph for displaying the frequency distribution of continuous data. It is also a graphical representation of the information contained in a frequency table.

In a histogram, class frequencies are represented by the areas of rectangles centred on each class interval. The class frequency is proportional to the rectangle’s height when the class intervals are all of equal width.

The histogram below displays the frequency distribution of the heights (in cm) of a sample of 42 people with class intervals of width 5 cm.

See also: frequency",frequency,"histogram_1.png,histogram_2.png,histogram_3.png",Mathematics
Hyperbola (rectangular hyperbola),"A hyperbola is the non-connected intersection of a double cone and a plane. The rectangular hyperbola has perpendicular axes (or asymptotes).

The function [FORMULA]  is an example of a rectangular hyperbola, as shown below:

See also: asymptote",asymptote,"hyperbola_rectangular_hyperbola_1.emf,hyperbola_rectangular_hyperbola_2.emf",Mathematics
Hypotenuse,"The hypotenuse is the longest side of a triangle in a right-angled triangle (opposite the right angle as shown).

See also: trigonometry",trigonometry,hypotenuse_1.png,Mathematics
Identity,"An identity is an equation that is true for all values of the variables involved over their natural domain: for example, [FORMULA] for all real numbers [FORMULA] and .",,,Mathematics
Identity (element),"An element of a set that, when combined (using a given operation) with any other element of the set, leaves that element unchanged is an identity.

For example, 0 is the identity element for addition of natural numbers, since for any natural number  it is the case that   and .

Similarly, 1 is the identity element for multiplication of natural numbers, since for any natural number  it is the case that  and .

See also: addition, multiplication, zero",addition; multiplication; zero,,Mathematics
Image (geometry),"In geometry, the image is a result of a transformation.

See also: transformation",transformation,,Mathematics
Implication,An implication is a statement of the form if ... then ... An implication is understood to be true unless the first part of the statement is true but the second part of the statement is false.,,,Mathematics
Implementation,Implementation is the process of translating an algorithm into a coding language.,,,Mathematics
Improper fraction,"An improper fraction is a fraction where the numerator is greater than or equal to the denominator: for example, [FORMULA] is an improper fraction, where as [FORMULA] is a proper fraction.",,,Mathematics
Inclusion (subset),"A set A is a subset of another set B if all the elements of A are also elements of B. For example, if A = {vowels} and B = {letters of the alphabet} then A is a (proper) subset of B, written symbolically as A ⊂ B. In the case where A is required to be a subset of B, but may include all  the elements of B then this is represented symbolically by A ⊆ B.",,,Mathematics
Independent event,"Two events are independent if knowing the outcome of one event tells us nothing about the outcome of the other event. We can express this, for example, as . This means that the probability of A given B is equal to the probability of A, that is, event B has no bearing on the probability of event A occurring.

See also: probability",probability,,Mathematics
Index,"[See: exponent, exponent laws, logarithm]",exponent; exponent laws; logarithm,,Mathematics
Index laws,[See: exponent],exponent,,Mathematics
Indices,[See: Plural. See: exponent],Plural. See: exponent,,Mathematics
Inequality,"An inequality is a mathematical expression containing the terms ‘less than’, ‘less than or equal to’, ‘greater than’, or ‘greater than or equal to’ their respective symbolic representations ‘<’, ‘≤’, ‘>’ and ‘≥’. For example, ‘the set of prime numbers less than or equal to 29’, is an inequality, as is the expression  where  and  are real numbers.

Inequalities can also be represented on a number line where closed dots represent numbers included in an interval and open dots numbers not included. For example, the inequality 
 could be represented on a number line as:

See also: number line",number line,"inequality_1.png,inequality_2.png",Mathematics
Inference,"An inference is an assertion made on the basis of analysis from given data or propositions; for example, on the basis of the weather patterns observed over several years, a farmer might infer that it is likely to be a hot summer.

See also: data, proposition",data; proposition,,Mathematics
