SubjectArea,Subject,Band,AchievementStandard_V1,AchievementStandard_V2,ChangeComment
English,English as an Additional Language,Level AL,,"By the end of Level AL, students demonstrate the following skills in English as an Additional Language.
Listening and Speaking
Students use simple English words and phrases to communicate with teachers and peers in familiar routine situations. They listen to others and concentrate for short periods. They follow one- and 2-step instructions, exchange simple personal information and attempt to use the foundational oral English needed to manage learning in an English-speaking classroom. They begin to adapt their emerging English language skills and knowledge to respond to new communicative and functional demands. They use simple, learnt formulaic responses to communicate. Their utterances are characterised by a reliance on key vocabulary and/or paralinguistic (non-verbal) communication such as gestures, facial expressions and head movements with many home language influences. They use some basic communication and learning strategies to participate and/or repair miscommunication in English. They demonstrate familiarity with some basic patterns in the sounds, intonation, rhythm, grammar and meaning of English. They attempt to copy pronunciation, stress and intonation used by others. They repeat key words and phrases that others use. They use home language peers as supports for learning and use resources, including classroom print texts such as pictures, diagrams, posters and other visual texts, to help them communicate.
Reading and Viewing
Students show interest in a variety of English texts and concentrate for short periods of time when reading or viewing short texts in print or visual form. They demonstrate reading-like behaviours, including holding a book, looking at the cover and pages of a book, turning single pages and looking at pictures. They recognise basic features of English texts, including page order and the role of illustrations in texts. They focus on images and other visual features that assist them to understand texts, and rely on peer or teacher support to complete simple structured activities such as sequencing pictures or acting out the key elements of a text. They read some environmental print, including their name and other familiar words and signs. They recognise and name some familiar letters and know the sounds commonly related to some letters and letter groups. When listening to texts being read aloud, they identify key words, and repeated words and phrases. They attempt to participate in shared reading experiences.
Writing
Students communicate their ideas and experiences through drawings and attempts at writing copied from other sources such as environmental print and very short teacher-modelled texts, showing evidence of an emerging understanding of writing processes. They demonstrate interest and some ability to concentrate in shared writing activities, including watching the teacher and other students writing. They participate in shared writing experiences. They demonstrate awareness that written texts in English are presented through conventions that change according to context and purpose. They use drawings to represent simple descriptions, recounts and procedures. They copy words or phrases from books, vocabulary lists and other resources, and can write their own name. They attempt to use different writing implements and learn how to hold and use them correctly. They demonstrate some understanding of the left-to-right directionality of English script and the importance of spacing and writing on lines. They demonstrate knowledge of some phoneme–grapheme correspondences. They talk about their pictures and copied writing using simple words and sentences that draw on their developing oral English language skills, and/or their home language(s), especially when sharing with home language peers or a multilingual teacher.",New in Version 2.0. Version 1.0 did not include Level AL.
English,English as an Additional Language,Level A1,"Speaking and Listening
At Level A1 students communicate in basic English in routine, familiar, social and classroom situations. They follow and give simple instructions, exchange basic personal information, and negotiate well-known, predictable activities and contexts. They begin to modify their responses and manner of interaction to match the responses of others and the context. They use simple learnt formulas and patterns, and they create original utterances by substituting words. Their utterances are characterised by a short simplified structure, simple subject–verb–object construction and overgeneralisation of rules. They use some basic communication and learning strategies to participate in and sustain interactions in English. They recognise that intonation carries meaning, and they listen for key words and for repetition of words and phrases. They use comprehensible pronunciation, stress and intonation. They use classroom resources such as picture cards or other visual texts to help them communicate.
Reading and Viewing
At Level A1 students read and engage with a wide range of short, simple, repetitive texts, including shared recounts and fictional and everyday texts. These texts may be in print or visual form.
Students read in context some familiar words, phrases, numbers and signs. They complete simple, structured activities such as sequencing sentences and pictures. They show early understanding that texts are written and structured for a variety of purposes. They recognise some common letters and letter patterns. They name some letters of the alphabet and know the sounds commonly related to some letters and letter groups. They recognise some basic features of texts, including text directionality and page order, and understand the function of titles and images. They hold and manipulate books appropriately. When listening to texts read aloud, they listen for key words and for repetition of words and phrases. They focus on images and other visual features that assist them to understand texts.
Writing
At Level A1 students communicate their ideas and experiences simply through drawings, copied writing, dictated texts and their own basic writing, showing evidence of a developing understanding of the writing process. They contribute to shared writing activities. They demonstrate an early awareness that written texts in English are presented through conventions, which change according to context and purpose. They write and draw for basic purposes and, with support, produce simple descriptions, recounts and procedures. Students’ writing reflects their oral structures, and they link ideas using basic conjunctions. They show awareness of the need for basic punctuation. They demonstrate knowledge of some sound–symbol relationships, and show evidence of some basic planning. They model their writing on shared writing activities and published texts, often copying words or phrases from books or word lists. They form letters and place text appropriately on the page. They use basic features of software applications to write and present their texts.","By the end of Level A1, students demonstrate the following skills in English as an Additional Language.
Listening and Speaking
Students communicate in simple English phrases and sentences in routine and familiar social and classroom situations. They follow and give simple instructions, exchange personal information, and participate in familiar and predictable activities and contexts. They modify their responses and manner of interaction to match the responses of others and the context. They use learnt formulaic responses and patterns, and create original utterances by substituting words. Their utterances have a short, simplified structure with simple subject–verb–object construction and overgeneralisation of rules. They use basic communication and learning strategies to participate in and sustain interactions in English. They recognise that intonation carries meaning, and they identify key words and repeated words and phrases. They use comprehensible pronunciation, stress and intonation. They use classroom resources such as picture cards and other visual texts to aid communication.
Reading and Viewing
Students read and engage with a wide range of short, simple, repetitive texts, including shared recounts and fictional and everyday texts, in print or visual form. Students read, in context, some familiar words, phrases, numbers and signs. They complete simple, structured activities such as sequencing sentences and pictures. They understand that texts are written and structured for a variety of purposes. They recognise some common letters and letter patterns. They name some letters of the alphabet and know the sounds commonly related to some letters and letter groups. They recognise features of texts, including text directionality and page order, and understand the function of titles and images. They hold and manipulate books appropriately. When listening to texts being read aloud, they listen for key words and for repetition of words and phrases. They focus on images and other visual features that assist them to understand texts.
Writing
Students communicate their ideas and experiences through drawings, copied writing, dictated texts and their own writing, showing evidence of a developing understanding of the writing process. They contribute to shared writing activities. They demonstrate awareness that written texts in English are presented through particular conventions, which change according to context and purpose. They write and draw for basic purposes and, with support, produce simple descriptions, recounts and procedural texts. Students’ writing reflects their spoken structures, and they link ideas using basic conjunctions. They use basic punctuation in their writing. They demonstrate knowledge of some phoneme–grapheme correspondences when writing and spelling words. They show evidence of some basic planning for writing. They model their writing on shared writing activities and published texts, often copying words or phrases from books or vocabulary lists. They form letters and place text appropriately on a page. They use basic digital resources to write and present their texts.","The structure has been retained (language modes) with clear throughlines of the skills sets identified under each language mode.
The first strand has been renamed ‘Listening and Speaking’ as EAL students first learn to listen before they begin to speak in English.
The first words have been changed from ‘At Level …’ to ‘By the end of Level …’ in recognition of the expectation that these are skills and knowledge to be assessed after the content descriptions have been taught."
English,English as an Additional Language,Level A2,"Speaking and Listening
At Level A2 students communicate in an expanding range of predictable social and learning situations. They express ideas and identify key points of information in classroom discussions about familiar topics, and in new topics when they are well supported by visual material, an appropriate pace of delivery, and discussion that links their prior knowledge to the new context. They follow a short sequence of instructions related to classroom procedures and learning activities. They negotiate familiar social and learning situations, using English appropriate to the situation. They adjust their speech choices in response to audience and topic. They combine known conversational formulas and vocabulary, including some from texts read in class, and apply some grammatical rules to make original utterances of varying grammatical accuracy. They sustain communication by negotiating turn-taking and by using strategies such as asking a speaker to repeat or to speak slowly, or asking what a word means.
Reading and Viewing
At Level A2 students read and respond to a wide range of familiar texts. These texts may be print or digital texts, including visual, multimodal or interactive texts.
Students predict, ask questions, retell and talk about texts read and viewed in class. With support, they read a range of topic-related classroom texts. They can read familiar texts with some fluency. They read back their own writing or own sentences recorded by another. They use texts purposefully, following simple procedural texts and finding basic information in texts. They discuss simply the events in texts and characters’ feelings and actions. They identify the purposes of familiar text types including classroom texts, simple stories and factual texts. They use their developing knowledge of context, sound–symbol relationships, word patterns and text structure to read simple familiar and unfamiliar texts. They interpret simple images and identify the layout of a range of text types.
Writing
At Level A2 students communicate ideas, events and experiences through simple texts based on familiar spoken and written language. They write for a variety of personal and classroom purposes, using known and modelled structures and features. They write everyday texts and simple stories, recounts and factual texts based on their own and shared class experiences. They use their developing oral base and reading repertoire when writing their own texts. They write texts using simple but coherently linked sentences, basic structures and well-known vocabulary. They use some common irregular past tense verbs correctly, and link clauses using basic conjunctions and connectives. They attempt to spell new words, based on known spelling patterns and base words. They use vocabulary lists, modelled texts and familiar books to find how to write new words. They write letters legibly and make some changes to their texts when editing. They use advanced features of software applications to write and present their texts.","By the end of Level A2, students demonstrate the following skills in English as an Additional Language.
Listening and Speaking
Students communicate in a range of predictable and familiar social and learning situations. They express ideas and identify key points of information in classroom discussions about familiar topics, and about new topics when they are well supported by visual material, an appropriate pace of delivery, and discussion that links their prior knowledge to the new context. They follow a short sequence of instructions related to classroom procedures and learning activities. They negotiate familiar social and learning situations, using English appropriate to the situation. They adjust their speech choices in response to audiences and topics. They combine known conversational formulas and vocabulary, including some from texts read in class, and apply grammatical rules to make original utterances of varying grammatical accuracy. They sustain communication by negotiating turn-taking and by using strategies such as asking a speaker to repeat or to speak slowly, or by asking what a word means.
Reading and Viewing
Students read and respond to a wide range of familiar print or digital texts, including visual, multimodal and interactive texts. They predict, ask questions, retell and talk about texts read and viewed in class. With support, students read a range of topic-related classroom texts. They can read familiar texts with some fluency. They read back their own writing or their own sentences recorded by another student. They use texts purposefully, following simple procedural texts and finding basic information in texts. They discuss the events and characters’ feelings and actions in texts. They identify the purposes of familiar text types, including classroom text, simple story and factual text. They use their developing knowledge of context, phoneme–grapheme correspondences, word patterns and text structure to read simple texts, both familiar and unfamiliar. They interpret simple images and identify the layout of a range of text types.
Writing
Students communicate ideas, events and experiences through simple texts based on familiar spoken and written language. They write for a variety of personal and classroom purposes, using known and modelled structures and features. They write everyday texts and simple stories, recounts and factual texts based on their own and shared class experiences. They use their developing oral and reading skills when writing their own texts. They write texts using simple but coherently linked sentences, basic structures and well-known vocabulary. They use some common irregular past tense verbs correctly, and link clauses using basic conjunctions and connectives. They make plausible attempts to spell unfamiliar words, based on known spelling patterns and base words. They use vocabulary lists, modelled texts and familiar books to find out how to write unfamiliar words. They write letters legibly, include some punctuation and make some changes to their texts when editing. They use digital resources to write and present their texts.","The structure has been retained (language modes) with clear throughlines of the skills sets identified under each language mode.
The first strand has been renamed ‘Listening and Speaking’ as EAL students first learn to listen before they begin to speak in English.
The first words have been changed from ‘At Level …’ to ‘By the end of Level …’ in recognition of the expectation that these are skills and knowledge to be assessed after the content descriptions have been taught."
English,English as an Additional Language,Level BL,"Speaking and Listening
At Level BL students communicate simply but effectively in familiar, social and classroom contexts, using simple formulaic and some creative structures. They learn through English that is well supported by context. They contribute relatively complex ideas through simple English, and use simple English to respond to the ideas of others.
Students’ oral expression in English is characterised by short utterances, varying grammatical accuracy, simple subject–verb–object construction and over-generalisation of rules. They use common adjectives and adverbs to describe or add emphasis. They use repetitive grammar patterns copied from stories, songs, rhymes or other short texts. Students’ pronunciation, stress and intonation are comprehensible but carry elements of home language pronunciation. They use some basic communication strategies, asking for repetition, and questioning to check, clarify or confirm understanding. They use some basic strategies to initiate and sustain simple conversations in English, restating, repeating or re-pronouncing as appropriate.
Reading and Viewing
At Level BL students read a wide range of familiar, short, simple, repetitive fictional and everyday texts, and complete basic structured activities based on them. These texts may be print or digital, including visual, multimodal and interactive.
Students retell a simple and familiar story, and sequence a process with sentences and pictures. They show early understanding that texts are written for a variety of purposes. They show beginning understanding of the letter–sound relationships of English. They read some familiar words and phrases in context, and recognise, name and know the sounds related to all letters and some common letter groups. They recognise that meaning is carried by intonation, and they listen for key words and for repetition of words and phrases in texts read aloud. They focus on illustrations and other non-written features when reading. They use word lists and simple dictionaries to assist them to read new words.
Writing
At Level BL students communicate their ideas and experiences simply through written, drawn, copied or dictated texts. They contribute to whole-class or small-group shared writing activities. They demonstrate an early awareness that written texts in English are presented according to certain conventions, which change according to context and purpose. They write simple sequenced descriptions, recounts and procedures, following models. They write or draw for specific audiences.
Students’ writing reflects their oral structures. They link ideas using common conjunctions and show awareness of the uses of basic punctuation. They demonstrate knowledge of some English letter–sound relationships and spelling of high-frequency words, and show evidence of some planning. They model their writing on shared writing activities and published texts, and use some basic strategies, such as copying words or phrases from lists, using images and asking how to write a word. They begin to form letters and place text appropriately. They copy texts using computer software applications.","By the end of Level BL, students demonstrate the following skills in English as an Additional Language.
Listening and Speaking
Students communicate in familiar social and classroom contexts, using simple formulaic and some creative structures. They understand spoken English that is supported by teacher direction and cues from classroom context. They contribute relatively complex ideas through simple spoken English, and use simple English to respond to the ideas of others. This is achieved through continuing support and scaffolding from teachers and English-speaking peers who provide authentic interactions and space to practise English. Peers who speak home language(s) also offer shared translation opportunities. This supports students to make connections between their home language(s) and their developing English language skills.
Students use short utterances and simple subject–verb–object constructions. They use common adjectives and adverbs to describe or add emphasis. They use repeated grammar patterns copied from stories, songs, rhymes or other short texts. Students’ pronunciation, stress and intonation are comprehensible but carry elements of home language pronunciation. They use some basic communication strategies, such as asking for repetition, and by questioning to check, clarify or confirm understanding. They use some basic strategies to initiate and sustain simple conversations in English, including restating, repeating or re-pronouncing as appropriate.
Reading and Viewing
Students read a variety of short, simple, familiar, repetitive fiction and everyday texts in print and digital form, including visual, multimodal and interactive texts. They complete basic structured activities for the texts they read.
Students retell simple, familiar stories, and sequence a process using simple sentences and pictures. They understand that texts are written for a variety of purposes. They understand the basic phoneme–grapheme correspondences of English. Students read some familiar words and phrases in context. They recognise, name and know the sounds related to all letters and some common letter groups. They recognise that meaning is carried by intonation, and they listen for key words and for repetition of words and phrases in texts read aloud. They focus on illustrations and other non-written features when reading. They use vocabulary lists and simple pictorial and bilingual dictionaries to assist them to read unfamiliar words.
Writing
Students communicate their ideas and experiences simply through written, drawn, copied or dictated texts. They contribute to whole-class or small-group shared writing activities. They understand that written texts in English comprise specific conventions, which change according to context and purpose. They write simple sequenced descriptions, recounts and procedures, following models. They write or draw for specific audiences. Students engage in a variety of writing activities where they develop ideas with peers, seek feedback from teachers and use model texts to inform their own writing.
Students’ writing reflects the text structures and linguistic features of their spoken language. They link ideas using common conjunctions, and understand the purpose of basic punctuation and use it in their texts. They demonstrate knowledge of some English phoneme–grapheme correspondences and spelling of high-frequency words, and show evidence of some planning. They model their writing on shared writing activities and published texts, and use some basic strategies, such as copying words or phrases from lists, using images and asking how to write a word. They begin to form letters and place text appropriately. They copy and write texts using digital tools.","The structure has been retained (language modes) with clear throughlines of the skills sets identified under each language mode.
The first strand has been renamed ‘Listening and Speaking’ as EAL students first learn to listen before they begin to speak in English.
The first words have been changed from ‘At Level …’ to ‘By the end of Level …’ in recognition of the expectation that these are skills and knowledge to be assessed after the content descriptions have been taught."
