SubjectArea,Subject,Band,AchievementStandard_V1,AchievementStandard_V2,ChangeComment
English,English as an Additional Language,Level CL,"Speaking and Listening
At Level CL students communicate simply but effectively in English in familiar social and classroom contexts. They communicate using formulaic language; short, simple and well-rehearsed grammatical features; and adaptations of their emerging English repertoire. They use stress and intonation appropriately in some familiar interactions and can imitate models with some accuracy. They understand common instructions and questions, and simple descriptions and explanations when strongly supported in familiar contexts. They understand and use basic subject–verb–object grammatical patterns, common regular and irregular verbs, and basic prepositions and connectives, such as time and sequence markers. They use their repertoire with varying accuracy to ask and respond to questions in predictable contexts, express simple ideas and preferences, and provide short explanations and descriptions. They use some strategies to initiate and sustain basic conversations in English, repeating and re-pronouncing as necessary.
Reading and Viewing
At Level CL students read and complete simple, structured activities around a wide range of familiar, short, simple texts that use repetitive structures and features and are strongly supported by illustrations. These texts may be print or digital texts, including handwritten, visual, multimodal and interactive texts.
Students read their own writing and other simple texts based on well-rehearsed spoken English. They read a range of familiar simple fictional, factual and everyday texts. They name some letters and know the sounds related to many letters and common letter combinations. They attempt to sound out words, recognise some common words, and read some new words based on their similarity to known words. They show some awareness of basic punctuation and use stress, intonation or pausing appropriately when reading familiar texts aloud. They use simple strategies such as pointing to words as they read or as shared texts are read aloud in class. They understand the basic practical and cultural purposes of the texts they read.
Writing
At Level CL, in familiar contexts, students write short, grammatically simple texts based on well-rehearsed spoken and well-practised written English. They write for a range of basic classroom and personal purposes, such as making lists and writing simple journal entries and notes, and complete activities following models. They demonstrate an early awareness that print texts in English are based on certain conventions, which change according to context and purpose. Their texts use familiar sentence patterns from well-known texts or classroom models. They begin to use conventional letter formations when writing or copying, attending to the relative sizes and shapes of letters, their position on the line and basic punctuation. They leave appropriate spaces between words. They attempt to write some new words using their developing knowledge of the sound–symbol system in English, referring to personal dictionaries, glossaries and classroom resources and asking for assistance. They copy texts using basic features in software applications.","By the end of Level CL, students demonstrate the following skills in English as an Additional Language.
Listening and Speaking
Students communicate using simple spoken English in familiar, structured social and classroom contexts. They use formulaic language; short, simple and well-rehearsed grammatical features; and adaptations of their emerging English repertoire. They use stress and intonation appropriately in some familiar interactions and can imitate model texts with some accuracy. They understand common instructions and questions, and simple descriptions and explanations, when strongly supported in familiar contexts. They understand and use basic subject–verb–object grammatical patterns, common regular and irregular verbs, basic prepositions and connectives such as time and sequence markers. They ask and respond to questions in predictable contexts, express simple ideas and preferences, and provide short explanations and descriptions. They use some strategies to initiate and sustain basic conversations in English, repeating and re-pronouncing as necessary.

Reading and Viewing
Students read a wide range of simple, familiar fiction, information and everyday print and digital texts in handwritten, visual, multimodal and interactive formats. They complete simple structured activities about these texts. Students read their own writing and other simple texts based on well-rehearsed spoken English. They name some letters and know the sounds related to many letters and common letter combinations. They attempt to sound out words, recognise some high-frequency words and read some unfamiliar words based on the similarity of these to known words. They demonstrate awareness of basic punctuation and use stress, intonation or pausing appropriately when reading familiar texts aloud. They use simple strategies such as pointing to words as they read, or as shared texts are read aloud in class. They understand the basic practical and cultural purposes of the texts they read.
Writing
Students write short, grammatically simple texts based on well-rehearsed spoken and well-practised written English in familiar contexts. They write for a range of basic classroom and personal purposes, such as making lists and writing simple recounts and notes, and complete activities following models and examples. They recognise that print texts in English are based on certain conventions, which change according to context and purpose. Their texts use familiar sentence patterns from well-known texts or classroom models. They begin to use conventional letter formations when writing or copying text, attending to the relative sizes and shapes of letters, their position on a line and basic punctuation. They leave appropriate spaces between words. They attempt to write some unfamiliar words using their developing knowledge of phoneme–grapheme correspondences in English, referring to personal dictionaries, glossaries and classroom resources and asking for assistance. They copy and create texts using digital tools.","The structure has been retained (language modes) with clear throughlines of the skills sets identified under each language mode.
The first strand has been renamed ‘Listening and Speaking’ as EAL students first learn to listen before they begin to speak in English.
The first words have been changed from ‘At Level …’ to ‘By the end of Level …’ in recognition of the expectation that these are skills and knowledge to be assessed after the content descriptions have been taught."
English,English as an Additional Language,Level C1,"Speaking and Listening
At Level C1 students communicate simply but effectively in English in social and classroom contexts across the curriculum. They negotiate meaning and interact with others using formulaic language; short, simple and well-rehearsed grammatical features; and creative adaptations of their English repertoire. They use some stress and intonation appropriately in familiar interactions. They use subject–verb–object utterances, basic prepositions and some common regular and irregular verbs. They understand and use introduced vocabulary, common basic grammatical patterns and connectives, such as time and sequence markers. They use these with varying grammatical accuracy to express ideas and preferences, and provide simple explanations and descriptions. They understand common instructions and questions, descriptions or explanations in familiar contexts and areas related to their prior knowledge and experience. They use some basic strategies to initiate and sustain conversations, repeating or re-pronouncing as necessary.
Reading and Viewing
At Level C1 students read and comprehend a range of short, simple, familiar factual or fictional texts developed by the teacher. These texts may be print or digital texts, including handwritten, visual, multimodal and interactive texts.
Students understand a range of basic print instructions and questions in context. They discuss texts at a literal level, and show some inferential understanding. They demonstrate an understanding of basic text structure, reading for different purposes, and using titles and chapter headings to make predictions about texts. Students read new texts with support, combining their developing knowledge of English sound–symbol relationships, their developing oral and sight vocabulary, their beginning knowledge of the conventions of print text organisation in English, and their emerging knowledge of English grammar. They read some common letter combinations and make logical attempts at reading new words. They use appropriate stress, intonation and phrasing when reading known texts aloud, showing an understanding of the function of basic punctuation.
Writing
At Level C1 students write for a range of basic classroom and personal purposes, making lists and writing simple journal entries, notes, descriptions, recounts of events and instructional texts. Their basic sentences and short texts are based on well-practised spoken English and familiar contexts. They write with varying grammatical accuracy, expressing themselves using familiar vocabulary and modelled structures and features. They order and sequence sentences about familiar topics into simple coherent texts, incorporating basic conventions such as headings and paragraphs. They correct some errors relating to targeted grammatical items, and rework drafts in response to teacher suggestions. With support they plan their texts and provide some additional information through visual texts. They utilise a range of strategies for finding and spelling words, using spelling patterns and checking resources. They use basic features in software applications to write and present their texts.","By the end of Level C1, students demonstrate the following skills in English as an Additional Language.
Listening and Speaking
Students communicate simply but effectively in English, in social and classroom contexts across the curriculum. They negotiate meaning and interact with others using formulaic language; short, simple and well-rehearsed grammatical features; and creative adaptations of their English repertoire. They use some stress and intonation appropriately in familiar interactions. They use subject–verb–object utterances, basic prepositions and some common regular and irregular verbs. They understand and use introduced vocabulary, common basic grammatical patterns and connectives such as time and sequence markers with varying grammatical accuracy to express ideas and preferences, and to provide simple explanations and descriptions. They understand simple instructions and questions, descriptions or explanations in familiar contexts and topics related to their prior knowledge and experience. They use some basic strategies to initiate and sustain conversations, including repeating or re-pronouncing as necessary.
Reading and Viewing
Students read and comprehend a range of short, simple, familiar information or fictional texts developed by the teacher. These texts may be print or digital, including handwritten, visual, multimodal and interactive texts.
Students understand a range of basic print instructions and questions in context. They discuss texts at a literal level and show some inferential understanding. They demonstrate an understanding of basic text structure, reading for different purposes, and they use titles and chapter headings to make predictions about texts. They combine their developing knowledge of English phoneme–grapheme correspondences, their developing oral and sight vocabulary, their beginning knowledge of the conventions of print text organisation in English and their emerging knowledge of English grammar to read unfamiliar texts with support. They read some common letter combinations and make logical attempts at reading unfamiliar words. They use appropriate stress, intonation and phrasing when reading known texts aloud, showing an understanding of the function of basic punctuation.
Writing
Students write for a range of basic classroom and personal purposes, including making lists and writing simple journal entries, notes, descriptions, recounts of events and instructional texts. They write simple sentences and short texts that are based on well-practised spoken English and familiar contexts. They write with varying grammatical accuracy, expressing themselves using familiar vocabulary and modelled structures and features. They order and sequence sentences about familiar topics into simple coherent texts, incorporating basic conventions such as headings and paragraphs. They correct some grammatical errors and rework drafts in response to the teacher’s suggestions. With support, they plan their texts and provide some additional information through visual texts. They use a range of strategies for finding and spelling words, using spelling patterns and checking resources. They use digital tools to write and present their texts.","The structure has been retained (language modes) with clear throughlines of the skills sets identified under each language mode.
The first strand has been renamed ‘Listening and Speaking’ as EAL students first learn to listen before they begin to speak in English.
The first words have been changed from ‘At Level …’ to ‘By the end of Level …’ in recognition of the expectation that these are skills and knowledge to be assessed after the content descriptions have been taught."
English,English as an Additional Language,Level C2,"Speaking and Listening
At Level C2 students use simple but effective strategies for initiating communication and negotiating meaning. They communicate effectively in a range of familiar social and some basic academic contexts, experimenting with and adapting their developing English and cultural understanding. With support in academic contexts, they extract some specific information from texts and understand teacher explanations involving familiar specific curriculum area vocabulary. With support, they use some increasingly complex grammatical features and a basic range of connectives, such as time and sequence markers, to show relationships between ideas. They use some standard expressions to express views and attitudes. They demonstrate some understanding of the structures and features of extended texts, by using appropriate stress, intonation, pausing and eye contact, and modelled introductory and concluding sentences.
Reading and Viewing
At Level C2 students read and comprehend a range of short, familiar fictional and factual texts and, when well supported, some unfamiliar texts. These texts may be print or digital texts, including handwritten, visual, multimodal and interactive texts.
Students show some comprehension beyond the literal level, suggesting appropriate interpretations and identifying basic cultural variables where evident. They use headings and diagrams to assist in reading accessible texts from across the curriculum for a range of purposes. They extract the main ideas from factual texts. They show awareness of how some connectives link and sequence ideas within a text. They read on and consider the context when deducing the meaning of unknown words. They read aloud with a degree of fluency, and draw upon their understanding of the text to use stress and intonation with increasing accuracy. They use their developing knowledge of sentence structure and sound–symbol relationships to read new words and self-correct. They select basic texts appropriate for particular reading purposes.
Writing
At Level C2 students write with a degree of autonomy for a range of everyday classroom and personal purposes, such as describing, explaining and recounting. They independently write some basic texts and experiment with presenting their own ideas. Their texts show varying grammatical accuracy. They incorporate emerging vocabulary and grammatical features to achieve desired effects. They use an increasing range of simple connectives to indicate some basic relationships within and between sentences and paragraphs. They choose appropriate text structures and use headings, tables and images. They use basic text models as a basis for their own texts. They use strategies to organise information in supported research tasks. With teacher support and feedback, they review, redraft and improve their writing by discussing alternative ways of arranging and expressing ideas. They use more advanced features in software applications to write, edit and present their texts.","By the end of Level C2, students demonstrate the following skills in English as an Additional Language.
Listening and Speaking
Students use simple strategies for initiating communication and negotiating meaning. They communicate effectively in a range of familiar social and some basic academic contexts, experimenting with and adapting their developing English and cultural understanding. With support in academic contexts, they extract some specific information from texts and understand teacher explanations involving familiar, specific curriculum area vocabulary. With support, they use some increasingly complex grammatical features, and a basic range of connectives such as time and sequence markers, to show relationships between ideas. They use some conventional expressions to express views and attitudes. They demonstrate some understanding of the structures and features of extended texts by using appropriate stress, intonation, pauses and eye contact, and modelled introductory and concluding sentences.
Reading and Viewing
Students read and comprehend a range of short, familiar fictional and information print and digital texts and, when well supported, some unfamiliar texts. These texts include handwritten, visual, multimodal and interactive texts.
Students demonstrate comprehension beyond the literal level, by suggesting appropriate interpretations and identifying basic cultural variables where evident. They use headings and diagrams to assist in reading texts from all curriculum areas and for a range of purposes. They extract the main ideas from information texts. They show awareness of how some connectives link and sequence ideas within a text. They read and consider the context when deducing the meaning of unfamiliar words. They read aloud with a degree of fluency, and draw on their understanding of the text to use stress and intonation with increasing accuracy. They use their developing knowledge of sentence structure and phoneme–grapheme correspondences to read unfamiliar words and self-correct. They select basic texts appropriate for specific reading purposes.
Writing
Students write for a range of everyday classroom and personal purposes, such as describing, explaining and recounting. They independently write some basic texts and experiment with presenting their own ideas. Their texts show varying spelling and grammatical accuracy. They incorporate emerging vocabulary, punctuation and grammatical features to achieve desired effects. They use an increasing range of simple connectives to indicate basic relationships within and between sentences and paragraphs. They choose appropriate text structures and use headings, tables and images. They use simple model texts as a basis for their own texts. They use strategies to organise information in supported research tasks. With teacher support and feedback, they review, redraft and improve their writing by discussing alternative ways of arranging and expressing ideas. They use a range of digital resources to write, edit and publish their texts.","The structure has been retained (language modes) with clear throughlines of the skills sets identified under each language mode.
The first strand has been renamed ‘Listening and Speaking’ as EAL students first learn to listen before they begin to speak in English.
The first words have been changed from ‘At Level …’ to ‘By the end of Level …’ in recognition of the expectation that these are skills and knowledge to be assessed after the content descriptions have been taught."
