SubjectArea,Subject,Band,AchievementStandard_V1,AchievementStandard_V2,ChangeComment
English,English as an Additional Language,Level C3,"Speaking and Listening
At Level C3 students listen, question and respond successfully in a wide range of social and academic contexts. They demonstrate sufficient control of stress, rhythm and intonation to be understood in most contexts. They use appropriate non-verbal language, take account of purpose and audience, and stage extended texts appropriately when participating in group debates and discussions. They discuss texts from across the curriculum using modelled examples in supportive classroom situations and structured group work. With varying accuracy, they use a range of question types, time signals, conjunctions and modal verbs to express a variety of academic functions, and to give and justify opinions and points of view. Students interpret accessible spoken and print texts and, with support, understand the full text. They listen for specific information when questions are given beforehand. They understand small amounts of abstract and generalised information when appropriate background is provided.
Reading and Viewing
At Level C3 students demonstrate a basic understanding of the main ideas, issues or plot developments in a range of accessible texts from across the curriculum. These texts may be print or digital texts, including handwritten, visual, multimodal and interactive texts.
Students demonstrate a basic understanding of the different purposes and structures of a range of text types and can make predictions about the likely content of texts. They identify the stages of imaginative texts they read, and the role of headings, diagrams and captions in factual texts. They follow meaning across sentences and paragraphs by tracking basic cohesive and reference items and clearly expressed cues in sentence structure and vocabulary. They use appropriate metalanguage to talk about the structure and features of a text. They adjust their rate of reading to the task, reading closely for analysis, scanning for specific information, and skimming for the main idea. They use cues from the surrounding text and their sound–symbol knowledge to assist in reading new words.
Writing
At Level C3, through guided activities, students write texts based on an extensive range of fictional and factual text types from across the curriculum, showing an awareness of purpose and audience. They consistently use the basic structures of these text types, and demonstrate consistent but not complete control of the English grammar appropriate to them. They demonstrate some control of passive voice, a range of tenses and direct speech. They produce paragraphs with topic sentences and incorporate some cohesive devices to make links and contrasts between and within paragraphs through a range of conjunctions, connectives and pronoun references. When planning, writing, reviewing and redrafting, they pay some attention to whole-text, sentence and word level issues, including punctuation. They use a range of strategies when spelling new words. They present their writing appropriately, in print and digital forms.","By the end of Level C3, students demonstrate the following skills in English as an Additional Language.
Listening and Speaking
Students listen, question and respond successfully in a wide range of social and academic contexts. They demonstrate sufficient control of stress, rhythm and intonation to be understood in most contexts. They use appropriate non-verbal language, take account of purpose and audience, and structure extended texts appropriately when participating in group debates and discussions. They discuss texts from across the curriculum using modelled examples in supportive classroom situations and structured group work. With varying accuracy, they use a range of question types, time signals, conjunctions and modal verbs to express points of view and to give and justify opinions. They interpret spoken and print texts and, with support, understand the full text. They listen for specific information when questions are given beforehand. They understand small amounts of abstract and generalised information when appropriate background is provided.
Reading and Viewing
Students demonstrate a basic understanding of the main ideas, issues or plot developments in a range of print and digital texts across all curriculum areas. These texts include handwritten, visual, multimodal and interactive texts. Students demonstrate a basic understanding of the different purposes and structures of a range of text types and can make predictions about the likely content of texts. They identify the structure of imaginative texts they read, and the role of headings, diagrams and captions in information texts. They follow meaning across sentences and paragraphs by tracking basic cohesive and reference items, and clearly expressed cues in sentence structure and vocabulary. They use appropriate metalanguage to talk about the structure and features of a text. They adjust their rate of reading to a task, reading closely for analysis, scanning for specific information and skimming for the main idea. They use their knowledge of phoneme–grapheme correspondences and cues from surrounding text to assist in reading unfamiliar words.
Writing
Through guided activities, students write texts based on an extensive range of fictional and information text types across all curriculum areas, showing an awareness of purpose and audience. They consistently use the basic structures of these text types, and demonstrate consistent but not complete control of the English grammar appropriate to these. They demonstrate some control of passive voice, a range of tenses and direct speech. They produce paragraphs with topic sentences and incorporate some cohesive devices to make links and contrasts between and within paragraphs through a range of conjunctions, connectives and pronoun references. When planning, writing, reviewing and redrafting, they pay some attention to whole-text, sentence and word-level issues, including punctuation. They use a range of strategies when spelling unfamiliar words. They present their writing appropriately, in print and digital forms.","The structure has been retained (language modes) with clear throughlines of the skills sets identified under each language mode.
The first strand has been renamed ‘Listening and Speaking’ as EAL students first learn to listen before they begin to speak in English.
The first words have been changed from ‘At Level …’ to ‘By the end of Level …’ in recognition of the expectation that these are skills and knowledge to be assessed after the content descriptions have been taught."
English,English as an Additional Language,Level C4,"Speaking and Listening
At Level C4 students demonstrate greater autonomy and control over their use of English, combining their expanding vocabulary with the appropriate use of a wide range of complex grammatical features including modal verbs, passive voice and tenses. They demonstrate understanding of the ways that pauses, stress, rhythm and intonation help to clarify meaning. They speak clearly and pronounce most sounds correctly. They take part in extended discourse on factual and interpersonal topics using an appropriate modelled structure, and respond appropriately to listeners’ reactions. They identify the intention of supportive speakers, using their knowledge of how intonation, volume, stress and lexical choices support and convey meaning and emphasise opinions and emotions. They identify examples of relatively explicit subjective language. They extract information from challenging spoken texts, using guide questions and taking notes on key ideas.
Reading and Viewing
At Level C4 students compare and make judgments about different texts (such as texts on the same topic by different authors) and read a wide range of accessible and culturally appropriate texts from across the curriculum with a high degree of independence. These texts may be print or digital texts, including handwritten, visual, multimodal and interactive texts.
Students take notes that identify main ideas, issues and plot developments. They identify supporting information to justify a response, including significant quotations that relate to key themes. They understand the main meaning by focusing on the first lines of key paragraphs. They adjust their reading style to the task. They locate and organise information from a range of reference sources, including the internet. They identify reference items across complex sentences. They predict the way a text may be organised and its likely language features. With more difficult texts, they identify a few specific facts and the basic perspective of the writer.
Writing
At Level C4 students write, with appropriate support, the full range of extended fictional and factual text types undertaken across the curriculum. With support they vary their writing to be consistent with the text type, the context and the needs of the reader, presenting similar content in different ways. They demonstrate reasonably consistent control of a wide range of grammatical features. They incorporate direct and indirect speech, including quotations, appropriately. They employ an extended range of appropriate cohesive devices between sentences and paragraphs, retaining clarity and fluency. They use some abstract noun groups. In response to feedback and self-assessment, they review and redraft their writing to enhance fluency, clarity, accuracy and appropriateness for purpose, audience and context. They plan, draft, edit and present their writing in a range of print and digital forms, as appropriate.","By the end of Level C4, students demonstrate the following skills in English as an Additional Language.
Listening and Speaking
Students demonstrate greater autonomy and control over their use of English, combining their expanding vocabulary with the appropriate use of a wide range of complex grammatical features including modal verbs, passive voice and tenses. They demonstrate understanding of the ways in which pauses, stress, rhythm and intonation help to clarify meaning. They speak clearly and pronounce most sounds correctly. They take part in extended discourse on factual and interpersonal topics using an appropriate modelled structure, and respond appropriately to listeners’ reactions. They deliver formal and informal presentations to an audience. They identify the intention of supportive speakers, using their knowledge of how intonation, volume, stress and lexical choices support and convey meaning and emphasise opinions and emotions. They identify examples of relatively explicit subjective language. They extract information from challenging spoken texts, using guide questions and taking notes on key ideas.
Reading and Viewing
Students compare and make judgements about different texts (such as texts on the same topic by different authors) and read a wide range of accessible and culturally appropriate texts from across the curriculum with a high degree of independence. These texts may be print or digital, including handwritten, visual, multimodal and interactive texts.
Students take notes that identify main ideas, issues and plot developments. They identify supporting information to justify a response, including significant quotations that relate to key themes. They understand the main meaning by focusing on the first lines of key paragraphs. They adjust their reading style to a task. They locate and organise information from a range of reference sources, including the internet, and begin to synthesise and make meaning from increasingly complex texts. They identify reference items across complex sentences. They predict the way a text may be organised and its likely language features. With more difficult texts, they identify a few specific facts and the basic perspective of the writer.
Writing
Students write, with appropriate support, the full range of extended imaginative and information text types undertaken across the curriculum. With support, they vary their writing to be consistent with the text type, the context and the needs of the reader, presenting similar content in different ways. They demonstrate reasonably consistent control of a wide range of grammatical features, including spelling. They incorporate direct and indirect speech, including quotations, appropriately. They employ an extended range of appropriate cohesive devices between sentences and paragraphs, retaining clarity and fluency. They use some abstract noun groups. In response to feedback and self-assessment, they review and redraft their writing to enhance fluency, clarity, accuracy and appropriateness for purpose, audience and context. They plan, draft, edit and present their writing in a range of print and digital forms, as appropriate.","The structure has been retained (language modes) with clear throughlines of the skills sets identified under each language mode.
The first strand has been renamed ‘Listening and Speaking’ as EAL students first learn to listen before they begin to speak in English.
The first words have been changed from ‘At Level …’ to ‘By the end of Level …’ in recognition of the expectation that these are skills and knowledge to be assessed after the content descriptions have been taught."
