SubjectArea,Subject,Band,Unit,UnitASCode,AreaofStudy,Outcome,OutcomeCode,ExampleType,ContentType,ExampleText,ParentText,URLTitle,URL,Sequence
Humanities,Classical Studies,Year 12,Unit 3,VCECSU3,,,,DetailedExampleStep,Paragraph,Resources,,,,57
Humanities,Classical Studies,Year 12,Unit 3,VCECSU3,,,,DetailedExampleStep,Paragraph,Books,,,,58
Humanities,Classical Studies,Year 12,Unit 3,VCECSU3,,,,DetailedExampleStep,Paragraph,"Zanker, Paul, 1990, The Power of Images in the Time of Augustus, The University of Michigan Press (trans. Alan Sharipo)",,,,59
Humanities,Classical Studies,Year 12,Unit 3,VCECSU3,,,,DetailedExampleStep,Paragraph,Film and documentaries,,,,60
Humanities,Classical Studies,Year 12,Unit 3,VCECSU3,,,,DetailedExampleStep,Paragraph,National Geographic on the construction of the Colosseum [available on YouTube],,,,61
Humanities,Classical Studies,Year 12,Unit 3,VCECSU3,,,,DetailedExampleStep,Paragraph,Professor Amy Smith (Reading University) on Greek Art,,,,62
Humanities,Classical Studies,Year 12,Unit 3,VCECSU3,,,,DetailedExampleStep,Paragraph,Websites,,,,63
Humanities,Classical Studies,Year 12,Unit 3,VCECSU3,,,,DetailedExampleStep,Paragraph,Introduction to Greek architecture,,,,64
Humanities,Classical Studies,Year 12,Unit 4,VCECSU4,,,,,UnitHeading,Unit 4 Classical perspectives,,,,1
Humanities,Classical Studies,Year 12,Unit 4,VCECSU4,,,,GeneralActivity,Paragraph,On completion of this unit the student should be able to analyse and evaluate expressions of a classical concern and establish its significance in classical culture.,,,,2
Humanities,Classical Studies,Year 12,Unit 4,VCECSU4,,,,GeneralActivity,Paragraph,Example of learning activities,,,,3
Humanities,Classical Studies,Year 12,Unit 4,VCECSU4,,,,GeneralActivity,Bullet,Create an information graph for each prescribed work:,,,,4
Humanities,Classical Studies,Year 12,Unit 4,VCECSU4,,,,GeneralActivity,Bullet,"Investigate the main features of the socio-historical context of each prescribed work, including: key issues and events occurring when the work was produced/made; influences on the author/artist; social, cultural, political and intellectual climate, values and beliefs at the time that can be connected to the classical concern. Present findings to the class. Use the information gained from the exploration of socio-historical context to consider whether the creator of the work might express any explicit attitudes towards the classical concern.",,,,5
Humanities,Classical Studies,Year 12,Unit 4,VCECSU4,,,,GeneralActivity,Bullet,Consider why each work was chosen to represent and aspect of a classical concern. For example:,,,,6
Humanities,Classical Studies,Year 12,Unit 4,VCECSU4,,,,GeneralActivity,Paragraph,Classical identities:,,,,7
Humanities,Classical Studies,Year 12,Unit 4,VCECSU4,,,,GeneralActivity,Bullet,What do works with idealised depictions suggest to us about the ideal Greek/Roman/masculine/feminine identity?,Classical identities:,,,8
Humanities,Classical Studies,Year 12,Unit 4,VCECSU4,,,,GeneralActivity,Bullet,How do works that portray barbarians help the Greeks define their own identity?,Classical identities:,,,9
Humanities,Classical Studies,Year 12,Unit 4,VCECSU4,,,,GeneralActivity,Bullet,What was the function of items associated with the democratic processes? What does this tell us about how the Athenians saw themselves and each other? What was the citizen identity of 5th century Athens?,Classical identities:,,,10
Humanities,Classical Studies,Year 12,Unit 4,VCECSU4,,,,GeneralActivity,Paragraph,War and warfare:,,,,11
Humanities,Classical Studies,Year 12,Unit 4,VCECSU4,,,,GeneralActivity,Bullet,What style of warfare is portrayed in a work? What does the work tell us about war and how it was waged in the classical world?,War and warfare:,,,12
Humanities,Classical Studies,Year 12,Unit 4,VCECSU4,,,,GeneralActivity,Bullet,What different types of warfare are presented in the works? Do they change over time? What are the differences?,War and warfare:,,,13
Humanities,Classical Studies,Year 12,Unit 4,VCECSU4,,,,GeneralActivity,Bullet,What and whose perspective of war is presented in a work?,War and warfare:,,,14
Humanities,Classical Studies,Year 12,Unit 4,VCECSU4,,,,GeneralActivity,Paragraph,Power and authority:,,,,15
Humanities,Classical Studies,Year 12,Unit 4,VCECSU4,,,,GeneralActivity,Bullet,What type of power is presented in each work? Does this change over time? What are the differences?,Power and authority:,,,16
Humanities,Classical Studies,Year 12,Unit 4,VCECSU4,,,,GeneralActivity,Bullet,How might a slave's collar connect to the concern of power and authority? What does the existence of slavery tell us about Roman power structures?,Power and authority:,,,17
Humanities,Classical Studies,Year 12,Unit 4,VCECSU4,,,,GeneralActivity,Bullet,"What can a coin tell us about Roman power? As well as any scenes depicted, consider where it was minted and what that might suggest about the scale of Roman dominion? Read or watch a range of readings and/or videos about the prescribed works' socio-historical contexts, noting references to the classical concern and considering how they might be connected to expressions of the concern in the prescribed works.",Power and authority:,,,18
Humanities,Classical Studies,Year 12,Unit 4,VCECSU4,,,,GeneralActivity,Bullet,Use reading strategies as the prescribed written works are read aloud in class:,,,,19
Humanities,Classical Studies,Year 12,Unit 4,VCECSU4,,,,GeneralActivity,Bullet,Annotate as follows(you might want to colour code different aspects):,Use reading strategies as the prescribed written works are read aloud in class:,,,20
Humanities,Classical Studies,Year 12,Unit 4,VCECSU4,,,,GeneralActivity,Bullet,"Highlight key phrases related to the classical concern, and include a brief annotation to remind yourself of its meaning or significance",Use reading strategies as the prescribed written works are read aloud in class:,,,21
Humanities,Classical Studies,Year 12,Unit 4,VCECSU4,,,,GeneralActivity,Bullet,"Highlight and key points, facts or evidence related to the classical concern",Use reading strategies as the prescribed written works are read aloud in class:,,,22
Humanities,Classical Studies,Year 12,Unit 4,VCECSU4,,,,GeneralActivity,Bullet,Note any questions that arise,Use reading strategies as the prescribed written works are read aloud in class:,,,23
Humanities,Classical Studies,Year 12,Unit 4,VCECSU4,,,,GeneralActivity,Bullet,Note points of significance for understanding this expression of the classical concern,Use reading strategies as the prescribed written works are read aloud in class:,,,24
Humanities,Classical Studies,Year 12,Unit 4,VCECSU4,,,,GeneralActivity,Bullet,Note similarities or differences to other prescribed works,Use reading strategies as the prescribed written works are read aloud in class:,,,25
Humanities,Classical Studies,Year 12,Unit 4,VCECSU4,,,,GeneralActivity,Bullet,"Indicate where the author expresses an attitude to the classical concern, whether explicitly or implicitly",Use reading strategies as the prescribed written works are read aloud in class:,,,26
Humanities,Classical Studies,Year 12,Unit 4,VCECSU4,,,,GeneralActivity,Bullet," Recap: In your own words, summarise and explain what you have read.",,,,27
Humanities,Classical Studies,Year 12,Unit 4,VCECSU4,,,,GeneralActivity,Bullet,"Interpret: Create interpretative statements about the text, such as ""the playwright suggests that..."" and use these to scaffold a written analysis of the text.",,,,28
Humanities,Classical Studies,Year 12,Unit 4,VCECSU4,,,,GeneralActivity,Bullet,Annotate key features of images of the prescribed material works and present findings to the class.,,,,29
Humanities,Classical Studies,Year 12,Unit 4,VCECSU4,,,,GeneralActivity,Bullet,Note points of significance for understanding this expression of the classical concern,Annotate key features of images of the prescribed material works and present findings to the class.,,,30
Humanities,Classical Studies,Year 12,Unit 4,VCECSU4,,,,GeneralActivity,Bullet,Note similarities or differences to other prescribed works,Annotate key features of images of the prescribed material works and present findings to the class.,,,31
Humanities,Classical Studies,Year 12,Unit 4,VCECSU4,,,,GeneralActivity,Bullet,Indicate what can be learned about the classical concern,Annotate key features of images of the prescribed material works and present findings to the class.,,,32
Humanities,Classical Studies,Year 12,Unit 4,VCECSU4,,,,GeneralActivity,Bullet,"Indicate where the creator of the work expresses an attitude to the classical concern, whether explicitly or implicitly",Annotate key features of images of the prescribed material works and present findings to the class.,,,33
Humanities,Classical Studies,Year 12,Unit 4,VCECSU4,,,,GeneralActivity,Bullet,Imagine you are a Greek or Roman at the time one of the prescribed works was created and consider how you would have viewed the work based on what you know about the socio-historical context of the time.,,,,34
Humanities,Classical Studies,Year 12,Unit 4,VCECSU4,,,,GeneralActivity,Bullet,"Create a checklist of focus questions to guide your interpretation of each prescribed work, such as",,,,35
Humanities,Classical Studies,Year 12,Unit 4,VCECSU4,,,,GeneralActivity,Bullet,Write an analysis of key features of one of the prescribed works and evaluate the expression of key ideas related to the classical concern in the work. Evaluate the significance of the work in representing and expressing the classical concern.,,,,36
Humanities,Classical Studies,Year 12,Unit 4,VCECSU4,,,,GeneralActivity,Bullet,Create a Venn diagram to help organise the similarities and differences of two or three prescribed works. How does this comparison help you understand the representations of the classical concern and the significance of the classical concern to the society in which it was created?,,,,37
Humanities,Classical Studies,Year 12,Unit 4,VCECSU4,,,,GeneralActivity,Bullet,Create a meme for each prescribed work that epitomises its expression of the classical concern.,,,,38
Humanities,Classical Studies,Year 12,Unit 4,VCECSU4,,,,GeneralActivity,Bullet,Place the prescribed works in a flow chart to see if you can trace overall trends of similarities and differences regarding this classical concern across time.,,,,39
Humanities,Classical Studies,Year 12,Unit 4,VCECSU4,,,,GeneralActivity,Bullet,Evaluate the significance of a classical concern to our understanding of the culture of Greece and/or Rome in order to write an extended response or give an oral presentation evaluating the significance of the classical concern in classical culture.,,,,40
Humanities,Classical Studies,Year 12,Unit 4,VCECSU4,,,,DetailedExample,Paragraph,Evaluate the significance of a classical concern to our understanding of the culture of Greece and/or Rome.,,,,41
Humanities,Classical Studies,Year 12,Unit 4,VCECSU4,,,,DetailedExampleStep,Paragraph,Activities:,,,,42
Humanities,Classical Studies,Year 12,Unit 4,VCECSU4,,,,DetailedExampleStep,Bullet,Create a pack containing copies of the prescribed written works and read them aloud with students. Students annotate as the works are read and the connections to the classical concern are discussed.,,,,43
Humanities,Classical Studies,Year 12,Unit 4,VCECSU4,,,,DetailedExampleStep,Bullet,View the prescribed material works together. Provide students with an image of each work that they can annotate based on class discussion.,,,,44
Humanities,Classical Studies,Year 12,Unit 4,VCECSU4,,,,DetailedExampleStep,Bullet,"Provide students with a table to organise their information and thinking on the classical concern, or have students create their own.",,,,45
Humanities,Classical Studies,Year 12,Unit 4,VCECSU4,,,,DetailedExampleStep,Paragraph," As the works are read and annotated in class, the table is filled in as a consolidation activity upon completion of the study of each work. Some works will require research into the provenance of and original use/function of the work and the findings can be noted in the table.",,,,46
Humanities,Classical Studies,Year 12,Unit 4,VCECSU4,,,,DetailedExampleStep,Paragraph, Students compare their notes with others and share their findings with the class.,,,,47
Humanities,Classical Studies,Year 12,Unit 4,VCECSU4,,,,DetailedExampleStep,Paragraph," Students use the table, notes and evidence they have collated as the basis for other activities, such as writing an extended response or giving an oral presentation evaluating the significance of the classical concern in classical culture.",,,,48
Humanities,Classical Studies,Year 12,Unit 4,VCECSU4,,,,DetailedExampleStep,Paragraph,Resources,,,,49
Humanities,Classical Studies,Year 12,Unit 4,VCECSU4,,,,DetailedExampleStep,Paragraph,Books,,,,50
Humanities,Classical Studies,Year 12,Unit 4,VCECSU4,,,,DetailedExampleStep,Paragraph,"Hornblower, S, Spawforth, A (eds), 1998, The Oxford Companion to Classical Civilization, Oxford University Press",,,,51
Humanities,Classical Studies,Year 12,Unit 4,VCECSU4,,,,DetailedExampleStep,Paragraph,"Pomeroy, SB, Burstein, SM, Donlan, W, Roberts, JT, 2004, A Brief History of Ancient Greece: Politics, Society and Culture, Oxford University Press",,,,52
Humanities,Classical Studies,Year 12,Unit 4,VCECSU4,,,,DetailedExampleStep,Paragraph,Documentaries,,,,53
Humanities,Classical Studies,Year 12,Unit 4,VCECSU4,,,,DetailedExampleStep,Paragraph,Meet the Romans: All roads lead to Rome [available on YouTube],,,,54
Humanities,Classical Studies,Year 12,Unit 4,VCECSU4,,,,DetailedExampleStep,Paragraph,Website,,,,55
Humanities,Classical Studies,Year 12,Unit 4,VCECSU4,,,,DetailedExampleStep,Paragraph,The Oxford Classical Dictionary,,,,56
Humanities,Classical Studies,Year 12,Unit 4,VCECSU4,,,,DetailedExampleStep,Paragraph,Podcasts,,,,57
Humanities,Classical Studies,Year 12,Unit 4,VCECSU4,,,,DetailedExampleStep,Paragraph,Ancient Greece: City and Society,,,,58
Humanities,Classical Studies,Year 12,Unit 4,VCECSU4,,,,DetailedExampleStep,Paragraph,Emperors of Rome,,,,59
Humanities,Classical Studies,Year 12,Unit 4,VCECSU4,,,,DetailedExampleStep,Paragraph,On completion of this unit the student should be able to compare and evaluate the key ideas and the techniques in two classical works and evaluate the relationships between these works and their socio-historical contexts.,,,,60
Humanities,Classical Studies,Year 12,Unit 4,VCECSU4,,,,DetailedExampleStep,Paragraph,Example of learning activities,,,,61
Humanities,Classical Studies,Year 12,Unit 4,VCECSU4,,,,DetailedExampleStep,Bullet,"Research the socio-historical context for Work 2 using the definition of socio-historical context as outlined in the VCE Classical Studies Study Design. The similarities and differences in socio-historical contexts of both works should be considered. If Work 2 is from a different context to Work 1, establish a basic grounding in the period, in terms of key events, leaders, social norms and beliefs. If Work 2 is of a different genre to Work 1, research the conventions and typical features of this genre before beginning to read the work.",,,,62
Humanities,Classical Studies,Year 12,Unit 4,VCECSU4,,,,DetailedExampleStep,Bullet,"Read and annotate Work 2. As with Work 1 and earlier works studied in Classical Studies, reading aloud and annotating Work 2 is recommended. Annotate Work 2 for:",,,,63
Humanities,Classical Studies,Year 12,Unit 4,VCECSU4,,,,DetailedExampleStep,Bullet,Ideas,"Read and annotate Work 2. As with Work 1 and earlier works studied in Classical Studies, reading aloud and annotating Work 2 is recommended. Annotate Work 2 for:",,,64
Humanities,Classical Studies,Year 12,Unit 4,VCECSU4,,,,DetailedExampleStep,Bullet,Links to socio-historical context,"Read and annotate Work 2. As with Work 1 and earlier works studied in Classical Studies, reading aloud and annotating Work 2 is recommended. Annotate Work 2 for:",,,65
Humanities,Classical Studies,Year 12,Unit 4,VCECSU4,,,,DetailedExampleStep,Bullet,Techniques,"Read and annotate Work 2. As with Work 1 and earlier works studied in Classical Studies, reading aloud and annotating Work 2 is recommended. Annotate Work 2 for:",,,66
Humanities,Classical Studies,Year 12,Unit 4,VCECSU4,,,,DetailedExampleStep,Bullet,Direct parallels with Work 1,"Read and annotate Work 2. As with Work 1 and earlier works studied in Classical Studies, reading aloud and annotating Work 2 is recommended. Annotate Work 2 for:",,,67
Humanities,Classical Studies,Year 12,Unit 4,VCECSU4,,,,DetailedExampleStep,Paragraph,"Examine the Terms used in this study section of the VCE Classical Studies Study Design, particularly the definitions of socio-historical context, ideas and techniques. When studying plays, note that stage directions have been added by the translator for clarity, and thus the wording of the stage directions should not be analysed. Do not quote the stage directions. However, the stage directions included by translators are typically based upon clues in the dialogue as to the actions of the characters or known performance choices from the period. Therefore, you should try to imagine the effect in performance of what is described in the stage directions and can discuss the impact of these actions in your analysis of the works.",,,,68
Humanities,Classical Studies,Year 12,Unit 4,VCECSU4,,,,DetailedExampleStep,Bullet,Consider Work 2 in relation to your Classical Concern from Area of Study 1. Answer the following questions about Work 2:,,,,69
Humanities,Classical Studies,Year 12,Unit 4,VCECSU4,,,,DetailedExampleStep,Bullet,What ideas and opinions does Work 2 present on the subject of [concern]?,Consider Work 2 in relation to your Classical Concern from Area of Study 1. Answer the following questions about Work 2:,,,70
Humanities,Classical Studies,Year 12,Unit 4,VCECSU4,,,,DetailedExampleStep,Bullet,How is this a similar or different view to Work 1?,Consider Work 2 in relation to your Classical Concern from Area of Study 1. Answer the following questions about Work 2:,,,71
Humanities,Classical Studies,Year 12,Unit 4,VCECSU4,,,,DetailedExampleStep,Bullet,Which of the prescribed short works most closely align with Work 2?,Consider Work 2 in relation to your Classical Concern from Area of Study 1. Answer the following questions about Work 2:,,,72
Humanities,Classical Studies,Year 12,Unit 4,VCECSU4,,,,DetailedExampleStep,Bullet,(If Work 2 is from a later context) What does Work 2 reveal about how this classical concern has evolved over time?,Consider Work 2 in relation to your Classical Concern from Area of Study 1. Answer the following questions about Work 2:,,,73
Humanities,Classical Studies,Year 12,Unit 4,VCECSU4,,,,DetailedExampleStep,Bullet,Practice developing comparative statements that discuss the two works within a single sentence. Read the information below about compound sentences to help to develop your understanding of how to create strong comparative statements.,,,,74
Humanities,Classical Studies,Year 12,Unit 4,VCECSU4,,,,DetailedExampleStep,Paragraph,"Practice developing comparative simple and compound statements about the two works. While students' vocabulary is not assessed in Classical Studies, it can be useful to consider different types of conjunctions, and which conjunctions express similarities, differences or are neutral.",,,,75
Humanities,Classical Studies,Year 12,Unit 4,VCECSU4,,,,DetailedExampleStep,Bullet,"Once comparative statements are mastered, practice developing a paragraph that compares the two works. There are no set expectations for structure in Classical Studies, but you can consider and trial different ways of ordering your ideas within a paragraph. Paragraph scaffolds or sentence starters can also be used.",,,,76
Humanities,Classical Studies,Year 12,Unit 4,VCECSU4,,,,DetailedExampleStep,Bullet,"Identify what you believe to be the three most important quotes from each of the works. As a class, share your quotes and explain why you have chosen these quotes as the most important. As a class, come to a consensus about which three are the most important.",,,,77
Humanities,Classical Studies,Year 12,Unit 4,VCECSU4,,,,DetailedExampleStep,Bullet,"Use the table below to compare the beginning, middle and end of the two works. This task helps you to consider how the texts develop ideas and the changes and continuities within each text.",,,,78
Humanities,Classical Studies,Year 12,Unit 4,VCECSU4,,,,DetailedExampleStep,Bullet,"Practice creating your own essay questions. Look at samples of questions, such as those essay questions included in the previous years' Classical Studies Written Examinations (Section B). Consider questions that focus on ideas, genre, socio-historical context and/or authorial intent, and practice developing both specific and broad questions.",,,,79
Humanities,Classical Studies,Year 12,Unit 4,VCECSU4,,,,DetailedExampleStep,Bullet,Use the template below to carefully consider one key idea that is common to both works and create a crib sheet for your classmates. The idea should not be the classical concern from Area of Study 1 but could be related.,,,,80
Humanities,Classical Studies,Year 12,Unit 4,VCECSU4,,,,DetailedExampleStep,Bullet,"Practise writing a comparative essay under timed conditions, based on an unseen question.",,,,81
Humanities,Classical Studies,Year 12,Unit 4,VCECSU4,,,,DetailedExample,Paragraph,"The task: For this outcome, students are required to develop a comparative essay under timed conditions, based upon an unseen question.",,,,82
Humanities,Classical Studies,Year 12,Unit 4,VCECSU4,,,,DetailedExampleStep,Paragraph,Selecting essay questions,,,,83
Humanities,Classical Studies,Year 12,Unit 4,VCECSU4,,,,DetailedExampleStep,Paragraph,"More than one essay question could be offered to allow students to practice selecting a question that best suits their understanding of the works. Note that a key skill in Area of Study 2 requires students to consider the Classical Concern studied in Area of Study 1, thus it is recommended that the essay questions offered allow students to establish connections to the Classical Concern, even indirectly, to fulfil this criterion.",,,,84
Humanities,Classical Studies,Year 12,Unit 4,VCECSU4,,,,DetailedExampleStep,Paragraph,Preparatory activities,,,,85
Humanities,Classical Studies,Year 12,Unit 4,VCECSU4,,,,DetailedExampleStep,Paragraph,Practice planning and writing (suggested activities),,,,86
Humanities,Classical Studies,Year 12,Unit 4,VCECSU4,,,,DetailedExampleStep,Bullet,Practice questions can be provided in advance for students to create plans and practice essay writing prior to the assessment.,,,,87
Humanities,Classical Studies,Year 12,Unit 4,VCECSU4,,,,DetailedExampleStep,Bullet,"Model planning difficult questions with students, discussing the benefits of planning before writing and what is needed in an effective plan (main line of argument, focus of each paragraph, evidence to be used).",,,,88
Humanities,Classical Studies,Year 12,Unit 4,VCECSU4,,,,DetailedExampleStep,Bullet,Divide students into groups to practice planning essay questions. Give students restricted amounts of time (e.g. 10 minutes).,,,,89
Humanities,Classical Studies,Year 12,Unit 4,VCECSU4,,,,DetailedExampleStep,Bullet,"After modelling a plan or having students plan in groups, ask students to practice writing the introduction to this essay. This could be completed under timed conditions and/or students could swap introductions for peer feedback.",,,,90
Humanities,Classical Studies,Year 12,Unit 4,VCECSU4,,,,DetailedExampleStep,Bullet,"When students produce practice essays or practice paragraphs, provide brief feedback and ask that students rewrite the paragraph (or one paragraph from the wider essay), applying the feedback.",,,,91
Humanities,Classical Studies,Year 12,Unit 4,VCECSU4,,,,DetailedExampleStep,Bullet,"Look at the sample essay fragments offered in the Written Examination External Assessment Report from the previous study design, or in model introductions or body paragraphs written by past students or the teacher. Ask students to identify features of the essays and identify the strengths and weaknesses of the writing. They could be asked to use the Performance Descriptors to assess the work. While high-scoring models can help students understand what they are working toward, sometimes lower-scoring examples are useful too, as it can be easier for students to identify errors in someone else's work, as they will have some critical distance from the ideas and writing. In this case, it is important to use samples either written by the teacher for this purpose, or deidentified work from a student from a previous year.",,,,92
Humanities,Classical Studies,Year 12,Unit 4,VCECSU4,,,,DetailedExampleStep,Paragraph,Practice notes sheet,,,,93
Humanities,Classical Studies,Year 12,Unit 4,VCECSU4,,,,DetailedExampleStep,Paragraph,"Allow students to sit the School Assessed Coursework for the Outcome with a pre-approved sheet of notes, or 'crib sheet'. It is recommended that this is restricted (e.g. one side of a A4 page, minimum 10pt font, dot-points only) and that this is submitted in advance of the assessment for approval by the teacher.",,,,94
Humanities,Classical Studies,Year 12,Unit 4,VCECSU4,,,,DetailedExampleStep,Paragraph,"The creation of the crib sheet encourages effective revision and preparation prior to the outcome, as well as ensuring that any errors in students' understanding are eliminated prior to assessment. With a restriction such as one A4 page, students are also required to consider which are the most useful or versatile points or quotes to include and to thus practice identifying significance.",,,,95
