SubjectArea,Subject,Band,Unit,UnitASCode,AreaofStudy,Outcome,OutcomeCode,ExampleType,ContentType,ExampleText,ParentText,URLTitle,URL,Sequence
Humanities,Classical Studies,Year 11,Unit 2,VCECSU2,,,,DetailedExampleStep,Bullet,What is the Greek plan?,When reading Book 7. 174-187 the class can discuss and/or write on the following questions:,,,94
Humanities,Classical Studies,Year 11,Unit 2,VCECSU2,,,,DetailedExampleStep,Bullet,How many men are in the Persian forces? How does this characterise the Persians?,When reading Book 7. 174-187 the class can discuss and/or write on the following questions:,,,95
Humanities,Classical Studies,Year 11,Unit 2,VCECSU2,,,,DetailedExampleStep,Bullet,"What is the effect of Herodotus including information about the ""attendants"" of the army? (7.187)?",When reading Book 7. 174-187 the class can discuss and/or write on the following questions:,,,96
Humanities,Classical Studies,Year 11,Unit 2,VCECSU2,,,,DetailedExampleStep,Bullet,When reading Book 7.201-225 the class can discuss and/or write on the following questions:,,,,97
Humanities,Classical Studies,Year 11,Unit 2,VCECSU2,,,,DetailedExampleStep,Bullet,How big does Herodotus say the Greek forces are?,When reading Book 7.201-225 the class can discuss and/or write on the following questions:,,,98
Humanities,Classical Studies,Year 11,Unit 2,VCECSU2,,,,DetailedExampleStep,Bullet,How are Leonidas and the Spartans and Xerxes characterised?,When reading Book 7.201-225 the class can discuss and/or write on the following questions:,,,99
Humanities,Classical Studies,Year 11,Unit 2,VCECSU2,,,,DetailedExampleStep,Bullet,Why don't the Persians expect resistance? How does this characterise them and the Greeks?,When reading Book 7.201-225 the class can discuss and/or write on the following questions:,,,100
Humanities,Classical Studies,Year 11,Unit 2,VCECSU2,,,,DetailedExampleStep,Bullet,What is the role of the Delphic oracle?,When reading Book 7.201-225 the class can discuss and/or write on the following questions:,,,101
Humanities,Classical Studies,Year 11,Unit 2,VCECSU2,,,,DetailedExampleStep,Bullet,Who wins this battle?,When reading Book 7.201-225 the class can discuss and/or write on the following questions:,,,102
Humanities,Classical Studies,Year 11,Unit 2,VCECSU2,,,,DetailedExampleStep,Bullet,"After Leonidas dies, Herodotus states that they (Spartans and Leonidas) ""deserve to be remembered"". How is this significant? Why should they be remembered?",When reading Book 7.201-225 the class can discuss and/or write on the following questions:,,,103
Humanities,Classical Studies,Year 11,Unit 2,VCECSU2,,,,DetailedExampleStep,Bullet,"Watch Zack Snyder's film, 300.",,,,104
Humanities,Classical Studies,Year 11,Unit 2,VCECSU2,,,,DetailedExampleStep,Bullet,"In groups, students compare key scenes from the film to Herodotus's account of the same events. Students create a table of similarities and differences between the text and the film.",,,,105
Humanities,Classical Studies,Year 11,Unit 2,VCECSU2,,,,DetailedExampleStep,Bullet,"In a class discussion, explore the extent to which the message of the works differ.",,,,106
Humanities,Classical Studies,Year 11,Unit 2,VCECSU2,,,,DetailedExampleStep,Bullet,Students create a piece of writing exploring how Snyder has used and adapted Herodotus' work.,,,,107
Humanities,Classical Studies,Year 11,Unit 2,VCECSU2,,,,DetailedExampleStep,Bullet,Students create a piece of writing exploring how Snyder has used and adapted Herodotus's work.,,,,108
Humanities,Classical Studies,Year 11,Unit 2,VCECSU2,,,,DetailedExampleStep,Paragraph,Resources,,,,109
Humanities,Classical Studies,Year 11,Unit 2,VCECSU2,,,,DetailedExampleStep,Paragraph,Classical works,,,,110
Humanities,Classical Studies,Year 11,Unit 2,VCECSU2,,,,DetailedExampleStep,Paragraph,[Works to be studied in Units 3 and 4 are not to be used for this area of study.],,,,111
Humanities,Classical Studies,Year 11,Unit 2,VCECSU2,,,,DetailedExampleStep,Paragraph,Sections or whole works from:,,,,112
Humanities,Classical Studies,Year 11,Unit 2,VCECSU2,,,,DetailedExampleStep,Paragraph,A tragedy by Aeschylus,,,,113
Humanities,Classical Studies,Year 11,Unit 2,VCECSU2,,,,DetailedExampleStep,Paragraph,A comedy by Aristophanes,,,,114
Humanities,Classical Studies,Year 11,Unit 2,VCECSU2,,,,DetailedExampleStep,Paragraph,"Caesar, The Conquest of Gaul",,,,115
Humanities,Classical Studies,Year 11,Unit 2,VCECSU2,,,,DetailedExampleStep,Paragraph,A selection of Catullus's poetry,,,,116
Humanities,Classical Studies,Year 11,Unit 2,VCECSU2,,,,DetailedExampleStep,Paragraph,"Cicero, In Defence of the Republic, Selected Political Speeches or Selected Works",,,,117
Humanities,Classical Studies,Year 11,Unit 2,VCECSU2,,,,DetailedExampleStep,Paragraph,A tragedy by Euripides,,,,118
Humanities,Classical Studies,Year 11,Unit 2,VCECSU2,,,,DetailedExampleStep,Paragraph,"Herodotus, The Histories [edition used in detailed example: Edited by John Marincola, Penguin, 2003)",,,,119
Humanities,Classical Studies,Year 11,Unit 2,VCECSU2,,,,DetailedExampleStep,Paragraph,"Juvenal, Satires",,,,120
Humanities,Classical Studies,Year 11,Unit 2,VCECSU2,,,,DetailedExampleStep,Paragraph,"Horace, Odes",,,,121
Humanities,Classical Studies,Year 11,Unit 2,VCECSU2,,,,DetailedExampleStep,Paragraph,"Livy, The Rise of Rome",,,,122
Humanities,Classical Studies,Year 11,Unit 2,VCECSU2,,,,DetailedExampleStep,Paragraph,"Ovid, Metamorphoses or Poems of Exile",,,,123
Humanities,Classical Studies,Year 11,Unit 2,VCECSU2,,,,DetailedExampleStep,Paragraph,"Petronius, The Satyricon",,,,124
Humanities,Classical Studies,Year 11,Unit 2,VCECSU2,,,,DetailedExampleStep,Paragraph,"Plato, The Last Days of Socrates",,,,125
Humanities,Classical Studies,Year 11,Unit 2,VCECSU2,,,,DetailedExampleStep,Paragraph,"Plutarch, Parallel Lives",,,,126
Humanities,Classical Studies,Year 11,Unit 2,VCECSU2,,,,DetailedExampleStep,Paragraph,"Sallust, Catiline's War, The Jugurthine War, Histories",,,,127
Humanities,Classical Studies,Year 11,Unit 2,VCECSU2,,,,DetailedExampleStep,Paragraph,"Seneca, The Satirycon",,,,128
Humanities,Classical Studies,Year 11,Unit 2,VCECSU2,,,,DetailedExampleStep,Paragraph,A tragedy by Sophocles,,,,129
Humanities,Classical Studies,Year 11,Unit 2,VCECSU2,,,,DetailedExampleStep,Paragraph,"Suetonius, The Twelve Caesars",,,,130
Humanities,Classical Studies,Year 11,Unit 2,VCECSU2,,,,DetailedExampleStep,Paragraph,"Tacitus, The Annals of Imperial Rome",,,,131
Humanities,Classical Studies,Year 11,Unit 2,VCECSU2,,,,DetailedExampleStep,Paragraph,"Thucydides, History of the Peloponnesian War",,,,132
Humanities,Classical Studies,Year 11,Unit 2,VCECSU2,,,,DetailedExampleStep,Paragraph,A selection of Greek vases,,,,133
Humanities,Classical Studies,Year 11,Unit 2,VCECSU2,,,,DetailedExampleStep,Paragraph,A selection of Roman mosaics or frescoes,,,,134
Humanities,Classical Studies,Year 11,Unit 2,VCECSU2,,,,DetailedExampleStep,Paragraph,A selection of Roman or Greek sculptures,,,,135
Humanities,Classical Studies,Year 11,Unit 2,VCECSU2,,,,DetailedExampleStep,Paragraph,Online classical works,,,,136
Humanities,Classical Studies,Year 11,Unit 2,VCECSU2,,,,DetailedExampleStep,Paragraph,Perseus Digital Library,,,,137
Humanities,Classical Studies,Year 11,Unit 2,VCECSU2,,,,DetailedExampleStep,Paragraph,The Internet Classics Archive,,,,138
Humanities,Classical Studies,Year 11,Unit 2,VCECSU2,,,,DetailedExampleStep,Paragraph,Classical reception works,,,,139
Humanities,Classical Studies,Year 11,Unit 2,VCECSU2,,,,DetailedExampleStep,Paragraph,"300 by Frank Miller (graphic novel, 1998) and/or 300 directed by Zach Snyder (film, 2006)",,,,140
Humanities,Classical Studies,Year 11,Unit 2,VCECSU2,,,,DetailedExampleStep,Paragraph,"Antigone by Frederic Leighton (artwork, 1882)",,,,141
Humanities,Classical Studies,Year 11,Unit 2,VCECSU2,,,,DetailedExampleStep,Paragraph,"Antigone and Polynices by Lytras Nikephoros (artwork, 1865)",,,,142
Humanities,Classical Studies,Year 11,Unit 2,VCECSU2,,,,DetailedExampleStep,Paragraph,"Antigone giving burial to her brother Polynices by Sébastien Louis Guillaume Norblin de la Gourdaine (artwork, 1825)",,,,143
Humanities,Classical Studies,Year 11,Unit 2,VCECSU2,,,,DetailedExampleStep,Paragraph,"Assassin's Creed Odyssey (video game, 2018)",,,,144
Humanities,Classical Studies,Year 11,Unit 2,VCECSU2,,,,DetailedExampleStep,Paragraph,"The Banquet of Cleopatra by Tiepolo (artwork, 1744)",,,,145
Humanities,Classical Studies,Year 11,Unit 2,VCECSU2,,,,DetailedExampleStep,Paragraph,"Cleopatra directed by Joseph L. Mankiewicz (film, 1963)",,,,146
Humanities,Classical Studies,Year 11,Unit 2,VCECSU2,,,,DetailedExampleStep,Paragraph,"Gladiator directed by Ridley Scott (film, 2000)",,,,147
Humanities,Classical Studies,Year 11,Unit 2,VCECSU2,,,,DetailedExampleStep,Paragraph,"The Hunger Games directed by Gary Ross (film, 2012)",,,,148
Humanities,Classical Studies,Year 11,Unit 2,VCECSU2,,,,DetailedExampleStep,Paragraph,"The Hunger Games by Suzanne Collins (book, 2008)",,,,149
Humanities,Classical Studies,Year 11,Unit 2,VCECSU2,,,,DetailedExampleStep,Paragraph,"David by Michelangelo (artwork, 1501-04)",,,,150
Humanities,Classical Studies,Year 11,Unit 2,VCECSU2,,,,DetailedExampleStep,Paragraph,"Spartacus directed by Stanley Kubrick (film, 1960)",,,,151
Humanities,Classical Studies,Year 11,Unit 2,VCECSU2,,,,DetailedExampleStep,Paragraph,National Theatre: Antigone [available on YouTube],,,,152
Humanities,Classical Studies,Year 11,Unit 2,VCECSU2,,,,DetailedExampleStep,Paragraph,The monuments of Washington DC (find images online),,,,153
Humanities,Classical Studies,Year 11,Unit 2,VCECSU2,,,,DetailedExampleStep,Paragraph,"The architecture of the Shrine of Remembrance, Melbourne",,,,154
Humanities,Classical Studies,Year 12,Unit 3,VCECSU3,,,,,UnitHeading,Unit 3 Classical expressions,,,,1
Humanities,Classical Studies,Year 12,Unit 3,VCECSU3,,,,GeneralActivity,Paragraph,On completion of this unit the student should be able to analyse the key ideas and techniques in a prescribed work of epic poetry and explain its relationship to its socio-historical context.,,,,2
Humanities,Classical Studies,Year 12,Unit 3,VCECSU3,,,,GeneralActivity,Paragraph,Example of learning activities,,,,3
Humanities,Classical Studies,Year 12,Unit 3,VCECSU3,,,,GeneralActivity,Bullet,"Examine the Terms used in this study section of the VCE Classical Studies Study Design, particularly the definitions of socio-historical context, ideas and techniques",,,,4
Humanities,Classical Studies,Year 12,Unit 3,VCECSU3,,,,GeneralActivity,Bullet,"Prior to reading the prescribed work, engage in some explicit learning about the period. When studying the Iliad, you need to bear in mind that we know very little about Archaic Greece - the Iliad serves as a primary source for this period. When studying the Aeneid, the context of Augustan Rome is crucial to understanding the work. Select from readings, documentaries and podcasts about Archaic Greece or Augustan Rome (a suggested list is including in the Recommended Resources).",,,,5
Humanities,Classical Studies,Year 12,Unit 3,VCECSU3,,,,GeneralActivity,Bullet,"Create a timeline of the Trojan story identifying key plot points (Paris and the Golden Apple, the thousand ships set sail, the Trojan Horse, etc.) and place the prescribed work within this timeline. A mythological 'cycle' can be compared to a comic book 'universe' with each book or film operating both as a story on its own, as well as part of a broader narrative. Audiences knew the full story and could appreciate allusions, foreshadowing and dramatic irony, as fans enjoy 'easter eggs' today. You are not expected to read the other Books in the epic or to be able to recall detailed information about its mythological context; this task is only aimed strengthening your understanding of the prescribed book.",,,,6
Humanities,Classical Studies,Year 12,Unit 3,VCECSU3,,,,GeneralActivity,Bullet,"Read the text together in class and establish an annotating key and plan. Annotate for ideas, techniques and references to socio-historical context. It can be useful to have a copy of the prescribed work with extra wide margins so that you can fit in all of your annotations.",,,,7
Humanities,Classical Studies,Year 12,Unit 3,VCECSU3,,,,GeneralActivity,Bullet,"Create character profiles for each of the main characters in the prescribed work. Incorporate descriptions of their physical appearance, relationship to other characters, achievements and personality traits. Select quotes from the prescribed work to include in the profile.",,,,8
Humanities,Classical Studies,Year 12,Unit 3,VCECSU3,,,,GeneralActivity,Bullet,"You will be given ten short extracts (approximately four lines long) from across the work on different cards. In groups, race to order the sections of the work accurately, in chronological plot order. This task helps you to know your prescribed work well and to be able to quickly identify extracts.",,,,9
Humanities,Classical Studies,Year 12,Unit 3,VCECSU3,,,,GeneralActivity,Bullet,"As you read through the text, collect examples of each technique and fill out the bingo sheet below (or adjust the sheet to include or remove techniques of your choice). The first student to find examples of all the techniques is the winner.",,,,10
Humanities,Classical Studies,Year 12,Unit 3,VCECSU3,,,,GeneralActivity,Bullet,"Split into two groups, with one group representing the gods and the other group representing the mortals. As a group, present arguments that your personae are more influential in causing events to occur in the plot of the prescribed text. You can choose to embody individual characters or discuss the group as a whole, drawing evidence from the prescribed work. You can also debate which group has more 'heroic' or praiseworthy individuals (from a classical perspective).",,,,11
Humanities,Classical Studies,Year 12,Unit 3,VCECSU3,,,,GeneralActivity,Bullet,"Practice establishing significance. Select an extract of 25 lines from your work. Develop arguments for why your extract is the most important in the work, in terms of contribution to the development of key ideas, character development and/or plot progression. You can also discuss how the extract includes significant examples of specific techniques.",,,,12
Humanities,Classical Studies,Year 12,Unit 3,VCECSU3,,,,GeneralActivity,Bullet,Practise annotating and analysing passages from the prescribed work.,,,,13
Humanities,Classical Studies,Year 12,Unit 3,VCECSU3,,,,DetailedExample,Paragraph,"Provide students with an extract from the prescribed work (approximately 25 lines), along with some unseen questions that require students to:",,,,14
Humanities,Classical Studies,Year 12,Unit 3,VCECSU3,,,,DetailedExampleStep,Bullet,Annotate the extract,,,,15
Humanities,Classical Studies,Year 12,Unit 3,VCECSU3,,,,DetailedExampleStep,Bullet,Identify the socio-historical context of the work and identify quotes or features in the extract that connect to this socio-historical context,,,,16
Humanities,Classical Studies,Year 12,Unit 3,VCECSU3,,,,DetailedExampleStep,Bullet,"Identify where the extract appears in the prescribed work, and what occurs before and after the extract",,,,17
Humanities,Classical Studies,Year 12,Unit 3,VCECSU3,,,,DetailedExampleStep,Bullet,Analyse how techniques are used to express ideas within the chosen extract (close analysis),,,,18
Humanities,Classical Studies,Year 12,Unit 3,VCECSU3,,,,DetailedExampleStep,Bullet,"Evaluate why the extract is significant by comparing this extract to other moments in the prescribed work, in terms of plot and presentation of characters and ideas.",,,,19
Humanities,Classical Studies,Year 12,Unit 3,VCECSU3,,,,DetailedExampleStep,Paragraph,"This could be asked as a single written analysis question that would require students to structure their own work (with criterion such as the above points for success) and/or as a series of short answer questions, with templates or sentence starters if required.",,,,20
Humanities,Classical Studies,Year 12,Unit 3,VCECSU3,,,,DetailedExampleStep,Paragraph,Resources,,,,21
Humanities,Classical Studies,Year 12,Unit 3,VCECSU3,,,,DetailedExampleStep,Paragraph,Books,,,,22
Humanities,Classical Studies,Year 12,Unit 3,VCECSU3,,,,DetailedExampleStep,Paragraph,"Fry, Stephen, 2018, Mythos. Michael Joseph (Imprint of Penguin Books)",,,,23
Humanities,Classical Studies,Year 12,Unit 3,VCECSU3,,,,DetailedExampleStep,Paragraph,"Graziosi, Barbara, 2016, The Iliad, Oxford University Press",,,,24
Humanities,Classical Studies,Year 12,Unit 3,VCECSU3,,,,DetailedExampleStep,Paragraph,"Graziosi, Barbara, 2019, Homer: A Very Short Introduction, Oxford University Press",,,,25
Humanities,Classical Studies,Year 12,Unit 3,VCECSU3,,,,DetailedExampleStep,Paragraph,"Beard, Mary, 2016, 'The Transformations of Augustus' in SPQR: A History of Ancient Rome, Profile Trade",,,,26
Humanities,Classical Studies,Year 12,Unit 3,VCECSU3,,,,DetailedExampleStep,Paragraph,"W.A Camps, WA, 1969, An Introduction to Virgil's Aeneid, Oxford University Press",,,,27
Humanities,Classical Studies,Year 12,Unit 3,VCECSU3,,,,DetailedExampleStep,Paragraph,"Martindale, Charles (ed.) 1997, The Cambridge Companion to Virgil, Cambridge Universit Press",,,,28
Humanities,Classical Studies,Year 12,Unit 3,VCECSU3,,,,DetailedExampleStep,Paragraph,Articles/chapters,,,,29
Humanities,Classical Studies,Year 12,Unit 3,VCECSU3,,,,DetailedExampleStep,Paragraph,"Introduction by Sheila Murnaghan to The Iliad trans. Stanley Lombardo (Hackett, 1997)",,,,30
Humanities,Classical Studies,Year 12,Unit 3,VCECSU3,,,,DetailedExampleStep,Paragraph,Documentary,,,,31
Humanities,Classical Studies,Year 12,Unit 3,VCECSU3,,,,DetailedExampleStep,Paragraph,Natalie Haynes Stands Up for the Classics: The Iliad,,,,32
Humanities,Classical Studies,Year 12,Unit 3,VCECSU3,,,,DetailedExampleStep,Paragraph,On completion of this unit the student should be able to analyse the key ideas and techniques used in the production of the prescribed material work(s) and its relationship to its socio-historical context,,,,33
Humanities,Classical Studies,Year 12,Unit 3,VCECSU3,,,,DetailedExampleStep,Paragraph,Example of learning activities,,,,34
Humanities,Classical Studies,Year 12,Unit 3,VCECSU3,,,,DetailedExampleStep,Bullet,"Examine the Terms used in this study section of the VCE Classical Studies Study Design, particularly the definitions of socio-historical context, ideas and techniques used in material culture works. Consider the differences between construction methods, compositional techniques and expressive techniques, and where a technique might fall into more than one of these categories.",,,,35
Humanities,Classical Studies,Year 12,Unit 3,VCECSU3,,,,DetailedExampleStep,Bullet,"Research the period in which your prescribed work(s) was created. Consider how the work(s) reflect their period or may have even played a significant role in historical events. Monuments and sculpture were often commissioned by leaders as political propaganda, which can teach us about the values and ideas leaders aimed to promote. Everyday objects teach us about how ordinary people lived through the historical period.",,,,36
Humanities,Classical Studies,Year 12,Unit 3,VCECSU3,,,,DetailedExampleStep,Bullet,"Research construction methods. Consider how the work was produced, what materials were used and where they were sourced. Research the expense of the materials and consider how this knowledge shapes your understanding of the financial and cultural value of the work(s). Works made with expensive marble, for example, cost their commissioners a huge amount and this reflects the importance that the commissioners placed on the works to convey their ideas.",,,,37
Humanities,Classical Studies,Year 12,Unit 3,VCECSU3,,,,DetailedExampleStep,Bullet,"Look at an image of the work and identify your initial reaction to it. What emotions do you feel when viewing the work? What draws your eye? Note this down and then compare this with how you perceive the work once you understand its context and aims. Classical Studies encourages you to focus more on how people of the time viewed the work (rather than your own response), but it can be useful to compare and contrast your own perception of the work with how it was viewed in its own socio-historical context. When does your response align with how ancient viewers would have responded, when does it diverge and why?",,,,38
Humanities,Classical Studies,Year 12,Unit 3,VCECSU3,,,,DetailedExampleStep,Bullet,"Select one technique that is used repeatedly in your work(s). Focus on compositional and expressive techniques, rather than construction methods. Consider techniques such as symbolism, iconography, focal points, positioning, facial expression, costume, stance and gesture, and colour (where relevant). Identify all the examples of the technique across your work(s) and prepare a presentation to the class to explain how the technique conveys ideas. Compare how the technique is used in different examples from the work(s).",,,,39
Humanities,Classical Studies,Year 12,Unit 3,VCECSU3,,,,DetailedExampleStep,Bullet,"Learn about the works in-situ. Research where sculptures or monuments were erected and what may have surrounded them (other artwork, types of buildings). Was the work positioned in a wealthy or prominent part of the city? If you study everyday objects, learn about how they were used. What class and demographic of people owned the object and when did they use it?",,,,40
Humanities,Classical Studies,Year 12,Unit 3,VCECSU3,,,,DetailedExampleStep,Bullet,Print out photographs of the work(s) with a margin around the image. Annotate the works for:,,,,41
Humanities,Classical Studies,Year 12,Unit 3,VCECSU3,,,,DetailedExampleStep,Bullet,Ideas (in particular values or classical ideas from the period),Print out photographs of the work(s) with a margin around the image. Annotate the works for:,,,42
Humanities,Classical Studies,Year 12,Unit 3,VCECSU3,,,,DetailedExampleStep,Bullet,Techniques (compositional and expressive in particular),Print out photographs of the work(s) with a margin around the image. Annotate the works for:,,,43
Humanities,Classical Studies,Year 12,Unit 3,VCECSU3,,,,DetailedExampleStep,Bullet,Socio-historical links,Print out photographs of the work(s) with a margin around the image. Annotate the works for:,,,44
Humanities,Classical Studies,Year 12,Unit 3,VCECSU3,,,,DetailedExampleStep,Bullet,Similarities and differences across the work(s),Print out photographs of the work(s) with a margin around the image. Annotate the works for:,,,45
Humanities,Classical Studies,Year 12,Unit 3,VCECSU3,,,,DetailedExampleStep,Bullet,"Compare the work(s) in terms of purpose with twenty-first century equivalents. If you are studying a war monument, what similarities and differences exist when compared to the Shrine or War Memorial? Temples, arenas, theatres and grave markers all have twenty-first century equivalents. Focus particularly on the differences as they teach us more about what the classical world prioritised and believed. Note that you are not encouraged to write about these similarities and differences in your assessment for Classical Studies, rather such comparisons are just a useful way of considering what the material culture can teach us about the classical world.",,,,46
Humanities,Classical Studies,Year 12,Unit 3,VCECSU3,,,,DetailedExampleStep,Bullet,"Create a mind map such as the example below to consider connections between sections of your prescribed work, or between works when multiple works have been prescribed. Look for similar ideas being expressed, works/sections from the same period, featuring similar characters or individuals or the repeated use of techniques.",,,,47
Humanities,Classical Studies,Year 12,Unit 3,VCECSU3,,,,DetailedExampleStep,Bullet,Make or find a 3D model of your prescribed work(s). Consider how people would have viewed and interacted with the work(s) at the time.,,,,48
Humanities,Classical Studies,Year 12,Unit 3,VCECSU3,,,,DetailedExampleStep,Bullet,Complete a series of questions based on images of a selection of prescribed material work(s).,,,,49
Humanities,Classical Studies,Year 12,Unit 3,VCECSU3,,,,DetailedExample,Paragraph,"Provide students with images of a selection of the prescribed material works (or a selection of images of sections where a single work is prescribed) and ask them to respond to questions such as those listed below. These questions move from lower-order identification questions to higher-order comparative, analytical and evaluative questions.",,,,50
Humanities,Classical Studies,Year 12,Unit 3,VCECSU3,,,,DetailedExampleStep,Bullet,Annotate the following image with five compositional or expressive techniques (5 marks).,,,,51
Humanities,Classical Studies,Year 12,Unit 3,VCECSU3,,,,DetailedExampleStep,Bullet,Explain how the work depicted in Image 1 was created. Refer to construction techniques in your response (3 marks).,,,,52
Humanities,Classical Studies,Year 12,Unit 3,VCECSU3,,,,DetailedExampleStep,Bullet,Identify the socio-historical context of Image 1 (1 mark) and describe how the work/section shown in Image 1 was used in its original context (2 marks).,,,,53
Humanities,Classical Studies,Year 12,Unit 3,VCECSU3,,,,DetailedExampleStep,Bullet,Identify two Roman ideas expressed in Image 2. Give evidence from the image (2 marks),,,,54
Humanities,Classical Studies,Year 12,Unit 3,VCECSU3,,,,DetailedExampleStep,Bullet,Compare how Image 1 and Image 2 express the importance of piety. (5 marks),,,,55
Humanities,Classical Studies,Year 12,Unit 3,VCECSU3,,,,DetailedExampleStep,Bullet,Evaluate the significance of the work/section depicted in Image 2 in relation to the prescribed work as a whole/in relation to other examples of its form where several works are prescribed for study. Justify your argument with examples from three other prescribed works/sections you have studied. (8 marks),,,,56
