SubjectArea,Subject,Band,Unit,UnitASCode,AreaofStudy,Outcome,OutcomeCode,ExampleType,ContentType,ExampleText,ParentText,URLTitle,URL,Sequence
Humanities,Classical Studies,,,"VCECSU1AS1,VCECSU1AS2,VCECSU2AS1,VCECSU2AS2,VCECSU3AS1,VCECSU3AS2,VCECSU4AS1,VCECSU4AS2",,,,,Header,,Humanities - Classical Studies,Classical Studies - Teaching and Learning,https://www.vcaa.vic.edu.au/curriculum/vce-curriculum/vce-study-designs/classical-studies/teaching-and-learning,0
Humanities,Classical Studies,Year 11,Unit 1,VCECSU1,,,,,UnitHeading,Unit 1 Mythical worlds,,,,1
Humanities,Classical Studies,Year 11,Unit 1,VCECSU1,,,,GeneralActivity,Paragraph,On completion of this unit the student should be able to explain the functions and forms of myths in the classical world and the relationship between classical works and those from a later period.,,,,2
Humanities,Classical Studies,Year 11,Unit 1,VCECSU1,,,,GeneralActivity,Paragraph,Example of learning activities,,,,3
Humanities,Classical Studies,Year 11,Unit 1,VCECSU1,,,,GeneralActivity,Bullet,Create a family tree of the Olympian gods.,,,,4
Humanities,Classical Studies,Year 11,Unit 1,VCECSU1,,,,GeneralActivity,Bullet,"Research one of the Olympian gods. Create a presentation that includes the following information: titles, responsibilities, attributes, symbols associated with the god and one myth in which they play a major role. Provide an image of an artwork that was created in ancient Greece or Rome.",,,,5
Humanities,Classical Studies,Year 11,Unit 1,VCECSU1,,,,GeneralActivity,Bullet,"Read the creation myth (lines 104-205) from Hesiod's Theogony and consider its purpose and function for the ancient Greeks, assessing what it might reveal about their fundamental beliefs and values.",,,,6
Humanities,Classical Studies,Year 11,Unit 1,VCECSU1,,,,GeneralActivity,Bullet,"Read one or more Homeric Hymns, for example 'To Artemis' and 'To Dionysus'. Explain what each hymn reveals about the god it praises; what it reveals about the values of classical Greece. Consider what function it might have served in ancient society.",,,,7
Humanities,Classical Studies,Year 11,Unit 1,VCECSU1,,,,GeneralActivity,Bullet,"Find and explain myths that explain natural phenomena, such as the seasons or earthquakes.",,,,8
Humanities,Classical Studies,Year 11,Unit 1,VCECSU1,,,,GeneralActivity,Bullet,Compare the difference between the nature of divine beings and mortals in a myth you have studied.,,,,9
Humanities,Classical Studies,Year 11,Unit 1,VCECSU1,,,,GeneralActivity,Bullet,"Annotate images artworks such as sculptures, paintings and vases, that depict myths. Examine what narrative is presented and annotate features that depict the figures and the narrative.",,,,10
Humanities,Classical Studies,Year 11,Unit 1,VCECSU1,,,,GeneralActivity,Bullet,"Explore myth cycles such as the House of Atreus or the House of Labdacus (Oedipus' family), Annotate a genealogical diagram to note the relationships with the gods, actions completed, consequences of those actions, the concept of fate and of curses. Consider what this reveals about the functions and ideas in these myths.",,,,11
Humanities,Classical Studies,Year 11,Unit 1,VCECSU1,,,,GeneralActivity,Bullet,"Create an infographic on a hero. Your infographic should include: name of the hero, parents, best known heroic acts, heroic attributes associated with this figure, gods associated with the hero and if they help or hinder, symbols associated with the hero, bibliographic details.",,,,12
Humanities,Classical Studies,Year 11,Unit 1,VCECSU1,,,,GeneralActivity,Bullet,"Read a Book of Homer's Iliad, Homer's Odyssey or Virgil's Aeneid and identify the heroic attributes of the central hero. Consider the attributes of a hero in a particular context, such as on a journey, at war or his role in the foundation of a city. (extracts/Books to be studied in Units 3 and 4 should be avoided)",,,,13
Humanities,Classical Studies,Year 11,Unit 1,VCECSU1,,,,GeneralActivity,Bullet,Read a poem that uses a myth you have studied and consider why the poet chose to use the myth and any adaptations made.,,,,14
Humanities,Classical Studies,Year 11,Unit 1,VCECSU1,,,,GeneralActivity,Bullet,"Investigate the 12 labours of Heracles/Hercules and consider the qualities of the hero that are emphasised. Watch a modern retelling of a myth, such as the 1997 film Hercules, and identify what makes Hercules heroic in both versions. Using a Venn diagram, compare the extent to which the 1997 film version is the same as the ancient version. Consider why this myth might still be relevant to our society and why you think changes were made to the modern retelling.",,,,15
Humanities,Classical Studies,Year 11,Unit 1,VCECSU1,,,,GeneralActivity,Bullet,"Compare the depiction of a mythological figure through time. For example, examine the birth of Aphrodite in Hesiod's Theogony with Botticelli's The Birth of Venus and/or Aphrodite in the Percy Jackson series. To what extent is the depiction the same? Do we see a difference in focus between the depictions? Do they have the same messages about power, beauty, love, and fertility? What do the depictions reveal about the societies in which they were produced.",,,,16
Humanities,Classical Studies,Year 11,Unit 1,VCECSU1,,,,GeneralActivity,Bullet,"Working in small groups, research one hero and the myths associated with this hero. Present findings to the class as a multimedia presentation.",,,,17
Humanities,Classical Studies,Year 11,Unit 1,VCECSU1,,,,DetailedExample,Paragraph,Heroes Research Task,,,,18
Humanities,Classical Studies,Year 11,Unit 1,VCECSU1,,,,DetailedExampleStep,Bullet,"In small groups students research one hero and the myths associated with them. They present their findings to the class as a multimedia presentation. Heroes might include Odysseus, Jason, Heracles/Hercules, Perseus, Theseus, Achilles, Romulus and Aeneas.",,,,19
Humanities,Classical Studies,Year 11,Unit 1,VCECSU1,,,,DetailedExampleStep,Paragraph,"In preparation for their presentation, students address and take notes on the following questions:",,,,20
Humanities,Classical Studies,Year 11,Unit 1,VCECSU1,,,,DetailedExampleStep,Bullet,Students create and deliver their multimedia presentation that includes the information they have gathered and relevant accompanying visuals.,,,,21
Humanities,Classical Studies,Year 11,Unit 1,VCECSU1,,,,DetailedExampleStep,Paragraph,"Following the presentations, hold a class discussion in which students explore what they have observed about heroes in myths. They consider what the heroes have in common and what purpose these figures might have served in ancient Greek and Roman culture? They all consider what their myths reveal about the values held by the ancient Greeks and Romans.",,,,22
Humanities,Classical Studies,Year 11,Unit 1,VCECSU1,,,,DetailedExampleStep,Bullet,Students they create a mind map that shows their understanding of the characteristics and functions of heroes in classical mythology.,,,,23
Humanities,Classical Studies,Year 11,Unit 1,VCECSU1,,,,DetailedExampleStep,Bullet,Compare Joseph Campbell's stages of the hero's journey with a classical myth and then compare these with modern works that follow or depart from Campbell's stages of the hero's journey.,,,,24
Humanities,Classical Studies,Year 11,Unit 1,VCECSU1,,,,DetailedExample,Paragraph,The hero's journey,,,,25
Humanities,Classical Studies,Year 11,Unit 1,VCECSU1,,,,DetailedExampleStep,Bullet,Present Joseph Campbell's stages of the hero's journey to the students and ask them to consider myths they know that follow this pattern.,,,,26
Humanities,Classical Studies,Year 11,Unit 1,VCECSU1,,,,DetailedExampleStep,Bullet,"As a class, read a classical myth of a hero's journey, such as extracts from Homer's Odyssey, aloud and have students assess how it confirms or departs from Campbell's description.",,,,27
Humanities,Classical Studies,Year 11,Unit 1,VCECSU1,,,,DetailedExampleStep,Bullet,Students annotate their text with examples of and reflections on how heroes are characterised in their text. Students could also examine the oral tradition in which the Odyssey was created and the values it conveys.,,,,28
Humanities,Classical Studies,Year 11,Unit 1,VCECSU1,,,,DetailedExampleStep,Bullet,"When they have finished their study of a classical hero myth students consider later or modern works, such as films that follow, or depart from, Campbell's stages of the hero's journey. Students give an oral presentation about their chosen work.",,,,29
Humanities,Classical Studies,Year 11,Unit 1,VCECSU1,,,,DetailedExampleStep,Paragraph,Resources,,,,30
Humanities,Classical Studies,Year 11,Unit 1,VCECSU1,,,,DetailedExampleStep,Paragraph,Classical works,,,,31
Humanities,Classical Studies,Year 11,Unit 1,VCECSU1,,,,DetailedExampleStep,Paragraph,"[Works to be studied in later areas of study may not to be used here, but a different section may be used. For example, a different Book of an epic than that to be studied in Unit 3 may be used]",,,,32
Humanities,Classical Studies,Year 11,Unit 1,VCECSU1,,,,DetailedExampleStep,Paragraph,"Hesiod, The Homeric Hymns",,,,33
Humanities,Classical Studies,Year 11,Unit 1,VCECSU1,,,,DetailedExampleStep,Paragraph,"Hesiod, Theogony",,,,34
Humanities,Classical Studies,Year 11,Unit 1,VCECSU1,,,,DetailedExampleStep,Paragraph,"Homer, The Iliad",,,,35
Humanities,Classical Studies,Year 11,Unit 1,VCECSU1,,,,DetailedExampleStep,Paragraph,"Homer, The Odyssey",,,,36
Humanities,Classical Studies,Year 11,Unit 1,VCECSU1,,,,DetailedExampleStep,Paragraph,"Ovid, Metamorphoses",,,,37
Humanities,Classical Studies,Year 11,Unit 1,VCECSU1,,,,DetailedExampleStep,Paragraph,"Virgil, The Aeneid",,,,38
Humanities,Classical Studies,Year 11,Unit 1,VCECSU1,,,,DetailedExampleStep,Paragraph,Modern Resources,,,,39
Humanities,Classical Studies,Year 11,Unit 1,VCECSU1,,,,DetailedExampleStep,Paragraph,"Fry, Stephen, 2018, Mythos. Michael Joseph (Imprint of Penguin Books)",,,,40
Humanities,Classical Studies,Year 11,Unit 1,VCECSU1,,,,DetailedExampleStep,Paragraph,"Morford, P.O and Lenardon, Robert J, 1995, Classical Mythology. Longman",,,,41
Humanities,Classical Studies,Year 11,Unit 1,VCECSU1,,,,DetailedExampleStep,Paragraph,"Nagy, Gregory, 2013, The Ancient Greek Hero in 24 Hours. Harvard University Press",,,,42
Humanities,Classical Studies,Year 11,Unit 1,VCECSU1,,,,DetailedExampleStep,Paragraph,"Weiss, Charles, 2012, Greece & Rome: Texts and Contexts. Homer's Odyssey. Cambridge University Press",,,,43
Humanities,Classical Studies,Year 11,Unit 1,VCECSU1,,,,DetailedExampleStep,Paragraph,Websites,,,,44
Humanities,Classical Studies,Year 11,Unit 1,VCECSU1,,,,DetailedExampleStep,Paragraph,Perseus Digital Library,,,,45
Humanities,Classical Studies,Year 11,Unit 1,VCECSU1,,,,DetailedExampleStep,Paragraph,The Internet Classics Archive,,,,46
Humanities,Classical Studies,Year 11,Unit 1,VCECSU1,,,,DetailedExampleStep,Paragraph,Theoi Greek Mythology,,,,47
Humanities,Classical Studies,Year 11,Unit 1,VCECSU1,,,,DetailedExampleStep,Paragraph,Works influenced by myth,,,,48
Humanities,Classical Studies,Year 11,Unit 1,VCECSU1,,,,DetailedExampleStep,Paragraph,"A book, poem, film or television show depicting a hero archetype or hero's journey; for example:",,,,49
Humanities,Classical Studies,Year 11,Unit 1,VCECSU1,,,,DetailedExampleStep,Paragraph,The Birth of Venus by Botticelli,,,,50
Humanities,Classical Studies,Year 11,Unit 1,VCECSU1,,,,DetailedExampleStep,Paragraph,Circe by Madeline Miller,,,,51
Humanities,Classical Studies,Year 11,Unit 1,VCECSU1,,,,DetailedExampleStep,Paragraph,"Hercules from Disney Studios (film, 1997)",,,,52
Humanities,Classical Studies,Year 11,Unit 1,VCECSU1,,,,DetailedExampleStep,Paragraph,"Hercules or Hercules directed by Brett Ratner and starring Dwayne Johnson(film, 2014)",,,,53
Humanities,Classical Studies,Year 11,Unit 1,VCECSU1,,,,DetailedExampleStep,Paragraph,"Oh Brother, Where Art Thou? By Joel and Ethan Coen(film, 2000)",,,,54
Humanities,Classical Studies,Year 11,Unit 1,VCECSU1,,,,DetailedExampleStep,Paragraph,"The Penelopiad by Margaret Atwood (book, 2005)",,,,55
Humanities,Classical Studies,Year 11,Unit 1,VCECSU1,,,,DetailedExampleStep,Paragraph,"Song of Achilles by Madeline Miller (book, 2012)",,,,56
Humanities,Classical Studies,Year 11,Unit 1,VCECSU1,,,,DetailedExampleStep,Paragraph,"Troy, directed by Wolfgang Petersen (film, 2004)",,,,57
Humanities,Classical Studies,Year 11,Unit 1,VCECSU1,,,,DetailedExampleStep,Paragraph,"Troy, Dragging of Hector (1966) by Sidney Nolan (artwork, 1966)",,,,58
Humanities,Classical Studies,Year 11,Unit 1,VCECSU1,,,,DetailedExampleStep,Paragraph,"Ulysses by Lord Alfred Tennyson (poem, 1833)",,,,59
Humanities,Classical Studies,Year 11,Unit 1,VCECSU1,,,,DetailedExampleStep,Paragraph,"The poetry of WB Yeats, such as 'Leda and the Swan' and 'No Second Troy'",,,,60
Humanities,Classical Studies,Year 11,Unit 1,VCECSU1,,,,DetailedExampleStep,Paragraph,"The Percy Jackson series (books, films or television shows)",,,,61
Humanities,Classical Studies,Year 11,Unit 1,VCECSU1,,,,DetailedExampleStep,Paragraph,On completion of this unit the student should be able to explain how archaeology has informed our understanding of classical myths and society and identify ethical issues in archaeology.,,,,62
Humanities,Classical Studies,Year 11,Unit 1,VCECSU1,,,,DetailedExampleStep,Paragraph,Example of learning activities,,,,63
Humanities,Classical Studies,Year 11,Unit 1,VCECSU1,,,,DetailedExampleStep,Bullet,"Create a glossary containing the words − stratigraphy, survey, excavation, artefact, dating, radiocarbon dating, repatriation, cultural heritage",,,,64
Humanities,Classical Studies,Year 11,Unit 1,VCECSU1,,,,DetailedExampleStep,Bullet,Watch an episode of Time Team to understand how an excavation takes place from discovery to any possible finds.,,,,65
Humanities,Classical Studies,Year 11,Unit 1,VCECSU1,,,,DetailedExampleStep,Bullet,Examine the discovery of Hisarlik and/or Knossos. Briefly outline who discovered your site and what lead to its discovery. In your evaluation use the following questions to guide your thinking:,,,,66
Humanities,Classical Studies,Year 11,Unit 1,VCECSU1,,,,DetailedExampleStep,Bullet,Who discovered and/or excavated the site? When?,Examine the discovery of Hisarlik and/or Knossos. Briefly outline who discovered your site and what lead to its discovery. In your evaluation use the following questions to guide your thinking:,,,67
Humanities,Classical Studies,Year 11,Unit 1,VCECSU1,,,,DetailedExampleStep,Bullet,What lead to its discovery?,Examine the discovery of Hisarlik and/or Knossos. Briefly outline who discovered your site and what lead to its discovery. In your evaluation use the following questions to guide your thinking:,,,68
Humanities,Classical Studies,Year 11,Unit 1,VCECSU1,,,,DetailedExampleStep,Bullet,Did the archaeologist(s) make any assumptions about the site?,Examine the discovery of Hisarlik and/or Knossos. Briefly outline who discovered your site and what lead to its discovery. In your evaluation use the following questions to guide your thinking:,,,69
Humanities,Classical Studies,Year 11,Unit 1,VCECSU1,,,,DetailedExampleStep,Bullet,Did this influence their interpretation of the site?,Examine the discovery of Hisarlik and/or Knossos. Briefly outline who discovered your site and what lead to its discovery. In your evaluation use the following questions to guide your thinking:,,,70
Humanities,Classical Studies,Year 11,Unit 1,VCECSU1,,,,DetailedExampleStep,Bullet,Did this in turn influence how the world views this site?,Examine the discovery of Hisarlik and/or Knossos. Briefly outline who discovered your site and what lead to its discovery. In your evaluation use the following questions to guide your thinking:,,,71
Humanities,Classical Studies,Year 11,Unit 1,VCECSU1,,,,DetailedExampleStep,Bullet,Research Heinrich Schliemann's excavation of Hisarlik and/or Arthur Evans' excavation of Knossos. Examine the degree to which the excavation was conducted to modern archaeological rigour.,,,,72
Humanities,Classical Studies,Year 11,Unit 1,VCECSU1,,,,DetailedExampleStep,Bullet,"Watch episodes of the mini-series by Michael Woods: 'In Search of the Trojan War' or Bettany Hughes's series 'The Minotaur's Island' to understand how mythology may have been informed by what is seen in the archaeological evidence, or vice versa. Make notes on archaeological evidence that reveals aspects of Mycenaean or Minoan society.",,,,73
Humanities,Classical Studies,Year 11,Unit 1,VCECSU1,,,,DetailedExampleStep,Bullet,"Explore the different types of archaeological evidence, including features of a site and artefacts discovered.",,,,74
Humanities,Classical Studies,Year 11,Unit 1,VCECSU1,,,,DetailedExampleStep,Bullet,"Examine a range of Mycenaean frescoes, vases and gold objects. Consider why the Mycenaeans chose the subject matter that they did for these items.",,,,75
Humanities,Classical Studies,Year 11,Unit 1,VCECSU1,,,,DetailedExampleStep,Bullet,"Explore the issue of ethics in archaeology and consider the question: Who owns the past? Discuss the link between archaeological artefacts and sites and cultural heritage by exploring what museums and art galleries decide to exhibit in exhibitions that tour the world. Examples might include the antiquities section of the British Museum, the Louvre (Paris), the Vatican Museums (Rome), the Metropolitan Museum of Art (New York), and the National Gallery of Victoria. Investigate questions such as: Why do museums and art galleries have sections devoted to antiquities? What attracts people to visiting museums and seeing these objects? Pick a museum artefact and research how it came to be in the museum collection.",,,,76
Humanities,Classical Studies,Year 11,Unit 1,VCECSU1,,,,DetailedExampleStep,Bullet,Research the controversy around the ownership of the Parthenon marbles and watch the debate on video: Send them back: The Parthenon Marbles should be returned to Athens. This debate took place at Cadogan Hall on 11th June 2012. Have a class debate as to whether the Parthenon Marbles should be returned to Greece.,,,,77
Humanities,Classical Studies,Year 11,Unit 1,VCECSU1,,,,DetailedExampleStep,Bullet,"Explore the site of Pompeii and Herculaneum, which are still being excavated, and assess the benefits of tourism and the negatives of having the site open to the public. View the Ercolano fresco from Herculaneum and consider the site's mythical connection to Hercules. Then examine frescoes from Pompeii and Herculaneum that depict myth and consider what ideas, beliefs and values are presented in these scenes.",,,,78
Humanities,Classical Studies,Year 11,Unit 1,VCECSU1,,,,DetailedExampleStep,Bullet,"Form teams to debate two research and debate to ethical issues, using evidence from Pompeii. The teams should argue for and against the motions:",,,,79
Humanities,Classical Studies,Year 11,Unit 1,VCECSU1,,,,DetailedExampleStep,Bullet,'Human remains should never be displayed.',,,,80
Humanities,Classical Studies,Year 11,Unit 1,VCECSU1,,,,DetailedExampleStep,Bullet,'Tourists should be banned from visiting Pompeii.',,,,81
Humanities,Classical Studies,Year 11,Unit 1,VCECSU1,,,,DetailedExampleStep,Paragraph, Research the artefacts associated with a chosen archaeological site in order to write an extended response or give an oral presentation explaining the significance of the chosen artefacts in informing your understanding of the society that produced them.,,,,82
Humanities,Classical Studies,Year 11,Unit 1,VCECSU1,,,,DetailedExample,Paragraph,Artefacts Task,,,,83
Humanities,Classical Studies,Year 11,Unit 1,VCECSU1,,,,DetailedExampleStep,Paragraph,"Students choose an archaeological site associated with a myth, such as Hisarlik (Troy), Mycenae or Knossos.",,,,84
Humanities,Classical Studies,Year 11,Unit 1,VCECSU1,,,,DetailedExampleStep,Bullet,"Provide students with a myth that is closely associated with the site, such as Theseus and the Minotaur or a myth associated with the Trojan War.",,,,85
Humanities,Classical Studies,Year 11,Unit 1,VCECSU1,,,,DetailedExampleStep,Bullet,"Students undertake brief research of when the site was discovered, how the site was discovered and by whom.",,,,86
Humanities,Classical Studies,Year 11,Unit 1,VCECSU1,,,,DetailedExampleStep,Bullet,Students pose a broad research question. An example might be 'Is there any truth to the myth of Theseus and the Minotaur?' or 'Could there have been a war at Troy that was inspiration for Homer's Iliad?',,,,87
Humanities,Classical Studies,Year 11,Unit 1,VCECSU1,,,,DetailedExampleStep,Bullet,"Students elect five artefacts from a site associated with myth and fill in the table below. These could be artefacts examined together in class or as an individual task, where students may need teacher support to find appropriate artefacts.",,,,88
Humanities,Classical Studies,Year 11,Unit 1,VCECSU1,,,,DetailedExampleStep,Paragraph,Artefact table,,,,89
Humanities,Classical Studies,Year 11,Unit 1,VCECSU1,,,,DetailedExampleStep,Bullet,Write an extended response or give an oral presentation explaining the significance of the chosen artefacts in informing your understanding of the society that produced them.,,,,90
Humanities,Classical Studies,Year 11,Unit 1,VCECSU1,,,,DetailedExampleStep,Paragraph,Resources,,,,91
Humanities,Classical Studies,Year 11,Unit 1,VCECSU1,,,,DetailedExampleStep,Paragraph,Classical works,,,,92
Humanities,Classical Studies,Year 11,Unit 1,VCECSU1,,,,DetailedExampleStep,Paragraph,"[Works to be studied in other areas of study may not to be used here, but a different section may be used. For example, a different Book of the Iliad than the one that will be studied in Unit 3 may be used]",,,,93
Humanities,Classical Studies,Year 11,Unit 1,VCECSU1,,,,DetailedExampleStep,Paragraph,"Homer, The Iliad",,,,94
Humanities,Classical Studies,Year 11,Unit 1,VCECSU1,,,,DetailedExampleStep,Paragraph,"Ovid, Metamorphoses, Book 8.",,,,95
Humanities,Classical Studies,Year 11,Unit 1,VCECSU1,,,,DetailedExampleStep,Paragraph,Perseus Digital Library,,,,96
Humanities,Classical Studies,Year 11,Unit 1,VCECSU1,,,,DetailedExampleStep,Paragraph,The Internet Classics Archive,,,,97
Humanities,Classical Studies,Year 11,Unit 1,VCECSU1,,,,DetailedExampleStep,Paragraph,Modern resources,,,,98
Humanities,Classical Studies,Year 11,Unit 1,VCECSU1,,,,DetailedExampleStep,Paragraph,"Morford, P.O and Lenardon, Robert J., Classical Mythology. Longman, 1995",,,,99
Humanities,Classical Studies,Year 11,Unit 1,VCECSU1,,,,DetailedExampleStep,Paragraph,"Wardle, KA, Wardle, D, 2013, The Mycenaean World, Bristol Classical Press",,,,100
Humanities,Classical Studies,Year 11,Unit 1,VCECSU1,,,,DetailedExampleStep,Paragraph,Documentaries,,,,101
Humanities,Classical Studies,Year 11,Unit 1,VCECSU1,,,,DetailedExampleStep,Paragraph,In Search of the Trojan War,,,,102
Humanities,Classical Studies,Year 11,Unit 1,VCECSU1,,,,DetailedExampleStep,Paragraph,The Minotaur's Island,,,,103
Humanities,Classical Studies,Year 11,Unit 1,VCECSU1,,,,DetailedExampleStep,Paragraph,Raiders of the Lost Past: The Minotaur's Palace,,,,104
Humanities,Classical Studies,Year 11,Unit 1,VCECSU1,,,,DetailedExampleStep,Paragraph,The Story Behind a stolen 2500-year-old vase (Australian Broadcasting Corporation),,,,105
Humanities,Classical Studies,Year 11,Unit 1,VCECSU1,,,,DetailedExampleStep,Paragraph,Time Team episodes,,,,106
Humanities,Classical Studies,Year 11,Unit 1,VCECSU1,,,,DetailedExampleStep,Paragraph,Troy: The Truth Behind the Legend,,,,107
Humanities,Classical Studies,Year 11,Unit 1,VCECSU1,,,,DetailedExampleStep,Paragraph,Send them back: The Parthenon Marbles should be returned to Athens [available on YouTube],,,,108
Humanities,Classical Studies,Year 11,Unit 1,VCECSU1,,,,DetailedExampleStep,Paragraph,Websites,,,,109
Humanities,Classical Studies,Year 11,Unit 1,VCECSU1,,,,DetailedExampleStep,Paragraph,Art in Context: A Deep Dive into Mycenaean Artifacts,,,,110
Humanities,Classical Studies,Year 11,Unit 1,VCECSU1,,,,DetailedExampleStep,Paragraph,Home | Acropolis Museum | Official website (theacropolismuseum.gr),,,,111
Humanities,Classical Studies,Year 11,Unit 1,VCECSU1,,,,DetailedExampleStep,Paragraph,British Museum,,,,112
Humanities,Classical Studies,Year 11,Unit 1,VCECSU1,,,,DetailedExampleStep,Paragraph,Hellenic Museum Melbourne | Art & History Museum,,,,113
Humanities,Classical Studies,Year 11,Unit 1,VCECSU1,,,,DetailedExampleStep,Paragraph,Home - Heraklion Archaeological Museum (heraklionmuseum.gr),,,,114
Humanities,Classical Studies,Year 11,Unit 1,VCECSU1,,,,DetailedExampleStep,Paragraph,"Turkish Museums - #FromHome - access to virtual tours of many museums in Türkiye including Troy, Ephesus, Assos, Hierapolis.",,,,115
Humanities,Classical Studies,Year 11,Unit 1,VCECSU1,,,,DetailedExampleStep,Paragraph,"Homepage - Pompeii Sites Official Pompeii Archaeological Site - this has links to other sites such as - this has links to other sites such as Oplontis, Boscoreale and many others.",,,,116
Humanities,Classical Studies,Year 11,Unit 1,VCECSU1,,,,DetailedExampleStep,Paragraph,Online text book,,,,117
Humanities,Classical Studies,Year 11,Unit 1,VCECSU1,,,,DetailedExampleStep,Paragraph,Minoan Archaeology Resource,,,,118
Humanities,Classical Studies,Year 11,Unit 2,VCECSU2,,,,,UnitHeading,Unit 2 Classical worlds,,,,1
Humanities,Classical Studies,Year 11,Unit 2,VCECSU2,,,,GeneralActivity,Paragraph,On completion of this unit the student should be able to analyse the representations and place of myth in classical culture and the ideas and beliefs they convey.,,,,2
Humanities,Classical Studies,Year 11,Unit 2,VCECSU2,,,,GeneralActivity,Paragraph,Example of learning activities,,,,3
