SubjectArea,Subject,Band,AssessmentType,AssessmentInformationDetails,AssessmentYears,UnitASCode,ExamReportCode,SectionCode,ContextHeader,ContextContent,Sequence
English,English,Year 12,Final Exam,Post Exam Report,2024,VCEEU4AS2,VCEEEARC,VCEEEARCCTX,Context,,1
English,English,Year 12,Final Exam,Post Exam Report,2024,VCEEU4AS2,VCEEEARC,VCEEEARCCTX,The ‘Background Information’ provided crucial information for the completion of the task.,,2
English,English,Year 12,Final Exam,Post Exam Report,2024,VCEEU4AS2,VCEEEARC,VCEEEARCCTX,,It was here that the students were given the context in which the text was created and the identity of the text’s author and the intended audience was defined.,3
English,English,Year 12,Final Exam,Post Exam Report,2024,VCEEU4AS2,VCEEEARC,VCEEEARCCTX,"Students needed to use this knowledge as well as inferred knowledge during their reading of the previously unseen persuasive text to establish the author’s purpose, the characteristics of the intended audience and the relationship between the author and the intended audience.",,4
English,English,Year 12,Final Exam,Post Exam Report,2024,VCEEU4AS2,VCEEEARC,VCEEEARCCTX,,This information derived by inferential reading was vital for students as they demonstrated their skill in analytical thinking while completing the task.,5
English,English,Year 12,Final Exam,Post Exam Report,2024,VCEEU4AS2,VCEEEARC,VCEEEARCCTX,There was no preferred structure or content.,,6
English,English,Year 12,Final Exam,Post Exam Report,2024,VCEEU4AS2,VCEEEARC,VCEEEARCCTX,,Students were free to adopt their own strategy to explain the ways in which the text was structured to persuade the intended audience and the ways in which language and visual language were harnessed to convey and amplify the ideas presented.,7
English,English,Year 12,Final Exam,Post Exam Report,2024,VCEEU4AS2,VCEEEARC,VCEEEARCCTX,"In 2024, the students were presented with a previously unseen text about a fictional gym experiencing financial insecurity and considering a partnership with another business, which held apparently conflicting values, to secure its financial viability.",,8
English,English,Year 12,Final Exam,Post Exam Report,2024,VCEEU4AS2,VCEEEARC,VCEEEARCCTX,The form was a speech made to an audience of Our Local Gym members presented at an emergency meeting.,,9
English,English,Year 12,Final Exam,Post Exam Report,2024,VCEEU4AS2,VCEEEARC,VCEEEARCCTX,,Two slides were shown to the audience during the speech.,10
English,English,Year 12,Final Exam,Post Exam Report,2024,VCEEU4AS2,VCEEEARC,VCEEEARCCTX,,"The Chair of the gym was Sandy Gestalt, whose purpose was to persuade the gym’s members to put aside their values for pragmatic reasons and vote in favour of the controversial partnership.",11
English,English,Year 12,Final Exam,Post Exam Report,2024,VCEEU4AS2,VCEEEARC,VCEEEARCCTX,,"Her contention was that the values of the two businesses could be reconciled by reframing perceptions, and that such a compromise was a financial necessity.",12
English,English,Year 12,Final Exam,Post Exam Report,2024,VCEEU4AS2,VCEEEARC,VCEEEARCCTX,"As in previous sections of the exam, the task was designed to allow students multiple entry points so that they could demonstrate their skills to the best of their ability.",,13
