SubjectArea,Subject,Band,AssessmentType,AssessmentInformationDetails,AssessmentYears,UnitASCode,ExamReportCode,EQCode,SectionCode,StrategyType,ExamQuestion,ResponseSource,Content,Example,Sequence
Humanities,Sociology,Year 12,Final Exam,Post Exam Report,2024,,VCESOER,,VCESOERH,,,,All questions,,0
Humanities,Sociology,Year 12,Final Exam,Post Exam Report,2024,,VCESOER,,VCESOERER,EnhancedStrategies,General Comments,ExaminerCommentary,The 2024 Sociology examination included a range of interesting examples and case studies. Questions required students to apply their knowledge in very specific ways. Students who paid careful attention to the various parts of complex questions and command terms were able to produce high-scoring responses.,,1
Humanities,Sociology,Year 12,Final Exam,Post Exam Report,2024,,VCESOER,,VCESOERCM,,General Comments,ExaminerCommentary,"Stronger responses included material from primary and/or secondary sources. Ways to gather this type of information include interviewing research participants and summarising lectures, news articles, documentaries, podcasts and ABS statistical data. Therefore, students are encouraged to use multiple sources when exploring their case studies to ensure they can demonstrate understanding of the following assessment criteria for Section B:",,2
Humanities,Sociology,Year 12,Final Exam,Post Exam Report,2024,,VCESOER,,VCESOERCM,,General Comments,ExaminerCommentary,Use and/or evaluation of a range of relevant evidence/sources,,3
Humanities,Sociology,Year 12,Final Exam,Post Exam Report,2024,,VCESOER,,VCESOERCM,,General Comments,ExaminerCommentary,Synthesis of evidence to draw conclusions.,,4
Humanities,Sociology,Year 12,Final Exam,Post Exam Report,2024,,VCESOER,,VCESOERCM,,General Comments,ExaminerCommentary,"To ensure they are meeting the requirements of the Study Design, students are reminded:",,5
Humanities,Sociology,Year 12,Final Exam,Post Exam Report,2024,,VCESOER,,VCESOERCM,,General Comments,ExaminerCommentary,"Of the distinction between ethnicity and religion; while religion can be considered a non-material aspect of ethnicity, it is not considered an ethnicity in the context of the Study Design",,6
Humanities,Sociology,Year 12,Final Exam,Post Exam Report,2024,,VCESOER,,VCESOERCM,,General Comments,ExaminerCommentary,To explore current movements and to evidence their impact on social change from a range of sources. Movements like the Black Panthers can only be used as illustrative examples when discussing types of movements or the impact of violent/nonviolent tactics.,,7
Humanities,Sociology,Year 12,Final Exam,Post Exam Report,2024,,VCESOER,,VCESOERCM,,General Comments,ExaminerCommentary,"Students are reminded of the flow-on nature of multiple-part questions, where part b. follows from part a. For example, Question 9a. required students to describe a type of social movement, and Question 9b. required them to discuss the success of this movement. If students discussed a different movement in part b., marks could not be awarded. Outside these multiple-part questions, all questions are standalone. For example, Question 10 asked students to analyse how power was used by a social movement, and many students saw this as a follow-on from Questions 9a. and 9b. and therefore did not provide the context of the movement or its opposition.",,8
Humanities,Sociology,Year 12,Final Exam,Post Exam Report,2024,,VCESOER,,VCESOERCM,,General Comments,ExaminerCommentary,"In 2024, several areas of the new study design were assessed, with various levels of understanding displayed by students. While many students were able to demonstrate an understanding of Michel Maffesoli's theory of neo-tribes - loose-knit communities connected by shared interests that are flexible, fluid and less interdependent - the examples chosen did not reflect this type of community. Similarly, many students who were able to provide a general understanding of Erica Chenoweth's research into the nonviolent tactics used by social movements were not always able to succinctly link this to tactics used by their chosen social movement.",,9
Humanities,Sociology,Year 12,Final Exam,Post Exam Report,2024,,VCESOER,,VCESOERCM,,General Comments,ExaminerCommentary,"Note: Student responses reproduced in this report have not been corrected for grammar, spelling or factual information.",,10
Humanities,Sociology,Year 12,Final Exam,Post Exam Report,2024,,VCESOER,,VCESOERCM,,General Comments,ExaminerCommentary,"This report provides sample answers, or an indication of what answers may have been included. Unless otherwise stated, these are not intended to be exemplary or complete responses.",,11
Humanities,Sociology,Year 12,Final Exam,Post Exam Report,2024,,VCESOER,,VCESOERCM,,General Comments,ExaminerCommentary,The statistics in this report may be subject to rounding resulting in a total more or less than 100 per cent.,,12
Humanities,Sociology,Year 12,Final Exam,Post Exam Report,2024,,VCESOER,,VCESOERCM,,General Comments,ExaminerCommentary,2024 VCE Sociology external assessment report,,13
Humanities,Sociology,Year 12,Final Exam,Post Exam Report,2024,,VCESOER,VCESO24EQ1,VCESOERCM,,Question 1a,ExaminerCommentary,"This question required students to identify one example of practical reconciliation and one example of symbolic reconciliation from Representation 1. Students are reminded that the command term 'identify' means to recognise and name features or elements, and therefore no written explanation of their choice was needed for this response.",,14
Humanities,Sociology,Year 12,Final Exam,Post Exam Report,2024,,VCESOER,VCESO24EQ1,VCESOERCM,,Question 1a,ExaminerCommentary,"To be awarded full marks, students were required to:",,15
Humanities,Sociology,Year 12,Final Exam,Post Exam Report,2024,,VCESOER,VCESO24EQ1,VCESOERCM,,Question 1a,ExaminerCommentary,"Identify an example of practical reconciliation, such as Closing the Gap, the National Congress of First Nations People",,16
Humanities,Sociology,Year 12,Final Exam,Post Exam Report,2024,,VCESOER,VCESO24EQ1,VCESOERCM,,Question 1a,ExaminerCommentary,"Identify an example of symbolic reconciliation, such as Bridge Walks, Apology to the Stolen Generation.",,17
Humanities,Sociology,Year 12,Final Exam,Post Exam Report,2024,,VCESOER,VCESO24EQ1,VCESOERCM,,Question 1b,ExaminerCommentary,"This question required students to use the examples from Question 1a. to explain the difference between practical and symbolic reconciliation. Students generally answered this question well; however, some students failed to use the examples from Question 1a. to support their explanation.",,18
Humanities,Sociology,Year 12,Final Exam,Post Exam Report,2024,,VCESOER,VCESO24EQ1,VCESOERCM,,Question 1b,ExaminerCommentary,"To be awarded full marks, students were required to:",,19
Humanities,Sociology,Year 12,Final Exam,Post Exam Report,2024,,VCESOER,VCESO24EQ1,VCESOERCM,,Question 1b,ExaminerCommentary,Explain the difference between practical reconciliation (addressing inequalities between Indigenous and non-Indigenous Australians) and symbolic reconciliation (recognising historical injustices),,20
Humanities,Sociology,Year 12,Final Exam,Post Exam Report,2024,,VCESOER,VCESO24EQ1,VCESOERCM,,Question 1b,ExaminerCommentary,Use aspects of the examples identified in Question 1a. to support their explanation.,,21
Humanities,Sociology,Year 12,Final Exam,Post Exam Report,2024,,VCESOER,VCESO24EQ2,VCESOERCM,,Question 2,ExaminerCommentary,"This question required students to evaluate (make a judgement on) the success of the process of reconciliation since 2000 and use three examples from Representation 1 to support their contention. Students are reminded to follow the instructions in the questions and only provide three examples from the Representation. Many students were able to select appropriate examples from the representation, but did not connect their examples to the process of reconciliation.",,22
Humanities,Sociology,Year 12,Final Exam,Post Exam Report,2024,,VCESOER,VCESO24EQ2,VCESOERER,EnhancedStrategies,Question 2,ExaminerCommentary,Higher-scoring responses linked the chosen evidence to the process of reconciliation and efforts taken to improve the relationship between Indigenous and non-Indigenous peoples.,,23
Humanities,Sociology,Year 12,Final Exam,Post Exam Report,2024,,VCESOER,VCESO24EQ2,VCESOERCM,,Question 2,ExaminerCommentary,"To be awarded full marks, students were required to:",,24
Humanities,Sociology,Year 12,Final Exam,Post Exam Report,2024,,VCESOER,VCESO24EQ2,VCESOERER,EnhancedStrategies,Question 2,ExaminerCommentary,"Make a judgement / have a contention, for example, that the process of reconciliation has been successful, partially successful or not successful",,25
Humanities,Sociology,Year 12,Final Exam,Post Exam Report,2024,,VCESOER,VCESO24EQ2,VCESOERER,EnhancedStrategies,Question 2,ExaminerCommentary,Provide three examples since 2000 from Representation 1 to support their contention,,26
Humanities,Sociology,Year 12,Final Exam,Post Exam Report,2024,,VCESOER,VCESO24EQ2,VCESOERER,EnhancedStrategies,Question 2,ExaminerCommentary,"Explain how the evidence chosen supports their contention, with links to the process of reconciliation.",,27
Humanities,Sociology,Year 12,Final Exam,Post Exam Report,2024,,VCESOER,VCESO24EQ2,VCESOERER,EnhancedStrategies,Question 2,StudentResponse,"The following is an example of a high-scoring response, where the student explains the first piece of evidence well and links it to the process of reconciliation:","Reconciliation refers to the restoration of friendly relationships of mutual understanding and respect between Indigenous and non-Indigenous people. It is referred to as a process as it requires long term effort to heal the scars caused from decades of Indigenous inequality and injustice. The 'apology to the stolen generations' (2008) to a large extent was successful as it had enabled the traumatic history of Indigenous children to be acknowledged publicly. This allows Indigenous people to feel a sense of healing as their past suppression is not overlooked, rather it has enabled non-Indigenous people to adopt a culturally relativistic mindset of Indigenous culture and sympathise with their loss.",28
Humanities,Sociology,Year 12,Final Exam,Post Exam Report,2024,,VCESOER,VCESO24EQ3,VCESOERCM,,Question 3,ExaminerCommentary,"This question required students to examine the relationship between one issue related to Australian Indigenous cultures and changing public awareness (knowledge and understanding). As specified by the VCE Sociology Study Design, the issue selected must be from within the last 10 years. The 'Change the Date of Australia Day' campaign and repatriation of artefacts were both appropriate common choices. Misconceptions about Australian Indigenous culture, however, were not suitable.",,29
Humanities,Sociology,Year 12,Final Exam,Post Exam Report,2024,,VCESOER,VCESO24EQ3,VCESOERER,EnhancedStrategies,Question 3,ExaminerCommentary,Higher-scoring responses used sourced evidence to support their examination of how and in what way awareness of Australian Indigenous cultures has changed in response to the issue. Many students outlined an appropriate example of an issue but did not link it to changing awareness.,,30
Humanities,Sociology,Year 12,Final Exam,Post Exam Report,2024,,VCESOER,VCESO24EQ3,VCESOERCM,,Question 3,ExaminerCommentary,"To be awarded full marks, students were required to:",,31
Humanities,Sociology,Year 12,Final Exam,Post Exam Report,2024,,VCESOER,VCESO24EQ3,VCESOERER,EnhancedStrategies,Question 3,ExaminerCommentary,"Provide a thorough overview of the issue related to Australian Indigenous cultures, by, for example, outlining the nature of the issue and its historical and political context, and referring to significant Indigenous and non-Indigenous people",,32
Humanities,Sociology,Year 12,Final Exam,Post Exam Report,2024,,VCESOER,VCESO24EQ3,VCESOERER,EnhancedStrategies,Question 3,ExaminerCommentary,"Demonstrate an understanding of the term 'awareness' (that is, the level of knowledge about Australian Indigenous cultures)",,33
Humanities,Sociology,Year 12,Final Exam,Post Exam Report,2024,,VCESOER,VCESO24EQ3,VCESOERER,EnhancedStrategies,Question 3,ExaminerCommentary,Provide an examination of how awareness of Australian Indigenous cultures has changed or could be expected to change because of the issue,,34
Humanities,Sociology,Year 12,Final Exam,Post Exam Report,2024,,VCESOER,VCESO24EQ3,VCESOERER,EnhancedStrategies,Question 3,ExaminerCommentary,Use relevant sourced evidence to support their answer.,,35
Humanities,Sociology,Year 12,Final Exam,Post Exam Report,2024,,VCESOER,VCESO24EQ3,VCESOERER,EnhancedStrategies,Question 3,StudentResponse,The following is an example of a high-scoring response:,"The removal of Indigenous artefacts from First Nations peoples has had a pervading impact for 250 years. Due to the dispossession during colonisation, First Nations people have lost over 100,000 cultural artefacts and human remains to overseas collecting institutions such as the British Museum (AIATSIS, 2022) ... as a result, awareness, what is known or understood, about Aboriginal culture is severely limited ... therefore, this will increase public awareness of Indigenous culture, which one Gwewal man said would 'benefit [them] and [their] whole community' [SBS].",36
Humanities,Sociology,Year 12,Final Exam,Post Exam Report,2024,,VCESOER,VCESO24EQ4,VCESOERCM,,Question 4,ExaminerCommentary,"This question required students to explain how Australia's 2022 World Cup team is an example of contemporary multiculturalism in Australia, using two examples from Representation 2. Students needed to follow the instructions in the questions and only provide two examples from the representation.",,37
Humanities,Sociology,Year 12,Final Exam,Post Exam Report,2024,,VCESOER,VCESO24EQ4,VCESOERLR,LimitedStrategies,Question 4,ExaminerCommentary,"Some students discussed the age of the representation as their explanation for its contemporary nature. This, however, does not explain the contemporary nature of multiculturalism. Many students discussed inclusion in their responses. While inclusion is a by-product of the contemporary concept of multiculturalism, without making this link explicit, students were not addressing the question. Many students incorrectly discussed Australia's ethnic diversity. Ethnic diversity is a precursor to multiculturalism, but without making the connection between the two, students were unable to address the question.",,38
Humanities,Sociology,Year 12,Final Exam,Post Exam Report,2024,,VCESOER,VCESO24EQ4,VCESOERER,EnhancedStrategies,Question 4,ExaminerCommentary,Higher-scoring responses linked the chosen evidence to the contemporary concept of multiculturalism.,,39
Humanities,Sociology,Year 12,Final Exam,Post Exam Report,2024,,VCESOER,VCESO24EQ4,VCESOERCM,,Question 4,ExaminerCommentary,"To be awarded full marks, students were required to:",,40
Humanities,Sociology,Year 12,Final Exam,Post Exam Report,2024,,VCESOER,VCESO24EQ4,VCESOERER,EnhancedStrategies,Question 4,ExaminerCommentary,"Demonstrate an understanding of the contemporary concept of multiculturalism in Australia, that is, many cultures/ethnicities living together peacefully",,41
Humanities,Sociology,Year 12,Final Exam,Post Exam Report,2024,,VCESOER,VCESO24EQ4,VCESOERER,EnhancedStrategies,Question 4,ExaminerCommentary,Select two relevant examples from the representation,,42
Humanities,Sociology,Year 12,Final Exam,Post Exam Report,2024,,VCESOER,VCESO24EQ4,VCESOERER,EnhancedStrategies,Question 4,ExaminerCommentary,Explain the relationship between their examples and aspects of the concept of multiculturalism.,,43
Humanities,Sociology,Year 12,Final Exam,Post Exam Report,2024,,VCESOER,VCESO24EQ4,VCESOERER,EnhancedStrategies,Question 4,StudentResponse,The following is an example of a high-scoring response:,"The Australian Institute of Multicultural Affairs aims to promote mutual respect and understanding about different cultures, demonstrated by a team that is 'diverse and unity' demonstrating that players come from a variety of ethnicities, and value each others' differences.",44
Humanities,Sociology,Year 12,Final Exam,Post Exam Report,2024,,VCESOER,VCESO24EQ5,VCESOERCM,,Question 5,ExaminerCommentary,"This question required students to explain how the make-up of Australia's 2022 World Cup team could have enabled a sense of inclusion for ethnic communities in Australia, using two examples from Representation 2. Students needed to follow the instructions in the question and only provide two examples from the representation.",,45
Humanities,Sociology,Year 12,Final Exam,Post Exam Report,2024,,VCESOER,VCESO24EQ5,VCESOERCM,,Question 5,ExaminerCommentary,Many students were able to select appropriate evidence. Some students discussed the multicultural nature of the team without connecting this to its impact on inclusion. Some students were not able to make the connection to ethnic communities but rather spoke about communities overseas or the individual players.,,46
Humanities,Sociology,Year 12,Final Exam,Post Exam Report,2024,,VCESOER,VCESO24EQ5,VCESOERER,EnhancedStrategies,Question 5,ExaminerCommentary,Higher-scoring responses linked the chosen evidence to the sense of inclusion for ethnic communities in Australia.,,47
Humanities,Sociology,Year 12,Final Exam,Post Exam Report,2024,,VCESOER,VCESO24EQ5,VCESOERCM,,Question 5,ExaminerCommentary,"To be awarded full marks, students were required to:",,48
Humanities,Sociology,Year 12,Final Exam,Post Exam Report,2024,,VCESOER,VCESO24EQ5,VCESOERER,EnhancedStrategies,Question 5,ExaminerCommentary,"Demonstrate an understanding of inclusion, that is, being made to feel a part of society through having equal access to the resources and opportunities in society",,49
Humanities,Sociology,Year 12,Final Exam,Post Exam Report,2024,,VCESOER,VCESO24EQ5,VCESOERER,EnhancedStrategies,Question 5,ExaminerCommentary,Select two relevant examples from the representation,,50
Humanities,Sociology,Year 12,Final Exam,Post Exam Report,2024,,VCESOER,VCESO24EQ5,VCESOERER,EnhancedStrategies,Question 5,ExaminerCommentary,Explain the relationship between their examples and inclusion for ethnic communities.,,51
Humanities,Sociology,Year 12,Final Exam,Post Exam Report,2024,,VCESOER,VCESO24EQ5,VCESOERER,EnhancedStrategies,Question 5,StudentResponse,The following is an example of a high-scoring response:,"Inclusion refers to the ability to engage, participate and have a voice in society. Considering that the 'Socceroos' offers a 'space for migrant communities' it could make ethnically diverse people feel as if they belong in Australian society. As people see the 'representation of athletes with diverse background', it allows people to feel as if their ethnicity is seen, valued and welcomed in Australia.",52
Humanities,Sociology,Year 12,Final Exam,Post Exam Report,2024,,VCESOER,VCESO24EQ6,VCESOERCM,,Question 6,ExaminerCommentary,This question required students to analyse the relationship between responses to cultural practices and the process of othering. Students were required to use examples from two or more ethnic groups studied throughout the year.,,53
Humanities,Sociology,Year 12,Final Exam,Post Exam Report,2024,,VCESOER,VCESO24EQ6,VCESOERCM,,Question 6,ExaminerCommentary,"Many students were able to discuss the processing of othering, but did not connect this to cultural processes, instead connecting this process to media representations or political factors.",,54
Humanities,Sociology,Year 12,Final Exam,Post Exam Report,2024,,VCESOER,VCESO24EQ6,VCESOERER,EnhancedStrategies,Question 6,ExaminerCommentary,"Higher-scoring responses referred to specific ethnic groups (such as Chinese Australians) rather than religious groups (like Muslims or the Jewish community) and used sourced evidence (primary and/or secondary) to support their analysis. Higher-scoring responses also referred to specific cultural practices; that is, rather than discussing traditional clothing within South Sudanese culture, they discussed the thoub for women and jalabiya for both men and women.",,55
Humanities,Sociology,Year 12,Final Exam,Post Exam Report,2024,,VCESOER,VCESO24EQ6,VCESOERCM,,Question 6,ExaminerCommentary,"To be awarded full marks, students were required to:",,56
Humanities,Sociology,Year 12,Final Exam,Post Exam Report,2024,,VCESOER,VCESO24EQ6,VCESOERER,EnhancedStrategies,Question 6,ExaminerCommentary,"Demonstrate an understanding of the process of othering - the rejection of / opposition to some or many elements of a minority culture, which leads to that culture being labelled as different from the dominant culture",,57
Humanities,Sociology,Year 12,Final Exam,Post Exam Report,2024,,VCESOER,VCESO24EQ6,VCESOERER,EnhancedStrategies,Question 6,ExaminerCommentary,"Demonstrate an understanding of cultural practices, behaviours, activities and customs of a particular culture",,58
Humanities,Sociology,Year 12,Final Exam,Post Exam Report,2024,,VCESOER,VCESO24EQ6,VCESOERER,EnhancedStrategies,Question 6,ExaminerCommentary,Provide a description of two or more ethnic groups and relevant cultural practices,,59
Humanities,Sociology,Year 12,Final Exam,Post Exam Report,2024,,VCESOER,VCESO24EQ6,VCESOERER,EnhancedStrategies,Question 6,ExaminerCommentary,Provide an analysis of the relationship between the response to the cultural practices and the process of othering,,60
Humanities,Sociology,Year 12,Final Exam,Post Exam Report,2024,,VCESOER,VCESO24EQ6,VCESOERER,EnhancedStrategies,Question 6,ExaminerCommentary,Use relevant sourced evidence to support their answer.,,61
Humanities,Sociology,Year 12,Final Exam,Post Exam Report,2024,,VCESOER,VCESO24EQ6,VCESOERER,EnhancedStrategies,Question 6,StudentResponse,The following is an example of a high-scoring response:,"Bosnian Australians celebrating the three-day festival called 'Borjam Ronaanzachi' often feel excluded by the Australian population as they are judged for their cultural practices. My participant stated that when celebrating Borjan they were 'laughed at because of [their] traditional attire', this exacerbated the process of othering as they were ostracised and alienated due to their cultural differences.",62
Humanities,Sociology,Year 12,Final Exam,Post Exam Report,2024,,VCESOER,VCESO24EQ7,VCESOERCM,,Question 7a,ExaminerCommentary,"This question required students to describe Michael Maffesoli's theory of 'neo-tribes', using an example.",,63
Humanities,Sociology,Year 12,Final Exam,Post Exam Report,2024,,VCESOER,VCESO24EQ7,VCESOERCM,,Question 7a,ExaminerCommentary,"Many students were able to demonstrate their understanding of a neo-tribe but did not provide an appropriate example. For instance, many students used a local sporting group and were therefore unable to successfully link the characteristics of a neo-tribe to the group, such as the community being fluid and community members having less reliance on one another.",,64
Humanities,Sociology,Year 12,Final Exam,Post Exam Report,2024,,VCESOER,VCESO24EQ7,VCESOERER,EnhancedStrategies,Question 7a,ExaminerCommentary,Higher-scoring responses successfully linked the characteristics of neo-tribes to their example.,,65
Humanities,Sociology,Year 12,Final Exam,Post Exam Report,2024,,VCESOER,VCESO24EQ7,VCESOERCM,,Question 7a,ExaminerCommentary,"To be awarded full marks, students were required to:",,66
Humanities,Sociology,Year 12,Final Exam,Post Exam Report,2024,,VCESOER,VCESO24EQ7,VCESOERER,EnhancedStrategies,Question 7a,ExaminerCommentary,Demonstrate an understanding of the concept of neo-tribes - a loose-knit 'community' connected by a shared interest - and the idea of belonging or shared identity that is flexible and fluid and where there is less interdependence between members,,67
Humanities,Sociology,Year 12,Final Exam,Post Exam Report,2024,,VCESOER,VCESO24EQ7,VCESOERER,EnhancedStrategies,Question 7a,ExaminerCommentary,"Name a community group that can be identified as a neo-tribe, such as gamers or cosplayers",,68
Humanities,Sociology,Year 12,Final Exam,Post Exam Report,2024,,VCESOER,VCESO24EQ7,VCESOERER,EnhancedStrategies,Question 7a,ExaminerCommentary,Connect the characteristics of a neo-tribe to the group identified.,,69
Humanities,Sociology,Year 12,Final Exam,Post Exam Report,2024,,VCESOER,VCESO24EQ7,VCESOERER,EnhancedStrategies,Question 7a,StudentResponse,The following is an example of a high-scoring response:,"Michel Maffesoli noted the emergence of neo-tribes as a response to a rise of individualism as well as the digital revolution. Neo-tribes refer to groups that are fluid and interest based, as demonstrated by the 2017 YouTube documentary Assassin's creed: Beyond the creed, in which members reveal that they can 'join whenever they have the time' affirming the fluidity characterised by neo-tribes, as they are extremely independent-based, and people can choose how much they want to engage. Moreover Maffesoli's neo-tribes often cause the return of the 'eternal child', further demonstrated by the gamers who long to 'have fun in their free time'.",70
Humanities,Sociology,Year 12,Final Exam,Post Exam Report,2024,,VCESOER,VCESO24EQ7,VCESOERCM,,Question 7b,ExaminerCommentary,"This question required students to compare (that is, identify the similarities and differences between) Ferdinand Tönnies's and Michel Maffesoli's theories of community. Students were also required to use examples to support their comparison.",,71
Humanities,Sociology,Year 12,Final Exam,Post Exam Report,2024,,VCESOER,VCESO24EQ7,VCESOERCM,,Question 7b,ExaminerCommentary,Many students were able to demonstrate an understanding of both Maffesoli's and Tönnies's theories of community but did not provide a comparison of these theories.,,72
Humanities,Sociology,Year 12,Final Exam,Post Exam Report,2024,,VCESOER,VCESO24EQ7,VCESOERCM,,Question 7b,ExaminerCommentary,"To be awarded full marks, students were required to:",,73
