SubjectArea,Subject,Band,AssessmentType,AssessmentInformationDetails,AssessmentYears,UnitASCode,ExamReportCode,EQCode,SectionCode,StrategyType,ExamQuestion,ResponseSource,Content,Example,Sequence
Humanities,Sociology,Year 12,Final Exam,Post Exam Report,2024,,VCESOER,VCESO24EQ7,VCESOERCM,,Question 7b,ExaminerCommentary,Demonstrate an understanding of Tönnies's theory of community (Gemeinschaft to Gesellschaft),,74
Humanities,Sociology,Year 12,Final Exam,Post Exam Report,2024,,VCESOER,VCESO24EQ7,VCESOERCM,,Question 7b,ExaminerCommentary,Demonstrate an understanding of Maffesoli's theory of neo-tribes,,75
Humanities,Sociology,Year 12,Final Exam,Post Exam Report,2024,,VCESOER,VCESO24EQ7,VCESOERCM,,Question 7b,ExaminerCommentary,Explore the similarities between the theories,,76
Humanities,Sociology,Year 12,Final Exam,Post Exam Report,2024,,VCESOER,VCESO24EQ7,VCESOERCM,,Question 7b,ExaminerCommentary,Explore the differences between the theories,,77
Humanities,Sociology,Year 12,Final Exam,Post Exam Report,2024,,VCESOER,VCESO24EQ7,VCESOERCM,,Question 7b,ExaminerCommentary,Use examples to support their comparison.,,78
Humanities,Sociology,Year 12,Final Exam,Post Exam Report,2024,,VCESOER,VCESO24EQ7,VCESOERER,EnhancedStrategies,Question 7b,StudentResponse,The following is an example of a high-scoring response:,"Both Tönnies and Maffesoli's theories arise from an identification of a shift in behaviour over time, in an attempt to understand human behaviour and community. While Tönnies identified a shift from an agrarian economy to one dominated by industry and factory during industrialisation and urbanisation during the industrial revolution, Maffesoli identified a shift during a post-modern world created by individualism.",79
Humanities,Sociology,Year 12,Final Exam,Post Exam Report,2024,,VCESOER,VCESO24EQ8,VCESOERCM,,Question 8,ExaminerCommentary,"This question required students to analyse the interplay between ICT and feelings of belonging, and how this interplay influences the experience of a community studied this year. Students were required to use two examples to support their analysis.",,80
Humanities,Sociology,Year 12,Final Exam,Post Exam Report,2024,,VCESOER,VCESO24EQ8,VCESOERCM,,Question 8,ExaminerCommentary,"Many students discussed an appropriate community. However, it was clear that some students were drawing from only one source, such as one documentary, and this limited their ability to provide multiple examples and a strong analysis. It is recommended that students study multiple sources when completing their case study.",,81
Humanities,Sociology,Year 12,Final Exam,Post Exam Report,2024,,VCESOER,VCESO24EQ8,VCESOERER,EnhancedStrategies,Question 8,ExaminerCommentary,Higher-scoring responses used sourced evidence to support their analysis of the interplay between ICT and the feelings of belonging and experience of community.,,82
Humanities,Sociology,Year 12,Final Exam,Post Exam Report,2024,,VCESOER,VCESO24EQ8,VCESOERCM,,Question 8,ExaminerCommentary,"To be awarded full marks, students were required to:",,83
Humanities,Sociology,Year 12,Final Exam,Post Exam Report,2024,,VCESOER,VCESO24EQ8,VCESOERER,EnhancedStrategies,Question 8,ExaminerCommentary,"Provide a thorough overview of the selected community, including its name, location and how the group identifies itself",,84
Humanities,Sociology,Year 12,Final Exam,Post Exam Report,2024,,VCESOER,VCESO24EQ8,VCESOERER,EnhancedStrategies,Question 8,ExaminerCommentary,"Demonstrate an understanding of belonging and feeling accepted, secure and supported within a community",,85
Humanities,Sociology,Year 12,Final Exam,Post Exam Report,2024,,VCESOER,VCESO24EQ8,VCESOERER,EnhancedStrategies,Question 8,ExaminerCommentary,Demonstrate an understanding of the experience of community and active participation in a meaningful way,,86
Humanities,Sociology,Year 12,Final Exam,Post Exam Report,2024,,VCESOER,VCESO24EQ8,VCESOERER,EnhancedStrategies,Question 8,ExaminerCommentary,Provide an analysis of the relationship between the use of ICT and feelings of belonging and the experience of community,,87
Humanities,Sociology,Year 12,Final Exam,Post Exam Report,2024,,VCESOER,VCESO24EQ8,VCESOERER,EnhancedStrategies,Question 8,ExaminerCommentary,Provide two well-chosen examples to support their analysis,,88
Humanities,Sociology,Year 12,Final Exam,Post Exam Report,2024,,VCESOER,VCESO24EQ8,VCESOERER,EnhancedStrategies,Question 8,ExaminerCommentary,Use relevant sourced evidence to support their answer.,,89
Humanities,Sociology,Year 12,Final Exam,Post Exam Report,2024,,VCESOER,VCESO24EQ8,VCESOERER,EnhancedStrategies,Question 8,StudentResponse,The following is an example of a high-scoring response:,"The Australian Youth Band uses ICT through message chains on group chats between members. This fosters interaction and communication and the formation of close, interpersonal relationships as there is mutual bonding through ICT.",90
Humanities,Sociology,Year 12,Final Exam,Post Exam Report,2024,,VCESOER,VCESO24EQ8,VCESOERER,EnhancedStrategies,Question 8,StudentResponse,,"Contrastingly, the use of ICT can create a digital divide amongst members, causing division and negative experiences of community. An anonymous source through primary research reported that they 'couldn't use Facebook at all' as her fellow Australian Youth Band members, resulting in alienation as it decreases interconnectedness with the band/community.",91
Humanities,Sociology,Year 12,Final Exam,Post Exam Report,2024,,VCESOER,VCESO24EQ9,VCESOERCM,,Question 9a,ExaminerCommentary,"This question required students to describe a social movement, including its type and current stage, using relevant evidence.",,92
Humanities,Sociology,Year 12,Final Exam,Post Exam Report,2024,,VCESOER,VCESO24EQ9,VCESOERCM,,Question 9a,ExaminerCommentary,"As classifying movements can be subjective, it was important that students justify their classification to demonstrate their understanding.",,93
Humanities,Sociology,Year 12,Final Exam,Post Exam Report,2024,,VCESOER,VCESO24EQ9,VCESOERER,EnhancedStrategies,Question 9a,ExaminerCommentary,"Higher-scoring responses provided a description of the key characteristics of the type and stage of the movement, rather than just identifying their chosen movement.",,94
Humanities,Sociology,Year 12,Final Exam,Post Exam Report,2024,,VCESOER,VCESO24EQ9,VCESOERCM,,Question 9a,ExaminerCommentary,"To be awarded full marks, students were required to:",,95
Humanities,Sociology,Year 12,Final Exam,Post Exam Report,2024,,VCESOER,VCESO24EQ9,VCESOERER,EnhancedStrategies,Question 9a,ExaminerCommentary,"Provide an overview of one social movement, including its name and aims",,96
Humanities,Sociology,Year 12,Final Exam,Post Exam Report,2024,,VCESOER,VCESO24EQ9,VCESOERER,EnhancedStrategies,Question 9a,ExaminerCommentary,Describe the type of movement,,97
Humanities,Sociology,Year 12,Final Exam,Post Exam Report,2024,,VCESOER,VCESO24EQ9,VCESOERER,EnhancedStrategies,Question 9a,ExaminerCommentary,Describe the stage of the movement,,98
Humanities,Sociology,Year 12,Final Exam,Post Exam Report,2024,,VCESOER,VCESO24EQ9,VCESOERER,EnhancedStrategies,Question 9a,ExaminerCommentary,Use relevant evidence to support their description.,,99
Humanities,Sociology,Year 12,Final Exam,Post Exam Report,2024,,VCESOER,VCESO24EQ9,VCESOERER,EnhancedStrategies,Question 9a,StudentResponse,The following is an example of a high-scoring response that addresses all components of the question:,"The Black Lives Matter (BLM) movement is a reformative movement as it seeks limited change within existing political systems in society. Such that they call for altering reforms under criminal justice system that addresses police brutality and systematic racism of Black people. In addition, it does not target individuals rather the society as a whole specifically the government and police.",100
Humanities,Sociology,Year 12,Final Exam,Post Exam Report,2024,,VCESOER,VCESO24EQ9,VCESOERER,EnhancedStrategies,Question 9a,StudentResponse,,"The current stage of the movement is bureaucratisation as it is characterised by high levels of organisation and strategy carried out within formal structures as they maintain strong relationships with the NBA and US democratic party. In addition have a large following seen through the George Floyd protest having 20,000+ protestors (ABC, 2020).",101
Humanities,Sociology,Year 12,Final Exam,Post Exam Report,2024,,VCESOER,VCESO24EQ9,VCESOERCM,,Question 9b,ExaminerCommentary,This question required students to evaluate (make a judgement on) the social change achieved by the movement identified in Question 9a. Students were required to reference the work of Chenoweth and use two examples to support their evaluation.,,102
Humanities,Sociology,Year 12,Final Exam,Post Exam Report,2024,,VCESOER,VCESO24EQ9,VCESOERCM,,Question 9b,ExaminerCommentary,Students are reminded that Chenoweth uses they/them pronouns.,,103
Humanities,Sociology,Year 12,Final Exam,Post Exam Report,2024,,VCESOER,VCESO24EQ9,VCESOERCM,,Question 9b,ExaminerCommentary,"Many students erroneously attributed the duration of the movement to its lack of success, stating that as the movement has been going for longer than two years, it could not be considered successful according to Chenoweth's arguments. While in their analysis Chenoweth defined complete success as happening within two years, their work is not predictive and therefore does not mean that movements that continue for longer than two years will not achieve social change.",,104
Humanities,Sociology,Year 12,Final Exam,Post Exam Report,2024,,VCESOER,VCESO24EQ9,VCESOERCM,,Question 9b,ExaminerCommentary,"Many students were able to provide an understanding that nonviolent movements are more likely to be successful than violent movements, however misattributed the extent of this difference.",,105
Humanities,Sociology,Year 12,Final Exam,Post Exam Report,2024,,VCESOER,VCESO24EQ9,VCESOERER,EnhancedStrategies,Question 9b,ExaminerCommentary,High-scoring responses were able to connect their examples to Chenoweth's theory.,,106
Humanities,Sociology,Year 12,Final Exam,Post Exam Report,2024,,VCESOER,VCESO24EQ9,VCESOERCM,,Question 9b,ExaminerCommentary,"To be awarded full marks, students were required to:",,107
Humanities,Sociology,Year 12,Final Exam,Post Exam Report,2024,,VCESOER,VCESO24EQ9,VCESOERER,EnhancedStrategies,Question 9b,ExaminerCommentary,"Provide a judgement (movement was successful, not successful or partially successful)",,108
Humanities,Sociology,Year 12,Final Exam,Post Exam Report,2024,,VCESOER,VCESO24EQ9,VCESOERER,EnhancedStrategies,Question 9b,ExaminerCommentary,"Provide an overview of Chenoweth's work, including their claims that nonviolent civil resistance more often leads to successful social change, as it is often more inclusive",,109
Humanities,Sociology,Year 12,Final Exam,Post Exam Report,2024,,VCESOER,VCESO24EQ9,VCESOERER,EnhancedStrategies,Question 9b,ExaminerCommentary,Provide an outline of two strategies used by the movement to achieve change,,110
Humanities,Sociology,Year 12,Final Exam,Post Exam Report,2024,,VCESOER,VCESO24EQ9,VCESOERER,EnhancedStrategies,Question 9b,ExaminerCommentary,Link the strategies outlined to Chenoweth's work,,111
Humanities,Sociology,Year 12,Final Exam,Post Exam Report,2024,,VCESOER,VCESO24EQ9,VCESOERER,EnhancedStrategies,Question 9b,ExaminerCommentary,Link the strategies to their contention.,,112
Humanities,Sociology,Year 12,Final Exam,Post Exam Report,2024,,VCESOER,VCESO24EQ9,VCESOERER,EnhancedStrategies,Question 9b,StudentResponse,The following is an example of a high-scoring response:,"Erica Chenoweth's research discovered that movements that carry out non-violent resistant tactics have higher success rate of 53% compared to violent (26%). The Black Lives Matter (BLM) movement adopted non-violent tactics such as protests which were 87.5% peaceful (ARC, 2020), boycotts and sit-ins. As a result the protests and mass media coverage being the forefront of non-violent resistance as Erica argues will result in success. Allowed the BLM to gain great success as the police reform bill was passed making it easier to prosecute police for misconduct, ban chokehold and compulsory wearing of bodycams, thus achieving their goal of addressing police brutality.",113
Humanities,Sociology,Year 12,Final Exam,Post Exam Report,2024,,VCESOER,VCESO24EQ10,VCESOERCM,,Question 10,ExaminerCommentary,This question required students to analyse how power was used by a social movement's opposition to attempt to prevent the movement from achieving its desired social change.,,114
Humanities,Sociology,Year 12,Final Exam,Post Exam Report,2024,,VCESOER,VCESO24EQ10,VCESOERCM,,Question 10,ExaminerCommentary,Many students did not provide an overview of the movement or its opposition and therefore were only able to make superficial connections between the use of power and attempts to prevent the movement from achieving its desired social change.,,115
Humanities,Sociology,Year 12,Final Exam,Post Exam Report,2024,,VCESOER,VCESO24EQ10,VCESOERER,EnhancedStrategies,Question 10,ExaminerCommentary,"Higher-scoring responses explored a current social movement, such as Black Lives Matter, rather than a historical movement and used sourced evidence to support their analysis of the use of power by the movement's opposition to attempt to prevent the movement from achieving social change. Higher-scoring responses were also able to explore the use of the police by government as a form of opposition, rather than a form of opposition in and of themselves.",,116
Humanities,Sociology,Year 12,Final Exam,Post Exam Report,2024,,VCESOER,VCESO24EQ10,VCESOERCM,,Question 10,ExaminerCommentary,"To be awarded full marks, students were required to:",,117
Humanities,Sociology,Year 12,Final Exam,Post Exam Report,2024,,VCESOER,VCESO24EQ10,VCESOERER,EnhancedStrategies,Question 10,ExaminerCommentary,"Provide a thorough overview of the social movement (nature, aim, type and stage) and its opposition",,118
Humanities,Sociology,Year 12,Final Exam,Post Exam Report,2024,,VCESOER,VCESO24EQ10,VCESOERER,EnhancedStrategies,Question 10,ExaminerCommentary,Demonstrate an understanding of different types of power,,119
Humanities,Sociology,Year 12,Final Exam,Post Exam Report,2024,,VCESOER,VCESO24EQ10,VCESOERER,EnhancedStrategies,Question 10,ExaminerCommentary,Provide an analysis of how the use of power by the opposition attempted to prevent the movement from achieving its desired social change,,120
Humanities,Sociology,Year 12,Final Exam,Post Exam Report,2024,,VCESOER,VCESO24EQ10,VCESOERER,EnhancedStrategies,Question 10,ExaminerCommentary,Use relevant sourced evidence to support their answer.,,121
Humanities,Sociology,Year 12,Final Exam,Post Exam Report,2024,,VCESOER,VCESO24EQ10,VCESOERER,EnhancedStrategies,Question 10,StudentResponse,The following is an example of a high-scoring response:,The National Farmers Federation (NFF) publicly opposed the goal of AA. They have used French and Raven information informational power to control what information is given to the public and to attempt to control their opinions and prevent AA from achieving a ban on all live exports ... NFF also use the formal coercive power by guilting people with the belief that a ban will be 'taking away many farmers main form of income' and that only unrealistic and selfish people would do such a thing.,122
Humanities,Sociology,Year 12,Final Exam,Post Exam Report,2025,,VCESOER,,VCESOERH,,,,All questions,,0
Humanities,Sociology,Year 12,Final Exam,Post Exam Report,2025,,VCESOER,,VCESOERCM,,General Comments,ExaminerCommentary,2025 VCE Sociology external assessment report,,1
Humanities,Sociology,Year 12,Final Exam,Post Exam Report,2025,,VCESOER,,VCESOERCM,,General Comments,ExaminerCommentary,"Note: Student responses reproduced in this report have not been corrected for grammar, spelling or factual information.",,2
Humanities,Sociology,Year 12,Final Exam,Post Exam Report,2025,,VCESOER,,VCESOERCM,,General Comments,ExaminerCommentary,"This report provides sample answers, or an indication of what answers may have included. Unless otherwise stated, these are not intended to be exemplary or complete responses.",,3
Humanities,Sociology,Year 12,Final Exam,Post Exam Report,2025,,VCESOER,,VCESOERCM,,General Comments,ExaminerCommentary,The statistics in this report may be subject to rounding resulting in a total more or less than 100 per cent.,,4
Humanities,Sociology,Year 12,Final Exam,Post Exam Report,2025,,VCESOER,,VCESOERCM,,General Comments,ExaminerCommentary,Question 1,,5
Humanities,Sociology,Year 12,Final Exam,Post Exam Report,2025,,VCESOER,,VCESOERER,EnhancedStrategies,General Comments,ExaminerCommentary,This question required students to demonstrate an understanding of the misconception that all Australian Indigenous people share one culture and to provide examples from Australian Indigenous cultures. Higher-scoring responses were able to draw from material and non-material cultures to demonstrate the reality that there are multiple Australian Indigenous cultures and explain how the evidence used supports the reality that there are multiple Australian Indigenous cultures.,,6
Humanities,Sociology,Year 12,Final Exam,Post Exam Report,2025,,VCESOER,,VCESOERCM,,General Comments,ExaminerCommentary,To be awarded full marks students were required to:,,7
Humanities,Sociology,Year 12,Final Exam,Post Exam Report,2025,,VCESOER,,VCESOERCM,,General Comments,ExaminerCommentary,Explain the public misconception that Australian Indigenous people share one culture,,8
Humanities,Sociology,Year 12,Final Exam,Post Exam Report,2025,,VCESOER,,VCESOERCM,,General Comments,ExaminerCommentary,Explain the origins of the misconception,,9
Humanities,Sociology,Year 12,Final Exam,Post Exam Report,2025,,VCESOER,,VCESOERCM,,General Comments,ExaminerCommentary,Explain why it is a misconception,,10
Humanities,Sociology,Year 12,Final Exam,Post Exam Report,2025,,VCESOER,,VCESOERCM,,General Comments,ExaminerCommentary,Use examples from Australian Indigenous cultures to explain the reality that there are multiple Australian Indigenous cultures.,,11
Humanities,Sociology,Year 12,Final Exam,Post Exam Report,2025,,VCESOER,,VCESOERER,EnhancedStrategies,General Comments,ExaminerCommentary,The following is an example of a high-scoring response that has effectively used evidence from multiple Indigenous cultures to demonstrate that there are multiple Australian Indigenous cultures:,,12
Humanities,Sociology,Year 12,Final Exam,Post Exam Report,2025,,VCESOER,,VCESOERCM,,General Comments,ExaminerCommentary,"The misconception that all Indigenous people share one culture has numerous sources, including the failure of the media to describe the specific cultural group of Indigenous people, which has ""contributed to people seeing an Aboriginal woman...rather than a 'Noongar' woman"" (Creative Spirits, 2022)...In reality, Indigenous people belong to a diverse and huge range of cultural groups, seen through their variety of languages, of which 167 Indigenous languages are still spoken today (ABS, 2021). Furthermore, these groups have different material and non-material culture, such as the Koori Bunjil and the Yolungu people Rainbow Serpent. Thus, the misconception is false and Indigenous people belong to a range of diverse cultures.",,13
Humanities,Sociology,Year 12,Final Exam,Post Exam Report,2025,,VCESOER,,VCESOERCM,,General Comments,ExaminerCommentary,Question 2,,14
Humanities,Sociology,Year 12,Final Exam,Post Exam Report,2025,,VCESOER,,VCESOERER,EnhancedStrategies,General Comments,ExaminerCommentary,"This question required students to apply Charles Wright Mills's concept of the sociological imagination to Representations 1a and 1b. Many students were able to demonstrate an understanding of Mills's concept and to select appropriate evidence from the representations provided; however, the connection between their evidence was not always explained. Many students incorrectly applied Evan Willis's framework to the representations, which did not fulfil the demands of the question. Higher-scoring responses were able to tease out how the personal struggles of Indigenous Australians (e.g. dispossession, abuse) are connected to broader public issues like national identity, systemic inequality and the denial of their rightful place in Australian society.",,15
Humanities,Sociology,Year 12,Final Exam,Post Exam Report,2025,,VCESOER,,VCESOERCM,,General Comments,ExaminerCommentary,To be awarded full marks students needed to:,,16
Humanities,Sociology,Year 12,Final Exam,Post Exam Report,2025,,VCESOER,,VCESOERCM,,General Comments,ExaminerCommentary,Demonstrate an understanding of the sociological imagination as conceived of by Charles Wright Mills as 'an awareness of the relationship between personal experience and wider society ... emphasis[ing] the importance of seeing the connections between social structures or public issues and individual experience or personal troubles' (Sociology Study Design),,17
Humanities,Sociology,Year 12,Final Exam,Post Exam Report,2025,,VCESOER,,VCESOERCM,,General Comments,ExaminerCommentary,Demonstrate an understanding of public awareness (knowledge and understanding),,18
Humanities,Sociology,Year 12,Final Exam,Post Exam Report,2025,,VCESOER,,VCESOERCM,,General Comments,ExaminerCommentary,Apply the sociological imagination to Representations 1a and 1b.,,19
Humanities,Sociology,Year 12,Final Exam,Post Exam Report,2025,,VCESOER,,VCESOERER,EnhancedStrategies,General Comments,ExaminerCommentary,The following is an example of a high-scoring response that has effectively connected their evidence to Mills' concept of the sociological imagination:,,20
Humanities,Sociology,Year 12,Final Exam,Post Exam Report,2025,,VCESOER,,VCESOERCM,,General Comments,ExaminerCommentary,"In representation 1a, it shows that Indigenous Australians have suffered ""two centuries of dispossession and abuse"". The sociological imagination helps us to understand that this is due to social structures such as the Australian governments incessant attempts to absorb Australian indigenous cultures into the dominant Anglo Celtic culture and thus led to the personal experiences of first nations individuals experiencing abuse and feeling disconnected from country.",,21
Humanities,Sociology,Year 12,Final Exam,Post Exam Report,2025,,VCESOER,,VCESOERCM,,General Comments,ExaminerCommentary,"In representation 1b, CW mills sociological imagination can show awareness (knowledge and understanding) of the experiences of Australian indigenous people as it can help to emphasise how the social structures of the Australian government and how European colonisers took the land for the British crown led to the personal experience of the Wurundjeri people feeling displaced.",,22
Humanities,Sociology,Year 12,Final Exam,Post Exam Report,2025,,VCESOER,,VCESOERCM,,General Comments,ExaminerCommentary,Question 3,,23
Humanities,Sociology,Year 12,Final Exam,Post Exam Report,2025,,VCESOER,,VCESOERCM,,General Comments,ExaminerCommentary,This question required students to present a balanced argument about why people may have different views (opinions and stereotypes) on reconciliation. Within this discussion students needed to demonstrate an example of both practical reconciliation (addressing inequalities between Indigenous and non-Indigenous Australians) and symbolic reconciliation (recognising historical injustices).,,24
Humanities,Sociology,Year 12,Final Exam,Post Exam Report,2025,,VCESOER,,VCESOERCM,,General Comments,ExaminerCommentary,"Discussions about the student's case study into initiatives to increase awareness of Australian Indigenous cultures, including the Change the Date campaign, did not allow students to sufficiently address the demands of the question.",,25
Humanities,Sociology,Year 12,Final Exam,Post Exam Report,2025,,VCESOER,,VCESOERCM,,General Comments,ExaminerCommentary,To be awarded full marks students needed to:,,26
Humanities,Sociology,Year 12,Final Exam,Post Exam Report,2025,,VCESOER,,VCESOERCM,,General Comments,ExaminerCommentary,Demonstrate an understanding of the process of reconciliation (actions that have been executed to address the healing of Indigenous Australians),,27
Humanities,Sociology,Year 12,Final Exam,Post Exam Report,2025,,VCESOER,,VCESOERCM,,General Comments,ExaminerCommentary,Provide an explanation of both practical and symbolic reconciliation with appropriate examples,,28
Humanities,Sociology,Year 12,Final Exam,Post Exam Report,2025,,VCESOER,,VCESOERCM,,General Comments,ExaminerCommentary,Provide a discussion on how/why views (opinions and stereotypes) on reconciliation may differ,,29
Humanities,Sociology,Year 12,Final Exam,Post Exam Report,2025,,VCESOER,,VCESOERCM,,General Comments,ExaminerCommentary,Synthesise a range of relevant evidence/sources to draw conclusions.,,30
Humanities,Sociology,Year 12,Final Exam,Post Exam Report,2025,,VCESOER,,VCESOERER,EnhancedStrategies,General Comments,ExaminerCommentary,Higher-scoring responses:,,31
Humanities,Sociology,Year 12,Final Exam,Post Exam Report,2025,,VCESOER,,VCESOERCM,,General Comments,ExaminerCommentary,Discussed the impact of reconciliation on awareness (knowledge and understanding) of Australian Indigenous Peoples and how this in turn positively influenced views (views and opinions),,32
Humanities,Sociology,Year 12,Final Exam,Post Exam Report,2025,,VCESOER,,VCESOERCM,,General Comments,ExaminerCommentary,"Included evidence to support their discussion from news articles, documentaries, podcasts and ABS statistical data",,33
Humanities,Sociology,Year 12,Final Exam,Post Exam Report,2025,,VCESOER,,VCESOERCM,,General Comments,ExaminerCommentary,Used qualifying language when explicit evidence of impact on views was not available.,,34
