SubjectArea,Subject,Band,AssessmentType,AssessmentInformationDetails,AssessmentYears,UnitASCode,ExamReportCode,EQCode,SectionCode,StrategyType,ExamQuestion,ResponseSource,Content,Example,Sequence
Humanities,Philosophy,Year 12,Final Exam,Post Exam Report,2025,,VCEPHERA,VCEPH25EQA3,VCEPHERACM,,Question 3b,ExaminerCommentary,"Similarly, students who selected Mill or Nietzsche often presented a response that was more directed towards whether CoCo was justified in her nonviolent civil disobedience, but didn't always engage with the specific requirements of the question with regard to such action being 'morally required', or provided only a cursory dismissal of any such requirement along the lines that no moral obligations exist.",,41
Humanities,Philosophy,Year 12,Final Exam,Post Exam Report,2025,,VCEPHERA,VCEPH25EQA3,VCEPHERALR,LimitedStrategies,Question 3b,ExaminerCommentary,"Some lower-scoring responses selected a thinker (or thinkers) other than those from the Unit 3 prescribed texts and thus were not considered to have fully answered the question, even if they were able to demonstrate comprehensive or detailed knowledge of the chosen thinker(s).",,42
Humanities,Philosophy,Year 12,Final Exam,Post Exam Report,2025,,VCEPHERA,VCEPH25EQA3,VCEPHERACM,,Question 3c,ExaminerCommentary,"Note that for this question part, students needed to refer to one of the two thinkers they had compared in Question 3b. Responses that used a different thinker from either of those referenced in Question 3b were not considered to have fully answered the question.",,43
Humanities,Philosophy,Year 12,Final Exam,Post Exam Report,2025,,VCEPHERA,VCEPH25EQA3,VCEPHERAER,EnhancedStrategies,Question 3c,StudentResponse,The following is an example of a high-scoring response to Question 3:,"a) In my view, I think that the good life does require taking a strong stance on moral issues to the extent that it doesn't cause harm to other individuals in the process. To take a strong stance on moral issues cultivates a sense of purpose and identity in one's life, however if this stance causes severe harm to others then this stance should be suppressed. For example, in the case CoCo's advocacy for government action on climate change, she advocates for this issue in a civil, nonviolent manner. Although it causes disobedience, disruption and inconvenience among other citizens, it does not cause harm to others. However, if this initiative were to cause harm to other individuals it would be more morally concerning and may be more dangerous to others than the issue they're advocating for. Therefore, I believe that the good life involves taking a strong moral stance, given that it is also conducive to other views in the process.",44
Humanities,Philosophy,Year 12,Final Exam,Post Exam Report,2025,,VCEPHERA,VCEPH25EQA3,VCEPHERAER,EnhancedStrategies,Question 3c,StudentResponse,,"b) Weil would agree that it is morally required to engage in nonviolent civil disobedience given that it supports the needs of the souls of other individuals. Weil argues this because of her belief that our obligations are unconditional and eternal and thus exist in a ""realm situated above our own"". Weil would argue that if civil disobedience is her conviction to participate in then Weil would support that it is a moral obligation. On the other hand, Peter Singer would differ by saying that if this civil disobedience does not prevent suffering for those who are in danger of suffering then the disobedience is meaningless. In this case, CoCo states that the sixth mass destruction is likely to extinguish 98% of the human population so Singer would argue that the prevention of suffering through the advocacy of climate change is necessary in order to prevent people from suffering in the future.",45
Humanities,Philosophy,Year 12,Final Exam,Post Exam Report,2025,,VCEPHERA,VCEPH25EQA3,VCEPHERAER,EnhancedStrategies,Question 3c,StudentResponse,,"c) I would argue that Singer's view is the more compelling response as he provides practical reasoning for why we have such obligations to such clauses as opposed to Weil who simplifies our obligations to a ""moral imperative"". However, Singer's view is often difficult to apply in our daily lives as he places a very strict requirement for us to prioritise giving provisions to other countries or people in need in order to prevent suffering. For example, by giving money to charities like the ""Bengal relief"" as opposed to spending $20,000 on a new car that we don't need. This would surely prevent us from enjoying our lives as it doesn't allow for individuals to spend money on minor things that have sentimental value. Nonetheless, Singer rebuts this by arguing that we should only give to the extent that it does not cause comparable harm to us. Thus, I agree with Singer's view on why we should have obligations.",46
Humanities,Philosophy,Year 12,Final Exam,Post Exam Report,2025,,VCEPHERA,VCEPH25EQA4,VCEPHERACM,,Question 4a,ExaminerCommentary,Question 4a required students to bring together three elements: responses needed to directly respond to the ideas provided in the passage; to explain Clifford's position on the philosophical concept of epistemic responsibility as it relates to both belief formation and truthfulness; and to relate these philosophical concepts to both ourselves and others.,,47
Humanities,Philosophy,Year 12,Final Exam,Post Exam Report,2025,,VCEPHERA,VCEPH25EQA4,VCEPHERAER,EnhancedStrategies,Question 4a,ExaminerCommentary,"High-scoring responses recognised that the passage spoke about the 'harm which is done by credulity' and focused on this concept of credulousness, or the epistemic carelessness of the 'credulous man', and connected this concept with the related concept of epistemic responsibilities, expressed in the passage as 'our duties', not only to ourselves but to others, recognising Clifford's argument that there is epistemic 'guilt' in failing to meet these obligations in their entirety and in every instance (and hence that this duty to form true beliefs can be understood not merely as a responsibility, but as a 'serious' one).",,48
Humanities,Philosophy,Year 12,Final Exam,Post Exam Report,2025,,VCEPHERA,VCEPH25EQA4,VCEPHERALR,LimitedStrategies,Question 4a,ExaminerCommentary,"Some lower-scoring responses addressed the question in terms of 'Clifford's Principle' or some of the more general points Clifford makes with regard to the need for beliefs to be made on sufficient evidence, without clearly making the connection to the specific concepts of credulousness and responsibility.",,49
Humanities,Philosophy,Year 12,Final Exam,Post Exam Report,2025,,VCEPHERA,VCEPH25EQA4,VCEPHERALR,LimitedStrategies,Question 4a,ExaminerCommentary,"Some lower-scoring responses were not 'based on the passage above' and thus were not considered to have fully answered the question, even if they were able to demonstrate comprehensive or detailed knowledge of the relevant set text.",,50
Humanities,Philosophy,Year 12,Final Exam,Post Exam Report,2025,,VCEPHERA,VCEPH25EQA4,VCEPHERAER,EnhancedStrategies,Question 4b,ExaminerCommentary,"For question 4b, students were able to select any thinker from any of the Unit 4 texts to compare with Clifford. High-scoring responses selected a thinker with specific relevance to the concept of epistemic responsibility.",,51
Humanities,Philosophy,Year 12,Final Exam,Post Exam Report,2025,,VCEPHERA,VCEPH25EQA4,VCEPHERAER,EnhancedStrategies,Question 4b,ExaminerCommentary,"Of these, Peirce was a popular selection, and many responses demonstrated recognition of a key distinction between Peirce and Clifford: that Pierce is most concerned with the fixation of belief and the settlement of opinion for the removal of doubt, rather than considering the sufficiency (or insufficiency) of justifications. Some other high-scoring responses found meaningful connections to both E Fricker and M Fricker. In the case of E Fricker, that our responsibility to ourselves is to the evaluation of the testimony we received, as articulated through her TDAPs (Testimony Deferential Acceptance Principles), and our responsibility to others is to recognise when they are epistemically better placed relative to ourselves. In the case of M Fricker, that our responsibility to others is to ensure that we apply appropriate credibility and avoid the injustices of excess or deficit, and that our responsibility to ourselves is to examine ourselves for prejudices and actively work to shed these prejudices when assigning credibility to a testifier.",,52
Humanities,Philosophy,Year 12,Final Exam,Post Exam Report,2025,,VCEPHERA,VCEPH25EQA4,VCEPHERALR,LimitedStrategies,Question 4b,ExaminerCommentary,"Some lower-scoring responses selected a relevant thinker for the comparison but did not directly address the philosophical concept of epistemic responsibility, or outlined the chosen thinker's view without making a direct connection between that view and Clifford's own. For example, some responses selected Peirce, but represented his view as advocating for the Method of Tenacity or the Method of Authority as sufficient means of belief formation, despite Peirce's direct critiques and ultimate dismissal of these methods; some responses compared Clifford to E Fricker but represented Clifford as only accepting direct observational evidence for belief formation and dismissing any testimonial evidence as insufficient, despite Clifford's direct arguments in support of forming beliefs on the basis of testimony or from justifications beyond our own experience.",,53
Humanities,Philosophy,Year 12,Final Exam,Post Exam Report,2025,,VCEPHERA,VCEPH25EQA4,VCEPHERACM,,Question 4b,ExaminerCommentary,"Some responses selected thinkers from Unit 4 who did not directly address epistemic responsibility in their works. In some cases, these responses made connections between these selected thinkers and Clifford's views on epistemic responsibility; for example, drawing connections to Nguyen's distinction between epistemic bubbles and echo chambers through the section of the passage on the 'thick atmosphere of falsehood and fraud' or the 'cloud castle of sweet illusions' as descriptions of echo chambers. However, these responses were less able to meet the specific demands of Question 4b, and so were less likely to score highly.",,54
Humanities,Philosophy,Year 12,Final Exam,Post Exam Report,2025,,VCEPHERA,VCEPH25EQA4,VCEPHERALR,LimitedStrategies,Question 4b,ExaminerCommentary,"Some lower-scoring responses selected a thinker other than those from the Unit 4 prescribed texts and thus were not considered to have fully answered the question, even if they were able to demonstrate comprehensive or detailed knowledge of the chosen thinker.",,55
Humanities,Philosophy,Year 12,Final Exam,Post Exam Report,2025,,VCEPHERA,VCEPH25EQA4,VCEPHERALR,LimitedStrategies,Question 4c,ExaminerCommentary,"Question 4c required students to respond directly to a claim about Clifford's position on the dangers of false beliefs, and directly referenced a phrase from the stimulus material provided. Although not explicitly stated, the question wording implied a requirement for students to frame their response in terms of direct comparison with Clifford's beliefs and claims, including those in the stimulus provided. Some lower-scoring responses provided the student's own view of the dangers of false beliefs without directly addressing Clifford's claims, and thus were not considered to have fully answered the question.",,56
Humanities,Philosophy,Year 12,Final Exam,Post Exam Report,2025,,VCEPHERA,VCEPH25EQA4,VCEPHERAER,EnhancedStrategies,Question 4c,StudentResponse,The following is an example of a high-scoring response to Question 4:,"a) Clifford believes that we have a serious responsibility both to ourselves and to others to form true beliefs because we live in a human world influenced by human actions. So, if one individual does not care about the truth and promotes the vices of carelessness and laziness, the others around him will not revere the truth in their mind and learn to cry ""peace"" when there is no peace. Such a carelessness results in an environment of falsehood and fraud, where the individual has made his neighbours ready to deceive, and he himself being credulous, creates liars and cheats. Therefore, we have a serious responsibility to ourselves and others to form true beliefs, because if we don't, we weaken our own character and compromise those around us.",57
Humanities,Philosophy,Year 12,Final Exam,Post Exam Report,2025,,VCEPHERA,VCEPH25EQA4,VCEPHERAER,EnhancedStrategies,Question 4c,StudentResponse,,"b) Peirce largely does not agree with Clifford on our responsibilities to society and ourselves when forming beliefs. This is because Peirce argues that the sole object of inquiry is the settlement of doubt. Peirce argues that we wish at all costs to avoid the great anxiety that arises from doubt. Clifford in fact agrees with Peirce on this point, as he argues that there is a great bitterness that arises when our beliefs are unsure. Peirce, then, presents the scientific method, which although uses evidence to form beliefs that are likely to be true, is based off the premise that it will be the best method at preventing doubt. Thus, Peirce differs from Clifford as he does not care about whether the beliefs are true or not, or even how we get our beliefs like Clifford, but rather that we can settle our beliefs in order to settle the doubt and avoid the great anxiety that comes with being unsure.",58
Humanities,Philosophy,Year 12,Final Exam,Post Exam Report,2025,,VCEPHERA,VCEPH25EQA4,VCEPHERAER,EnhancedStrategies,Question 4c,StudentResponse,,"c) I mostly agree with Clifford that it is dangerous to hold false beliefs, even if they are comforting and pleasant. In my view, the implications of beliefs that are wrong are great and pose a threat both to the individual and to society as a whole. For example, on an individual scale, if we take an individual who believes that the sun won't burn them, then, in the future, we would see that this false belief which is based upon no evidence or inquiry would likely see them contract skin cancer and live a difficult life that would only have been prevented by forming the true belief that the sun will burn them. On the societal scale too we can see that it is dangerous to hold false beliefs. For example if an individual believed that fire didn't pose a threat to anyone, and so he sets his local park on fire, it is easy to see the devastating impacts on others' lives that false beliefs can have. However, at the same time, these are mostly extreme examples, in some cases it is not dangerous to hold beliefs which could be false, but rather it could be beneficial. For example, if I was anxious about a test, but I knew I had studied for it, even if it may be false that I will do it well, believing this would likely result in the best outcome as it suppresses my anxiety (similar to Peirce's model) and would likely result in me performing better. Therefore, in most cases it is dangerous at an individual and societal level to hold beliefs that are false, but there are some circumstances where the stakes are less extreme and settling a belief, even if it may be false, would likely result in a better outcome.",59
Humanities,Philosophy,Year 12,Final Exam,Post Exam Report,2025,,VCEPHER,,VCEPHERBH,,,,Section B: Section B,,0
Humanities,Philosophy,Year 12,Final Exam,Post Exam Report,2025,,VCEPHERB,,VCEPHERBCM,,Section B - General Comments,ExaminerCommentary,"For Section B, students were asked to attempt one of three questions. The responses were marked based on a rubric that provided descriptors for achievement on five criteria, from which a total score on a scale 0-20 was awarded.",,1
Humanities,Philosophy,Year 12,Final Exam,Post Exam Report,2025,,VCEPHERB,,VCEPHERBER,EnhancedStrategies,Section B - General Comments,ExaminerCommentary,"Question 1 was the most popular of the three selections available to students, with approximately half of all responses being for Question 1, and the other half of the responses being split approximately evenly between Questions 2 and 3. For that reason, the student response sample provided is a high-scoring response to Question 1.",,2
Humanities,Philosophy,Year 12,Final Exam,Post Exam Report,2025,,VCEPHERB,,VCEPHERBER,EnhancedStrategies,Section B - General Comments,ExaminerCommentary,"A note on the selection of thinkers from the prescribed texts: In many cases, especially among the high-scoring responses, it was clear that students had made astute selections from the available thinkers from Unit 4, considering which combination of thinkers was most salient and relevant to the concepts raised in and by the prompt question. In other cases, especially among lower-scoring responses, the selection of thinkers suggested that the student had predetermined which thinkers they would use in their essay, rather than selecting thinkers most appropriate to the prompt.",,3
Humanities,Philosophy,Year 12,Final Exam,Post Exam Report,2025,,VCEPHERB,,VCEPHERBCM,,Section B - General Comments,ExaminerCommentary,"When giving advice to students about the selection of thinkers for the Section B response, teachers could consider the advantage to the student in knowing as many texts as possible, so that they can respond to the prompt with the most appropriate combination. Students who have made a firm decision prior to the exam, and students who have detailed knowledge and understanding of only a limited number of the prescribed texts, run the risk of trying to apply a less relevant thinker to their chosen prompt.",,4
Humanities,Philosophy,Year 12,Final Exam,Post Exam Report,2025,,VCEPHERB,,VCEPHERBCM,,Section B - General Comments,ExaminerCommentary,"A note on case studies: All of the questions for Section B required that students use 'a case study you have studied this year as your central example'. This instruction, similarly with the instruction in Section A, Question 3, required students not merely to mention or reference a chosen case study, but for that case study to be the central concern of the essay. Many students were able to demonstrate this by opening their essay with an outline of the chosen case study and then introducing the two chosen thinkers in terms of how their works would be relevant to the case study (although this isn't a required structure of the essay, and some high-scoring essays were not structured this way). Teachers could consider having a discussion with students to clarify what is meant by 'central example'. On balance, this task should be understood to be an essay about the case study, in which the Unit 4 philosophical texts are used as support for the discussion, rather than as an essay about the philosophical texts themselves.",,5
Humanities,Philosophy,Year 12,Final Exam,Post Exam Report,2025,,VCEPHERB,,VCEPHERBER,EnhancedStrategies,Section B - General Comments,ExaminerCommentary,"One feature that often distinguished the high-scoring responses was the use of precise and specific examples from their chosen case study, while lower-scoring responses often addressed the selected case study in more broad or general terms. For example, 'medical misogyny' and 'social media misinformation' were both popular choices, and many responses demonstrated understanding and relevant application of these topics as case studies for their essay by referring to these phenomena in general ways (e.g. that the disproportionate ratio of male to female doctors and the lack of medical testing on female populations led to drugs or treatments that were not appropriate for female patients; that the proliferation of misinformation on social media has led to a breakdown in public trust of information etc.). These were valid case studies to consider and were often applied in ways that were relevant to the prompt the student was addressing; however, high-scoring responses included another layer of specificity. For example, that medical misogyny was especially apparent in the case of the children of thalidomide, or in the underdiagnosis or misdiagnosis of endometriosis; or that social media misinformation was especially apparent in the spread of the QAnon conspiracy theory which led to 'Pizzagate' and thus to a shooting in a Washington pizza shop. These more precise and detailed examples allowed students more opportunities to demonstrate skills and knowledge. Teachers could advise students that case studies selected for Unit 4 should identify a topic from which a range of examples linked to that topic can be discussed.",,6
Humanities,Philosophy,Year 12,Final Exam,Post Exam Report,2025,,VCEPHERB,VCEPH25EQB1,VCEPHERBCM,,Question 1,ExaminerCommentary,"Question 1 was well suited to case studies relevant to the context of 'silencing, exclusion and cancelling', and to thinkers from Unit 4 whose works considered how we respond to others holding beliefs that disagree with our own, and which also allowed for consideration of the role of experience, testimony and expertise in the formation of and justification for belief.",,7
Humanities,Philosophy,Year 12,Final Exam,Post Exam Report,2025,,VCEPHERB,VCEPH25EQB1,VCEPHERBER,EnhancedStrategies,Question 1,ExaminerCommentary,"Mill was a popular selection, particularly in light of the specific reference to 'harm' in the prompt. Many responses connected this with Mill's 'harm principle'; high-scoring responses were also able to explore some of the nuance in Mill's claims with regard to 'controversial opinions', especially as that concept relates to Mill's position on the power dynamics between majority and minority positions, and the effect of 'vituperative' argumentation understood through that hierarchical dynamic.",,8
Humanities,Philosophy,Year 12,Final Exam,Post Exam Report,2025,,VCEPHERB,VCEPH25EQB1,VCEPHERBCM,,Question 1,ExaminerCommentary,"M Fricker was another popular choice, with many responses demonstrating recognition of the relevance of her work on epistemic injustice and credibility deficit as examples of harms, and using the examples she provides in both Tom Robinson's jury and in Herbert Greenleaf to consider how those harms relate to controversial opinions. Nguyen's distinction between epistemic bubbles and echo chambers was used in many responses, often to argue for the good in allowing controversial opinions which could burst epistemic bubbles. Some responses proposed that E Fricker's TDAPs be used to guard against the harms of controversial opinions.",,9
Humanities,Philosophy,Year 12,Final Exam,Post Exam Report,2025,,VCEPHERB,VCEPH25EQB1,VCEPHERBCM,,Question 1,ExaminerCommentary,"Clifford and Peirce were used less commonly, although sometimes in comparison with each other: Peirce through the harms of Tenacity and Authority as responses to controversy; Clifford through the harms apparent in false (or insufficiently justified) beliefs. However, often these responses demonstrated difficulty in connecting these thinkers to the concepts and perspectives most relevant to this prompt.",,10
Humanities,Philosophy,Year 12,Final Exam,Post Exam Report,2025,,VCEPHERB,VCEPH25EQB2,VCEPHERBCM,,Question 2,ExaminerCommentary,"This question was best suited to case studies relevant to the context of 'truth, trust, credibility and expertise', and which also allowed for some consideration of 'misinformation, disinformation and echo chambers', and to thinkers from Unit 4 whose works considered the epistemic responsibilities we have to ourselves and to others when forming beliefs, and the circumstances in which we should trust others.",,11
Humanities,Philosophy,Year 12,Final Exam,Post Exam Report,2025,,VCEPHERB,VCEPH25EQB2,VCEPHERBLR,LimitedStrategies,Question 2,ExaminerCommentary,"Clifford was a popular choice. Some lower-scoring responses demonstrated a misunderstanding of Clifford as being purely evidentialist, in the sense of accepting only personal empirical justifications for belief, and missed the opportunity to discuss the sections of Clifford's text in which he establishes grounds for the acceptance of testimony (such as through the example of Thucydides). Responses that used Clifford with an awareness of this part of the text often scored highly.",,12
Humanities,Philosophy,Year 12,Final Exam,Post Exam Report,2025,,VCEPHERB,VCEPH25EQB2,VCEPHERBCM,,Question 2,ExaminerCommentary,"E Fricker was also a popular choice. Through her TDAPs, many responses argued that we have a mechanism available by which we can determine when we can believe others, though often these responses were less focused on why it would be important that others are able to believe us, and thus were less likely to score highly.",,13
Humanities,Philosophy,Year 12,Final Exam,Post Exam Report,2025,,VCEPHERB,VCEPH25EQB2,VCEPHERBLR,LimitedStrategies,Question 2,ExaminerCommentary,"Responses applying Peirce often presented his views as a counter-perspective to either E Fricker or Clifford, on the basis that Peirce was more focused on the fixation of belief than on the belief being formed on sufficient grounds, and thus arguing that we do not need to trust others or be trusted in return as Methods of Tenacity or Authority would suffice. Lower-scoring responses often demonstrated an overly generalised understanding of Peirce's work, or understood his consideration of both Tenacity and Authority uncritically. High-scoring students who used Peirce were able to demonstrate how the need for trust and the epistemic foundations of the scientific method were superior for achieving fixation of belief, and thus to show how Peirce's view supported the need for trust in belief formation.",,14
