SubjectArea,Subject,Band,AssessmentType,AssessmentInformationDetails,AssessmentYears,UnitASCode,ExamReportCode,EQCode,SectionCode,StrategyType,ExamQuestion,ResponseSource,Content,Example,Sequence
Humanities,Philosophy,Year 12,Final Exam,Post Exam Report,2025,,VCEPHERB,VCEPH25EQB2,VCEPHERBCM,,Question 2,ExaminerCommentary,Responses using Nguyen's discussion of the perniciousness of echo chambers and the role of trust in helping people to break out of echo chambers were often able to demonstrate the importance of the epistemic interdependence suggested by the question. Those who explored the concept of trust as central to Nguyen's distinction between epistemic bubbles and echo chambers were often able to demonstrate relevant connections between the thinker and the requirements of this prompt.,,15
Humanities,Philosophy,Year 12,Final Exam,Post Exam Report,2025,,VCEPHERB,VCEPH25EQB2,VCEPHERBCM,,Question 2,ExaminerCommentary,"Other responses selected M Fricker (usually in terms of linking credibility excess or deficit to the concept of mutual trust, especially in the case of Greenleaf's failure to trust Marge due to his epistemic biases) or Mill (usually in terms of how alternative views allow us to examine our own beliefs). However, often these responses demonstrated difficulty connecting these thinkers to the concepts and perspectives most relevant to this prompt, and thus scored less highly.",,16
Humanities,Philosophy,Year 12,Final Exam,Post Exam Report,2025,,VCEPHERB,VCEPH25EQB3,VCEPHERBCM,,Question 3,ExaminerCommentary,"This question was best suited to case studies relevant to the context of 'truth, trust, credibility and expertise', and which also allowed for some consideration of 'misinformation, disinformation and echo chambers', and to thinkers from Unit 4 whose works considered the role of experience, testimony and expertise in the formation of and justification for belief.",,17
Humanities,Philosophy,Year 12,Final Exam,Post Exam Report,2025,,VCEPHERB,VCEPH25EQB3,VCEPHERBCM,,Question 3,ExaminerCommentary,"Many responses selected E Fricker as a counterview to the statement made in the prompt, on the basis that her TDAPs provide the grounds on which we are able to believe testimony, and thus that we are justified in believing something that is beyond our own personal experience.",,18
Humanities,Philosophy,Year 12,Final Exam,Post Exam Report,2025,,VCEPHERB,VCEPH25EQB3,VCEPHERBLR,LimitedStrategies,Question 3,ExaminerCommentary,"Peirce was also presented in many responses as a counter-perspective to the prompt, on the basis that Peirce was more focused on the fixation of belief than on the truth of beliefs, and thus that Peirce would support the view that we can believe something without direct personal experience, since we are free to choose any belief we wish in the effort to remove doubt. As with the responses using Peirce in Section B, Question 2, lower-scoring responses often demonstrated an uncritical acceptance of both the Method of Tenacity and the Method of Authority when applying Peirce to this prompt. Some high-scoring responses demonstrated how the scientific method, and the ongoing collaborative efforts achieved through the scientific method, show that Peirce's view contradicts the statement made in the prompt.",,19
Humanities,Philosophy,Year 12,Final Exam,Post Exam Report,2025,,VCEPHERB,VCEPH25EQB3,VCEPHERBLR,LimitedStrategies,Question 3,ExaminerCommentary,"Clifford was also a popular selection, but again, some lower-scoring responses demonstrated a misunderstanding of Clifford as being purely evidentialist, in the sense of accepting only personal empirical justifications for belief, and therefore that he would agree with the statement made in the prompt. These responses missed the opportunity to discuss the sections of Clifford's text in which he establishes grounds for the acceptance of beliefs beyond our own personal experience, through the justified assumption of the uniformity of nature. Responses that used Clifford with an awareness of this part of the text (such as through the example of the spectroscope) were more likely to score highly.",,20
Humanities,Philosophy,Year 12,Final Exam,Post Exam Report,2025,,VCEPHERB,VCEPH25EQB3,VCEPHERBCM,,Question 3,ExaminerCommentary,"Many students applied Nguyen's work on echo chambers by making a connection to the epistemic dangers of restricting belief only to personal empirical experience, and thus being prone to dismissing experts and figures of epistemic authority and more susceptible to the voices within the echo chamber.",,21
Humanities,Philosophy,Year 12,Final Exam,Post Exam Report,2025,,VCEPHERB,VCEPH25EQB3,VCEPHERBCM,,Question 3,ExaminerCommentary,"Other responses selected Mill or M Fricker (usually in terms of linking credibility excess or deficit to the belief of testimony over personal experience, especially in the case of Greenleaf's failure to believe Marge). However, often these responses demonstrated difficulty connecting these thinkers to the concepts and perspectives most relevant to this prompt, and thus scored less highly.",,22
Humanities,Philosophy,Year 12,Final Exam,Post Exam Report,2025,,VCEPHERB,VCEPH25EQB3,VCEPHERBER,EnhancedStrategies,Question 3,StudentResponse,The following is an example of a high-scoring response to Question 1:,"In 2023, the Australian Federal government held a referendum proposing a constitutional amendment to establish a permanent advisory body - the Voice. The Australian Human Rights Commission (AHRC) - an independent third party which investigates discrimination and human rights breaches - claimed that its intention was to ""help realise Indigenous rights through the establishment of an Indigenous voice to parliament"", claiming that increasing Indigenous testimony would lead to tangible improvements in Aboriginal lives. In this essay, I will critically discuss the perspectives of Mill and M. Fricker in relation to the case study and whether controversial opinions cause more harm than good in society.",23
Humanities,Philosophy,Year 12,Final Exam,Post Exam Report,2025,,VCEPHERB,VCEPH25EQB3,VCEPHERBER,EnhancedStrategies,Question 3,StudentResponse,,"According to Mill, controversial opinions do not cause more harm than good in society, so long as they do not incite violence. Mill contends that, upon being exposed to beliefs, one is exposed to truth, a belief that contains a portion of the truth, or even if a belief is wrong, it can challenge the grounds of one's own argument, preventing it from being held as a habit rather than a heartfelt conviction. In all cases, the hearer improves their belief and prevents it from forming into unjustified principle. To engage in open debate, Mill contends that we must cultivate epistemic virtues such as temperate discussion and the willingness to listen to others. To do otherwise is to form epistemic vices such as the suppression of arguments or the misrepresentation of opinions. Therefore, to Mill, controversial opinions do more good than harm so long as they are justified and expressed in a reasonable and temperate manner.",24
Humanities,Philosophy,Year 12,Final Exam,Post Exam Report,2025,,VCEPHERB,VCEPH25EQB3,VCEPHERBER,EnhancedStrategies,Question 3,StudentResponse,,"I can see the value of Mill's argument in real life when people are well-informed and able to engage in open discussion. For example, in my philosophy classroom, when my classmate shares a different perspective, I am compelled to consider their contrary opinion and their reasoning, and so unconsciously revisit my reasons for my own belief. In doing so, my belief is often strengthened in a way that reflects Mill's argument that engagement with opposing opinions can develop one's argument and guard against dogmatic beliefs.",25
Humanities,Philosophy,Year 12,Final Exam,Post Exam Report,2025,,VCEPHERB,VCEPH25EQB3,VCEPHERBER,EnhancedStrategies,Question 3,StudentResponse,,"To what extent were Mill's principles for reasoned engagement with controversial opinions evident in the Voice referendum? Although the government did not suppress any beliefs, they did not provide enough robust reasoning and arguments for citizens to develop their own beliefs. According to the Rule of Law article - an official site for the education of Australian laws - the coalition was excluded from any meaningful discussion and there was a lack of debate, claiming that the referendum was ""based on the concept of the Voice ... rather than a detailed model for its implementation."" As a result, there was a lack of clarity to what exactly the referendum would do for the nation and an assumption as to what the citizens knew. Thus, it is likely that the citizens formed controversial opinions but they were unjustified because of a lack of clear reasoning. This failure to help form justified contrary opinions did not only occur by the Albanese government. The opposition advocated for the slogan ""if you don't know, vote no"" which supported/fostered epistemic vices of ignorance and epistemic laziness. Therefore, to Mill, controversial opinions did more harm than good due to a lack of robust reasoning and clear arguments that undermined Mill's principle for justified and reasoned debate.",26
Humanities,Philosophy,Year 12,Final Exam,Post Exam Report,2025,,VCEPHERB,VCEPH25EQB3,VCEPHERBER,EnhancedStrategies,Question 3,StudentResponse,,"However, there is a significant impediment to forming and expressing beliefs that even Mill himself could not have anticipated. Political discussions are carried out today largely thorough social media. Short form content, emojis and one-word tweets do not contribute reasoned argument, often perpetuating negativity and emotion. As Johan Hari demonstrates in ""Stolen Focus"", the words that most increase the tweet rate are ""bad"", ""attack"" and ""blame"". The medium of discussion actively promotes irrationality and demotes reasoned argument, making it easy to develop controversial opinions that incite harm and violence and are also unjustified.",27
Humanities,Philosophy,Year 12,Final Exam,Post Exam Report,2025,,VCEPHERB,VCEPH25EQB3,VCEPHERBER,EnhancedStrategies,Question 3,StudentResponse,,"While Mill's argument is rational and necessary to uphold the epistemic values of discussion, it is insufficient as it omits the prejudice that influences beliefs and harms knowers. On the other hand, M. Fricker exposes prejudice's surreptitious nature and contends that controversial opinions can cause more harm than good in society if they are soaked in prejudice. Fricker uses the example of Mr Greenleaf (a civic-minded and reasonable man) who believed Marge wasn't telling the truth because, like other females, she was going off instinct rather than facts, thus attributing her a credibility deficit. The detrimental issue is that Greenleaf tried hard to listen to the evidence but did not know his perception of the truth was distorted by prejudice. As a result, Marge's epistemic autonomy and dignity was undermined, causing a testimonial injustice, harming her as a knower, and Greenleaf was harmed as he missed out on the truth. To Fricker, the epistemic injustice is morally problematic and thus we have a doxastic self-responsibility to engage in critical self-reflection to correct for our prejudices, allowing us to engage with controversial opinion properly.",28
Humanities,Philosophy,Year 12,Final Exam,Post Exam Report,2025,,VCEPHERB,VCEPH25EQB3,VCEPHERBER,EnhancedStrategies,Question 3,StudentResponse,,"Taking Fricker's argument into consideration, the Voice was a useful tool to correct for prejudices. According to the AHRC, ""Indigenous people have long been excluded from decision making"". It seems, then, that as their epistemic agency was undermined, Indigenous people were victim to ""systemic racial prejudice"". As its intention was to ""remove any doubt that the constitution had discriminated against people of the Aboriginal race"", according to the Rule of law article, it seems that the Voice mechanism would have been a useful vessicle for us to reassess our credibility judgements and correct for lurking prejudices. In doing so, we may have been able to engage with controversial opinions in a fair manner, leading to the intended improvements in Aboriginal lives.",29
Humanities,Philosophy,Year 12,Final Exam,Post Exam Report,2025,,VCEPHERB,VCEPH25EQB3,VCEPHERBER,EnhancedStrategies,Question 3,StudentResponse,,"M. Fricker's argument is compelling as it exposes the psychologically stealthy nature of prejudice and the harm it does the knower. For example, a teacher may label a student as less intelligent, resulting in a credibility deficit. This not only hams the student by dismissing their contributions to the class, it also impoverishes the classroom's collective understanding. Yet, even if the referendum was successful, I do not think it would have gone far enough to achieve epistemic justice. What would it mean to see Indigenous people as equal knowers in their own right? According to the head of the Indigenous Health equity unit at Melbourne University, there are ingrained ""problematic colonial thought processes"". Western scientific knowledge values rationality and dominance over nature, but there is also more holistic and communal ""ways of knowing"". For example, there are instances when we can learn from Indigenous knowledge such as how to ""mitigate and adapt for climate change"" or ""holistic models of wellbeing"". But the paradigm of ""Western scientific ways of knowing"" such as ""Western knowledge is superior to Indigenous knowledge"" dismisses their contribution as irrelevant or inferior. Thus, the controversial opinions that M. Fricker considers as beneficial to society is undermined by the paradigm of ""western scientific"" knowledge, ultimately resulting in a problematic testimonial injustice.",30
Humanities,Philosophy,Year 12,Final Exam,Post Exam Report,2025,,VCEPHERB,VCEPH25EQB3,VCEPHERBER,EnhancedStrategies,Question 3,StudentResponse,,"Therefore, controversial opinions do more harm than good in society if there is a lack of robust reasons in the belief and if their opinion is soaked in prejudice.",31
