SubjectArea,Subject,Band,AssessmentType,AssessmentInformationDetails,AssessmentYears,UnitASCode,ExamReportCode,EQCode,SectionCode,StrategyType,ExamQuestion,ResponseSource,Content,Example,Sequence
Humanities,Philosophy,Year 12,Final Exam,Post Exam Report,2025,,VCEPHER,,VCEPHERAH,,,,Section A: Section A,,0
Humanities,Philosophy,Year 12,Final Exam,Post Exam Report,2025,,VCEPHERA,,VCEPHERACM,,Section A - General Comments,ExaminerCommentary,"The questions in Section A each required students to respond to a stimulus text. The responses to each question were marked holistically. While this report provides advice related to performance on each part (a-c) within each question, it is important to note that marks were not awarded individually to these question parts.",,1
Humanities,Philosophy,Year 12,Final Exam,Post Exam Report,2025,,VCEPHERA,VCEPH25EQA1,VCEPHERACM,,Question 1a,ExaminerCommentary,Question 1a required students to bring together three elements: responses needed to directly respond to the ideas provided in the passage by Nietzsche; to explain Nietzsche's position on the philosophical concept of self-discipline; and to relate these to the overall concept of 'the good life'.,,2
Humanities,Philosophy,Year 12,Final Exam,Post Exam Report,2025,,VCEPHERA,VCEPH25EQA1,VCEPHERAER,EnhancedStrategies,Question 1a,ExaminerCommentary,"High-scoring responses recognised that the passage spoke about the discipline of suffering and connected this concept with the related concept of self-discipline, arguing that the role of self-discipline in Nietzsche's understanding of the good life is to enable the individual to accept and embrace suffering rather than avoid it, and thus to cultivate the noble virtues necessary for the good life.",,3
Humanities,Philosophy,Year 12,Final Exam,Post Exam Report,2025,,VCEPHERA,VCEPH25EQA1,VCEPHERALR,LimitedStrategies,Question 1a,ExaminerCommentary,"Lower-scoring responses often focused on the role of suffering in the good life, responded to the 'discipline of suffering' without making the connection to self-discipline, or focused on the contemptibility of the man who avoids suffering without making a connection between this part of the passage and the concept of self-discipline.",,4
Humanities,Philosophy,Year 12,Final Exam,Post Exam Report,2025,,VCEPHERA,VCEPH25EQA1,VCEPHERACM,,Question 1a,ExaminerCommentary,"It was not necessary for responses to this question part to discuss Nietzsche's broader philosophical concepts such as 'herd morality' / 'slave morality', 'master morality', the virtue of solitude, the role of fear as the mother of morality, the hypocrisy of commanders, his arguments against utilitarianism etc. Responses that were not selective in identifying the most salient perspectives and positions in Nietzsche's text, as they relate specifically to the passage provided, generally scored less highly.",,5
Humanities,Philosophy,Year 12,Final Exam,Post Exam Report,2025,,VCEPHERA,VCEPH25EQA1,VCEPHERALR,LimitedStrategies,Question 1a,ExaminerCommentary,"Some lower-scoring responses made no reference to 'the passage above' at all and thus were not considered to have fully answered the question, even if they were able to demonstrate comprehensive or detailed knowledge of the relevant set text.",,6
Humanities,Philosophy,Year 12,Final Exam,Post Exam Report,2025,,VCEPHERA,VCEPH25EQA1,VCEPHERAER,EnhancedStrategies,Question 1b,ExaminerCommentary,"For Question 1b, students were able to select any thinker from any of the Unit 3 texts. High-scoring responses selected a thinker from that list with specific relevance to the concept of self-discipline.",,7
Humanities,Philosophy,Year 12,Final Exam,Post Exam Report,2025,,VCEPHERA,VCEPH25EQA1,VCEPHERAER,EnhancedStrategies,Question 1b,ExaminerCommentary,"Of these, the thinkers in Plato's Gorgias, both Callicles and Socrates, were often used in high-scoring responses as a comparison to Nietzsche's view on the role of self-discipline, and both thinkers provided relevant comparisons in their differing views on self-discipline. (In the case of Callicles, that he would reject Nietzsche's view of self-discipline as a form of self-enslavement; in the case of Socrates, that he would value self-discipline, but that his understanding of self-discipline is greatly different from Nietzsche's.) Aristotle was also a popular choice and provided a relevant comparative perspective. (That he would agree with the need for self-discipline as a means of cultivating virtue, but would have a greatly different view of what virtues constituted the good life.)",,8
Humanities,Philosophy,Year 12,Final Exam,Post Exam Report,2025,,VCEPHERA,VCEPH25EQA1,VCEPHERACM,,Question 1b,ExaminerCommentary,"Responses that included a relevant thinker for the comparison but did not directly address the philosophical concept of self-discipline, or outlined the chosen thinker's view without making a direct connection between that view and Nietzsche's own, generally scored less highly. For example, some responses chose Callicles, but focused on the avoidance of suffering rather than on self-discipline; some chose Socrates, but focused on analogies such as the gully-bird or the leaky-jar; some chose Aristotle but understood discipline only in terms of an Aristotelian ('golden') mean.",,9
Humanities,Philosophy,Year 12,Final Exam,Post Exam Report,2025,,VCEPHERA,VCEPH25EQA1,VCEPHERACM,,Question 1b,ExaminerCommentary,"Some responses selected thinkers from Unit 3 who did not directly address self-discipline in their works. For example, some responses attempted to apply Simone de Beauvoir's views on authenticity and freedom as a comparison to Nietzsche's views on freedom and self-overcoming, or Singer's utilitarian perspective on the reduction of suffering as a comparison to Nietzsche's advocacy for the role of suffering. These responses were less able to meet the specific demands of this question part, and so were less likely to score highly.",,10
Humanities,Philosophy,Year 12,Final Exam,Post Exam Report,2025,,VCEPHERA,VCEPH25EQA1,VCEPHERALR,LimitedStrategies,Question 1b,ExaminerCommentary,"Some lower-scoring responses selected a thinker other than those from the Unit 3 prescribed texts and thus were not considered to have fully answered the question, even if they were able to demonstrate comprehensive or detailed knowledge of the chosen thinker.",,11
Humanities,Philosophy,Year 12,Final Exam,Post Exam Report,2025,,VCEPHERA,VCEPH25EQA1,VCEPHERACM,,Question 1c,ExaminerCommentary,"Question 1c required students to recognise a shift in focus, from the role of self-discipline to the role of suffering, and to address suffering as a distinct but related philosophical concept with relation to the good life.",,12
Humanities,Philosophy,Year 12,Final Exam,Post Exam Report,2025,,VCEPHERA,VCEPH25EQA1,VCEPHERALR,LimitedStrategies,Question 1c,ExaminerCommentary,This question part specifically required students to support their reasoning with an example. Students who did not use an example were not considered to have fully answered the question.,,13
Humanities,Philosophy,Year 12,Final Exam,Post Exam Report,2025,,VCEPHERA,VCEPH25EQA1,VCEPHERAER,EnhancedStrategies,Question 1c,StudentResponse,The following is an example of a high-scoring response to Question 1:,"a) Nietzsche criticizes what he describes as 'slave morality', the morality of the majority that believes in trying to minimize suffering. To Nietzsche, modes of morality that assess things based on pleasure and pain ignore the benefits of suffering: that it allows for the development of greatness amongst mankind. He argues that all of the greatest achievements of mankind have come about due to suffering, and argues for the discipline of suffering. This could be seen as a type of self-discipline, in which case Nietzsche would agree that self-discipline is a key ingredient in the good life. However, as he disagrees with modes of morality that assess based on the amount of pleasure and pain, self-discipline that aims at minimizing suffering would be ridiculous to him and a part of the morality of the herd.",14
Humanities,Philosophy,Year 12,Final Exam,Post Exam Report,2025,,VCEPHERA,VCEPH25EQA1,VCEPHERAER,EnhancedStrategies,Question 1c,StudentResponse,,"b) Callicles argues for the hedonist view that pleasure is the key to the good life, arguing that we should let our desires grow as much as possible, rather than try to limit them. To justify his view, Callicles turns to nature, arguing that natural law has made some individuals stronger than others, thus nature wants those individuals to use their strength to grow their pleasure, even if it's at the expense of the naturally weak. Callicles would disagree with Nietzsche's view on the discipline of suffering, seeing all forms of self-discipline as a hindrance to desire and thus incompatible with the good life. However, his views on the naturally weak and the naturally strong mirror Nietzsche's, with both thinkers see the morality of the weak/slave as a way to try to suppress the strength of the strong. Callicles however, thinks that pleasure is the most important thing, while Nietzsche believes it is suffering.",15
Humanities,Philosophy,Year 12,Final Exam,Post Exam Report,2025,,VCEPHERA,VCEPH25EQA1,VCEPHERAER,EnhancedStrategies,Question 1c,StudentResponse,,"c) I believe that suffering plays a role in the good life, agreeing with Nietzsche that suffering often allows for immense growth of strength and character. Without knowing suffering, happiness wouldn't feel as good as we would have nothing to compare it to. Some of the greatest pieces of art have been created because of suffering. However, I don't believe that all suffering is necessary. Take for example a young child suffering greatly from an illness and dying. What did that child gain from suffering? Moreover, imagine a deer in the forest who gets gravely injured and has to suffer for days before passing away from injury. What does that deer gain? It cannot grow from suffering the same way we can. It cannot learn and ultimately dies. I believe that we only think suffering is important because we experience it, because we don't know any different, thus we give a reason for it. I think that if we didn't have to suffer at all, if we had the choice between experiencing suffering or not, we would choose not to. It is only because we don't have the choice that we believe it is necessary.",16
Humanities,Philosophy,Year 12,Final Exam,Post Exam Report,2025,,VCEPHERA,VCEPH25EQA2,VCEPHERACM,,Question 2a,ExaminerCommentary,"Question 2a required students to directly respond to the ideas provided in the passage; to explain Allen's use of Aristotle's position on the philosophical concept of justice; and to relate these to the distribution of goods in terms of equality, equity or 'unevenness'.",,17
Humanities,Philosophy,Year 12,Final Exam,Post Exam Report,2025,,VCEPHERA,VCEPH25EQA2,VCEPHERAER,EnhancedStrategies,Question 2a,ExaminerCommentary,"High-scoring responses recognised that the passage spoke about Allen's concept of distributive justice, and connected this concept with the related concepts of proportionality, equity, equality, evenness and fairness. Additionally, high-scoring responses were likely to demonstrate a complex and nuanced understanding of 'society's goods' as required by the viewpoint provided in the prompt, and as described in the passage provided; for example, that Aristotle argues that honour is a 'good' and so by extension Allen argues for an understanding of 'goods' beyond merely materialist or wealth-focused understandings of 'society's goods', by 'drawing on' Aristotle's approach.",,18
Humanities,Philosophy,Year 12,Final Exam,Post Exam Report,2025,,VCEPHERA,VCEPH25EQA2,VCEPHERALR,LimitedStrategies,Question 2a,ExaminerCommentary,"Lower-scoring responses often focused on reciprocity, or responded to the prompt only in terms of interpersonal distribution of goods (i.e. individual acts of charity or friendship), without making the connection to 'the allotment of public goods' or 'the public store' as indicators of the need to consider distributive justice at the political, systemic or societal levels.",,19
Humanities,Philosophy,Year 12,Final Exam,Post Exam Report,2025,,VCEPHERA,VCEPH25EQA2,VCEPHERACM,,Question 2a,ExaminerCommentary,"It was not necessary for responses to this question part to discuss Allen's broader philosophical concepts such as distinctions between rivalrous self-interest and equitable self-interest. There was some scope to briefly draw on an understanding of retributive justice as a counterpoint understanding of 'justice' as a philosophical concept, or to clarify the specific meaning of 'distributive justice' relevant to the prompt. Responses that were not selective in identifying the most salient perspectives and positions in Allen's text, as they relate specifically to the passage provided, generally scored less highly.",,20
Humanities,Philosophy,Year 12,Final Exam,Post Exam Report,2025,,VCEPHERA,VCEPH25EQA2,VCEPHERACM,,Question 2a,ExaminerCommentary,"Some responses made no reference to the approach 'described in the passage above' at all and thus were not considered to have fully answered the question, even if they were able to demonstrate comprehensive or detailed knowledge of the relevant set text. Similarly, because this question part specified the use of a contemporary example, responses that did not include a contemporary example were not considered to have fully answered the question. In some cases, students chose generic examples, hypotheticals or non-contemporary examples, or repeated some variation of Allen's own example of the proportional distribution of meals to appetites, as provided in the passage. These responses were also considered to have not fully answered the question.",,21
Humanities,Philosophy,Year 12,Final Exam,Post Exam Report,2025,,VCEPHERA,VCEPH25EQA2,VCEPHERAER,EnhancedStrategies,Question 2b,ExaminerCommentary,"For Question 2b, students were able to select any thinker from any of the Unit 3 texts. High-scoring responses selected a thinker from that list with specific relevance to the concept of justice, especially as it applies to the distribution of goods.",,22
Humanities,Philosophy,Year 12,Final Exam,Post Exam Report,2025,,VCEPHERA,VCEPH25EQA2,VCEPHERAER,EnhancedStrategies,Question 2b,ExaminerCommentary,"Unlike Question 1b, Question 2b did not specifically require the student to compare their chosen thinker and Allen, so high-scoring responses did not need to refer to Allen or to the passage provided.",,23
Humanities,Philosophy,Year 12,Final Exam,Post Exam Report,2025,,VCEPHERA,VCEPH25EQA2,VCEPHERACM,,Question 2b,ExaminerCommentary,"Callicles was again a popular choice, and provided students with relevant and specific perspectives on both justice and the distribution of goods: that justice was properly a matter of natural law rather than conventional law, and thus an uneven distribution of goods in which the strongest/best/powerful received the greater share was a just distribution. Some students also found meaningful connections to more modern philosophers, such as Mill, Weil and Singer. In the case of Mill, that justice was a matter of the protection of necessary liberties, and so governments ('regimes') responsible for the distribution of goods should act with that principle of justice in mind, rather than equality. In the case of Weil, that we each have eternal obligations to all other humans deriving from their intrinsic nature as humans, and that it is through the distribution of goods that these obligations can be justly exercised. In the case of Singer, that goods should be distributed evenly to the point of marginal utility, and that in order to achieve this it is just that the affluent be called upon to give a greater share and receive a lesser share than those in greater need.",,24
Humanities,Philosophy,Year 12,Final Exam,Post Exam Report,2025,,VCEPHERA,VCEPH25EQA2,VCEPHERACM,,Question 2b,ExaminerCommentary,"Responses that included a relevant thinker for the comparison but did not directly address the philosophical concept of justice, or demonstrated a limited understanding of related philosophical concepts such as equality, equity and unevenness, generally scored less highly. For example, some responses chose Callicles, but focused on the unrestrained desires; some chose Mill, but understood his conception of justice only in terms of the 'harm principle'.",,25
Humanities,Philosophy,Year 12,Final Exam,Post Exam Report,2025,,VCEPHERA,VCEPH25EQA2,VCEPHERACM,,Question 2b,ExaminerCommentary,"Some responses selected thinkers from Unit 3 who did not directly address justice or the distribution of goods in their works. For example, some responses discussed Laelius's views on the importance of friendship, or understood Aristotle only through the application of an Aristotelian ('Golden') mean achieved by avoiding both excess and deficit. These responses were less able to meet the specific demands of this question part, and so were less likely to be high-scoring.",,26
Humanities,Philosophy,Year 12,Final Exam,Post Exam Report,2025,,VCEPHERA,VCEPH25EQA2,VCEPHERALR,LimitedStrategies,Question 2b,ExaminerCommentary,"Some lower-scoring responses selected a thinker other than those from the Unit 3 prescribed texts and thus were not considered to have fully answered the question, even if they were able to demonstrate comprehensive or detailed knowledge of the chosen thinker.",,27
Humanities,Philosophy,Year 12,Final Exam,Post Exam Report,2025,,VCEPHERA,VCEPH25EQA2,VCEPHERACM,,Question 2c,ExaminerCommentary,"Question 2c required students to expand their focus from the relationship between the distribution of goods and justice to a broader application of the concept of 'equal' as it relates to the distribution of goods and the good life. Unlike Question 1c, Question 2c did not specifically require the student to provide an example to justify their reasoning, nor to reference other Unit 3 thinkers, so responses could score highly without including examples or referencing Allen or any other Unit 3 thinker, provided they were justified in another way.",,28
Humanities,Philosophy,Year 12,Final Exam,Post Exam Report,2025,,VCEPHERA,VCEPH25EQA2,VCEPHERAER,EnhancedStrategies,Question 2c,StudentResponse,The following is an example of a high-scoring response to Question 2:,"a) Allen believes that justice involves the fair and equal agency of all citizens in society, with the concept and application of justice being applied in two distinct ways: distributive and straightening-out justice. Distributive justice involves the proportional allotment of public goods in accordance to need such as the starving and homeless receiving more food than those who are rich and can feed themselves. This approach to justice affirms the concept that society's goods should be distributed unevenly, protecting substantive equality.",29
Humanities,Philosophy,Year 12,Final Exam,Post Exam Report,2025,,VCEPHERA,VCEPH25EQA2,VCEPHERAER,EnhancedStrategies,Question 2c,StudentResponse,,"b) Callicles would agree that uneven distribution of goods is just. He believes that true justice lies in the strong dominating the weak and taking more than them in accordance to the natural law of might being right. As such, Callicles supports the uneven distribution of goods in its entirety so long as the strong receive more than the weak. For him, conventional morality concerning justice of equality is simply arbitrary rules made by the weak to suppress the strong and stop them from getting more than their fair share. As nature is naturally opposed to convention, Callicles promotes the strong abandoning societal expectations of equality as being true justice.",30
Humanities,Philosophy,Year 12,Final Exam,Post Exam Report,2025,,VCEPHERA,VCEPH25EQA2,VCEPHERAER,EnhancedStrategies,Question 2c,StudentResponse,,"c) I believe that equality is vital for a good life, specifically for a good life with others. For the most part I agree with Allen's concept of equitable self-interest: we desire to live in a society that is well and hence must recognize that the benefit of others is also a benefit to ourselves. In sacrificing selfish or rivalrous greed and inequal provision of goods, we are able to extend a sense of friendship to other citizens, decreasing that rivalry that dictates us wanting more than others. In recognising that equality is vital for preserving the public bond, ensuring that everyone has an equal share is the best way to promote social cohesion and peace, a characteristic that is the ultimate goal for any collectivity or democracy that requires us to live a good life surrounded by people,",31
Humanities,Philosophy,Year 12,Final Exam,Post Exam Report,2025,,VCEPHERA,VCEPH25EQA3,VCEPHERACM,,Question 3a,ExaminerCommentary,"Question 3 differed in structure and content from the other questions in Section A, most notably in that the stimulus text provided wasn't taken from one of the prescribed texts, and also in that the elements of the question were arranged significantly differently. Question 3a required students to provide their own justified response to a question about the good life.",,32
Humanities,Philosophy,Year 12,Final Exam,Post Exam Report,2025,,VCEPHERA,VCEPH25EQA3,VCEPHERAER,EnhancedStrategies,Question 3a,ExaminerCommentary,"Many responses demonstrated some difficulty connecting the philosophical concepts, arguments and perspectives of Unit 3 to the specific example of CoCo's nonviolent activism. High-scoring responses recognised that the question posed in this element of Question 3 was a question of moral obligation, or of moral necessity, as seen in the use of 'require' in the prompt question.",,33
Humanities,Philosophy,Year 12,Final Exam,Post Exam Report,2025,,VCEPHERA,VCEPH25EQA3,VCEPHERALR,LimitedStrategies,Question 3a,ExaminerCommentary,"This question part also required students to use the provided stimulus text as their 'central example'. This instruction, similarly to the instruction in Section B regarding the use of case studies as 'central examples', required students to not merely mention CoCo as a part of their response but to apply the specific and precise details of CoCo's activism, as outlined in the provided stimulus, to the question of our moral obligation or moral necessity. Some lower-scoring responses justified a position on whether the good life requires taking a strong stance on moral issues without reference to CoCo or to the stimulus material provided, and thus were not considered to have fully answered the question.",,34
Humanities,Philosophy,Year 12,Final Exam,Post Exam Report,2025,,VCEPHERA,VCEPH25EQA3,VCEPHERACM,,Question 3a,ExaminerCommentary,There was a wide variety of possible responses to this question part.,,35
Humanities,Philosophy,Year 12,Final Exam,Post Exam Report,2025,,VCEPHERA,VCEPH25EQA3,VCEPHERACM,,Question 3b,ExaminerCommentary,"For Question 3b, students could select any two thinkers from any of the Unit 3 texts. While none of the thinkers directly addressed the question of nonviolent civil disobedience, the comparison prompt could be understood through 'CoCo's claim that it is morally required ...' to be focused on the philosophical concept of moral obligations. As such, some thinkers were better suited to this question than others.",,36
Humanities,Philosophy,Year 12,Final Exam,Post Exam Report,2025,,VCEPHERA,VCEPH25EQA3,VCEPHERAER,EnhancedStrategies,Question 3b,ExaminerCommentary,"Singer was a popular choice, with high-scoring responses successfully drawing a connection between his drowning child analogy and the climate-crisis action of CoCo, applying the assumption that suffering is bad and the argument that follows: that we ought morally to act to prevent suffering if we can do so without sacrificing something of equivalent moral value, to a conclusion that supports a moral requirement to nonviolent civil disobedience.",,37
Humanities,Philosophy,Year 12,Final Exam,Post Exam Report,2025,,VCEPHERA,VCEPH25EQA3,VCEPHERAER,EnhancedStrategies,Question 3b,ExaminerCommentary,"Weil was another popular choice, with high-scoring responses successfully connecting CoCo's claim to Weil's position that there exists an eternal obligation towards all humans, and that through participation in nonviolent civil disobedience that obligation can be effectively expressed in a real way, through the medium of earthly needs.",,38
Humanities,Philosophy,Year 12,Final Exam,Post Exam Report,2025,,VCEPHERA,VCEPH25EQA3,VCEPHERAER,EnhancedStrategies,Question 3b,ExaminerCommentary,"High-scoring responses often used Wolf as a counterpoint to either Singer or Weil, based on the argument that CoCo's commitment to nonviolent civil disobedience represented a form of 'moral sainthood' and therefore her life was neither good nor desirable, and such action was not morally required. Very high-scoring responses made this comparison with precision and nuance, but students needed to take care not to present an exaggerated or caricatured version of either CoCo or of Wolf's claims in such an argument.",,39
Humanities,Philosophy,Year 12,Final Exam,Post Exam Report,2025,,VCEPHERA,VCEPH25EQA3,VCEPHERAER,EnhancedStrategies,Question 3b,ExaminerCommentary,"Some high-scoring responses successfully applied Simone de Beauvoir with reference to a life of authenticity and freedom, including the respect for universal human freedoms, establishing CoCo's actions as motivated by the protection of universal human freedoms. However, some responses reduced de Beauvoir to merely advocating that CoCo should be free to choose nonviolent civil disobedience, rather than fully engaging with the concept of nonviolent civil disobedience being 'morally required'.",,40
