SubjectArea,Subject,Band,AssessmentType,AssessmentInformationDetails,AssessmentYears,UnitASCode,ExamReportCode,SectionCode,SectionHeader,SectionHeaderDescription,SectionHeaderContent,ReportCoverage,Sequence
Humanities,Geography,Year 12,Final Exam,Post Exam Report,2024,,VCEGEER,VCEGEERGC,General Comments,,2024 VCE Geography external assessment report,,0
Humanities,Geography,Year 12,Final Exam,Post Exam Report,2024,,VCEGEER,VCEGEERGC,General Comments,,"In the 2024 Geography examination, many students attempted the whole paper, with few questions left unanswered. Students were able to demonstrate sound geographic knowledge, with some providing well above standard responses throughout the examination.",,1
Humanities,Geography,Year 12,Final Exam,Post Exam Report,2024,,VCEGEER,VCEGEERGC,General Comments,,"Responses generally showed a good level of geographic competency with appropriate use of geography-specific terminology. Most students utilised up-to-date case studies and statistics. Lower-scoring responses indicated generalisations, which were, at times, also out of date.",,2
Humanities,Geography,Year 12,Final Exam,Post Exam Report,2024,,VCEGEER,VCEGEERGC,General Comments,,"Students should exercise discernment in selecting the most appropriate case study and data to use to respond to questions. Higher-scoring responses used data that added to the depth of their response; lower-scoring responses used data indiscriminately. The application of relevant data in a strategic way is a focus area for guiding students into higher achievement. Responses that included all the numbers that had been learnt indicated an inability to discern what the question is asking. In general, however, the case studies used by students in written responses were appropriate and on-topic. There was a significant reliance on textbook knowledge evident across all areas of assessment. This was particularly evident with the use of Greenland as a case study for Land Cover Change and either Bangladesh or Niger as the population case study for a growing population.",,3
Humanities,Geography,Year 12,Final Exam,Post Exam Report,2024,,VCEGEER,VCEGEERGC,General Comments,,"There were a significant number of responses that were off-topic or demonstrated inadequate preparation, particularly in Questions 3 and 9, the two longer 10-mark questions. The use of the formulaic 'Pattern, Quantity and Exception' for Question 6 was not required and impacted negatively in some responses. Rigid application of this formula did not support focus on the changes between the two timeframes as the question required. Rote learning of responses, as was evident in some responses to Question 9 in particular, is not encouraged, as it does not support students to address the focus of questions asked in this examination. The application of key skills and key knowledge continues to be the focus of the examination.",,4
Humanities,Geography,Year 12,Final Exam,Post Exam Report,2024,,VCEGEER,VCEGEERGC,General Comments,,"Students should ensure they understand the command/instructional terms. Of note in the 2024 examination, questions that directed students to 'analyse' or describe 'to what extent' required they make a determination of assessment, level of agreement or accuracy and explain this further in their response. The explanation as to the accuracy of their determination was the most important part of the response. This permitted a variation of finite decisions that could be made by students. Responses could either agree or disagree with a statement; it was the geographic reasoning that was being fully marked. Answers should have included underlying analysis, such as positive/negative, social/economic or short-/long-term understandings. It was not possible to fully respond to such questions without first making a determination and then supporting/analysing.",,5
Humanities,Geography,Year 12,Final Exam,Post Exam Report,2024,,VCEGEER,VCEGEERGC,General Comments,,"In the Answer Book, lines are included beneath each question as an indication of the depth or length of the expected response; these do not account for variation in handwriting. Students are permitted - and encouraged - to use the extra writing space provided at the end of the Answer Book, if required. Students are to alert assessors should extra writing space be utilised in their responses. This was done well in 2024 by the majority of students. With more writing space included in the Answer Book this year, fewer students required supplementary booklets to complete their written responses.",,6
Humanities,Geography,Year 12,Final Exam,Post Exam Report,2024,,VCEGEER,VCEGEERSI,Specific information,,"Note: Student responses reproduced in this report have not been corrected for grammar, spelling or factual information.",,0
Humanities,Geography,Year 12,Final Exam,Post Exam Report,2024,,VCEGEER,VCEGEERSI,Specific information,,"This report provides sample answers or an indication of what answers may have included. Unless otherwise stated, these are not intended to be exemplary or complete responses.",,1
Humanities,Geography,Year 12,Final Exam,Post Exam Report,2024,,VCEGEER,VCEGEERSI,Specific information,,The statistics in this report may be subject to rounding resulting in a total more or less than 100 per cent.,,2
Humanities,Geography,Year 12,Final Exam,Post Exam Report,2025,,VCEGEER,VCEGEERGC,General Comments,,"Note: Student responses reproduced in this report have not been corrected for grammar, spelling or 
factual information.",,0
Humanities,Geography,Year 12,Final Exam,Post Exam Report,2025,,VCEGEER,VCEGEERGC,General Comments,,"This report provides sample answers or an indication of what answers may have included. Unless otherwise stated, these are not intended to be exemplary or complete responses",,1
Humanities,Geography,Year 12,Final Exam,Post Exam Report,2025,,VCEGEER,VCEGEERGC,General Comments,,"The statistics in this report may be subject to rounding, resulting in a total of more or less than 100 per cent.",,2
Humanities,Geography,Year 12,Final Exam,Post Exam Report,2025,,VCEGEER,VCEGEERGC,General Comments,,Students were asked to identify and describe a natural characteristic of a forest.,,3
Humanities,Geography,Year 12,Final Exam,Post Exam Report,2025,,VCEGEER,VCEGEERGC,General Comments,,"Most students were able to answer this question, but in general more detail was needed to receive full marks. Some responses showed a lack of understanding of the term 'natural characteristic', and students are reminded to focus as thoroughly on physical geography as on human geography.",,4
Humanities,Geography,Year 12,Final Exam,Post Exam Report,2025,,VCEGEER,VCEGEERGC,General Comments,,"Identification may be embedded in the description or made as a separate statement. A description is not an explanation. Description may include appearance, function, spatial arrangement or interconnection, and can include specialised terminology such as 'canopy' or 'understorey'.",,5
Humanities,Geography,Year 12,Final Exam,Post Exam Report,2025,,VCEGEER,VCEGEERGC,General Comments,,The following is an example of a high-scoring response:,,6
Humanities,Geography,Year 12,Final Exam,Post Exam Report,2025,,VCEGEER,VCEGEERGC,General Comments,,"One natural characteristic of forests are closed forests. Closed forests consist of tall sun reaching trees that create a dense canopy, often shielding the forest floor from obtaining much sunlight. These are mostly consisted of rainforests, which are approx. 40% of earths forests, making closed forests 
quite expansive.",,7
Humanities,Geography,Year 12,Final Exam,Post Exam Report,2025,,VCEGEER,VCEGEERGC,General Comments,,Environmental impacts could include:,,8
Humanities,Geography,Year 12,Final Exam,Post Exam Report,2025,,VCEGEER,VCEGEERGC,General Comments,,"damage to water table, loss of habitat, irreparable loss of biodiversity, extinction of species, loss of soil nutrition",,9
Humanities,Geography,Year 12,Final Exam,Post Exam Report,2025,,VCEGEER,VCEGEERGC,General Comments,,location-specific impacts (e.g. identifying a specific plant being impacted or specifying the damage at this location; reduced impact of forest fires due to selective logging at this location),,10
Humanities,Geography,Year 12,Final Exam,Post Exam Report,2025,,VCEGEER,VCEGEERGC,General Comments,,intensifying effects of climate change; hotter and drier with less forest cover.,,11
Humanities,Geography,Year 12,Final Exam,Post Exam Report,2025,,VCEGEER,VCEGEERGC,General Comments,,Social conditions would be location-specific and could include:,,12
Humanities,Geography,Year 12,Final Exam,Post Exam Report,2025,,VCEGEER,VCEGEERGC,General Comments,,positive - locations for housing being provided or jobs for the local population,,13
Humanities,Geography,Year 12,Final Exam,Post Exam Report,2025,,VCEGEER,VCEGEERGC,General Comments,,"negative - loss of cultural connection or hunting/spiritual connections, or deaths of local people who stand in the way of progress; migration of non-locals into the area further impacting 
cultural losses.",,14
Humanities,Geography,Year 12,Final Exam,Post Exam Report,2025,,VCEGEER,VCEGEERGC,General Comments,,The following is an example of a high-scoring response for Cameroon:,,15
Humanities,Geography,Year 12,Final Exam,Post Exam Report,2025,,VCEGEER,VCEGEERGC,General Comments,,"Environment: in the process of cutting down trees (deforestation) this releases harmful gases into the atmosphere, especially CO2 emissions which accelerate the greenhouse gas effect assisting with climate change with Cameroon producing around 110 million metric tons of CO2 emissions due to deforestation.",,16
Humanities,Geography,Year 12,Final Exam,Post Exam Report,2025,,VCEGEER,VCEGEERGC,General Comments,,"Social conditions: An impact on social conditions is the impact on communities that live near areas that have experienced deforestation which depletes natural resources that are of use to them and the connection they shared with the land that may now be lost, hindering connections to sacred land.",,17
Humanities,Geography,Year 12,Final Exam,Post Exam Report,2025,,VCEGEER,VCEGEERGC,General Comments,,Students were required to discuss one issue and associated challenge of the impact on the social conditions outlined in part a.,,18
Humanities,Geography,Year 12,Final Exam,Post Exam Report,2025,,VCEGEER,VCEGEERGC,General Comments,,"Students needed to write about a social condition linked to the impact of deforestation at this location. These impacts may include people needing to migrate, animals or vegetation requiring protection, funding needed to address the social condition identified, and change in structures due to new working arrivals.",,19
Humanities,Geography,Year 12,Final Exam,Post Exam Report,2025,,VCEGEER,VCEGEERGC,General Comments,,"The challenges that arise to respond to this issue would be linked to deforestation. These could include the need to address the economic pressure to continue deforestation, government corruption in illegal logging practices, raising social awareness of the negative consequences of deforestation, legislation and enforcement of means to protect local/traditional norms from changes.",,20
Humanities,Geography,Year 12,Final Exam,Post Exam Report,2025,,VCEGEER,VCEGEERGC,General Comments,,A reminder of these terms:,,21
Humanities,Geography,Year 12,Final Exam,Post Exam Report,2025,,VCEGEER,VCEGEERGC,General Comments,,an issue or issues may result from deforestation,,22
Humanities,Geography,Year 12,Final Exam,Post Exam Report,2025,,VCEGEER,VCEGEERGC,General Comments,,"a challenge is what needs to be responded to by governments, non-government organisations 
or individuals.",,23
Humanities,Geography,Year 12,Final Exam,Post Exam Report,2025,,VCEGEER,VCEGEERGC,General Comments,,The following is an example of a high-scoring response for Borneo:,,24
Humanities,Geography,Year 12,Final Exam,Post Exam Report,2025,,VCEGEER,VCEGEERGC,General Comments,,"A major issue arising from the loss of livelihood security is the loss of secure land rights for indigenous communities. Although many communities rely on forests for cultural identity and forest resources, ~40% of Indigenous land claims in Borneo are legally recognised. The associated challenge is that plantation concessions frequently overlap with customary land with over 55% of new concessions since the 2010s have been granted on indigenous territories. This makes it extremely difficult for communities to contest land grabs or seek compensation, leading to ongoing poverty with rates reaching up to 30% in forest fringe areas and loss of cultural practices and a continued conflict with palm oil companies.",,25
Humanities,Geography,Year 12,Final Exam,Post Exam Report,2025,,VCEGEER,VCEGEERGC,General Comments,,"Responses covered a wide range of case studies including Borneo, Cameroon, the Amazon, Sumatra, PNG, Central Victoria, Tanzania, Tasmania, the Philippines, Madagascar and Ghana. Students demonstrated a good knowledge of their case study for deforestation and an understanding of environmental and social impacts. Many students used case-study-specific data to support their discussion, such as the number of gorillas or orangutans left in the wild, or the specifics of the Baku people. There was an evident and clear understanding from many students about the difference between an issue and a challenge. Higher-scoring responses were awarded marks according to their choice of issue and data relating to the challenge. Students are encouraged to use time-management skills to answer the question; general context for the case study was not required.",,26
Humanities,Geography,Year 12,Final Exam,Post Exam Report,2025,,VCEGEER,VCEGEERGC,General Comments,,Students were required to use grassland and coniferous forest data to show there are both similarities and differences in the locations across the Northern and Southern Hemispheres. Accurate and relevant quantification would lift the quality of the answers.,,27
Humanities,Geography,Year 12,Final Exam,Post Exam Report,2025,,VCEGEER,VCEGEERGC,General Comments,,"Overall, this question was well done, and most students were able to describe the data effectively. However, some did not focus on comparison and some did not incorporate data into their responses.",,28
Humanities,Geography,Year 12,Final Exam,Post Exam Report,2025,,VCEGEER,VCEGEERGC,General Comments,,The following is an example of a high-scoring response:,,29
Humanities,Geography,Year 12,Final Exam,Post Exam Report,2025,,VCEGEER,VCEGEERGC,General Comments,,"Both the distribution of grassland and coniferous forest is located predominantly in the northern hemisphere evident as grassland is distributed from 90-5N latitude and only slightly in the southern hemisphere from 0-45S latitude. This is similar to coniferous forests, distributed from 80-5N latitude and only slightly in the southern hemisphere from 0-50S latitude. However grassland covers a significantly larger area of vegetation compared to coniferous forests. This is evident as grassland reaches a distribution of 340 km2 at 50-45N compared to coniferous forests which reaches a maximum of 75 km2 at 40-35N.",,30
Humanities,Geography,Year 12,Final Exam,Post Exam Report,2025,,VCEGEER,VCEGEERGC,General Comments,,This question tested students' understanding of the nature of a glacier and their ability to read a map.,,31
Humanities,Geography,Year 12,Final Exam,Post Exam Report,2025,,VCEGEER,VCEGEERGC,General Comments,,"East and east-south-east were accepted responses, with the most common error being south-east.",,32
Humanities,Geography,Year 12,Final Exam,Post Exam Report,2025,,VCEGEER,VCEGEERGC,General Comments,,Responses were required to provide the length of the glacier for the years 1890 and 2010. Units of measurement needed to be included.,,33
Humanities,Geography,Year 12,Final Exam,Post Exam Report,2025,,VCEGEER,VCEGEERGC,General Comments,,The most common error was an incorrect response for 2010. A misunderstanding of the process of glacier melting was evident when it was misinterpreted that the glacier had melted and retreated in a location other than the terminus/snout.,,34
Humanities,Geography,Year 12,Final Exam,Post Exam Report,2025,,VCEGEER,VCEGEERGC,General Comments,,"Students were required to distinguish between a glacier and an ice sheet. Specific examples could be used to support the identified differences, which demonstrated a general understanding of what a glacier is as part of the evaluation. Many responses did not differentiate an ice sheet from sea ice.",,35
Humanities,Geography,Year 12,Final Exam,Post Exam Report,2025,,VCEGEER,VCEGEERGC,General Comments,,The following is an example of a high-scoring response:,,36
Humanities,Geography,Year 12,Final Exam,Post Exam Report,2025,,VCEGEER,VCEGEERGC,General Comments,,A glacier is ice that forms on the tops of mountains through the accumulation of snow each year with the snow that doesn't melt settling hard forming a glacier (and contains rocks). However an ice sheet forms flat and generally stretches for long distance. The main difference is that glaciers are on mountains where ice sheets are not.,,37
Humanities,Geography,Year 12,Final Exam,Post Exam Report,2025,,VCEGEER,VCEGEERGC,General Comments,,"Students were required to identify their case study and give enough detail to establish that melting of ice sheets and glaciers is occurring at this location. The geospatial technology being used is an assessment tool and should be clearly identified, with its use at this location explained. The management of the ice sheet / glacier needed to be linked to the information received from the geospatial technology.",,38
Humanities,Geography,Year 12,Final Exam,Post Exam Report,2025,,VCEGEER,VCEGEERGC,General Comments,,"Most schools are continuing to use Greenland as an example. Other locations included Chile, Kyrgyzstan, Alaska, Peru, Norway, Pakistan, the Andes, New Zealand, Bhutan, the Himalayas / Nepal and Switzerland. Students had a strong understanding of what geospatial technologies are, but needed to use data to help support their evaluation. Some students presented pre-written responses, which did not adequately address the question and therefore were unable to achieve full marks. Higher-scoring responses successfully distinguished between 'assessing' and 'managing', and applied these concepts to data for their 
selected location.",,39
Humanities,Geography,Year 12,Final Exam,Post Exam Report,2025,,VCEGEER,VCEGEERGC,General Comments,,The following is an example of a high-scoring response:,,40
Humanities,Geography,Year 12,Final Exam,Post Exam Report,2025,,VCEGEER,VCEGEERGC,General Comments,,"In Ilulissat, Greenland, the two GRACE Satellites have to some extent assisted in effectively assessing and managing rates of melting glaciers and ice sheets (MGIS) nationally. This project involved the initial construction of the first GRACE satellite in 2017 and the consequent second satellite being constructed in May 2018. These satellites hover over 500 km above ground level and can provide precise data on the recent melting of Greenland's MGIS. These satellites utilise the volume and density of the air in order to explicitly collect data on where MGIS is occurring and to what extent they are melting. The satellites collected data on one of Greenland's biggest glaciers, the Jakobshaven glacier, where in 2019 600 billion tonnes of ice melted contributing to approximately a 0.8mm sea level rise. The satellites have also calculated that overall 27 gigatons of ice have melted within Greenland, which could cause sea levels to rise by up to 2.2mm approximately. Furthermore, the satellites are an extremely efficient way for the Greenland and surrounding governments such as the Danish government to assess rates of MGIS through explicit understanding of where MGIS is occurring within Greenland and by how much. This can lead to effective management by government as data collected by the satellites have raised awareness for the implementation and severity revolved around the MGIS in Greenland. In response the Greenland government has implemented responses such as the Hydropower Plant Project in order to reduce carbon dioxide emissions from diesel powered electricity and instead increase the usage of green, sustainable and clean energy in the town of Ilulissat, Greenland. Contributing to lowered carbon dioxide emissions which can lower the enhanced greenhouse effect, in an attempt to restrict MGIS from occurring. These satellites are financially sustainable due to the fact that as much as they were expensive to implement (costing up to $270million US), data collected has driven awareness within Greenland for MGIS, contributing to socially sustainable responses being made by governments and citizens. Overall the long term positives of the satellites outweigh the initial high set up costs, and other potential restrictions such as satellite inability to functions adequately during extreme weather events. Evidently showing that this geo-spatial technology has done more than ""little"" to effectively assess and managed MGIS in Greenland and is overall quite an effective response.",,41
Humanities,Geography,Year 12,Final Exam,Post Exam Report,2025,,VCEGEER,VCEGEERGC,General Comments,,Students needed to identify change from 'x' land use to 'y' land use at this location.,,42
Humanities,Geography,Year 12,Final Exam,Post Exam Report,2025,,VCEGEER,VCEGEERGC,General Comments,,Strong fieldwork knowledge was evident for most students.,,43
Humanities,Geography,Year 12,Final Exam,Post Exam Report,2025,,VCEGEER,VCEGEERGC,General Comments,,"Geographic characteristics can be human or natural, though students were not required to identify these with this terminology. Two geographic characteristics - such as location, scale, topography, regional setting, infrastructure of the site or demographic characteristics - needed to be identified. Possible responses could include proximity to other local features making it ideal to develop (e.g. near a train station so greater access for patrons/residents) or demand in the local area (e.g. no other primary school around and there is a population bulge in this age group). Students needed to identify how each of these characteristics resulted in this location being changed from one land use to the next. Students could use two natural geographic characteristics, two human characteristics or a combination of both. Characteristics needed to be explained, not just elaborated with description. Students needed to explain how the characteristic impacted the land use change. For example, the site was sufficiently large (= scale).",,44
Humanities,Geography,Year 12,Final Exam,Post Exam Report,2025,,VCEGEER,VCEGEERGC,General Comments,,"Many students explained the impacts of the change at their fieldwork site used for part a. This is a different question, and students could not be awarded for marks for this response. A significant number of students explained economic or social drivers of the change instead of geographic characteristics. Overall, this fieldwork section as part of the Land Use Change area of study was well done.",,45
Humanities,Geography,Year 12,Final Exam,Post Exam Report,2025,,VCEGEER,VCEGEERGC,General Comments,,The following is an example of a high-scoring response:,,46
Humanities,Geography,Year 12,Final Exam,Post Exam Report,2025,,VCEGEER,VCEGEERGC,General Comments,,"Hawthorn Grove Estate's land use moved from commercial to residential from 1960-2014, the land was used as ""Hotel California"" (commercial). Following this, the land was cleared and from 2014-2024 the land became residential.",,47
Humanities,Geography,Year 12,Final Exam,Post Exam Report,2025,,VCEGEER,VCEGEERGC,General Comments,,"A geographic characteristic that likely impacted the land use change of the Hawthorn Grove Estate is the human geographic characteristic of close proximity to schools. The Hawthorn Grove Estate is directly opposite the school Xavier College, 400 metres from MLC and 1km from Glenferrie Primary School. This makes the location a desirable spot for families to live, influencing the change from commercial to residential. Another human geographic characteristic that likely influenced the land use change of the Hawthorn Grove Estate is its close proximity to the city. The land is approximately 6km East of Melbourne's CBD, which make the location a desirable spot for home buyers. This is because, being so close to the CBD means transport is more accessible and is closer to a wider array of services, such as food and hospitality.",,48
Humanities,Geography,Year 12,Final Exam,Post Exam Report,2025,,VCEGEER,VCEGEERGC,General Comments,,"Students were required to describe three types of population movement using different origin and destination examples, with a brief statement of why each type of population movement is occurring between the origin and destination given. For example, people are migrating from Tuvalu to New Zealand as forced migration. With the sea level rising surrounding Tuvalu, people have no choice but to relocate and New Zealand's society and government has welcomed a limited number of these forced environmental refugees.",,49
Humanities,Geography,Year 12,Final Exam,Post Exam Report,2025,,VCEGEER,VCEGEERGC,General Comments,,The following is an example of a high-scoring response:,,50
