SubjectArea,Subject,Band,AssessmentType,AssessmentInformationDetails,AssessmentYears,UnitASCode,ExamReportCode,EQCode,SectionCode,StrategyType,ExamQuestion,ResponseSource,Content,Example,Sequence
Humanities,Geography,Year 12,Final Exam,Post Exam Report,2024,,VCEGEER,VCEGE24EQ5,VCEGEERCM,,Question 5,ExaminerCommentary,"All students who attempted this question were successfully able to identify an ageing population. Most common case studies were Germany and Japan; some students also wrote about Australia. Most students were able to state one demographic characteristic, and often stated two for a full response. The use of these characteristics to then classify the country as 'ageing' was less successfully completed. The use of accurate data such as the elderly dependency ratio was a sound choice of demographic characteristic to include; however, an explanation of the support that this number gave to the country's being classified as 'ageing' was often omitted or not explained well. A number of responses provided two demographic characteristics, but gave an explanation of how this contributes to the ageing classification for only one. Low-scoring responses included generalities, such as identifying the number of people above the age of 65 as a demographic characteristic and explaining this characteristic as having many older people.",,56
Humanities,Geography,Year 12,Final Exam,Post Exam Report,2024,,VCEGEER,VCEGE24EQ5,VCEGEERER,EnhancedStrategies,Question 5,StudentResponse,The following is an example of a high-scoring response:,Japan contains a large percentage of its population at the age of 65 yeas and above making up 25% of its population.,57
Humanities,Geography,Year 12,Final Exam,Post Exam Report,2024,,VCEGEER,VCEGE24EQ5,VCEGEERER,EnhancedStrategies,Question 5,StudentResponse,,Japan also contains a low total fertility rate (TFR) of 1.14 which is well below the replacement rate of 2.1,58
Humanities,Geography,Year 12,Final Exam,Post Exam Report,2024,,VCEGEER,VCEGE24EQ5,VCEGEERER,EnhancedStrategies,Question 5,StudentResponse,,"This supports that Japan is currently in late stage 4 of the DTM, with low birth rates and high life expectancy leading to population decline.",59
Humanities,Geography,Year 12,Final Exam,Post Exam Report,2024,,VCEGEER,VCEGE24EQ6,VCEGEERCM,,Question 6,ExaminerCommentary,"To fully respond to this question, students needed to refer to and use both maps provided in the Data Book. Responses needed to cover both time periods and correctly identify regions, not necessarily countries, across the distribution as presented in Figure 2. In describing the distribution, higher-scoring answers showed accurate quantification, effectively employed and included a level of geographical literacy, and showed concepts such as change, regions identified and global spread at each time period. Although it was not required, a significant number of responses did name specific countries.",,60
Humanities,Geography,Year 12,Final Exam,Post Exam Report,2024,,VCEGEER,VCEGE24EQ6,VCEGEERER,EnhancedStrategies,Question 6,StudentResponse,The following is an example of a high-scoring response:,"Within 2000, Europe was the primary region experiencing a population decrease, with countries such as Italy and Greece experiencing less than 0.2% natural decrease per year. Other than European countries and Russia in 2000 no other regions are experiencing natural decrease in comparison, highly concentrated to this region. Whereas, in predicted regions of population decrease in 2050, not only has it spread into the western regions of Europe it has also increased in intensity. With predicted 0.2-0.5% decrease per year in Italy and more than 0.5% in Greece. Yet, in addition to this East Asia and the Americas are predicted to experience natural decrease. In countries such as China, Japan, Canada and Chile predicted to experience natural decrease in 2050.",61
Humanities,Geography,Year 12,Final Exam,Post Exam Report,2024,,VCEGEER,VCEGE24EQ7,VCEGEERCM,,Question 7a,ExaminerCommentary,"This question required an explanation for the high proportion of those aged 19 and under in the population structure of Country A, as shown in the Data Book's population structure. Two reasons were required; one reason could only receive a maximum of half the available marks. Explanations needed to go beyond a description of the wide base and the 'bottom heavy' nature of the population structure. Responses could have included the high crude birth rate, higher than the 2.1 replacement rate; or a falling infant mortality rate alongside a persistently high crude birth rate; some answers could be partly descriptive. Country A's position on the Demographic Transition Model - that is, late Stage 1 or early Stage 2 - could also have been used to explain the significant number of the population below 19 years of age. Social and economic reasons such as the need for rural labour, old-age security and replacement rates could be given. Religion was not an acceptable reason, unless it was specific to a country or society.",,62
Humanities,Geography,Year 12,Final Exam,Post Exam Report,2024,,VCEGEER,VCEGE24EQ7,VCEGEERER,EnhancedStrategies,Question 7a,StudentResponse,The following is an example of a high-scoring response:,"One cultural factor potentially contributing to the high youth dependency ratio exhibited in Country A, Figure 3 is cultural norms around women's role as homemakers and childbirthers. This would contribute to the high proportion of youth by increasing the fertility window of women as well as their desire to have kids, thus increasing birth rates and youth dependency. One social factor could be reduced access to contraception. Countries where less funding and resources are put into the provision of reproductive services will thus have less means to reduce birth rates, contributing to high youth dependency.",63
Humanities,Geography,Year 12,Final Exam,Post Exam Report,2024,,VCEGEER,VCEGE24EQ7,VCEGEERLR,LimitedStrategies,Question 7b,ExaminerCommentary,Many responses did not fully answer this question. Most were able to provide a basic statement that life expectancy will increase. Responses were expected to use data from Figure 3 and include specific reference to Country A. The link between the infant mortality rate and the need for replacement children to support the family and older family members was commonly explored; the link between better health resources/access resulting in a lower infant mortality rate and improving life expectancy was also explained well. The nature of the changing impact over decades was less frequently addressed; clear responses that did address this part of the question may have included some reference to moving from Stage 2 to Stage 3 of the Demographic Transition Model and the consequence of this for the life expectancy of Country A.,,64
Humanities,Geography,Year 12,Final Exam,Post Exam Report,2024,,VCEGEER,VCEGE24EQ7,VCEGEERER,EnhancedStrategies,Question 7b,ExaminerCommentary,"A significant number of responses repeated the question as a statement; this did not score well. High-scoring responses commented on the population momentum and a resulting increased longevity due to improved life chances, with respect to health and economic prosperity, and higher rates of child survival. These responses also commented that such changes were accompanied by decreased births, meaning lower maternal death rates and thus an increased life expectancy rate.",,65
Humanities,Geography,Year 12,Final Exam,Post Exam Report,2024,,VCEGEER,VCEGE24EQ8,VCEGEERCM,,Question 8a,ExaminerCommentary,"Many responses misidentified the focus of this question, often focusing on Malthus' theory and the point of crisis when resources are insufficient to meet the population's needs. However, such responses did attain some marks if well expressed and explained. This question was, however, asking students to outline the main reasons for variations of population growth developed in Malthusian theory. Ideally, the variations in population growth would include the following.",,66
Humanities,Geography,Year 12,Final Exam,Post Exam Report,2024,,VCEGEER,VCEGE24EQ8,VCEGEERCM,,Question 8a,ExaminerCommentary,"Working class will reproduce at a rate greater than food production, which is a population increase.",,67
Humanities,Geography,Year 12,Final Exam,Post Exam Report,2024,,VCEGEER,VCEGE24EQ8,VCEGEERCM,,Question 8a,ExaminerCommentary,A point of crisis is reached when food resources no longer keep up with population growth.,,68
Humanities,Geography,Year 12,Final Exam,Post Exam Report,2024,,VCEGEER,VCEGE24EQ8,VCEGEERCM,,Question 8a,ExaminerCommentary,"The population checks of famine, war and disease will reduce population.",,69
Humanities,Geography,Year 12,Final Exam,Post Exam Report,2024,,VCEGEER,VCEGE24EQ8,VCEGEERCM,,Question 8a,ExaminerCommentary,A population increase will follow as society and economy recover.,,70
Humanities,Geography,Year 12,Final Exam,Post Exam Report,2024,,VCEGEER,VCEGE24EQ8,VCEGEERER,EnhancedStrategies,Question 8b,ExaminerCommentary,"Students needed to state their determination as to whether the provided data did or did not support Malthus' prediction, and then explain how closely Figure 4 supported this prediction. Many students were able to stipulate that countries with high food insecurity and corresponding high fertility were supportive of Malthus' prediction reaching a point of crisis. Populations with low food insecurity and low fertility were not necessarily supportive of Malthus' prediction. Those responses that referenced the quantifying data in the provided graphic, using contrasting quadrants or country names to support or reject their reasoning, were able to attain full marks. Elaboration in higher-scoring responses showed an understanding of Malthus' theory and/or provided further information relating to the examples.",,71
Humanities,Geography,Year 12,Final Exam,Post Exam Report,2024,,VCEGEER,VCEGE24EQ8,VCEGEERER,EnhancedStrategies,Question 8b,StudentResponse,The following is an example of a high-scoring response:,"Malthusian theory predicted that as population grew exponentially, it would outstrip food and resources, which he predicted to grow arithmetically. Such as in Figure 4 where a total high fertility rate is positively associated with food insecurity. His theory also predicted that variations in population growth would occur from two main causes, positive and preventative ""checks"". Positive checks and natural variations which keep population growth in check, such as disease or famine, resulting in higher death rates which reduce population. Meanwhile preventative checks occur often often because of government or proactive actions such as policies to increase contraception thus reducing birth rates. E.g. The One Child Policy in China.",72
Humanities,Geography,Year 12,Final Exam,Post Exam Report,2024,,VCEGEER,VCEGE24EQ9,VCEGEERCM,,Question 9,ExaminerCommentary,This question required students to analyse the causes of the issues and challenges of growing populations. Most students wrote about an appropriate country as their selected growing population. More than one cause was required to fully complete this question.,,73
Humanities,Geography,Year 12,Final Exam,Post Exam Report,2024,,VCEGEER,VCEGE24EQ9,VCEGEERER,EnhancedStrategies,Question 9,ExaminerCommentary,"Responses that included analysis specific to the identified location rather than providing generic coverage of the causes of the issues and challenges of growing populations scored well. The highest-scoring responses classified causes as economic or social and identified resulting issues and associated challenges. Some strategies and responses could be interpreted as challenges with use of appropriate data to support the statement and add depth to the analysis given. Lower-scoring responses may have included thorough detail about issues and challenges in a country with a growing population and, if written well, even if they did not provide causes, could have obtained half the marks available. Many responses read as if they were a pre-prepared response.",,74
Humanities,Geography,Year 12,Final Exam,Post Exam Report,2024,,VCEGEER,VCEGE24EQ9,VCEGEERCM,,Question 9,ExaminerCommentary,"Some responses misidentified and labelled issues as causes, and both causes and issues as challenges to be faced. In particular, responses tended to use the terms 'issue' and 'challenge' interchangeably.",,75
Humanities,Geography,Year 12,Final Exam,Post Exam Report,2024,,VCEGEER,VCEGE24EQ9,VCEGEERCM,,Question 9,ExaminerCommentary,A reminder of these terms:,,76
Humanities,Geography,Year 12,Final Exam,Post Exam Report,2024,,VCEGEER,VCEGE24EQ9,VCEGEERER,EnhancedStrategies,Question 9,ExaminerCommentary,"A cause contributes to changes in a population, such as growth",,77
Humanities,Geography,Year 12,Final Exam,Post Exam Report,2024,,VCEGEER,VCEGE24EQ9,VCEGEERER,EnhancedStrategies,Question 9,ExaminerCommentary,An issue or issues may result from these changes,,78
Humanities,Geography,Year 12,Final Exam,Post Exam Report,2024,,VCEGEER,VCEGE24EQ9,VCEGEERER,EnhancedStrategies,Question 9,ExaminerCommentary,A challenge is what needs to be responded to by the government or external organisations.,,79
Humanities,Geography,Year 12,Final Exam,Post Exam Report,2024,,VCEGEER,VCEGE24EQ9,VCEGEERCM,,Question 9,ExaminerCommentary,"Nearly all students wrote about the case studies of either Niger or Bangladesh, though occasionally the focus was on Saudi Arabia. Of note, the rural-to-urban migration in Bangladesh was used as a cause of growing population. This was not accurate. Though there is a change in the distribution of the population, the country's overall population does not grow in this instance. The migration of workers from external countries into Saudi Arabia for work, however, does cause the population to grow and was able to be utilised as a cause to respond to this question.",,80
Humanities,Geography,Year 12,Final Exam,Post Exam Report,2025,,VCEGEER,,VCEGEERH,,,,All questions,,0
Humanities,Geography,Year 12,Final Exam,Post Exam Report,2025,,VCEGEER,,VCEGEERCM,,General Comments,ExaminerCommentary,"Note: Student responses reproduced in this report have not been corrected for grammar, spelling or 
factual information.",,1
Humanities,Geography,Year 12,Final Exam,Post Exam Report,2025,,VCEGEER,,VCEGEERCM,,General Comments,ExaminerCommentary,"This report provides sample answers or an indication of what answers may have included. Unless otherwise stated, these are not intended to be exemplary or complete responses",,2
Humanities,Geography,Year 12,Final Exam,Post Exam Report,2025,,VCEGEER,,VCEGEERCM,,General Comments,ExaminerCommentary,"The statistics in this report may be subject to rounding, resulting in a total of more or less than 100 per cent.",,3
Humanities,Geography,Year 12,Final Exam,Post Exam Report,2025,,VCEGEER,VCEGE25EQ1,VCEGEERCM,,Question 1,ExaminerCommentary,Students were asked to identify and describe a natural characteristic of a forest.,,4
Humanities,Geography,Year 12,Final Exam,Post Exam Report,2025,,VCEGEER,VCEGE25EQ1,VCEGEERCM,,Question 1,ExaminerCommentary,"Most students were able to answer this question, but in general more detail was needed to receive full marks. Some responses showed a lack of understanding of the term 'natural characteristic', and students are reminded to focus as thoroughly on physical geography as on human geography.",,5
Humanities,Geography,Year 12,Final Exam,Post Exam Report,2025,,VCEGEER,VCEGE25EQ1,VCEGEERCM,,Question 1,ExaminerCommentary,"Identification may be embedded in the description or made as a separate statement. A description is not an explanation. Description may include appearance, function, spatial arrangement or interconnection, and can include specialised terminology such as 'canopy' or 'understorey'.",,6
Humanities,Geography,Year 12,Final Exam,Post Exam Report,2025,,VCEGEER,VCEGE25EQ1,VCEGEERER,EnhancedStrategies,Question 1,StudentResponse,The following is an example of a high-scoring response:,"One natural characteristic of forests are closed forests. Closed forests consist of tall sun reaching trees that create a dense canopy, often shielding the forest floor from obtaining much sunlight. These are mostly consisted of rainforests, which are approx. 40% of earths forests, making closed forests 
quite expansive.",7
Humanities,Geography,Year 12,Final Exam,Post Exam Report,2025,,VCEGEER,VCEGE25EQ2,VCEGEERCM,,Question 2a,ExaminerCommentary,Environmental impacts could include:,,8
Humanities,Geography,Year 12,Final Exam,Post Exam Report,2025,,VCEGEER,VCEGE25EQ2,VCEGEERCM,,Question 2a,ExaminerCommentary,"Damage to water table, loss of habitat, irreparable loss of biodiversity, extinction of species, loss of soil nutrition",,9
Humanities,Geography,Year 12,Final Exam,Post Exam Report,2025,,VCEGEER,VCEGE25EQ2,VCEGEERCM,,Question 2a,ExaminerCommentary,Location-specific impacts (e.g. identifying a specific plant being impacted or specifying the damage at this location; reduced impact of forest fires due to selective logging at this location),,10
Humanities,Geography,Year 12,Final Exam,Post Exam Report,2025,,VCEGEER,VCEGE25EQ2,VCEGEERCM,,Question 2a,ExaminerCommentary,Intensifying effects of climate change; hotter and drier with less forest cover.,,11
Humanities,Geography,Year 12,Final Exam,Post Exam Report,2025,,VCEGEER,VCEGE25EQ2,VCEGEERCM,,Question 2a,ExaminerCommentary,Social conditions would be location-specific and could include:,,12
Humanities,Geography,Year 12,Final Exam,Post Exam Report,2025,,VCEGEER,VCEGE25EQ2,VCEGEERCM,,Question 2a,ExaminerCommentary,Positive - locations for housing being provided or jobs for the local population,,13
Humanities,Geography,Year 12,Final Exam,Post Exam Report,2025,,VCEGEER,VCEGE25EQ2,VCEGEERCM,,Question 2a,ExaminerCommentary,"Negative - loss of cultural connection or hunting/spiritual connections, or deaths of local people who stand in the way of progress; migration of non-locals into the area further impacting 
cultural losses.",,14
Humanities,Geography,Year 12,Final Exam,Post Exam Report,2025,,VCEGEER,VCEGE25EQ2,VCEGEERER,EnhancedStrategies,Question 2a,StudentResponse,The following is an example of a high-scoring response for Cameroon:,"Environment: in the process of cutting down trees (deforestation) this releases harmful gases into the atmosphere, especially CO2 emissions which accelerate the greenhouse gas effect assisting with climate change with Cameroon producing around 110 million metric tons of CO2 emissions due to deforestation.",15
Humanities,Geography,Year 12,Final Exam,Post Exam Report,2025,,VCEGEER,VCEGE25EQ2,VCEGEERER,EnhancedStrategies,Question 2a,StudentResponse,,"Social conditions: An impact on social conditions is the impact on communities that live near areas that have experienced deforestation which depletes natural resources that are of use to them and the connection they shared with the land that may now be lost, hindering connections to sacred land.",16
Humanities,Geography,Year 12,Final Exam,Post Exam Report,2025,,VCEGEER,VCEGE25EQ2,VCEGEERCM,,Question 2b,ExaminerCommentary,Students were required to discuss one issue and associated challenge of the impact on the social conditions outlined in part a.,,17
Humanities,Geography,Year 12,Final Exam,Post Exam Report,2025,,VCEGEER,VCEGE25EQ2,VCEGEERCM,,Question 2b,ExaminerCommentary,"Students needed to write about a social condition linked to the impact of deforestation at this location. These impacts may include people needing to migrate, animals or vegetation requiring protection, funding needed to address the social condition identified, and change in structures due to new working arrivals.",,18
Humanities,Geography,Year 12,Final Exam,Post Exam Report,2025,,VCEGEER,VCEGE25EQ2,VCEGEERCM,,Question 2b,ExaminerCommentary,"The challenges that arise to respond to this issue would be linked to deforestation. These could include the need to address the economic pressure to continue deforestation, government corruption in illegal logging practices, raising social awareness of the negative consequences of deforestation, legislation and enforcement of means to protect local/traditional norms from changes.",,19
Humanities,Geography,Year 12,Final Exam,Post Exam Report,2025,,VCEGEER,VCEGE25EQ2,VCEGEERCM,,Question 2b,ExaminerCommentary,A reminder of these terms:,,20
Humanities,Geography,Year 12,Final Exam,Post Exam Report,2025,,VCEGEER,VCEGE25EQ2,VCEGEERCM,,Question 2b,ExaminerCommentary,An issue or issues may result from deforestation,,21
Humanities,Geography,Year 12,Final Exam,Post Exam Report,2025,,VCEGEER,VCEGE25EQ2,VCEGEERCM,,Question 2b,ExaminerCommentary,"A challenge is what needs to be responded to by governments, non-government organisations 
or individuals.",,22
Humanities,Geography,Year 12,Final Exam,Post Exam Report,2025,,VCEGEER,VCEGE25EQ2,VCEGEERER,EnhancedStrategies,Question 2b,StudentResponse,The following is an example of a high-scoring response for Borneo:,"A major issue arising from the loss of livelihood security is the loss of secure land rights for indigenous communities. Although many communities rely on forests for cultural identity and forest resources, ~40% of Indigenous land claims in Borneo are legally recognised. The associated challenge is that plantation concessions frequently overlap with customary land with over 55% of new concessions since the 2010s have been granted on indigenous territories. This makes it extremely difficult for communities to contest land grabs or seek compensation, leading to ongoing poverty with rates reaching up to 30% in forest fringe areas and loss of cultural practices and a continued conflict with palm oil companies.",23
Humanities,Geography,Year 12,Final Exam,Post Exam Report,2025,,VCEGEER,VCEGE25EQ2,VCEGEERER,EnhancedStrategies,Question 2b,ExaminerCommentary,"Responses covered a wide range of case studies including Borneo, Cameroon, the Amazon, Sumatra, PNG, Central Victoria, Tanzania, Tasmania, the Philippines, Madagascar and Ghana. Students demonstrated a good knowledge of their case study for deforestation and an understanding of environmental and social impacts. Many students used case-study-specific data to support their discussion, such as the number of gorillas or orangutans left in the wild, or the specifics of the Baku people. There was an evident and clear understanding from many students about the difference between an issue and a challenge. Higher-scoring responses were awarded marks according to their choice of issue and data relating to the challenge. Students are encouraged to use time-management skills to answer the question; general context for the case study was not required.",,24
Humanities,Geography,Year 12,Final Exam,Post Exam Report,2025,,VCEGEER,VCEGE25EQ3,VCEGEERCM,,Question 3,ExaminerCommentary,Students were required to use grassland and coniferous forest data to show there are both similarities and differences in the locations across the Northern and Southern Hemispheres. Accurate and relevant quantification would lift the quality of the answers.,,25
Humanities,Geography,Year 12,Final Exam,Post Exam Report,2025,,VCEGEER,VCEGE25EQ3,VCEGEERCM,,Question 3,ExaminerCommentary,"Overall, this question was well done, and most students were able to describe the data effectively. However, some did not focus on comparison and some did not incorporate data into their responses.",,26
Humanities,Geography,Year 12,Final Exam,Post Exam Report,2025,,VCEGEER,VCEGE25EQ3,VCEGEERER,EnhancedStrategies,Question 3,StudentResponse,The following is an example of a high-scoring response:,"Both the distribution of grassland and coniferous forest is located predominantly in the northern hemisphere evident as grassland is distributed from 90-5N latitude and only slightly in the southern hemisphere from 0-45S latitude. This is similar to coniferous forests, distributed from 80-5N latitude and only slightly in the southern hemisphere from 0-50S latitude. However grassland covers a significantly larger area of vegetation compared to coniferous forests. This is evident as grassland reaches a distribution of 340 km2 at 50-45N compared to coniferous forests which reaches a maximum of 75 km2 at 40-35N.",27
Humanities,Geography,Year 12,Final Exam,Post Exam Report,2025,,VCEGEER,VCEGE25EQ4,VCEGEERCM,,Question 4a,ExaminerCommentary,This question tested students' understanding of the nature of a glacier and their ability to read a map.,,28
Humanities,Geography,Year 12,Final Exam,Post Exam Report,2025,,VCEGEER,VCEGE25EQ4,VCEGEERLR,LimitedStrategies,Question 4a,ExaminerCommentary,"East and east-south-east were accepted responses, with the most common error being south-east.",,29
Humanities,Geography,Year 12,Final Exam,Post Exam Report,2025,,VCEGEER,VCEGE25EQ4,VCEGEERCM,,Question 4b,ExaminerCommentary,Responses were required to provide the length of the glacier for the years 1890 and 2010. Units of measurement needed to be included.,,30
Humanities,Geography,Year 12,Final Exam,Post Exam Report,2025,,VCEGEER,VCEGE25EQ4,VCEGEERLR,LimitedStrategies,Question 4b,ExaminerCommentary,The most common error was an incorrect response for 2010. A misunderstanding of the process of glacier melting was evident when it was misinterpreted that the glacier had melted and retreated in a location other than the terminus/snout.,,31
Humanities,Geography,Year 12,Final Exam,Post Exam Report,2025,,VCEGEER,VCEGE25EQ4,VCEGEERLR,LimitedStrategies,Question 4c,ExaminerCommentary,"Students were required to distinguish between a glacier and an ice sheet. Specific examples could be used to support the identified differences, which demonstrated a general understanding of what a glacier is as part of the evaluation. Many responses did not differentiate an ice sheet from sea ice.",,32
