SubjectArea,Subject,Band,AssessmentType,AssessmentInformationDetails,AssessmentYears,UnitASCode,ExamReportCode,EQCode,SectionCode,StrategyType,ExamQuestion,ResponseSource,Content,Example,Sequence
Humanities,Geography,Year 12,Final Exam,Post Exam Report,2024,,VCEGEER,,VCEGEERH,,,,All questions,,0
Humanities,Geography,Year 12,Final Exam,Post Exam Report,2024,,VCEGEER,,VCEGEERCM,,General Comments,ExaminerCommentary,"In the 2024 Geography examination, many students attempted the whole paper, with few questions left unanswered. Students were able to demonstrate sound geographic knowledge, with some providing well above standard responses throughout the examination.",,1
Humanities,Geography,Year 12,Final Exam,Post Exam Report,2024,,VCEGEER,,VCEGEERLR,LimitedStrategies,General Comments,ExaminerCommentary,"Responses generally showed a good level of geographic competency with appropriate use of geography-specific terminology. Most students utilised up-to-date case studies and statistics. Lower-scoring responses indicated generalisations, which were, at times, also out of date.",,2
Humanities,Geography,Year 12,Final Exam,Post Exam Report,2024,,VCEGEER,,VCEGEERER,EnhancedStrategies,General Comments,ExaminerCommentary,"Students should exercise discernment in selecting the most appropriate case study and data to use to respond to questions. Higher-scoring responses used data that added to the depth of their response; lower-scoring responses used data indiscriminately. The application of relevant data in a strategic way is a focus area for guiding students into higher achievement. Responses that included all the numbers that had been learnt indicated an inability to discern what the question is asking. In general, however, the case studies used by students in written responses were appropriate and on-topic. There was a significant reliance on textbook knowledge evident across all areas of assessment. This was particularly evident with the use of Greenland as a case study for Land Cover Change and either Bangladesh or Niger as the population case study for a growing population.",,3
Humanities,Geography,Year 12,Final Exam,Post Exam Report,2024,,VCEGEER,,VCEGEERCM,,General Comments,ExaminerCommentary,"There were a significant number of responses that were off-topic or demonstrated inadequate preparation, particularly in Questions 3 and 9, the two longer 10-mark questions. The use of the formulaic 'Pattern, Quantity and Exception' for Question 6 was not required and impacted negatively in some responses. Rigid application of this formula did not support focus on the changes between the two timeframes as the question required. Rote learning of responses, as was evident in some responses to Question 9 in particular, is not encouraged, as it does not support students to address the focus of questions asked in this examination. The application of key skills and key knowledge continues to be the focus of the examination.",,4
Humanities,Geography,Year 12,Final Exam,Post Exam Report,2024,,VCEGEER,,VCEGEERCM,,General Comments,ExaminerCommentary,"Students should ensure they understand the command/instructional terms. Of note in the 2024 examination, questions that directed students to 'analyse' or describe 'to what extent' required they make a determination of assessment, level of agreement or accuracy and explain this further in their response. The explanation as to the accuracy of their determination was the most important part of the response. This permitted a variation of finite decisions that could be made by students. Responses could either agree or disagree with a statement; it was the geographic reasoning that was being fully marked. Answers should have included underlying analysis, such as positive/negative, social/economic or short-/long-term understandings. It was not possible to fully respond to such questions without first making a determination and then supporting/analysing.",,5
Humanities,Geography,Year 12,Final Exam,Post Exam Report,2024,,VCEGEER,,VCEGEERCM,,General Comments,ExaminerCommentary,"In the Answer Book, lines are included beneath each question as an indication of the depth or length of the expected response; these do not account for variation in handwriting. Students are permitted - and encouraged - to use the extra writing space provided at the end of the Answer Book, if required. Students are to alert assessors should extra writing space be utilised in their responses. This was done well in 2024 by the majority of students. With more writing space included in the Answer Book this year, fewer students required supplementary booklets to complete their written responses.",,6
Humanities,Geography,Year 12,Final Exam,Post Exam Report,2024,,VCEGEER,,VCEGEERCM,,General Comments,ExaminerCommentary,"Note: Student responses reproduced in this report have not been corrected for grammar, spelling or factual information.",,7
Humanities,Geography,Year 12,Final Exam,Post Exam Report,2024,,VCEGEER,,VCEGEERCM,,General Comments,ExaminerCommentary,"This report provides sample answers or an indication of what answers may have included. Unless otherwise stated, these are not intended to be exemplary or complete responses.",,8
Humanities,Geography,Year 12,Final Exam,Post Exam Report,2024,,VCEGEER,,VCEGEERCM,,General Comments,ExaminerCommentary,The statistics in this report may be subject to rounding resulting in a total more or less than 100 per cent.,,9
Humanities,Geography,Year 12,Final Exam,Post Exam Report,2024,,VCEGEER,,VCEGEERCM,,General Comments,ExaminerCommentary,2024 VCE Geography external assessment report,,10
Humanities,Geography,Year 12,Final Exam,Post Exam Report,2024,,VCEGEER,VCEGE24EQ1,VCEGEERCM,,Question 1a,ExaminerCommentary,"The prompt to name the location of a specific example of deforestation is to support students in their response. Common case studies investigated included Cameroon, Borneo and the Amazon rainforest.",,11
Humanities,Geography,Year 12,Final Exam,Post Exam Report,2024,,VCEGEER,VCEGE24EQ1,VCEGEERER,EnhancedStrategies,Question 1a,ExaminerCommentary,"Two reasons were required to achieve full marks in this response. Two marks were awarded for each reason, which needed to link to a specific location or case study. Assessors were looking for:",,12
Humanities,Geography,Year 12,Final Exam,Post Exam Report,2024,,VCEGEER,VCEGE24EQ1,VCEGEERER,EnhancedStrategies,Question 1a,ExaminerCommentary,A statement of reason for deforestation for the current land cover change,,13
Humanities,Geography,Year 12,Final Exam,Post Exam Report,2024,,VCEGEER,VCEGE24EQ1,VCEGEERCM,,Question 1a,ExaminerCommentary,An extended list/narrative of the reason for the land use change at the selected location.,,14
Humanities,Geography,Year 12,Final Exam,Post Exam Report,2024,,VCEGEER,VCEGE24EQ1,VCEGEERER,EnhancedStrategies,Question 1a,ExaminerCommentary,"General commentary such as 'deforestation is caused by logging' was insufficient on its own to achieve full marks as this is below the expected level of understanding for a Unit 3 student of Geography. An additional contextual explanation that 'deforestation is caused by logging to sell the timber for economic gain' would, however, earn the full two marks.",,15
Humanities,Geography,Year 12,Final Exam,Post Exam Report,2024,,VCEGEER,VCEGE24EQ1,VCEGEERLR,LimitedStrategies,Question 1a,ExaminerCommentary,Common errors included students not linking the general causes of deforestation to their specific location or case study. The use of implausible estimations and inaccurate data detracted from responses and could not be awarded marks.,,16
Humanities,Geography,Year 12,Final Exam,Post Exam Report,2024,,VCEGEER,VCEGE24EQ1,VCEGEERCM,,Question 1b,ExaminerCommentary,This question required students to differentiate two separate methods by which the scale of deforestation was assessed. It required:,,17
Humanities,Geography,Year 12,Final Exam,Post Exam Report,2024,,VCEGEER,VCEGE24EQ1,VCEGEERCM,,Question 1b,ExaminerCommentary,Two appropriate ways to assess deforestation at the selected location,,18
Humanities,Geography,Year 12,Final Exam,Post Exam Report,2024,,VCEGEER,VCEGE24EQ1,VCEGEERCM,,Question 1b,ExaminerCommentary,"A description, not an explanation, of both methods shown. The description should be relevant to the site not just to the assessment methodology.",,19
Humanities,Geography,Year 12,Final Exam,Post Exam Report,2024,,VCEGEER,VCEGE24EQ1,VCEGEERER,EnhancedStrategies,Question 1b,ExaminerCommentary,"If one method was completed, a maximum of half the available marks could be awarded. There was no requirement for students to comment on the effectiveness of this assessment nor to explain each method of assessment in detail. Both methods of assessment selected by students needed to be specifically linked to the single case study / chosen location. High-scoring responses often referred to the scale of the two different assessment types, such as stating that the first method was a broad-scale assessment of deforestation, and the second a local scale. This was not required to achieve full marks but did distinguish stronger geographic responses from more generalised responses.",,20
Humanities,Geography,Year 12,Final Exam,Post Exam Report,2024,,VCEGEER,VCEGE24EQ1,VCEGEERCM,,Question 1c,ExaminerCommentary,"This question could be completed separately to the response given in Question 1b. When responses described more than one management technique, only the first was marked. Marks were awarded for naming and elaborating upon the management technique; however, the focus of this question was on the evaluation of the management technique's effectiveness in addressing the deforestation impact at a specific location as identified by the student.",,21
Humanities,Geography,Year 12,Final Exam,Post Exam Report,2024,,VCEGEER,VCEGE24EQ1,VCEGEERER,EnhancedStrategies,Question 1c,ExaminerCommentary,High-scoring responses:,,22
Humanities,Geography,Year 12,Final Exam,Post Exam Report,2024,,VCEGEER,VCEGE24EQ1,VCEGEERER,EnhancedStrategies,Question 1c,ExaminerCommentary,Identified impact(s) linked to the management technique at this specific location,,23
Humanities,Geography,Year 12,Final Exam,Post Exam Report,2024,,VCEGEER,VCEGE24EQ1,VCEGEERER,EnhancedStrategies,Question 1c,ExaminerCommentary,"Elaborated upon the evaluation; for example, 'weak but strengthening when ...'",,24
Humanities,Geography,Year 12,Final Exam,Post Exam Report,2024,,VCEGEER,VCEGE24EQ1,VCEGEERER,EnhancedStrategies,Question 1c,ExaminerCommentary,"Gave a reason or stated the basis for their evaluation related to assessment, addressing specific impact at this location",,25
Humanities,Geography,Year 12,Final Exam,Post Exam Report,2024,,VCEGEER,VCEGE24EQ1,VCEGEERER,EnhancedStrategies,Question 1c,ExaminerCommentary,Used data to support their evaluation of assessment.,,26
Humanities,Geography,Year 12,Final Exam,Post Exam Report,2024,,VCEGEER,VCEGE24EQ1,VCEGEERER,EnhancedStrategies,Question 1c,ExaminerCommentary,"The use of accurate, location-specific data to support the student's evaluation of success or limitations of the management technique were hallmarks of higher-scoring responses.",,27
Humanities,Geography,Year 12,Final Exam,Post Exam Report,2024,,VCEGEER,VCEGE24EQ2,VCEGEERCM,,Question 2,ExaminerCommentary,"Many responses to this question were generalised and did not address the issue of change over a defined time. This was seen, for example, in responses that stated simply that ice and glaciers had melted in the selected location. The use of accurate data to support the depth and elaboration of the scale of the melt were often absent in responses. Greenland was the most commonly selected location; other locations selected included Bolivia and Pakistan.",,28
Humanities,Geography,Year 12,Final Exam,Post Exam Report,2024,,VCEGEER,VCEGE24EQ2,VCEGEERER,EnhancedStrategies,Question 2,ExaminerCommentary,High-scoring responses included:,,29
Humanities,Geography,Year 12,Final Exam,Post Exam Report,2024,,VCEGEER,VCEGE24EQ2,VCEGEERER,EnhancedStrategies,Question 2,ExaminerCommentary,"A general statement about the melting; for example, significant scale of retreat",,30
Humanities,Geography,Year 12,Final Exam,Post Exam Report,2024,,VCEGEER,VCEGE24EQ2,VCEGEERER,EnhancedStrategies,Question 2,ExaminerCommentary,"The specific time period for change; for example, 'since 1970 ...'",,31
Humanities,Geography,Year 12,Final Exam,Post Exam Report,2024,,VCEGEER,VCEGE24EQ2,VCEGEERER,EnhancedStrategies,Question 2,ExaminerCommentary,"A specific scale of change; for example, '12-metre retreat'",,32
Humanities,Geography,Year 12,Final Exam,Post Exam Report,2024,,VCEGEER,VCEGE24EQ2,VCEGEERER,EnhancedStrategies,Question 2,ExaminerCommentary,"Further depth and elaboration of scale of change such as quantification of rate, or past, present or future changes.",,33
Humanities,Geography,Year 12,Final Exam,Post Exam Report,2024,,VCEGEER,VCEGE24EQ2,VCEGEERCM,,Question 2,ExaminerCommentary,"Some responses provided detail about the Holocene period and its three main timeframes. This was not required and, on its own, often an insufficient response. If used as the basis to show that change has occurred over many timescales, however, this could be used to lay the basis for the current depth and elaboration of the melting ice scale of change over a defined period of time.",,34
Humanities,Geography,Year 12,Final Exam,Post Exam Report,2024,,VCEGEER,VCEGE24EQ2,VCEGEERER,EnhancedStrategies,Question 2,StudentResponse,The following is an example of a high-scoring response:,In Greenland a defined period of time in which icemelt was significant was between January 2019 and December 2019. For this period a total of 600 billion tons of ice was melted in Greenland. Greenland showing the large scale loss of ice for that period. In Greenland furthermore 92% of Greenland's total ice,35
Humanities,Geography,Year 12,Final Exam,Post Exam Report,2024,,VCEGEER,VCEGE24EQ2,VCEGEERER,EnhancedStrategies,Question 2,StudentResponse,,was melting at some point over these defined period of time and this period can contributed approximately one to two milliliters of sea level rise showing the large scale rate of ice melt in Greenland in this period.,36
Humanities,Geography,Year 12,Final Exam,Post Exam Report,2024,,VCEGEER,VCEGE24EQ3,VCEGEERCM,,Question 3,ExaminerCommentary,"This longer response required students to include more than one natural process, and at least one human activity. The focus of this question was the interconnection between these two components - human and natural. Responses that did not include this aspect were not able to achieve greater than six marks; this occurred in a significant number of responses. Many students were able to write about climate change as a human activity, but the geographic discussion in responses sometimes lacked detail and development. Some responses about climate change as both a human activity and as a natural process struggled for clarity. Common inaccuracies in responses included description of the albedo effect and the ozone layer, how they function, and the role they play in contributing to global warming.",,37
Humanities,Geography,Year 12,Final Exam,Post Exam Report,2024,,VCEGEER,VCEGE24EQ3,VCEGEERER,EnhancedStrategies,Question 3,ExaminerCommentary,Features of high-scoring responses:,,38
Humanities,Geography,Year 12,Final Exam,Post Exam Report,2024,,VCEGEER,VCEGE24EQ3,VCEGEERER,EnhancedStrategies,Question 3,ExaminerCommentary,"The information provided was unique to the selected location, rather than generic coverage with an unrelated example of a location.",,39
Humanities,Geography,Year 12,Final Exam,Post Exam Report,2024,,VCEGEER,VCEGE24EQ3,VCEGEERER,EnhancedStrategies,Question 3,ExaminerCommentary,Both the concept and reality of climate change was evident.,,40
Humanities,Geography,Year 12,Final Exam,Post Exam Report,2024,,VCEGEER,VCEGE24EQ3,VCEGEERER,EnhancedStrategies,Question 3,ExaminerCommentary,"Discussion was written in full, rather than being presented simply as a list of causes of the phenomenon.",,41
Humanities,Geography,Year 12,Final Exam,Post Exam Report,2024,,VCEGEER,VCEGE24EQ3,VCEGEERER,EnhancedStrategies,Question 3,ExaminerCommentary,The interconnection was often presented as the combination of natural and human processes working together to increase either the scale or rate of the melting.,,42
Humanities,Geography,Year 12,Final Exam,Post Exam Report,2024,,VCEGEER,VCEGE24EQ3,VCEGEERER,EnhancedStrategies,Question 3,ExaminerCommentary,"While a broad timescale may have been included, often to show how climate change is a natural process over millennia, the emphasis of the interconnection focused on the current time period.",,43
Humanities,Geography,Year 12,Final Exam,Post Exam Report,2024,,VCEGEER,VCEGE24EQ3,VCEGEERER,EnhancedStrategies,Question 3,ExaminerCommentary,"Use of appropriate, accurate data to back up statements related to the selected location.",,44
Humanities,Geography,Year 12,Final Exam,Post Exam Report,2024,,VCEGEER,VCEGE24EQ3,VCEGEERCM,,Question 3,ExaminerCommentary,Some low-scoring responses about the impacts of melting ice sheets and glaciers upon humans and the natural environment read as though they were prepared responses for a different question.,,45
Humanities,Geography,Year 12,Final Exam,Post Exam Report,2024,,VCEGEER,VCEGE24EQ3,VCEGEERCM,,Question 3,ExaminerCommentary,"All students are encouraged to read the entire question when formulating their response, rather than focusing on keywords that do not cover all aspects of the question.",,46
Humanities,Geography,Year 12,Final Exam,Post Exam Report,2024,,VCEGEER,VCEGE24EQ3,VCEGEERER,EnhancedStrategies,Question 3,StudentResponse,The following is an example of a high-scoring response:,"The Natural process of decreasing albedo of Greenland's ice sheet is contributing to its ice melt. Ash from volcanism, dust from deserts for around the globe as well as other impurities are blown onto Greenland's ice sheet making it darker, making is absorb more radiation from the sun and more ice melt. These impurities called cryoconite which gather on the ice's surface and form clusters of accelerated ice melt. This natural process that decreases Greenland's ice albedo has a strong interconnection with the human activity of fossil fuel combustion, primarily in Europe through coal-fired power stations. This human activity releases soot into the atmosphere which is blown onto Greenland's ice sheet by strong trade winds. The vast quantities of fossil fuel that has been combusted since the industrial revolution has resulted in approximately 1.9˚C of warming on average globally, due to the enhanced greenhouse effect. Thus, large quantities of soot reach Greenland. This accumulates on the ice surface and is covered by snow fall. Future melting uncovers these impurities which decreases the ice's albedo further, contributing to ice melt. Recently it was determined that the average surface temperature in Greenland has increased by 2.8˚C. Thus, a significant signpost to the contribution continuing albedo from both natural and human source has on ice melt in Greenland.",47
Humanities,Geography,Year 12,Final Exam,Post Exam Report,2024,,VCEGEER,VCEGE24EQ4,VCEGEERER,EnhancedStrategies,Question 4a,ExaminerCommentary,"Students were required to write about satellite images or remote sensing; the majority completed this accurately. A few students mistakenly wrote about the photographic images in the Data Book provided in the examination. High-scoring responses identified how the technology would be used, such as relating to change over time, by writing, for example, 'from one year to the next' or 'before and after work on this land use change has occurred'. Students were to detail an example, such as comparing the previous width of a street with the possible new width. Students were also expected to discuss the merit of such images, such as their reliability or clarity in assisting the identification of land use change.",,48
Humanities,Geography,Year 12,Final Exam,Post Exam Report,2024,,VCEGEER,VCEGE24EQ4,VCEGEERER,EnhancedStrategies,Question 4a,StudentResponse,The following is an example of a high-scoring response:,"In order to identify land use change in Varanasi, India, the analysis of satellite images could provide the process and scale of change on a spatial (size of region affected) and temporal (comparison of images from 2000 to 2024) distribution. By comparing satellite images from different years, the geographer could analyse the bird's-eye view image of the area and geographic characteristics that may indicate likely land use change. For example, comparing the number of motor vehicles would imply a change from semi-residential to transport land use increases.",49
Humanities,Geography,Year 12,Final Exam,Post Exam Report,2024,,VCEGEER,VCEGE24EQ4,VCEGEERER,EnhancedStrategies,Question 4b,ExaminerCommentary,"High-scoring responses to this question stated the geographic technique utilised and explained why this would be a good data source. Well-scoring responses included the use of 'surveys of the local population' or 'the use of photographs as in the data book' to determine the local impact of the change in land use to inform the geographer. Excellent responses referred to the difference in the local scale of this information as opposed to the wider information collected in Question 4a. Some responses mistakenly referred to a 'secondary response' instead of a 'second response', which is a primary data collection form not a secondary data collection form. No marks were awarded for answers that mentioned the use of satellite images or other forms of remote sensing; the question explicitly stated these were not to be included, but the statistics suggest this was a common error. Students are reminded to read the entire question carefully.",,50
Humanities,Geography,Year 12,Final Exam,Post Exam Report,2024,,VCEGEER,VCEGE24EQ4,VCEGEERER,EnhancedStrategies,Question 4b,StudentResponse,The following is an example of a high-scoring response:,"Another source of data that the geographer could use in an investigation of the change in land use at Varanasi is data created via interviews. This can help to attain knowledge on how long the change took, its impact on residents, the ways the change happened and much more. This data is valuable as it is primary data that comes straight from the source and also considers individual perspectives which many other types of data do not.",51
Humanities,Geography,Year 12,Final Exam,Post Exam Report,2024,,VCEGEER,VCEGE24EQ4,VCEGEERCM,,Question 4c,ExaminerCommentary,"Students were required to elaborate on a geospatial technique, providing its name and a description of its use. To fully answer this question, responses needed to describe the context of use of the geospatial technique at students' specific fieldwork site and the land use change under review. Responses at times did not refer to the fieldwork site nor include any indication of the land use before and after change. While not explicitly stated in the question, and therefore not required for marks, it was nevertheless more difficult for responses to describe the use of the geospatial technique in fieldwork without stating the land use change at a given location.",,52
Humanities,Geography,Year 12,Final Exam,Post Exam Report,2024,,VCEGEER,VCEGE24EQ4,VCEGEERCM,,Question 4c,ExaminerCommentary,"A maximum of two marks were awarded if the technique described in the response was not a geospatial technique accompanied by a clear link to their specific fieldwork site. This occurred in a significant number of responses. Once again, students are reminded to read the whole question carefully.",,53
Humanities,Geography,Year 12,Final Exam,Post Exam Report,2024,,VCEGEER,VCEGE24EQ4,VCEGEERCM,,Question 4c,ExaminerCommentary,"The selection of land-use change case studies was varied. Many students wrote about urbanisation at the rural/urban fringe. Commonly selected Melbourne-based fieldwork sites included the Docklands, the land use change at Fishermans Bend or the former Alphington paper mill.",,54
Humanities,Geography,Year 12,Final Exam,Post Exam Report,2024,,VCEGEER,VCEGE24EQ4,VCEGEERER,EnhancedStrategies,Question 4c,StudentResponse,The following is an example of a high-scoring response:,"One geospatial technology used at my fieldwork investigation about the impacts of industrial to mixed use residential land use change at Altona North Precinct 15 was a geotagged Survey 123 traffic count. I conducted a traffic count along the southern boarder of the precinct, which was Blackshaws Road. These results were then uploaded along with a location pin by Survey 123, where they were placed on a GIS map with other people traffic count. I used the data to identify traffic as a potential impact, with 71 cars recorded in 5 minutes.",55
