SubjectArea,Subject,Band,AssessmentType,AssessmentInformationDetails,AssessmentYears,UnitASCode,ExamReportCode,SectionCode,SectionHeader,SectionHeaderDescription,SectionHeaderContent,ReportCoverage,Sequence
Humanities,Geography,Year 12,Final Exam,Post Exam Report,2025,,VCEGEER,VCEGEERGC,General Comments,,"Forced migration is an example of low agency migration, where people often have no choice but to migrate. An example of migration from the country of origin Ukraine to the country of destination Poland. Following the Russian invasion of Ukraine in 2022, many Ukrainians were forced to seek refuge in Poland due to their close proximity and Poland's swift humanitarian response. As of May 2025, 1 million Ukrainian refugees are living in Poland, but up to 5 million resided in Poland at some point throughout the invasion.",,51
Humanities,Geography,Year 12,Final Exam,Post Exam Report,2025,,VCEGEER,VCEGEERGC,General Comments,,"Voluntary migration is an example of high agency migration, where the individual migrates due to their choice. An example is migration from India (country of Origin) to the UAE (country of destination). This movement is often due to economic migration where people from India seek work in the UAE. As of 2023, there are 3.5 million Indian labour migrants in the UAE, and blue-collar jobs have increased by 25%.",,52
Humanities,Geography,Year 12,Final Exam,Post Exam Report,2025,,VCEGEER,VCEGEERGC,General Comments,,"Long-term migration can either be high or low agency, and involves the individual migrating for extended period of time. An example is to move permanently from Australia (country of origin) to Japan (country of destination). In Tokyo, 3% of their population in their 20s is made up of migrants from Australia.",,53
Humanities,Geography,Year 12,Final Exam,Post Exam Report,2025,,VCEGEER,VCEGEERGC,General Comments,,"Students were able to earn up to 3 of the 4 marks per migration type, but struggled to get the fourth mark because they did not give a detailed enough example in the discussion. A strength of this question saw students utilise three different migration examples. Higher-scoring responses included a clear example with data/numbers and linked to reasons, and factoring in push/pull, choice/agency and so on. Many were able to use an example of origin and destination from their case study for aging or growing populations. Students who got full marks for each type showed a deep understanding of the movement type.",,54
Humanities,Geography,Year 12,Final Exam,Post Exam Report,2025,,VCEGEER,VCEGEERGC,General Comments,,Students were required to use the population structure provided to identify that there are more people of working age than there are of economic dependence.,,55
Humanities,Geography,Year 12,Final Exam,Post Exam Report,2025,,VCEGEER,VCEGEERGC,General Comments,,Dependent population - both youth dependents and old age dependents are significantly smaller in number than economically active population.,,56
Humanities,Geography,Year 12,Final Exam,Post Exam Report,2025,,VCEGEER,VCEGEERGC,General Comments,,The following is an example of a high-scoring response:,,57
Humanities,Geography,Year 12,Final Exam,Post Exam Report,2025,,VCEGEER,VCEGEERGC,General Comments,,Country A is experiencing a Demographic Dividend as there is a large number of 16-65 year old people which are able to work. There is a large bump in population among middle aged which can be seen by 4.7% male and 4.6% females in the 30-34 section.,,58
Humanities,Geography,Year 12,Final Exam,Post Exam Report,2025,,VCEGEER,VCEGEERGC,General Comments,,Students needed to correctly identify that this population structure will age into the future and the smaller number of people shown under the current working age will result in a significantly impacted/reversed demographic dividend in the future. There will be an aged population and this will require government and NGO planning now to ease the impact and provide sustainability into the next 30 to 40 years. Students were required to make a prediction using data from the figure.,,59
Humanities,Geography,Year 12,Final Exam,Post Exam Report,2025,,VCEGEER,VCEGEERGC,General Comments,,The following is an example of a high-scoring response:,,60
Humanities,Geography,Year 12,Final Exam,Post Exam Report,2025,,VCEGEER,VCEGEERGC,General Comments,,"In the next 30-40 years, 80% of Country A's current working population will be in or nearing retirement, resulting in a larger dependency population that the government will have to account for. Country A also shows low birth rates in 2025, being only 6% of pop is 0-4, this means that in 30-40 years, the work force will not be large enough to account for the aged/retired pop resulting in a deficit of workers to look after the elderly. Thus, the challenge would be a demographic deficit as elderlys are more prevalent and DTM 4 indicate a reducing birth rate.",,61
Humanities,Geography,Year 12,Final Exam,Post Exam Report,2025,,VCEGEER,VCEGEERGC,General Comments,,"This question was well answered and most students used data from the population pyramid. The expression 'justify using evidence' means to use the data provided. Some students were unable to predict a challenge, but those students who did were able to justify and use data in support of their prediction.",,62
Humanities,Geography,Year 12,Final Exam,Post Exam Report,2025,,VCEGEER,VCEGEERGC,General Comments,,Students were required to identify the nature of population trends. The rate of growth may be continuing or be impacted by government and NGO plans and policies. This is evident as the country is moving through the population structures that are typical of the Demographic Transition Model stages. A variety of sketches would be considered acceptable. The validity of these sketches is the core factor. Examples of sketch diagrams could include age gender structures or positions on the DTM.,,63
Humanities,Geography,Year 12,Final Exam,Post Exam Report,2025,,VCEGEER,VCEGEERGC,General Comments,,The following is an example of a high-scoring response for Tanzania:,,64
Humanities,Geography,Year 12,Final Exam,Post Exam Report,2025,,VCEGEER,VCEGEERGC,General Comments,,"Tanzania is experiencing a rapidly growing population, evident by a growth rate of 2.9%, however over time, Tanzania's structure has changed considerably.",,65
Humanities,Geography,Year 12,Final Exam,Post Exam Report,2025,,VCEGEER,VCEGEERGC,General Comments,,"During 1990s, Tanzania had a high fertility rate of 5.03 and high growth rate of 3.05%. This resulted in a large youthful population, as seen in figure c, and a small elderly population thus placing Tanzania in stage 2 of the Demographic Transition Model (DTM), as seen in figure B. This can be attributed to low female literacy rates at 48% leading to low education surrounding contraception and therefore high fertility rates, evident as 40% of girls aged 15-19 with no education had a child, compared to 6% of those with secondary education. This can also be attributed to high levels of poverty, with 26.4% below the poverty line, leading to high levels of subsistence agriculture and kids seen as an economic asset, leading to high fertility.",,66
Humanities,Geography,Year 12,Final Exam,Post Exam Report,2025,,VCEGEER,VCEGEERGC,General Comments,,"During 2025, both the fertility rate and growth rate have decreased significantly, at 4.5 and 2.9% respectively. This has resulted in a smaller, youthful population, although still large with 42% below 15 and a larger elderly population placing Tanzania in late stage 2/early stage 3 of the DTM as seen in figure B. This can be attributed to decreasing infant mortality rates, at 57/1000 live births reducing the need for replacement children as well as increased contraception rising from 27% in 2017 to 31.7% in 2025 and unmet need for contraception decreasing from 50% in 2017 to 22% in 2025.",,67
Humanities,Geography,Year 12,Final Exam,Post Exam Report,2025,,VCEGEER,VCEGEERGC,General Comments,,"As Tanzanians general population trend is a decreasing fertility rate and increasing life expectancy, Tanzania is likely to enter a demographic dividend in the future as seen by the population structure in figure D. This is because lower fertility rates mean there is a smaller proportion of youthful dependents to care for. However high fertility rates in the past means there is a large working class, thus resulting in economic growth for the country.",,68
Humanities,Geography,Year 12,Final Exam,Post Exam Report,2025,,VCEGEER,VCEGEERGC,General Comments,,"Students sketched a wide range of diagrams, including population structure diagrams, maps of the country and population over time. Students were generally able to discuss what was currently happening with the population but some did not analyse the change over time or how the change may impact the country into the future. Some students used a prepared response that did not answer the question, and therefore did not enable them to achieve marks. Some students drew detailed sketches but did not refer to them or annotate them, so it was not clear what the diagrams were showing. A wide range of countries were chosen, including Chad, Kenya, Tanzania, South Sudan, Saudi Arabia and Madagascar, with the majority of students choosing either Bangladesh or Niger.",,69
Humanities,Geography,Year 12,Final Exam,Post Exam Report,2025,,VCEGEER,VCEGEERGC,General Comments,,Two separate issues of the demographic needed to be named. These could have included a negative pressure caused by this population type or a positive influence or impact upon the society.,,70
Humanities,Geography,Year 12,Final Exam,Post Exam Report,2025,,VCEGEER,VCEGEERGC,General Comments,,Students needed to link this answer to their answer for part a. The strategy selected needed to be named and its main aims given.,,71
Humanities,Geography,Year 12,Final Exam,Post Exam Report,2025,,VCEGEER,VCEGEERGC,General Comments,,"Students needed to discuss the strategy identified in part b. Outcomes of this strategy were to be clearly identified as being positive or negative to resolve the demographic issue being faced at this location. Students were required to use evidence to support the discussion on environmental, social, economic and cultural impacts, as the question asked for an evaluation of the strategy.",,72
Humanities,Geography,Year 12,Final Exam,Post Exam Report,2025,,VCEGEER,VCEGEERGC,General Comments,,The following is an example of a high-scoring response for Germany:,,73
Humanities,Geography,Year 12,Final Exam,Post Exam Report,2025,,VCEGEER,VCEGEERGC,General Comments,,"The response implemented by BMW has seen a high level of effectiveness in targeting the declining working age sector. They implement over 70 amendments, which totalled just $64,000 euros, thus denoting the economically viable outcomes. These amendments included the introduction of weight adapted footwear and wooden floors which reduce the knee pain and strain on their workers, thus removing the potentiality of retirement through injury. Further, they introduced more frequent workstation changes as well as ""barber style"" work chairs, which reduces strain on one part of the body within an entire days work, as well as ensuring adequate and sufficient rest within breaks. Their success has been outlined through quantifiable evidence, whereby in 2020 50% of Dinggolfingsc (town in Germany) workers were above the age of 50. Alongside this, their review of the strategy has seen a 5% reduction in absenteeism and an increase in productivity by 7%. Through conducted surveys, it was outlined that this is likely due to their enjoyment in work and great fullness towards the ability to keep working through old age. This highlights the effectiveness as it reduces the pressure among the government agencies and the pension system, as more individuals remain paying taxes. As the way Germany's current pension system works is the money is immediately collected and distributed among retirees. As a result, 85% of the pensioners income is state financed, which pressures the government seeing an additional $154billion required in 2021 to meet the owed incomes. Thus the BMW response is actively reducing these perceived issues. However, it is not a long term response as eventually total fertility rates must be targeted and advanced. Overall, the BMW response targets the reduced working age sector and reduces pressure on the German government.",,74
Humanities,Geography,Year 12,Final Exam,Post Exam Report,2025,,VCEGEER,VCEGEERGC,General Comments,,Students needed to use reading time to plan this response as all three parts of this question were linked. Information provided in part a. needed to allow students to respond to the next two parts of Question 10. High-scoring responses were able to link the students' strategies directly to the issue and to the idea of an ageing population.,,75
Humanities,Geography,Year 12,Final Exam,Post Exam Report,2025,,VCEGEER,VCEGEERGC,General Comments,,"Students worked on a wide range of case studies: Australia, Japan and Germany were some of the most popular, and Italy, Spain, China, Portugal, Romania, Finland, South Korea and Singapore were also included.",,76
Humanities,Geography,Year 12,Final Exam,Post Exam Report,2025,,VCEGEER,VCEGEERGC,General Comments,,"The strategy for Germany was often open-door policy, but this was too vague and inaccurate. Responses for Germany also referred to examples used by populist politicians rather than data, particularly around unemployment, racism, crime, etc. Japanese examples use Angel Plan, Abenomics and robots, but these were often superficial. Students should choose a country with sufficient current and accurate policies/data. Many of the strategies implemented are now over 20 years old, which allows for evaluation but not many current approaches.",,77
Humanities,Geography,Year 12,Final Exam,Post Exam Report,2025,,VCEGEER,VCEGEERGC,General Comments,,"Generally, students should use the reading time to read over the questions and determine the structure and complexity required for the long-response questions. They should look for multi-part questions to ensure it is possible to respond to all parts with a linking response. Students should be very careful not to contradict themselves (i.e. in responses for questions 2a/2b and 10a/10b). Students would benefit from taking a moment to plan their long-answer responses, so they do not repeat themselves too much and effectively use the writing space provided with specifics. In this examination, students were able to show that they knew their case studies and had data to support their statements.",,78
