SubjectArea,Subject,SubjectStreamCode,SubjectStreamName,Band,AssessmentType,AssessmentInformationDetails,AssessmentYears,UnitASCode,ExamReportCode,EQCode,SectionCode,StrategyType,ExamQuestion,ResponseSource,Content,Example,Sequence
English,English,,,Year 12,Final Exam,Post Exam Report,2024,"VCEEU3AS1,VCEEU4AS1",VCEENGER,,VCEENGERA,,Section A: Analytical response to a text,,,,1
English,English,,,Year 12,Final Exam,Post Exam Report,2024,"VCEEU3AS1,VCEEU4AS1",VCEENGER,,VCEENGERA,EnhancedStrategies,,,Strategies that enhanced responses,,2
English,English,,,Year 12,Final Exam,Post Exam Report,2024,"VCEEU3AS1,VCEEU4AS1",VCEENGER,,VCEENGERA,EnhancedStrategies,,ExaminerCommentary,"Topic interpretation: Consideration of the implications of the topic

The response considered the implications in the word ‘for’ and created a reading to explore this.","‘As indicated by the title, while much occurs in the play it is all for nothing.
Do you agree?’
More than merely a frivolous comedy of manners, Shakespeare’s Much Ado About Nothing unveils the strategies of subjugation and deception employed by a hereditary elite. Contrary to what the title might suggest, the play explores a range of confronting issues, including the moral depravity of a power-obsessed ruling class within a highly stratified society, the seemingly oppressive institution of marriage, and the construction of ostensible harmony in order to conceal human failings. However, despite the turmoil it experiences throughout the play, Messina’s social order is eventually returned to its original, underlying purpose: to perpetuate a values system that will inevitably be adopted by future generations. In this way, ‘nothing’ has occurred by the play’s conclusion.",3
English,English,,,Year 12,Final Exam,Post Exam Report,2024,"VCEEU3AS1,VCEEU4AS1",VCEENGER,,VCEENGERA,EnhancedStrategies,,ExaminerCommentary,"Argument construction: Using strategic sequencing to explain the connections between the ideas presented and to guide the ‘reading’ of the text

This response used summary sentences in each paragraph to make explicit the ideas being presented and their connection to one another.","‘Tradition is inescapable.
To what extent does Chronicle of a Death Foretold show this to be true?’
BP1 Marquez exposes a social framework steeped in traditional notions of male conquest …
BP2 [These values are] extolled by an obstinate society who adhere unfailingly to their traditional social codes … [designed] to control, condone and rationalise the brutal upkeep of tradition to ensure its perpetuation …
BP3 The novel’s fragmentation thus illustrates how tradition itself is subject to decay and contortion under the town’s self-serving narratives.
BP4 [thus] … rendering tradition as only inescapable when a society does not reflect on their historical shortcomings.",4
English,English,,,Year 12,Final Exam,Post Exam Report,2024,"VCEEU3AS1,VCEEU4AS1",VCEENGER,,VCEENGERA,EnhancedStrategies,,ExaminerCommentary,"Argument substantiation: Using a range of evidence to support the ‘reading’

This response considered the text’s linguistic elements, setting, characters and, by implication, the text’s structures and the way in which these elements interplayed to support the reading presented.","‘The Memory Police is as much about gain as it is about loss.
Discuss.’
… Ogawa posits that the complacency and passivity towards the loss of objects and memories within the island begins with the citizen’s desensitisation to loss, stifling their capacity to freely grieve or connect with one another for survival. The island’s isolation in ‘an expanse of a totally empty sea’ mirrors the pervasive solitude experienced by its inhabitants who are metaphorically adrift in a sea of forgotten memories, symbolising an inner ‘emptiness’ disconnecting them from one another. Capturing an emotional isolation in ‘eyes as still as a lonely swamp’, Ogawa continues her metaphor of an isolation … Within the gradual erasure of memories that permeates an emotional disconnection, Ogawa portrays the gradual erosion of humanity’s survival in the citizen’s amnesia resulting in … loss of knowledge in cultural identity and history … the blanket of ‘perfect and untouched’ snow not only represents the narrator’s reluctancy in rekindling ‘frightening’ memories, but also serves as a metaphor for society’s intensifying emotional numbness as an eternal winter falls on the island. … the suffocating imagery of ‘lay buried under the snow’ represents Japan’s tendency to ‘bur[y]’ its traumatic past … Ogawa demonstrates how placing responsibility of cultural amnesia on external forces is a projection of complacency … as citizens are unable to ‘discriminate’ between personal accountability and erosion of self awareness.",5
English,English,,,Year 12,Final Exam,Post Exam Report,2024,"VCEEU3AS1,VCEEU4AS1",VCEENGER,,VCEENGERA,EnhancedStrategies,,ExaminerCommentary,"Capacity to resolve the topic: Resolving the topic, i.e. showing an understanding of the interplay between the author’s context, audience(s) and purpose in relation to the topic 

This response used the conclusion to resolve the topic and, thus, completed the response.","‘In Oedipus the King, all who deserve it are justly punished.
Do you agree?’
There is a sense that no human, no matter your accolades or past achievements, or even perception from others can succumb to their ego and lose touch with reality. Sophocles imparts to us that every being must understand their existential value in the world they find themselves in, and must be careful in attempting to take self willed action undermining the natural order, as you will find yourself measured and found wanting with just punishment. ‘Oedipus the King’ is not a play that demonstrates the atrocities, but rather the tragic enlightenment of the fundamentally ignorant …",6
English,English,,,Year 12,Final Exam,Post Exam Report,2024,"VCEEU3AS1,VCEEU4AS1",VCEENGER,,VCEENGERA,EnhancedStrategies,,ExaminerCommentary,"Capacity to communicate ideas: Use language with precision

The student used appropriate metalanguage and linking devices to explore complex interconnected ideas.","‘In High Ground a desire for control is the most important factor in decision-making. 
Do you agree?’
The film begins with the rising sun above Arnhem Land’s sacred rock structure, this scene is accompanied with the soundtrack of a Yolngu man chanting in his language. The song harmonises with the landscape as the camera slowly pans to reveal the vast Australian desert. Johnson promptly portrays the connection to land Indigenous Australians share. He furthers this notion by depicting a scene of young Gutjuk who is being taught a traditional dance by his uncle, Baywara. The dance is heavily inspired by the natural world, even their names derive from ‘Hawk’ & ‘Snake’. However, the serene harmony of this scene is interrupted by the sharp editing cuts to the marching colonial officers. Their faces are obscured & only their weapons are left visible, depicting them as ominous figures that are harbingers of chaos. 
Their actions are motivated by the desire to implement their ‘law’ … Unlike Indigenous communities that inhabit the land, they wish to own it … heinous atrocities that are committed … driven by this desire to control …",7
English,English,,,Year 12,Final Exam,Post Exam Report,2024,"VCEEU3AS1,VCEEU4AS1",VCEENGER,,VCEENGERA,LimitedStrategies,,,Strategies that limited responses,,8
English,English,,,Year 12,Final Exam,Post Exam Report,2024,"VCEEU3AS1,VCEEU4AS1",VCEENGER,,VCEENGERA,LimitedStrategies,,ExaminerCommentary,Topic interpretation: Responses may have:,,9
English,English,,,Year 12,Final Exam,Post Exam Report,2024,"VCEEU3AS1,VCEEU4AS1",VCEENGER,,VCEENGERA,LimitedStrategies,,ExaminerCommentary,Topic interpretation,"misunderstood that the invitation of the topic was to explore the ideas/values presented by the author and consider the topic through an entirely different lens, missing the point of the task",10
English,English,,,Year 12,Final Exam,Post Exam Report,2024,"VCEEU3AS1,VCEEU4AS1",VCEENGER,,VCEENGERA,LimitedStrategies,,ExaminerCommentary,Topic interpretation,"read the topic as only inviting a discussion of one concept, when in fact the topic invited consideration of the relationship between two or more concepts. For example, a response may have discussed only humour and not defence in topic Question 2i (‘“Now you are officially the best-looking person in the family.” Humour is Noah’s strongest defence in Born a Crime. Do you agree?’)",11
English,English,,,Year 12,Final Exam,Post Exam Report,2024,"VCEEU3AS1,VCEEU4AS1",VCEENGER,,VCEENGERA,LimitedStrategies,,ExaminerCommentary,Topic interpretation,"dismissed the concepts and discussed other concept(s) with respect to the relationship offered. For example, in response to Question 1ii (‘“In their shame, they could hardly bear to look at each other.” Regret and shame determine experiences in Bad Dreams and Other Stories. To what extent do you agree?’), a response might have claimed it is not ‘regret and shame’ that determine experience, it is social circumstance, and went on to address the new concept that has been introduced",12
English,English,,,Year 12,Final Exam,Post Exam Report,2024,"VCEEU3AS1,VCEEU4AS1",VCEENGER,,VCEENGERA,LimitedStrategies,,ExaminerCommentary,Topic interpretation,"misread the topic or conflate the two topics on offer. For example, when answering Question 15i (‘Sunset Boulevard both challenges and reinforces traditional gender expectations. Discuss.’) or Question 15ii (‘“There is nothing tragic about being 50, not unless you try to be 25.” In Sunset Boulevard, how does Wilder portray Hollywood’s infatuation with youth?’), a response might have discussed gender expectations and infatuation with youth.",13
English,English,,,Year 12,Final Exam,Post Exam Report,2024,"VCEEU3AS1,VCEEU4AS1",VCEENGER,,VCEENGERA,LimitedStrategies,,ExaminerCommentary,Topic interpretation,"Some terms caused difficulty, such as ‘central concern’, ‘inescapable’ and ‘perceptions’. Having a strategy to deal with unfamiliar terms is advisable. Students should be reminded they are able to bring dictionaries into the examination.",14
English,English,,,Year 12,Final Exam,Post Exam Report,2024,"VCEEU3AS1,VCEEU4AS1",VCEENGER,,VCEENGERA,LimitedStrategies,,ExaminerCommentary,Argument construction: Responses might have:,,15
English,English,,,Year 12,Final Exam,Post Exam Report,2024,"VCEEU3AS1,VCEEU4AS1",VCEENGER,,VCEENGERA,LimitedStrategies,,ExaminerCommentary,Argument construction,"drifted from the topic or spent time discussing irrelevant material, such as an extended discussion about the author’s personal attributes",16
English,English,,,Year 12,Final Exam,Post Exam Report,2024,"VCEEU3AS1,VCEEU4AS1",VCEENGER,,VCEENGERA,LimitedStrategies,,ExaminerCommentary,Argument construction,"demonstrated no meaningful strategy in their presentation of ideas. For example, in Question 18i (‘“Why should a man suffer so grievously for an offence he had committed inadvertently?” In Things Fall Apart, the consequences of actions are rarely fair. Do you agree?’) a response might only have offered examples of characters who do or do not understand their past",17
English,English,,,Year 12,Final Exam,Post Exam Report,2024,"VCEEU3AS1,VCEEU4AS1",VCEENGER,,VCEENGERA,LimitedStrategies,,ExaminerCommentary,Argument construction,"used a structure that simply presented a series of ‘examples’ that ‘prove’ a contention using one character/story/poem per paragraph, rather than discussed the author’s ideas",18
English,English,,,Year 12,Final Exam,Post Exam Report,2024,"VCEEU3AS1,VCEEU4AS1",VCEENGER,,VCEENGERA,LimitedStrategies,,ExaminerCommentary,Argument construction,"considered only one of the concepts presented by the topic. For example, ‘differences’ but not ‘understanding’",19
English,English,,,Year 12,Final Exam,Post Exam Report,2024,"VCEEU3AS1,VCEEU4AS1",VCEENGER,,VCEENGERA,LimitedStrategies,,ExaminerCommentary,Argument construction,considered the key term (such as ‘youth’) but not the modifying term that addressed the aspect of the concept that their attention was drawn to (such as ‘infatuation’). Or responses may only have discussed ‘cruelty’ but not addressed the topic’s specific concern of ‘unrelenting cruelty’,20
English,English,,,Year 12,Final Exam,Post Exam Report,2024,"VCEEU3AS1,VCEEU4AS1",VCEENGER,,VCEENGERA,LimitedStrategies,,ExaminerCommentary,Argument construction,"used a flawed understanding or definition of the terms of a topic, leading to irrelevance.",21
English,English,,,Year 12,Final Exam,Post Exam Report,2024,"VCEEU3AS1,VCEEU4AS1",VCEENGER,,VCEENGERA,LimitedStrategies,,ExaminerCommentary,Argument substantiation: Responses might have:,,22
English,English,,,Year 12,Final Exam,Post Exam Report,2024,"VCEEU3AS1,VCEEU4AS1",VCEENGER,,VCEENGERA,LimitedStrategies,,ExaminerCommentary,Argument substantiation,suggested the task was a discussion of ‘facts’ rather than of the strategies/vehicles the author had used to convey ideas,23
English,English,,,Year 12,Final Exam,Post Exam Report,2024,"VCEEU3AS1,VCEEU4AS1",VCEENGER,,VCEENGERA,LimitedStrategies,,ExaminerCommentary,Argument substantiation,tried to ‘twist’ a topic so that they could discuss more familiar textual material,24
English,English,,,Year 12,Final Exam,Post Exam Report,2024,"VCEEU3AS1,VCEEU4AS1",VCEENGER,,VCEENGERA,LimitedStrategies,,ExaminerCommentary,Argument substantiation,"referenced only a specific part of a text (for example, only the opening) and thus reduced their capacity to discuss the way in which ideas are developed",25
English,English,,,Year 12,Final Exam,Post Exam Report,2024,"VCEEU3AS1,VCEEU4AS1",VCEENGER,,VCEENGERA,LimitedStrategies,,ExaminerCommentary,Argument substantiation,"demonstrated a limited or incomplete understanding of the author’s ideas, indicated by the way in which the response attempted to substantiate the ideas",26
English,English,,,Year 12,Final Exam,Post Exam Report,2024,"VCEEU3AS1,VCEEU4AS1",VCEENGER,,VCEENGERA,LimitedStrategies,,ExaminerCommentary,Argument substantiation,used quotes merely to serve as description rather than as the basis for analysis,27
English,English,,,Year 12,Final Exam,Post Exam Report,2024,"VCEEU3AS1,VCEEU4AS1",VCEENGER,,VCEENGERA,LimitedStrategies,,ExaminerCommentary,Argument substantiation,"exclusively used a particular aspect of the text. For example, characters’ experiences to substantiate a reading, thus indicating a limited understanding of the text.",28
English,English,,,Year 12,Final Exam,Post Exam Report,2024,"VCEEU3AS1,VCEEU4AS1",VCEENGER,,VCEENGERA,LimitedStrategies,,ExaminerCommentary,Capacity to conclude essay: Responses might have:,,29
English,English,,,Year 12,Final Exam,Post Exam Report,2024,"VCEEU3AS1,VCEEU4AS1",VCEENGER,,VCEENGERA,LimitedStrategies,,ExaminerCommentary,Capacity to conclude essay,stopped at the end of their body paragraphs without attempting to conclude,30
English,English,,,Year 12,Final Exam,Post Exam Report,2024,"VCEEU3AS1,VCEEU4AS1",VCEENGER,,VCEENGERA,LimitedStrategies,,ExaminerCommentary,Capacity to conclude essay,been limited to merely restating the argument in the conclusion.,31
English,English,,,Year 12,Final Exam,Post Exam Report,2024,"VCEEU3AS1,VCEEU4AS1",VCEENGER,,VCEENGERA,LimitedStrategies,,ExaminerCommentary,Capacity to communicate ideas: The effectiveness of a response may have been limited by:,,32
English,English,,,Year 12,Final Exam,Post Exam Report,2024,"VCEEU3AS1,VCEEU4AS1",VCEENGER,,VCEENGERA,LimitedStrategies,,ExaminerCommentary,Capacity to communicate ideas,"poor vocabulary choices, including using vocabulary inappropriately",33
English,English,,,Year 12,Final Exam,Post Exam Report,2024,"VCEEU3AS1,VCEEU4AS1",VCEENGER,,VCEENGERA,LimitedStrategies,,ExaminerCommentary,Capacity to communicate ideas,struggles with grammar,34
English,English,,,Year 12,Final Exam,Post Exam Report,2024,"VCEEU3AS1,VCEEU4AS1",VCEENGER,,VCEENGERA,LimitedStrategies,,ExaminerCommentary,Capacity to communicate ideas,incoherence.,35
English,English,,,Year 12,Final Exam,Post Exam Report,2024,VCEEU3AS2,VCEENGER,,VCEENGERB,,Section B: Creating a text,,,,36
English,English,,,Year 12,Final Exam,Post Exam Report,2024,VCEEU3AS2,VCEENGER,,VCEENGERB,EnhancedStrategies,,,Strategies that enhanced responses,,37
English,English,,,Year 12,Final Exam,Post Exam Report,2024,VCEEU3AS2,VCEENGER,,VCEENGERB,EnhancedStrategies,,ExaminerCommentary,Using the title as a central component in the text’s creation.,,38
English,English,,,Year 12,Final Exam,Post Exam Report,2024,VCEEU3AS2,VCEENGER,,VCEENGERB,EnhancedStrategies,,ExaminerCommentary,Strategically developing ideas throughout the text.,,39
English,English,,,Year 12,Final Exam,Post Exam Report,2024,VCEEU3AS2,VCEENGER,,VCEENGERB,EnhancedStrategies,,ExaminerCommentary,Revisiting imagery from the stimulus as a way of creating cohesion through the text.,,40
English,English,,,Year 12,Final Exam,Post Exam Report,2024,VCEEU3AS2,VCEENGER,,VCEENGERB,EnhancedStrategies,,ExaminerCommentary,Establishing a voice that strategically connected to the reader to achieve the text’s purpose.,,41
English,English,,,Year 12,Final Exam,Post Exam Report,2024,VCEEU3AS2,VCEENGER,,VCEENGERB,EnhancedStrategies,,ExaminerCommentary,Using linguistic strategies to amplify and develop ideas.,,42
English,English,,,Year 12,Final Exam,Post Exam Report,2024,VCEEU3AS2,VCEENGER,,VCEENGERB,LimitedStrategies,,,Strategies that limited responses,,43
English,English,,,Year 12,Final Exam,Post Exam Report,2024,VCEEU3AS2,VCEENGER,,VCEENGERB,LimitedStrategies,,ExaminerCommentary,"Free writing – some planning is essential, given the limited time available to produce and develop a text.",,44
English,English,,,Year 12,Final Exam,Post Exam Report,2024,VCEEU3AS2,VCEENGER,,VCEENGERB,LimitedStrategies,,ExaminerCommentary,Presenting ideas that were unrelated or minimally related to the Framework.,,45
English,English,,,Year 12,Final Exam,Post Exam Report,2024,VCEEU3AS2,VCEENGER,,VCEENGERB,LimitedStrategies,,ExaminerCommentary,Contorting previously prepared responses in an attempt to connect with the exam title and stimulus.,,46
English,English,,,Year 12,Final Exam,Post Exam Report,2024,VCEEU3AS2,VCEENGER,,VCEENGERB,LimitedStrategies,,ExaminerCommentary,"Writing for self, rather than for the reader.",,47
English,English,,,Year 12,Final Exam,Post Exam Report,2024,VCEEU3AS2,VCEENGER,,VCEENGERB,LimitedStrategies,,ExaminerCommentary,Relying solely on plot to convey ideas.,,48
English,English,,,Year 12,Final Exam,Post Exam Report,2024,VCEEU3AS2,VCEENGER,,VCEENGERB,LimitedStrategies,,,"Some students appropriated the intellectual or moral status of others, possibly to add a sense of legitimacy to their views.",,49
English,English,,,Year 12,Final Exam,Post Exam Report,2024,VCEEU3AS2,VCEENGER,,VCEENGERB,LimitedStrategies,,ExaminerCommentary,"For example, a student may have appropriated the voice of a psychologist when writing about mental health issues.",,50
English,English,,,Year 12,Final Exam,Post Exam Report,2024,VCEEU3AS2,VCEENGER,,VCEENGERB,LimitedStrategies,,ExaminerCommentary,"While students are free to adopt a voice within this section, appropriate elaboration of an idea tends to be more compelling than simply claiming expert status.",,51
English,English,,,Year 12,Final Exam,Post Exam Report,2024,VCEEU3AS2,VCEENGER,,VCEENGERB,LimitedStrategies,,ExaminerCommentary,Students are encouraged to consider the many ways in which a position can be legitimised.,,52
