SubjectArea,Subject,SubjectStreamCode,SubjectStreamName,Band,AssessmentType,AssessmentInformationDetails,AssessmentYears,UnitASCode,ExamReportCode,EQCode,SectionCode,StrategyType,ExamQuestion,ResponseSource,Content,Example,Sequence
English,English,,,Year 12,Final Exam,Post Exam Report,2024,VCEEU3AS2,VCEENGER,,VCEENGERB,StudentResponse,Framework of Ideas 4: Play — Example 7,StudentResponse,"I was five years old when my father granted me the exhilarating freedom to select a gift from the kaleidoscope of aisles at Big W for my birthday. The vibrant colours overwhelmed me as I dashed past tempting action figures and Legos, but I was instantly drawn to a large crimson box. Inside, was a board game that when I rattled, sparked my curiosity. Immediately transfixed, I claimed the box as my present. But little did I know, I had just made a decision that would shape a whirlwind of joy, devastation, fulfilment, and eventual emptiness over the next six years.

On the day I turned six, anticipation surged as I ripped through the thin Batman wrapping. The powerful aroma of hardwood varnish engulfed me as I slid of the lid, revealing gleaming figurines sprawled across a black and white chessboard. In that fleeting moment, it was like the world had held its breath, as I realised that the epic battles with my toy soldiers were becoming a reality. No longer confined to the imaginative skirmishes of my childhood, I could now play a game where I could command armies on a chessboard.

It was time to play chess.

My father always promised me a gold coin every time I could beat him at chess. I was seven years old when I first defeated him. After countless months of hearing the resounding echo if ‘checkmate’, my relentless mentality to persevere paid off, earning me my first gold coin. Despite its humble value, that first taste of victory remains forever etched in my memory, a testament to my insatiable hunger to win the battle.

By nine years old, I had clinched my first tournament victory. Nine. Outwitting and outplaying opponents more than four times my age, I left spectators stunned and speechless. This complex game of chess had become child’s play. And with it, came the thrill of success, reflected in my father’s beaming face, which only fuelled my drive to keep practicing and refining my strategies.

~

One year later, I had risen to become the undisputed leader of my age group. I had become the soldier in command, the Queen of the board; wasting no time as I reached the pinnacle of Australian chess, all whilst in primary school. Yet behind the applause and the pride, there lingered the quiet, unsettling pressure, the shadow of disappointment that followed every loss. Each win would light up my father’s face, but after every defeat, I felt the weight of his disappointment pressing harder, like the heavy hum of silence that follows a lost battle. And like in every game, even the strongest pieces get flanked into a corner, left vulnerable and exposed. The chessboard, once a playground to my imagination, evolved into a battlefield, where every move felt like a life-or-death decision. Soon, the pressure mounted, and the exhaustion weighed heavy, leading me to succumb to a deep sense of complacency. My prime had passed in a heartbeat – my first taste of zugzwang*.

As time passed, a realisation hit me harder than any defeat; I was no longer playing for myself; I was playing for my father’s elusive approval. Shackled by my father’s thoughts, the once passionate drive to learn or practice complex strategies eventually faded, replaced by the naive belief that my God-given talent would keep my father’s admiration within reach. Because of this, I became locked in a bitter stalemate for the next six years, losing ground to opponents I once effortlessly surpassed. Each game became a gruelling campaign, where every loss felt like a retreat into the shadows. I was left questioning my next move. Do I keep fighting? Or do I succumb to my injuries? I had stubbornly clung to my misguided beliefs, taking the path of a knight, skipping steps.

My father often told me that I never finish what I started, that I always make it so far in the race just to stop at the finish line. At the time, his advice fell on deaf ears. But what he said soon became a painful reality, as my rivals were no longer playing catch-up – they were leaving me behind. Eventually, my passion for the game dimmed, slowly extinguished at the expense of my blunder. I had ultimately took the biggest risk by placing my faith in my natural talent, and lost it all playing a gambit.

~

Now, at seventeen, I find myself stood far adrift from a game I once cherished. Occasionally, I catch snippets of conversations, or see chess games showcased on TikTok, and all I can do is just smile and reminisce. Reminisce about the adrenaline that came from every victorious battle, and the tears I shed from every scar of defeat. In the chaos of growing up, I had lost sight of the exhilaration chess once provided, and now it solely remains as a memory.

~

Soon, I will be eighteen, and my time in playing chess has ultimately come to an end. Chess once consumed me, as I soared past everyone’s expectations but my father’s. Yet, as I matured, I became distracted by the joy of new friendships, the camaraderie of team sports, and the turbulence of relationships. Now, as I prepare to face the unpredictable battles of adulthood, I feel the weight of another game I don’t fully understand – Life. In this vast battlefield of existence, there are no checkmates, no clear victories, only choices that feel like zugzwang*. Just like in chess, even when every move feels like a trap, you still have to play.

*Zugzwang – a term in chess when any move will result in a disadvantage.","The student used the title in two ways. There was consideration of the way the value of play can be subverted at a time when society believes it is the appropriate time to play. Then this idea was developed at the end where the experience of this time reshaped an understanding of life.
The student referenced both stimulus 1 and 2 ironically by exploring the consequences of not having freedom to play and not having the outcome of play prescribed and limited.
The length is approximately 800 words.

---

The text used the opening paragraphs to orient the reader. The innocent child’s excitement was purposefully established to create a powerful contrast with the way in which a ‘natural’ joy was subverted by the imposition of adult values. The optimistic beginning contrasted sharply with the bleak ending and irony was employed to achieve this.

Early in the piece the student began to use war imagery, which became a sustained motif. The writer highlighted the collateral damage inflicted on the child using these allusions. The power of this sophisticated strategy spoke to purposeful linguistic structures and vocabulary used by the writer. This was one way in which the writer established both voice and a connection to the reader to achieve the text’s purpose.

An ominously short paragraph was used to mark the introduction of the adult into the world of the child, and the end of one way of playing with the introduction of another.

The use of repeated sounds stressed ideas: this strategy demonstrates the skill of the writer. The Pyrrhic victory at this stage of the text foreshadowed the ultimate loss

The juxtaposition of results with the father’s facial expression allowed the reader to infer the child’s motivation and the way that the game had become secondary to the child’s more basic need for love. This stimulated sympathy for the narrator and emphasised the sadness of the recount.

The contrast between the appropriate use of play and reality represented in the careful selection of vocabulary at this point re-enforced the approaching loss and foreshadowed the invitation to reflect on the importance of the ‘time to play’.
The use of repeated sounds stressed ideas: this strategy demonstrates the skill of the writer. The Pyrrhic victory at this stage of the text foreshadowed the ultimate loss.
The writer continued to harness both the language of chess with its associations with war and the very real battle that was occurring, using metaphor to consider the ideas more deeply and resonate more strongly with the reader.

Imagery such as ‘shackled’ highlighted the plight of the child and built the reader’s emotional response to the text.
The matter-of-fact way in which the text referred to the narrator’s ‘injuries’ worked to heighten the readers’ feelings of sadness, thus presenting more compelling ideas.

The narrator’s assumption of blame for a ‘blunder’ highlighted the many ways in which the positive notions of play were corrupted.

In the final paragraph the narrator indicated through their measured voice that there was a greater cost than had been presented before. The authorial decision to withhold this information ensured its impact on the reader is intensified.

The narrator’s resignation to a life of zugzwang shows the damage inflicted on the child. The concept of the time for play was reintroduced and the lasting impact of corrupting childhood was hinted at, encouraging the reader to undertake meaningful reflection about the ideas presented.",59
English,English,,,Year 12,Final Exam,Post Exam Report,2024,VCEEU3AS2,VCEENGER,,VCEENGERB,StudentResponse,Framework of Ideas 4: Play — Example 8,StudentResponse,"Parents, listen up! Are your little ones struggling to find time to play? Are their creative minds being constricted in what they can do in school? Do you wish there was a place where they were free to do whatever they want to do? Well you’re in luck! Here at ‘Little Bodies Big Minds’ we are aiming to provide kindergarten-primary school children a safe space in which they can think whatever they like to think and play whatever they like to play! Come on parents, it’s time to play!

We are strong believers in supporting creativity here at Little Bodies Big Minds. Your mind is a rocket ship, let your ideas soar! Think outside of the box! It is so important to support creative thinking while your children are still young. It is fundamental to their development and their skills to encourage them to think and play freely. We know that at school, it’s hard for kids to do whatever they want to do, which is just as important for them to learn rules and understand boundaries, but we believe there should be a balance. Children have such unique minds and abilities, why not celebrate them? If you still aren’t convinced, here’s how we work.

Little Bodies Big Minds is a 2 story building equipped with different rooms and activities for your little ones to switch between and enjoy throughout their day. Each room will be supervised by a member of our highly trained staff, don’t worry, we don’t everything slide! Our first floor is dedicated solely to letting children thinking what they like and play what they like. We have different sports running, arts and crafts rooms, dress up and make believe boxes and tons of toys to fit each of their desires. And the best part about it, they are free to switch at any time they like. There are no set rooms or activities for the day, only what your child feels like doing, while our staff is there at their service! Of course, many children can’t play without getting a little tired. That’s why our second floor includes a high quality canteen in case some kids forget to pack snacks and need a little energy boost, as well as relaxation and nap rooms where kids can wind down and rest before getting back to playing! Our Centre is open after school hours on weekdays and all day on weekends to encourage children to still attend school as our committee is well aware how important school is for young minds. So whenever your kids come back from school feeling hyper, come on down and we’ll take it from there!

To put your mind at ease, Little Bodies Big Minds have a ZERO bullying and violence policy. We encourage creativity and play, we do not tolerate harm of ANY kind. We take safety very seriously and will act immediately when confronted with any issue. Trust us when we say safety comes first at Little Bodies Big Minds. If you have any further concerns regarding protocol or safety feel free to email us or even come in for a chat! We are aware overcrowding is a hazard and will have every parent sign their child in as they enter to avoid exceeding the limit of people to avoid as many risks as we can. If you are wondering, of course, parents are free to sign in along with their child and join them for the day. We encourage fun for all, after all!

If you have made it this far, hopefully we have convinced you to join our playful family and support your child’s wild creativity! We are so excited to meet you all and see what ideas we can make. Even if you are still on the fence about, come down for a day and see what we are all about! It’s time to play!

– Little Bodies Big Minds Committee","The title was explored through this piece by its emphasis on the developmental importance of play in childhood.
The student used both stimulus 1 and 2 for inspiration. The text clearly uses the idea of free play and the figurative idea of the child’s mind that is powered by play.
The length is approximately 600 words.

---

This piece established a commanding and authoritative voice from the opening and through a tricolon of leading questions promoting the value of play in young children.

The value of play was ‘sold’ and the idea of play being a valuable and saleable commodity was also introduced.

In this section of the text the commercialisation of play was explored, as was the tension between free play and supervision. The idea that play can lead to danger was alluded to by the reassurance of ‘supervision’.
The suggestion was made that play is messy and therefore unattractive in the home, so it needs to be outsourced. The idea of ensuring children play being a parental responsibility was implied by the reassurance from the facility, saying ‘taking it from there’ for the reader – perhaps shouldering a burden.

The cheerful tone implied no judgement, but the reader was left to consider the values of a society that would commercialise the concept of free play, and whether play is free when different types of play are scheduled in different rooms. This drip-fed complex ideas to the reader.

The inclusive and welcoming voice demonstrated how enticing the idea of outsourcing the responsibility to enable play would be. The link between play and intellectual development was alluded to by the committee’s signature.
The piece had a clear structure and finished adroitly with the title, leaving a sense that a clever entrepreneurial mind was at work.",60
English,English,,,Year 12,Final Exam,Post Exam Report,2024,VCEEU3AS2,VCEENGER,,VCEENGERB,StudentResponse,Framework of Ideas 4: Play — Example 9,StudentResponse,"Dear Victorian Department of Education and policy makers,

I am writing to you as a concerned high school teacher and former child psychologist. I urge you to consider increasing the funding for high schools for play facilities and play spaces. With recent budget reports it seems that there is prioritized funding for primary schools for these facilities as rightfully so, however I believe that high schools deserve these facilities just as much. This should be considered as there are many valuable mental health benefits, many valuable academic benefits and even many social health and wellbeing benefits.

Recent studies have shown that 83% of adolescents are not meeting the recommended amount of physical activity per day being 60 minutes according to the Australian Institute of Health and Wellfare. In addition the Australian Institute of health and Wellfare have reported that 15.4% of high school students experience high psychological distress. An increased funding for play facilities and play spaces will not only encourage students to engage in physical play and in turn engage in physical activity, but it would enable students to release endorphins which promote feelings associated to joy, and in turn decrease the release of cortisol, our main stress hormone. In a study conducted by Beyond Blue it reported that 77% of students who engage in regular physical activity have decreased feelings of anxiety and stress. As youth mental health talk is becoming more common I believe it is just as important to install more of these facilities in high school settings. If the statistics haven’t spoken for themselves it is clear that these place spaces and play facilities greatly benefit our young youth. According to the Black Dog Institute, adolescents that partake in regular physical play decrease feelings and susceptibility of depression by up to 30%. Don’t you think it’s time to play?

Moreover, it is clear that play facilities and play spaces benefit the mental health of our bright youth, but they also yield academic success benefits. Numerous studies have demonstrated that students who participate in regular physical activity score at least 10% higher in standardised tests than their peers who do not engage in regular physical activity. Another study conducted by the University of Sydney reported that by implementing breaks of physical play between work periods increased the ‘on task behaviour’ by up to 20%. Evidently these play spaces and facilities would yield academic benefits but it’s more than that. Play facilities and play spaces would allow students to chill out, enjoy the rays and re-energize themselves enabling them to refocus and apply themselves better academically illustrated by the results. These spaces would allow students to have some down time during a busy day encouraging them to push through and persevere. So what do you think is it time to play?

Not convinced, furthermore, play spaces and facilities hold significant social health and wellbeing benefits. According to the National Recreation and Park Association 87% of adults reported that playgrounds and play spaces are vital for adolescents. This is because these spaces contribute to the development of social skills in children and youth, in addition these spaces allow students to build social networks and understand boundaries. As these play environments contribute to social skill it also builds on crucial skills like cooperation, problem-solving and confidence. These play facilities would prepare our students for the future world with these environments as a foundation for their social networking. Recent studies from the University of Melbourne have shown that schools that have these facilities reported 30% decrease in bullying. Bullying as we all know is negatively impacting students across all of Australia, so this may be an outlet to prevent bullying. Imagine your child is getting bullied everyday up to the point that they don’t even want to go to school anymore. The pain and devastation you’re feeling is what many Australian parents felt. So why should we put more children, more parents through this heartbreaking feeling.

I urge you, Victorian Department of Education and Policy Makers to take into consideration the prior points when reallocating the funding with reference to underlying benefits that increased funding can enable. The choice is up to you now whether it is time to play or not. Whether it is time to allow our youth to flourish and bloom and prepared for the what the world has for them.

Thank you for your time and attention.

Dr. Doe

[redacted] Secondary College","The title was used as an invitation to accept the premise that students’ secondary school years are a ‘time to play’.
Stimulus 1 was addressed via the writer’s concern that freedom to play is dependent on the provision of appropriate spaces being available. The idea derived from part of the metaphor in stimulus 2 that play allows for increased happiness was also addressed.
The length is approximately 700 words.

---

The context was clearly formed here from the opening.

The authorial voice was established.

Expert evidence was used to support the claims made.

The change from offering expert evidence to the personal highlighted the responsibility for action on the part of the reader.

Links were made between relevant ideas.
The final line of the paragraphs became an insistent call to the intended reader to respond.
The relentless barrage of information was used as a persuasive tool here and the changes between the formal style and the personal were holding the reader to account.

The final paragraph presented play as closely connected with the readers’ stated beliefs and thus re-enforced the persuasive nature of the piece.",61
English,English,,,Year 12,Final Exam,Post Exam Report,2024,VCEEU4AS2,VCEENGER,,VCEENGERC,,Section C: Analysis of argument and language,,,,62
English,English,,,Year 12,Final Exam,Post Exam Report,2024,VCEEU4AS2,VCEENGER,,VCEENGERC,EnhancedStrategies,,,Strategies that enhanced responses,,63
English,English,,,Year 12,Final Exam,Post Exam Report,2024,VCEEU4AS2,VCEENGER,,VCEENGERC,EnhancedStrategies,,ExaminerCommentary,"Capacity to infer the intended listeners’ values and role in the text’s purpose: Using an understanding of the text’s context, purpose and audience and the relationship between the speaker and listeners to create targeted analysis

This response demonstrated an understanding of context, audience and purpose in their introductions.","As council funding is verified and reallocated, the survival of ‘Our Local Gym’, a grassroots athletic establishment, has become an issue of extreme concern. Consequently, Sandy Gestalt, chair of the gym’s committee, delivered a speech to her fellow members, in which she claims the safety of Our Local Gym will be assured through her proposed partnership with confectionary brand Long Live Lollies. Addressing all members of the gym community, current and potential, Gestalt aspires to garner support for the presented partnership in the upcoming vote, in the hope that it will save Our Local Gym.",64
English,English,,,Year 12,Final Exam,Post Exam Report,2024,VCEEU4AS2,VCEENGER,,VCEENGERC,EnhancedStrategies,,ExaminerCommentary,"Analysis of argument construction: Focusing on the way in which ideas were strategically sequenced in order to position the listener given the text’s context and audience

This response used linguistic cues to indicate the argument’s strategy.","BP1 ‘Before she forwards her contention, Gestalt first seeks to imbue her speech with an overwhelmingly hopeful and optimistic tone.’ ‘… Gestalt not only strives to build rapport between audience and speaker given their long-standing connection, but also construct an optimistic future …’; ‘Gestalt guides her listeners to view the gym as a facility worth protecting, thus …’ 
BP2 ‘Having established the current predicament threatening the livelihood of such a special cultural institution, Gestalt continues by attempting to present a partnership with ‘Long Live Lollies’ as the only viable solution.’ 
BP3 ‘[She] implores the audience to … focus not on the immediate, ostensible challenges, but the opportunities also presented …’; ‘Thus, Gestalt guides her listeners to view her proposal of a partnership with enthusiasm …’ 
BP4 ‘By suggesting that each listener’s vote carries a responsibility to represent those not present as well …’; ‘also allows Gestalt to nonetheless convey the need to embrace what might seem “uncomfortable” … as an opportunity to grow …’",65
English,English,,,Year 12,Final Exam,Post Exam Report,2024,VCEEU4AS2,VCEENGER,,VCEENGERC,EnhancedStrategies,,ExaminerCommentary,"Analysis of language: Harnessing analytical thinking strategies and explaining how language was targeted at the views/values/beliefs of the intended audience

This response demonstrated clear and sustained use of the analytical thinking process.","Gestalt hopes to assure the concerns of fiscally conscious members of the gym community, who may struggle to cover the cost of an exorbitant membership fee, by evoking a sense of certainty through calling this declaration a ‘guarantee’.
… reminding [the listeners] that they are ‘not just voting for ourselves’. Evoking the transcendent nature of the community of Our Local Gym, Gestalt reminds her audience as such to reinvigorate with them both a sense of the gravity of their situation, and the importance of their decision. Gestalt hopes that by concluding in such a manner, she plays on the empathy held by those who cherish their gym community, and desires that they vote in support of her proposal not only for themselves, but for those like them, yet to discover Our Local Gym, who may foster an equally rich sense of community, provided the gym remains.",66
