SubjectArea,Subject,Band,Unit,UnitASCode,AreaofStudy,Outcome,OutcomeCode,ExampleType,ContentType,ExampleText,ParentText,URLTitle,URL,Sequence
Science,Chemistry,Year 11,Unit 2,VCECHU2AS2,Area of Study 2 - How are chemicals measured and analysed?,Outcome 2,VCECHU2AS2O2KK,DetailedExampleStep,Bullet,"Present a 20-second oral summary of the stakeholder to the class, for example: 'My name is X and I am the mayor of this town where it is proposed that we supplement our drinking water supplies with treated water, since we often need to apply water restrictions due to low water reserves in our dam. The majority of my constituents are against the proposal since there are concerns that the treated water will still contain microbes or chemicals that may threaten human health and that treated water could never exactly replicate the quality of rain water or the water in our dams.'",,,,90
Science,Chemistry,Year 11,Unit 2,VCECHU2AS2,Area of Study 2 - How are chemicals measured and analysed?,Outcome 2,VCECHU2AS2O2KK,DetailedExampleStep,Bullet,"On a slip of paper, construct one question that they would like addressed by someone relating to this case study. Students may suggest which stakeholder they would like to primarily respond to their question. The question should be well thought out so as to give maximum insight into different perspectives in considering the issue. Students may use the following list of question terms to assist them:",,,,91
Science,Chemistry,Year 11,Unit 2,VCECHU2AS2,Area of Study 2 - How are chemicals measured and analysed?,Outcome 2,VCECHU2AS2O2KK,DetailedExampleStep,Paragraph,"List 1: Who / What / Where / When / Why / How...?
List 2: ...would / could / should / is / are / might / will / was / were...?
Submit the question to the teacher, who will collate (perhaps by photocopying all slips onto a single sheet of paper) and distribute them to the relevant discussion panel.",,,,92
Science,Chemistry,Year 11,Unit 2,VCECHU2AS2,Area of Study 2 - How are chemicals measured and analysed?,Outcome 2,VCECHU2AS2O2KK,DetailedExampleStep,Bullet,"Now working with the other members of the panel, discuss the questions that have been submitted and write notes in the logbook detailing the response to these questions from the perspective of a stakeholder. Include as much scientific data as possible in the responses. Students may need to conduct additional Internet research to develop responses.",,,,93
Science,Chemistry,Year 11,Unit 2,VCECHU2AS2,Area of Study 2 - How are chemicals measured and analysed?,Outcome 2,VCECHU2AS2O2KK,DetailedExampleStep,Paragraph,Lesson 3: In this lesson students role-play the perspective of one stakeholder as part of a panel discussion. They may use any notes already written in the logbook and may also make additional notes in the logbook during the class.,,,,94
Science,Chemistry,Year 11,Unit 2,VCECHU2AS2,Area of Study 2 - How are chemicals measured and analysed?,Outcome 2,VCECHU2AS2O2KK,DetailedExampleStep,Paragraph,"Lesson 4: In this lesson students provide an individual response to the question 'Would you drink recycled water?' by producing a public communication in an agreed format; for example, newspaper article, infographic or TV advertisement. At the end of the lesson they submit a draft of their response. They may use any notes from the logbook.",,,,95
Science,Chemistry,Year 11,Unit 2,VCECHU2AS2,Area of Study 2 - How are chemicals measured and analysed?,Outcome 2,VCECHU2AS2O2KK,DetailedExampleStep,Paragraph,"The communication must include referenced qualitative and quantitative data, distinction between identified facts and opinions presented in the Q&A panel discussion, and a justified personal stance on the question.",,,,96
Science,Chemistry,Year 11,Unit 2,VCECHU2AS2,Area of Study 2 - How are chemicals measured and analysed?,Outcome 2,VCECHU2AS2O2KS,DetailedExampleStep,Paragraph,The media communication should identify / highlight:,,,,97
Science,Chemistry,Year 11,Unit 2,VCECHU2AS2,Area of Study 2 - How are chemicals measured and analysed?,Outcome 2,VCECHU2AS2O2KK,DetailedExampleStep,Bullet,A likely target audience,,,,98
Science,Chemistry,Year 11,Unit 2,VCECHU2AS2,Area of Study 2 - How are chemicals measured and analysed?,Outcome 2,VCECHU2AS2O2KK,DetailedExampleStep,Bullet,Specific scientific concept(s) being communicated,,,,99
Science,Chemistry,Year 11,Unit 2,VCECHU2AS2,Area of Study 2 - How are chemicals measured and analysed?,Outcome 2,VCECHU2AS2O2KK,DetailedExampleStep,Bullet,Distinction between fact and opinion,,,,100
Science,Chemistry,Year 11,Unit 2,VCECHU2AS2,Area of Study 2 - How are chemicals measured and analysed?,Outcome 2,VCECHU2AS2O2KS,DetailedExampleStep,Bullet,Scientific data used to justify position of the stakeholder.,,,,101
Science,Chemistry,Year 11,Unit 2,VCECHU2AS2,Area of Study 2 - How are chemicals measured and analysed?,Outcome 2,VCECHU2AS2O2KK,DetailedExampleStep,Paragraph,Students will be assessed with respect to:,,,,102
Science,Chemistry,Year 11,Unit 2,VCECHU2AS2,Area of Study 2 - How are chemicals measured and analysed?,Outcome 2,VCECHU2AS2O2KK,DetailedExampleStep,Bullet,Accuracy of scientific information,,,,103
Science,Chemistry,Year 11,Unit 2,VCECHU2AS2,Area of Study 2 - How are chemicals measured and analysed?,Outcome 2,VCECHU2AS2O2KK,DetailedExampleStep,Bullet,Clarity of explanations,,,,104
Science,Chemistry,Year 11,Unit 2,VCECHU2AS2,Area of Study 2 - How are chemicals measured and analysed?,Outcome 2,VCECHU2AS2O2KK,DetailedExampleStep,Bullet,Appropriateness for purpose and audience.,,,,105
Science,Chemistry,Year 11,Unit 2,VCECHU2AS3,Area of Study 3 - How do quantitative scientific investigations develop our understanding of chemical reactions?,Outcome 3,,,OutcomeHeading,Outcome 3,,,,1
Science,Chemistry,Year 11,Unit 2,VCECHU2AS3,Area of Study 3 - How do quantitative scientific investigations develop our understanding of chemical reactions?,Outcome 3,,,OutcomeDescription,"On completion of this unit the student should be able to draw an evidence-based conclusion from primary data generated from a student-adapted or student-designed scientific investigation related to the production of gases, acid-base or redox reactions or the analysis of substances in water.",,,,2
Science,Chemistry,Year 11,Unit 2,VCECHU2AS3,Area of Study 3 - How do quantitative scientific investigations develop our understanding of chemical reactions?,Outcome 3,,,SectionHeading,Examples of learning activities,,,,3
Science,Chemistry,Year 11,Unit 2,VCECHU2AS3,Area of Study 3 - How do quantitative scientific investigations develop our understanding of chemical reactions?,Outcome 3,VCECHU2AS3O3KK,Activity,Paragraph,Key knowledge: Investigation design,,,,4
Science,Chemistry,Year 11,Unit 2,VCECHU2AS3,Area of Study 3 - How do quantitative scientific investigations develop our understanding of chemical reactions?,Outcome 3,VCECHU2AS3O3KS,Activity,Bullet,"Discuss the importance of developing investigable questions for scientific investigation considering Albert Einstein's quote that: 'The important thing is not to stop questioning', Robert Half's quote that 'Asking the right questions takes as much skill as giving the right answers' and Nancy Willard's quote that 'Sometimes questions are more important than the answers'.",,,,5
Science,Chemistry,Year 11,Unit 2,VCECHU2AS3,Area of Study 3 - How do quantitative scientific investigations develop our understanding of chemical reactions?,Outcome 3,VCECHU2AS3O3KK,Activity,Bullet,Work in groups to prepare instructions to new chemistry students on:,,,,6
Science,Chemistry,Year 11,Unit 2,VCECHU2AS3,Area of Study 3 - How do quantitative scientific investigations develop our understanding of chemical reactions?,Outcome 3,VCECHU2AS3O3KK,Activity,Bullet,How to prepare a standard solution,Work in groups to prepare instructions to new chemistry students on:,,,7
Science,Chemistry,Year 11,Unit 2,VCECHU2AS3,Area of Study 3 - How do quantitative scientific investigations develop our understanding of chemical reactions?,Outcome 3,VCECHU2AS3O3KK,Activity,Bullet,"How to convert between different concentration units; for example, mol L-1  g L-1",Work in groups to prepare instructions to new chemistry students on:,,,8
Science,Chemistry,Year 11,Unit 2,VCECHU2AS3,Area of Study 3 - How do quantitative scientific investigations develop our understanding of chemical reactions?,Outcome 3,VCECHU2AS3O3KK,Activity,Bullet,"How to convert between different gas measurement units; for example, kPa  atm",Work in groups to prepare instructions to new chemistry students on:,,,9
Science,Chemistry,Year 11,Unit 2,VCECHU2AS3,Area of Study 3 - How do quantitative scientific investigations develop our understanding of chemical reactions?,Outcome 3,VCECHU2AS3O3KK,Activity,Bullet,How to perform a titration,Work in groups to prepare instructions to new chemistry students on:,,,10
Science,Chemistry,Year 11,Unit 2,VCECHU2AS3,Area of Study 3 - How do quantitative scientific investigations develop our understanding of chemical reactions?,Outcome 3,VCECHU2AS3O3KK,Activity,Bullet,How to balance redox equations,Work in groups to prepare instructions to new chemistry students on:,,,11
Science,Chemistry,Year 11,Unit 2,VCECHU2AS3,Area of Study 3 - How do quantitative scientific investigations develop our understanding of chemical reactions?,Outcome 3,VCECHU2AS3O3KK,Activity,Bullet,How to set up a calibration curve in colorimetry.,Work in groups to prepare instructions to new chemistry students on:,,,12
Science,Chemistry,Year 11,Unit 2,VCECHU2AS3,Area of Study 3 - How do quantitative scientific investigations develop our understanding of chemical reactions?,Outcome 3,VCECHU2AS3O3KK,Activity,Paragraph,Key knowledge: Scientific evidence,,,,13
Science,Chemistry,Year 11,Unit 2,VCECHU2AS3,Area of Study 3 - How do quantitative scientific investigations develop our understanding of chemical reactions?,Outcome 3,VCECHU2AS3O3KK,Activity,Bullet,Research why the Brnsted-Lowry theory of acids and bases is considered more useful than the Arrhenius theory of acids and bases.,,,,14
Science,Chemistry,Year 11,Unit 2,VCECHU2AS3,Area of Study 3 - How do quantitative scientific investigations develop our understanding of chemical reactions?,Outcome 3,VCECHU2AS3O3KK,Activity,Bullet,"Crumple a sheet of paper in your hand to form a 'clot' approximating a sphere and measure its diameter; collate class data to plot a histogram of clot diameters and account for the shape of the histogram; identify and distinguish between sources of error and uncertainty; use the results to discuss the difference between accuracy, precision, repeatability and reproducibility; calculate the mean; discuss how the mean would be similar / different if the activity is undertaken by a different class; explain why accurate measurements are important in chemistry.",,,,15
Science,Chemistry,Year 11,Unit 2,VCECHU2AS3,Area of Study 3 - How do quantitative scientific investigations develop our understanding of chemical reactions?,Outcome 3,VCECHU2AS3O3KK,Activity,Paragraph,Key knowledge: Science communication,,,,16
Science,Chemistry,Year 11,Unit 2,VCECHU2AS3,Area of Study 3 - How do quantitative scientific investigations develop our understanding of chemical reactions?,Outcome 3,VCECHU2AS3O3KK,Activity,Bullet,"Select examples of scientific posters and post them around the room at stations. Use post-it notes or similar to provide feedback on the samples, identifying two strengths and two weaknesses for each. Conduct a class walkthrough of all the posters, summarising and discussing the strengths and weaknesses; develop a whole-of-class summary of do's and don'ts for a high-quality scientific poster.",,,,17
Science,Chemistry,Year 11,Unit 2,VCECHU2AS3,Area of Study 3 - How do quantitative scientific investigations develop our understanding of chemical reactions?,Outcome 3,VCECHU2AS3O3KK,Activity,Paragraph,Examples of research topics,,,,18
Science,Chemistry,Year 11,Unit 2,VCECHU2AS3,Area of Study 3 - How do quantitative scientific investigations develop our understanding of chemical reactions?,Outcome 3,VCECHU2AS3O3KK,Activity,Paragraph,"The following topics are a sample of practical investigations that may be considered. Students may use different scientific methodologies to generate primary data. In particular, controlled experiments, fieldwork, modelling, and product, process or system development are the most appropriate methodologies for this area of study. Simulations may be used in situations where students do not have access to appropriate laboratory equipment and where students are able to manipulate variables to generate a unique data set, but teachers must subsequently determine how students' ability to design an investigation will be assessed for this outcome. Teachers must determine the appropriateness of proposed student investigations in terms of resources and safety; modifications or alternative investigations may be suggested in cases where proposed investigations are unsafe, impractical and / or cannot be resourced by the school.",,,,19
Science,Chemistry,Year 11,Unit 2,VCECHU2AS3,Area of Study 3 - How do quantitative scientific investigations develop our understanding of chemical reactions?,Outcome 3,VCECHU2AS3O3KK,Activity,Bullet,Is solubility related to biodegradability?,,,,20
Science,Chemistry,Year 11,Unit 2,VCECHU2AS3,Area of Study 3 - How do quantitative scientific investigations develop our understanding of chemical reactions?,Outcome 3,VCECHU2AS3O3KK,Activity,Bullet,"Investigate the temperature range over which chocolate can exist in both molten and solid states and its dependence on relevant parameters. Note: chocolate appears to be a solid material at room temperature but melts when heated to around body temperature, and then when cooled down again it often stays melted even at room temperature. Explain these phenomena in terms of what may be happening from a molecular structure perspective.",,,,21
Science,Chemistry,Year 11,Unit 2,VCECHU2AS3,Area of Study 3 - How do quantitative scientific investigations develop our understanding of chemical reactions?,Outcome 3,VCECHU2AS3O3KK,Activity,Bullet,"Design and perform experiments to investigate the properties of vitamins, for example:",,,,22
Science,Chemistry,Year 11,Unit 2,VCECHU2AS3,Area of Study 3 - How do quantitative scientific investigations develop our understanding of chemical reactions?,Outcome 3,VCECHU2AS3O3KK,Activity,Bullet,Are water-soluble vitamins more prone to destruction by cooking than non-water-soluble vitamins?,"Design and perform experiments to investigate the properties of vitamins, for example:",,,23
Science,Chemistry,Year 11,Unit 2,VCECHU2AS3,Area of Study 3 - How do quantitative scientific investigations develop our understanding of chemical reactions?,Outcome 3,VCECHU2AS3O3KK,Activity,Bullet,Which cooking methods preserve the most Vitamin C in carrots?,"Design and perform experiments to investigate the properties of vitamins, for example:",,,24
Science,Chemistry,Year 11,Unit 2,VCECHU2AS3,Area of Study 3 - How do quantitative scientific investigations develop our understanding of chemical reactions?,Outcome 3,VCECHU2AS3O3KK,Activity,Bullet,Do water-soluble vitamins react differently to UV light than non-water-soluble vitamins?,"Design and perform experiments to investigate the properties of vitamins, for example:",,,25
Science,Chemistry,Year 11,Unit 2,VCECHU2AS3,Area of Study 3 - How do quantitative scientific investigations develop our understanding of chemical reactions?,Outcome 3,VCECHU2AS3O3KK,Activity,Bullet,When is the Vitamin C content of fruit at its peak?,"Design and perform experiments to investigate the properties of vitamins, for example:",,,26
Science,Chemistry,Year 11,Unit 2,VCECHU2AS3,Area of Study 3 - How do quantitative scientific investigations develop our understanding of chemical reactions?,Outcome 3,VCECHU2AS3O3KK,Activity,Bullet,"Investigate experimentally the sensitivity of Vitamin C to light, oxygen or pH.",,,,27
Science,Chemistry,Year 11,Unit 2,VCECHU2AS3,Area of Study 3 - How do quantitative scientific investigations develop our understanding of chemical reactions?,Outcome 3,VCECHU2AS3O3KK,Activity,Bullet,Investigate experimentally the claims that:,,,,28
Science,Chemistry,Year 11,Unit 2,VCECHU2AS3,Area of Study 3 - How do quantitative scientific investigations develop our understanding of chemical reactions?,Outcome 3,VCECHU2AS3O3KK,Activity,Bullet,Citric acid can be considered as an antioxidant mainly due to its low pH and that other fruit acids could also act as antioxidants if their pH was low enough,Investigate experimentally the claims that:,,,29
Science,Chemistry,Year 11,Unit 2,VCECHU2AS3,Area of Study 3 - How do quantitative scientific investigations develop our understanding of chemical reactions?,Outcome 3,VCECHU2AS3O3KK,Activity,Bullet,A 0.01% solution of EDTA (ethylene diamine tetraacetic acid) protects apple juice from oxidation,Investigate experimentally the claims that:,,,30
Science,Chemistry,Year 11,Unit 2,VCECHU2AS3,Area of Study 3 - How do quantitative scientific investigations develop our understanding of chemical reactions?,Outcome 3,VCECHU2AS3O3KK,Activity,Bullet,A 0.9% solution of sodium chloride may act to counter the oxidation of ascorbic acid,Investigate experimentally the claims that:,,,31
Science,Chemistry,Year 11,Unit 2,VCECHU2AS3,Area of Study 3 - How do quantitative scientific investigations develop our understanding of chemical reactions?,Outcome 3,VCECHU2AS3O3KK,Activity,Bullet,"Some fruit juices contain substances that help destroy Vitamin C; for example, apple juice held at 37 C with a pH of 3.5 for 60 days will lose about 99% of its ascorbic acid, while pineapple juice under the same conditions will lose about 70%.",Investigate experimentally the claims that:,,,32
Science,Chemistry,Year 11,Unit 2,VCECHU2AS3,Area of Study 3 - How do quantitative scientific investigations develop our understanding of chemical reactions?,Outcome 3,VCECHU2AS3O3KK,Activity,Bullet,Use the Briggs-Rauscher reaction to determine which fruits or teas contain the most antioxidants.,,,,33
Science,Chemistry,Year 11,Unit 2,VCECHU2AS3,Area of Study 3 - How do quantitative scientific investigations develop our understanding of chemical reactions?,Outcome 3,VCECHU2AS3O3KK,Activity,Bullet,"Investigate the chemistry underpinning the claim that the following is a 'chemical-free and easy way to clean fruit': fill a sink with water, add 1 cup of vinegar and stir; add all fruit and soak for 10 minutes (water will be dirty and fruit will sparkle with no wax or dirty film). This is great for berries as it keeps them from moulding; do this with strawberries and they last for two weeks.",,,,34
Science,Chemistry,Year 11,Unit 2,VCECHU2AS3,Area of Study 3 - How do quantitative scientific investigations develop our understanding of chemical reactions?,Outcome 3,VCECHU2AS3O3KK,Activity,Bullet,How does water quality differ at various points along a waterway or around a body of water? (see Detailed example),,,,35
Science,Chemistry,Year 11,Unit 2,VCECHU2AS3,Area of Study 3 - How do quantitative scientific investigations develop our understanding of chemical reactions?,Outcome 3,VCECHU2AS3O3KK,Activity,Bullet,How do commercial brands of water differ from each other?,,,,36
Science,Chemistry,Year 11,Unit 2,VCECHU2AS3,Area of Study 3 - How do quantitative scientific investigations develop our understanding of chemical reactions?,Outcome 3,VCECHU2AS3O3KK,Activity,Bullet,How does bottled water differ from tap water?,,,,37
Science,Chemistry,Year 11,Unit 2,VCECHU2AS3,Area of Study 3 - How do quantitative scientific investigations develop our understanding of chemical reactions?,Outcome 3,VCECHU2AS3O3KK,Activity,Bullet,How does bottled water differ from filtered tap water?,,,,38
Science,Chemistry,Year 11,Unit 2,VCECHU2AS3,Area of Study 3 - How do quantitative scientific investigations develop our understanding of chemical reactions?,Outcome 3,VCECHU2AS3O3KK,Activity,Bullet,How is bottled water sanitised for human consumption?,,,,39
Science,Chemistry,Year 11,Unit 2,VCECHU2AS3,Area of Study 3 - How do quantitative scientific investigations develop our understanding of chemical reactions?,Outcome 3,VCECHU2AS3O3KK,Activity,Bullet,What are some practical ways to recycle plastic bottles?,,,,40
Science,Chemistry,Year 11,Unit 2,VCECHU2AS3,Area of Study 3 - How do quantitative scientific investigations develop our understanding of chemical reactions?,Outcome 3,VCECHU2AS3O3KK,Activity,Bullet,How does the solubility of a solute vary in fresh water as compared to sea water?,,,,41
Science,Chemistry,Year 11,Unit 2,VCECHU2AS3,Area of Study 3 - How do quantitative scientific investigations develop our understanding of chemical reactions?,Outcome 3,VCECHU2AS3O3KK,Activity,Bullet,How are different types of shells / polymers / metals affected by different pH conditions?,,,,42
Science,Chemistry,Year 11,Unit 2,VCECHU2AS3,Area of Study 3 - How do quantitative scientific investigations develop our understanding of chemical reactions?,Outcome 3,VCECHU2AS3O3KK,Activity,Bullet,How effective are different sampling methods in the accurate analysis of the quantity of a substance that is dissolved in water?,,,,43
Science,Chemistry,Year 11,Unit 2,VCECHU2AS3,Area of Study 3 - How do quantitative scientific investigations develop our understanding of chemical reactions?,Outcome 3,VCECHU2AS3O3KK,Activity,Bullet,"How are the specific heat capacities of different liquids affected by the addition of salts, acids, bases, oxidants or reductants?",,,,44
Science,Chemistry,Year 11,Unit 2,VCECHU2AS3,Area of Study 3 - How do quantitative scientific investigations develop our understanding of chemical reactions?,Outcome 3,VCECHU2AS3O3KK,Activity,Bullet,"How are the conductivities of different liquids affected by the addition of salts, acids, bases, oxidants or reductants?",,,,45
Science,Chemistry,Year 11,Unit 2,VCECHU2AS3,Area of Study 3 - How do quantitative scientific investigations develop our understanding of chemical reactions?,Outcome 3,VCECHU2AS3O3KK,Activity,Bullet,Which ions are more important in determining the 'hardness' of water?,,,,46
Science,Chemistry,Year 11,Unit 2,VCECHU2AS3,Area of Study 3 - How do quantitative scientific investigations develop our understanding of chemical reactions?,Outcome 3,VCECHU2AS3O3KK,Activity,Bullet,How do different types of detergents perform in water of varying 'hardness'?,,,,47
Science,Chemistry,Year 11,Unit 2,VCECHU2AS3,Area of Study 3 - How do quantitative scientific investigations develop our understanding of chemical reactions?,Outcome 3,VCECHU2AS3O3KK,Activity,Bullet,Is the pH of sea water affected in the same way as the pH of fresh water when acidic or basic substances are added to them?,,,,48
Science,Chemistry,Year 11,Unit 2,VCECHU2AS3,Area of Study 3 - How do quantitative scientific investigations develop our understanding of chemical reactions?,Outcome 3,VCECHU2AS3O3KK,Activity,Bullet,How does the rate of corrosion of different metals compare in salt and fresh water?,,,,49
Science,Chemistry,Year 11,Unit 2,VCECHU2AS3,Area of Study 3 - How do quantitative scientific investigations develop our understanding of chemical reactions?,Outcome 3,VCECHU2AS3O3KK,DetailedExample,Paragraph,How does water quality differ at various points along a river?,,,,50
Science,Chemistry,Year 11,Unit 2,VCECHU2AS3,Area of Study 3 - How do quantitative scientific investigations develop our understanding of chemical reactions?,Outcome 3,VCECHU2AS3O3KK,DetailedExampleStep,Paragraph,Introduction,,,,51
Science,Chemistry,Year 11,Unit 2,VCECHU2AS3,Area of Study 3 - How do quantitative scientific investigations develop our understanding of chemical reactions?,Outcome 3,VCECHU2AS3O3KK,DetailedExampleStep,Paragraph,"This practical investigation builds on knowledge and skills developed in Unit 2 Area of Study 1 and / or Unit 2 Area of Study 2. Teachers must consider the management logistics of the investigation, taking into account number of students, available resources and student interest. The following questions require consideration:",,,,52
Science,Chemistry,Year 11,Unit 2,VCECHU2AS3,Area of Study 3 - How do quantitative scientific investigations develop our understanding of chemical reactions?,Outcome 3,VCECHU2AS3O3KK,DetailedExampleStep,Bullet,What input will students have into the selection of the investigation question?,,,,53
Science,Chemistry,Year 11,Unit 2,VCECHU2AS3,Area of Study 3 - How do quantitative scientific investigations develop our understanding of chemical reactions?,Outcome 3,VCECHU2AS3O3KK,DetailedExampleStep,Bullet,Will different groups of students in the class be able to undertake different investigations?,,,,54
Science,Chemistry,Year 11,Unit 2,VCECHU2AS3,Area of Study 3 - How do quantitative scientific investigations develop our understanding of chemical reactions?,Outcome 3,VCECHU2AS3O3KK,DetailedExampleStep,Bullet,"To what extent will all students consider the same investigation question, or complete different parts to the same question so that class data can be collated?",,,,55
Science,Chemistry,Year 11,Unit 2,VCECHU2AS3,Area of Study 3 - How do quantitative scientific investigations develop our understanding of chemical reactions?,Outcome 3,VCECHU2AS3O3KK,DetailedExampleStep,Bullet,What input will students have into the design of the experiment?,,,,56
Science,Chemistry,Year 11,Unit 2,VCECHU2AS3,Area of Study 3 - How do quantitative scientific investigations develop our understanding of chemical reactions?,Outcome 3,VCECHU2AS3O3KK,DetailedExampleStep,Bullet,Will off-school site work be involved?,,,,57
