SubjectArea,Subject,Band,Unit,UnitASCode,AreaofStudy,Outcome,OutcomeCode,ExampleType,ContentType,ExampleText,ParentText,URLTitle,URL,Sequence
Science,Chemistry,Year 12,Unit 4,VCECHU4AS1,Area of Study 1 - How are organic compounds categorised and synthesised?,Outcome 1,VCECHU4AS1O1KK,Activity,Bullet,Case study: Research the production and use of haloalkanes and how they contribute to having negative effects on the environment. Focus on the relationship between haloalkane stability and their toxicity / photolability. Discuss the case of ozone depletion by CFCs; consider how green chemistry principles can be applied to develop safer alternatives that reduce harmful environmental effects.,,,,15
Science,Chemistry,Year 12,Unit 4,VCECHU4AS1,Area of Study 1 - How are organic compounds categorised and synthesised?,Outcome 1,VCECHU4AS1O1KK,Activity,Paragraph,Key knowledge: Reactions of organic compounds,,,,16
Science,Chemistry,Year 12,Unit 4,VCECHU4AS1,Area of Study 1 - How are organic compounds categorised and synthesised?,Outcome 1,VCECHU4AS1O1KK,Activity,Bullet,Relate the oxidation of ethanol  ethanoic acid to the smell of vinegar in wines that have been exposed to air.,,,,17
Science,Chemistry,Year 12,Unit 4,VCECHU4AS1,Area of Study 1 - How are organic compounds categorised and synthesised?,Outcome 1,VCECHU4AS1O1KK,Activity,Bullet,"Classification and identification: Design and annotate flow charts to represent reaction pathways for: the synthesis of primary haloalkanes and primary alcohols by substitution; addition reactions of alkenes; esterification; ester hydrolysis; the synthesis of primary amines and carboxylic acids; transesterification to produce biodiesel; hydrolysis of proteins, carbohydrates and fats; and condensation polymerisation reactions to produce biomolecules.",,,,18
Science,Chemistry,Year 12,Unit 4,VCECHU4AS1,Area of Study 1 - How are organic compounds categorised and synthesised?,Outcome 1,VCECHU4AS1O1KK,Activity,Bullet,"Controlled experiment: Design and perform test-tube scale ester synthesis from a variety of alcohols and carboxylic acids. Compare the experimental results using acid and base catalysts, write balanced chemical equations, and compare the mechanism of acid-catalysed and base-catalysed reactions.",,,,19
Science,Chemistry,Year 12,Unit 4,VCECHU4AS1,Area of Study 1 - How are organic compounds categorised and synthesised?,Outcome 1,VCECHU4AS1O1KK,Activity,Bullet,"Measure the change in pH as the enzyme urease (sourced from ground whole soya beans) hydrolyses urea (carbonyl diamide) in solution (see a useful resource from the Royal Society of Chemistry), analogous to how large biologically important molecules are broken down. Add HCl to lower the pH and observe the rate of the subsequent increase in pH as ammonia is produced from the reaction. Relate this experiment to how urea and fertilisers are used for food production. (see Detailed example)",,,,20
Science,Chemistry,Year 12,Unit 4,VCECHU4AS1,Area of Study 1 - How are organic compounds categorised and synthesised?,Outcome 1,VCECHU4AS1O1KS,Activity,Bullet,Discuss the following examples of the uses and properties of organic compounds:,,,,21
Science,Chemistry,Year 12,Unit 4,VCECHU4AS1,Area of Study 1 - How are organic compounds categorised and synthesised?,Outcome 1,VCECHU4AS1O1KK,Activity,Bullet,Iodine dissolves in ethanol but is not easily dissolved in water,Discuss the following examples of the uses and properties of organic compounds:,,,22
Science,Chemistry,Year 12,Unit 4,VCECHU4AS1,Area of Study 1 - How are organic compounds categorised and synthesised?,Outcome 1,VCECHU4AS1O1KK,Activity,Bullet,"Small organic compounds may be used as solvents for non-polar molecules; for example, propanone (acetone) in industry",Discuss the following examples of the uses and properties of organic compounds:,,,23
Science,Chemistry,Year 12,Unit 4,VCECHU4AS1,Area of Study 1 - How are organic compounds categorised and synthesised?,Outcome 1,VCECHU4AS1O1KK,Activity,Bullet,Ethanol is used in some cosmetics and topical skin applications because it evaporates quickly when applied to the skin,Discuss the following examples of the uses and properties of organic compounds:,,,24
Science,Chemistry,Year 12,Unit 4,VCECHU4AS1,Area of Study 1 - How are organic compounds categorised and synthesised?,Outcome 1,VCECHU4AS1O1KK,Activity,Bullet,"Fruits smell the way they do because they contain esters; for example, pineapple contains the ester ethyl butanoate",Discuss the following examples of the uses and properties of organic compounds:,,,25
Science,Chemistry,Year 12,Unit 4,VCECHU4AS1,Area of Study 1 - How are organic compounds categorised and synthesised?,Outcome 1,VCECHU4AS1O1KK,Activity,Bullet,Esters are used in the food industry as fragrances and flavouring agents because of their sweet smells,Discuss the following examples of the uses and properties of organic compounds:,,,26
Science,Chemistry,Year 12,Unit 4,VCECHU4AS1,Area of Study 1 - How are organic compounds categorised and synthesised?,Outcome 1,VCECHU4AS1O1KK,Activity,Bullet,The volatility of small esters make them useful in perfumes,Discuss the following examples of the uses and properties of organic compounds:,,,27
Science,Chemistry,Year 12,Unit 4,VCECHU4AS1,Area of Study 1 - How are organic compounds categorised and synthesised?,Outcome 1,VCECHU4AS1O1KK,Activity,Bullet,"The volatility of many organic solvents, such as some ketones and esters, makes them hazardous",Discuss the following examples of the uses and properties of organic compounds:,,,28
Science,Chemistry,Year 12,Unit 4,VCECHU4AS1,Area of Study 1 - How are organic compounds categorised and synthesised?,Outcome 1,VCECHU4AS1O1KK,Activity,Bullet,"Many short-chain carboxylic acids, such as butyric acid, have unpleasant odours (for example, the compounds found in parmesan cheese, vomit, sweaty socks)",Discuss the following examples of the uses and properties of organic compounds:,,,29
Science,Chemistry,Year 12,Unit 4,VCECHU4AS1,Area of Study 1 - How are organic compounds categorised and synthesised?,Outcome 1,VCECHU4AS1O1KK,Activity,Bullet,Cooking in triglycerides retains water-soluble nutrients that would be removed from the food if cooked in water.,Discuss the following examples of the uses and properties of organic compounds:,,,30
Science,Chemistry,Year 12,Unit 4,VCECHU4AS1,Area of Study 1 - How are organic compounds categorised and synthesised?,Outcome 1,VCECHU4AS1O1KK,Activity,Bullet,"Prepare a sample of nylon in the laboratory and extract a protein from food (for example, casein from milk); compare the structure of nylon with that of a protein.",,,,31
Science,Chemistry,Year 12,Unit 4,VCECHU4AS1,Area of Study 1 - How are organic compounds categorised and synthesised?,Outcome 1,VCECHU4AS1O1KS,Activity,Bullet,Identify the functional groups present in monosaccharides; write equations to show how monosaccharides condense to form disaccharides and polysaccharides.,,,,32
Science,Chemistry,Year 12,Unit 4,VCECHU4AS1,Area of Study 1 - How are organic compounds categorised and synthesised?,Outcome 1,VCECHU4AS1O1KK,Activity,Bullet,"Model the ring structures of two D-glucose molecules, the condensation reaction between them and the glycosidic bond that is subsequently formed.",,,,33
Science,Chemistry,Year 12,Unit 4,VCECHU4AS1,Area of Study 1 - How are organic compounds categorised and synthesised?,Outcome 1,VCECHU4AS1O1KK,Activity,Bullet,Edible oils and fats are distinguished on the basis of their melting points: explain the relationship between the structure of an oil or a fat and its melting point.,,,,34
Science,Chemistry,Year 12,Unit 4,VCECHU4AS1,Area of Study 1 - How are organic compounds categorised and synthesised?,Outcome 1,VCECHU4AS1O1KK,Activity,Bullet,"Product, process or system development: Make small-scale biodiesel using available materials such as cooking oils (can be compared with used ones), grease and animal fats, by reacting them with a mixture of methanol and sodium hydroxide. Construct a hypothesis and prediction, conduct investigation, observe quality and quantity of produced biodiesel, and make a comparison of base- and acid-catalysed transesterification.",,,,35
Science,Chemistry,Year 12,Unit 4,VCECHU4AS1,Area of Study 1 - How are organic compounds categorised and synthesised?,Outcome 1,VCECHU4AS1O1KK,Activity,Bullet,"Case study: Research a selected industrial process or product synthesis and summarise the operating conditions, including temperature and pressure conditions and the use of catalysts; for example, selected processes and products from Essential Chemical Industry. Calculate atom economies of products; investigate the use of green and safer reagents; for example, the use of acidified potassium dichromate for oxidation of alcohols can be replaced by Fenton's reagent.",,,,36
Science,Chemistry,Year 12,Unit 4,VCECHU4AS1,Area of Study 1 - How are organic compounds categorised and synthesised?,Outcome 1,VCECHU4AS1O1KK,Activity,Bullet,Controlled experiment: Determine the ideal temperature and concentration conditions to demonstrate that Vitamin C can be used as catalyst to speed up the decomposition of hydrogen peroxide.,,,,37
Science,Chemistry,Year 12,Unit 4,VCECHU4AS1,Area of Study 1 - How are organic compounds categorised and synthesised?,Outcome 1,VCECHU4AS1O1KK,DetailedExample,Paragraph,Hydrolysis of urea - a cross-cutting real-world context for high school organic chemistry,,,,38
Science,Chemistry,Year 12,Unit 4,VCECHU4AS1,Area of Study 1 - How are organic compounds categorised and synthesised?,Outcome 1,VCECHU4AS1O1KK,DetailedExampleStep,Paragraph,Introduction,,,,39
Science,Chemistry,Year 12,Unit 4,VCECHU4AS1,Area of Study 1 - How are organic compounds categorised and synthesised?,Outcome 1,VCECHU4AS1O1KK,DetailedExampleStep,Bullet,"Curriculum concepts of organic chemistry are spread across Units 1-4, which should come as no surprise to educators of chemistry who will be aware of the prominence of studying organic chemistry in science and engineering in post-secondary courses (chemistry, medicine, pharmacy, microbiology, chemical engineering). However, many of the types of reactions studied in Unit 4 Area of Study 1 are difficult to undertake practically in a high school setting, either because they take too long, are messy and difficult to manage with a large class of students; involve solvents or catalysts not normally seen in high schools; or have observations that students find difficult to connect to their learning. As such, large biologically important molecules tend to stay as three-dimensional representations in textbooks and in internet sources.",,,,40
Science,Chemistry,Year 12,Unit 4,VCECHU4AS1,Area of Study 1 - How are organic compounds categorised and synthesised?,Outcome 1,VCECHU4AS1O1KK,DetailedExampleStep,Bullet,"Urea is a biologically important molecule, but it is not large. However, it can be used in a laboratory setting to provide students with observations for (a) the synthesis of primary amines, and (b) the hydrolytic reaction of an amide linkage (through the addition of the enzyme urease acting as a catalyst), breaking down the slightly larger molecule into smaller molecules (CO2 and NH3) for important biological and chemical purposes.",,,,41
Science,Chemistry,Year 12,Unit 4,VCECHU4AS1,Area of Study 1 - How are organic compounds categorised and synthesised?,Outcome 1,VCECHU4AS1O1KK,DetailedExampleStep,Paragraph,Diagram 2,,,,42
Science,Chemistry,Year 12,Unit 4,VCECHU4AS1,Area of Study 1 - How are organic compounds categorised and synthesised?,Outcome 1,VCECHU4AS1O1KK,DetailedExampleStep,Paragraph,"Urease
NH2CONH2(s) + H2O(l)  2NH3(aq) + CO2(aq)",,,,43
Science,Chemistry,Year 12,Unit 4,VCECHU4AS1,Area of Study 1 - How are organic compounds categorised and synthesised?,Outcome 1,VCECHU4AS1O1KK,DetailedExampleStep,Bullet,"Area of Study 1 includes calculating atom economy, which is easy for students to carry out with this single step hydrolysis reaction (CO2 as the by-product). Also included in this area of study is using the IUPAC systematic naming of organic compounds. Students can investigate why urea's accepted systematic name is carbonyl diamide, but that it could also be called carbonyldiamine, diaminomethanal and diaminomethanone.",,,,44
Science,Chemistry,Year 12,Unit 4,VCECHU4AS1,Area of Study 1 - How are organic compounds categorised and synthesised?,Outcome 1,VCECHU4AS1O1KK,DetailedExampleStep,Bullet,"Urea has a vital link to the narrative of sustainable development, with its main application being as a fertiliser (SDG2: Zero hunger). Added as a solid fertiliser, it is dissolved and then hydrolysed by urease in the soil, eventually into ammonium (NH4+) and nitrate (NO3-) ions taken up by plants. However, the highly soluble nitrate ions leach into groundwater, leading to acute toxicity, oxygen-depletion and eutrophication in aquatic environments (SDG14: Life below water).",,,,45
Science,Chemistry,Year 12,Unit 4,VCECHU4AS1,Area of Study 1 - How are organic compounds categorised and synthesised?,Outcome 1,VCECHU4AS1O1KK,DetailedExampleStep,Bullet,"When approaching VCE examinations, students will benefit from an activity that also links to previous curriculum across Units 3 and 4. This is essentially an activity about the rate of reaction of the enzyme catalyst, and other variables affecting reaction rate.",,,,46
Science,Chemistry,Year 12,Unit 4,VCECHU4AS1,Area of Study 1 - How are organic compounds categorised and synthesised?,Outcome 1,VCECHU4AS1O1KK,DetailedExampleStep,Bullet,"Despite all of these possible curriculum contexts, the practical activity itself is fairly simple and can easily be conducted in a single period. Instead of a pure source of urease, the catalyst can be a food source high in urease, such as whole soya beans that you can buy from health food shops. They are extremely hard so you will have to use an electric coffee grinder or similar device to reduce them to powder.",,,,47
Science,Chemistry,Year 12,Unit 4,VCECHU4AS1,Area of Study 1 - How are organic compounds categorised and synthesised?,Outcome 1,VCECHU4AS1O1KK,DetailedExampleStep,Bullet,"Materials required: relevant glassware, a pH meter, whole soya beans, cotton wool and Buchner funnel (for solid filtration), dilute (0.66 M) urea solution, dilute (0.1 M) HCl solution, dilute (0.1 M) sodium hydroxide solution), a means to deliver a measurable volume of solution (burette, graduated pipette, drop pipette of known volume), a glass stirring rod or magnetic stirrer, a grinder to produce a powder from the soya beans.",,,,48
Science,Chemistry,Year 12,Unit 4,VCECHU4AS1,Area of Study 1 - How are organic compounds categorised and synthesised?,Outcome 1,VCECHU4AS1O1KK,DetailedExampleStep,Paragraph,Science skills,,,,49
Science,Chemistry,Year 12,Unit 4,VCECHU4AS1,Area of Study 1 - How are organic compounds categorised and synthesised?,Outcome 1,VCECHU4AS1O1KS,DetailedExampleStep,Paragraph,Teachers should identify and inform students of the relevant science skills embedded in the task.,,,,50
Science,Chemistry,Year 12,Unit 4,VCECHU4AS1,Area of Study 1 - How are organic compounds categorised and synthesised?,Outcome 1,VCECHU4AS1O1KK,DetailedExampleStep,Paragraph,Health and safety notes,,,,51
Science,Chemistry,Year 12,Unit 4,VCECHU4AS1,Area of Study 1 - How are organic compounds categorised and synthesised?,Outcome 1,VCECHU4AS1O1KK,DetailedExampleStep,Paragraph,"Students should wear appropriate personal protective equipment, including eyewear, as dilute (0.1 M) sodium hydroxide solution and dilute (0.1 M) hydrochloric acid are eye irritants.",,,,52
Science,Chemistry,Year 12,Unit 4,VCECHU4AS1,Area of Study 1 - How are organic compounds categorised and synthesised?,Outcome 1,VCECHU4AS1O1KK,DetailedExampleStep,Paragraph,Method,,,,53
Science,Chemistry,Year 12,Unit 4,VCECHU4AS1,Area of Study 1 - How are organic compounds categorised and synthesised?,Outcome 1,VCECHU4AS1O1KK,DetailedExampleStep,Bullet,Shake 2 g of the urease powder (pre-ground from the whole soya beans) with about 20 mL of deionised water in a 100 mL conical flask for about a minute.,,,,54
Science,Chemistry,Year 12,Unit 4,VCECHU4AS1,Area of Study 1 - How are organic compounds categorised and synthesised?,Outcome 1,VCECHU4AS1O1KK,DetailedExampleStep,Bullet,Filter the mixture by passing through damp cotton wool in a Buchner funnel or by passing through damp cotton wool in a 50 mL (or smaller) plastic syringe. The resulting liquid may be cloudy. Use a measuring cylinder to put 10 mL of the filtrate into a 100 mL beaker.,,,,55
Science,Chemistry,Year 12,Unit 4,VCECHU4AS1,Area of Study 1 - How are organic compounds categorised and synthesised?,Outcome 1,VCECHU4AS1O1KK,DetailedExampleStep,Bullet,"Place the beaker on a magnetic stirrer and clamp a pH meter so that it dips into the solution without interfering with the stirrer bar (alternatively, stir the beaker solution consistently with a glass stirring rod). Add deionised water so the probe of the pH meter is covered. Adjust the pH of the solution to 6.5 by adding drops of 0.1 M hydrochloric acid or drops of 0.1 M sodium hydroxide solution. Record the pH at the start of the experiment.",,,,56
Science,Chemistry,Year 12,Unit 4,VCECHU4AS1,Area of Study 1 - How are organic compounds categorised and synthesised?,Outcome 1,VCECHU4AS1O1KK,DetailedExampleStep,Bullet,Use a 2 mL graduated pipette to add 2.0 mL of 0.66 M urea solution to the beaker and start a stop clock. Stir the solution consistently (with a magnetic stirrer or by hand with a glass stirring rod).,,,,57
Science,Chemistry,Year 12,Unit 4,VCECHU4AS1,Area of Study 1 - How are organic compounds categorised and synthesised?,Outcome 1,VCECHU4AS1O1KK,DetailedExampleStep,Bullet,"After a set amount of time, add enough 0.1 M hydrochloric acid solution dropwise to bring the pH back to 6.5. Record accurately the amount of 0.1 M hydrochloric acid solution added (a burette containing HCl solution could be fixed above the beaker, or a graduated pipette could be used, or even a drop pipette with a known volume).",,,,58
Science,Chemistry,Year 12,Unit 4,VCECHU4AS1,Area of Study 1 - How are organic compounds categorised and synthesised?,Outcome 1,VCECHU4AS1O1KK,DetailedExampleStep,Bullet,"Monitor the pH. After a similar set of time, once more add a measured volume of 0.1 M HCl solution to return the pH to 6.5. Record this amount.",,,,59
Science,Chemistry,Year 12,Unit 4,VCECHU4AS1,Area of Study 1 - How are organic compounds categorised and synthesised?,Outcome 1,VCECHU4AS1O1KK,DetailedExampleStep,Bullet,"Repeat the HCl addition step at least a third time, so that you have measurements for the volume of HCl needed to return the pH to 6.5 after each fixed interval of time.",,,,60
Science,Chemistry,Year 12,Unit 4,VCECHU4AS1,Area of Study 1 - How are organic compounds categorised and synthesised?,Outcome 1,VCECHU4AS1O1KK,DetailedExampleStep,Bullet,All waste material and solutions can be safely poured down the sink.,,,,61
Science,Chemistry,Year 12,Unit 4,VCECHU4AS1,Area of Study 1 - How are organic compounds categorised and synthesised?,Outcome 1,VCECHU4AS1O1KK,DetailedExampleStep,Paragraph,Discussion questions and report writing in logbook,,,,62
Science,Chemistry,Year 12,Unit 4,VCECHU4AS1,Area of Study 1 - How are organic compounds categorised and synthesised?,Outcome 1,VCECHU4AS1O1KK,DetailedExampleStep,Bullet,Students complete a results table showing the amount of HCl added in a fixed amount of time (determined by the students) to reduce the pH back to the starting pH of 6.5. Accompanying questions should lead students to conclude that the raising of the pH was due to the formation of the weak base ammonia.,,,,63
Science,Chemistry,Year 12,Unit 4,VCECHU4AS1,Area of Study 1 - How are organic compounds categorised and synthesised?,Outcome 1,VCECHU4AS1O1KK,DetailedExampleStep,Bullet,"While students don't need to calculate in the rate coefficient in VCE Chemistry, they could be expected to demonstrate that the rate of reaction of the catalyst slows as the concentration of the reactant in solution (urea) reduces.",,,,64
Science,Chemistry,Year 12,Unit 4,VCECHU4AS1,Area of Study 1 - How are organic compounds categorised and synthesised?,Outcome 1,VCECHU4AS1O1KK,DetailedExampleStep,Bullet,"As an experiment involving several variables known to impact reaction rate (temperature, concentration, surface area of solids, use of a catalyst), students can be tasked to describe how these have been controlled through the design of their experiment.",,,,65
Science,Chemistry,Year 12,Unit 4,VCECHU4AS1,Area of Study 1 - How are organic compounds categorised and synthesised?,Outcome 1,VCECHU4AS1O1KK,DetailedExampleStep,Bullet,Logical questions to engage students with the real-world context of urea would be to ask them to explain:,,,,66
Science,Chemistry,Year 12,Unit 4,VCECHU4AS1,Area of Study 1 - How are organic compounds categorised and synthesised?,Outcome 1,VCECHU4AS1O1KK,DetailedExampleStep,Bullet,Why urea is such an important fertiliser (It has high N content and is readily hydrolysed into ammonia for plant life.),Logical questions to engage students with the real-world context of urea would be to ask them to explain:,,,67
Science,Chemistry,Year 12,Unit 4,VCECHU4AS1,Area of Study 1 - How are organic compounds categorised and synthesised?,Outcome 1,VCECHU4AS1O1KK,DetailedExampleStep,Bullet,"Why farmers would wet the soil (As demonstrated in this practical activity, urea is first converted into ammonia. Wet soil will dissolve more ammonia in solution, reducing nitrogen loss from the soil before it can be utilised by the plants.)",Logical questions to engage students with the real-world context of urea would be to ask them to explain:,,,68
Science,Chemistry,Year 12,Unit 4,VCECHU4AS1,Area of Study 1 - How are organic compounds categorised and synthesised?,Outcome 1,VCECHU4AS1O1KK,DetailedExampleStep,Bullet,"Why farmers add urease inhibitors in conjunction with urea (To slow the reaction down, giving more time for nitrogen take-up by plants, and leading to less nitrate run-off into groundwater.)",Logical questions to engage students with the real-world context of urea would be to ask them to explain:,,,69
Science,Chemistry,Year 12,Unit 4,VCECHU4AS1,Area of Study 1 - How are organic compounds categorised and synthesised?,Outcome 1,VCECHU4AS1O1KK,DetailedExampleStep,Bullet,"Advantages and disadvantages of organic fertilisers such as urea, compared to inorganic fertilisers.",Logical questions to engage students with the real-world context of urea would be to ask them to explain:,,,70
Science,Chemistry,Year 12,Unit 4,VCECHU4AS1,Area of Study 1 - How are organic compounds categorised and synthesised?,Outcome 1,VCECHU4AS1O1KK,DetailedExampleStep,Paragraph,Teacher notes,,,,71
Science,Chemistry,Year 12,Unit 4,VCECHU4AS1,Area of Study 1 - How are organic compounds categorised and synthesised?,Outcome 1,VCECHU4AS1O1KK,DetailedExampleStep,Bullet,"This practical activity has been modified from a Royal Society of Chemistry (RSC) practical activity Rate of hydrolysis of urea. The resource contains student worksheets and teacher notes, along with worked solutions. It should be noted that the activity was designed to have students practically demonstrate that the reaction rate is first order and to determine the rate equation for the hydrolysis of urea. This aspect of chemical kinetics is not in the VCE chemistry curriculum.",,,,72
Science,Chemistry,Year 12,Unit 4,VCECHU4AS1,Area of Study 1 - How are organic compounds categorised and synthesised?,Outcome 1,VCECHU4AS1O1KK,DetailedExampleStep,Bullet,"This activity was part of a RSC set of practical activities Challenging plants, which had a central focus on understanding chemical changes involved in making fertilisers, which are often designed to meet specific requirements such as particular nutrient deficiencies and methods of application (including rate of release). The RSC also have collated a number of practical and non-practical activity resources as part of a Feed the World package, to engage students with chemistry's importance in addressing global food security and SDG 2.",,,,73
Science,Chemistry,Year 12,Unit 4,VCECHU4AS1,Area of Study 1 - How are organic compounds categorised and synthesised?,Outcome 1,VCECHU4AS1O1KK,DetailedExampleStep,Bullet,"Another sustainable development extension activity would be to have students undertake a case study into how urea is industrially produced. The Bosch-Meiser process, now 100 years old but still the main industrial production process, utilises CO2 and NH3. Both of these reactants are traditionally sourced from fossil fuel production (NH3 requiring H2 via the Haber-Bosch process - itself sourced from fossil fuels). Therefore, for urea to be considered a 'green' fertiliser, we must first have 'green' ammonia produced from 'green' hydrogen.",,,,74
Science,Chemistry,Year 12,Unit 4,VCECHU4AS2,Area of Study 2 - How are organic compounds analysed and used?,Outcome 2,,,OutcomeHeading,Outcome 2,,,,1
Science,Chemistry,Year 12,Unit 4,VCECHU4AS2,Area of Study 2 - How are organic compounds analysed and used?,Outcome 2,,,OutcomeDescription,"On completion of this unit the student should be able to apply qualitative and quantitative tests to analyse organic compounds and their structural characteristics, deduce structures of organic compounds using instrumental analysis data, explain how some medicines function, and experimentally analyse how some natural medicines can be extracted and purified.",,,,2
Science,Chemistry,Year 12,Unit 4,VCECHU4AS2,Area of Study 2 - How are organic compounds analysed and used?,Outcome 2,,,SectionHeading,Examples of learning activities,,,,3
Science,Chemistry,Year 12,Unit 4,VCECHU4AS2,Area of Study 2 - How are organic compounds analysed and used?,Outcome 2,VCECHU4AS2O2KK,Activity,Paragraph,Key knowledge: Laboratory analysis of organic compounds,,,,4
