SubjectArea,Subject,Band,AssessmentType,AssessmentInformationDetails,AssessmentYears,UnitASCode,ExamReportCode,SectionCode,ExamResponsesSkillType,ExamResponsesSkillHeader,ExamResponsesSkill,ExamResponsesExplanation,ExamResponsesExample,Sequence
English,English Language,Year 12,Final Exam,Post Exam Report,2024,"VCEELU3AS1,VCEELU3AS2,VCEELU4AS1,VCEELU4AS2",VCEELERC,C,EnhancedStrategies,Question 7,"The following extract from a high-scoring response covers important elements of the question. The introduction to this response explores the idea that language does not always define identity and that it can instead reflect identity and values, particularly in Australian society. In two of the body paragraphs, shown below, the response successfully explores these core points, with the first paragraph examining how language evolves to reflect social diversity and unity, highlighting its role in shaping and expressing contemporary Australian identities. The second extract of the response explores how linguistic resistance to change can reinforce rigid cultural norms, limiting inclusivity and the ability to adapt to a dynamic and multicultural society. The response as a whole successfully demonstrates the dynamic relationship between language and identity in contemporary Australia.",,,8
English,English Language,Year 12,Final Exam,Post Exam Report,2024,"VCEELU3AS1,VCEELU3AS2,VCEELU4AS1,VCEELU4AS2",VCEELERC,C,StudentResponse,Question 7,High-scoring student response,,"Within the multicultural and multi-faceted contemporary Australia, language is constantly evolving to best reflect the more diverse Australian identities. For instance, an increase in open gender diversity is evident in modern Australia, with the LGBTQ+ community becoming more comfortable in sharing that aspect of their identity. As such language is evolving to accommodate this, such as the 2023 Macquarie Dictionary word of the year shortlist “gendy nooch”. In order to reflect the identities of gender neutral people and simultaneously showcase their Australian identity, archetypal features such as the hypocoristic suffix “-y” and the shortening “nooch” from “neutral”, are employed. This meets the Australian goals of celebrating “our diversity” whilst “[striving] for a unified … nation” (Stimulus C). Hence, language is always shifting to be the best representation of a gender-diverse Australian identity, simultaneously.
…
However, due to the fact that language defines our Australian identity many become overly protective of preserving values preventing the constant change. For instance, in July 2024, an Australian swimming coach for the Olympics was denounced for supporting the Korean team and labelled as “un-Australian”. The use of the derivational prefix “un-“ indicates the existence of a set of hard rules as to what being an ‘Australian’ consists of, such as unwavering loyalty to the Australian swimming team. By prohibiting the support and encouragement to other international teams, the values of sportsmanship and mateship between nations is compromised. This implication of set rules as to what being an Australian consists of prevents necessary social, and consequently, linguistic change that more accurately defines the Australian community. The use of a term like “un-Australian” prevents growth and development in what defines an Australian, which is critical in promoting social harmony and inclusivity between cultures, like between Australians and Koreans.",9
English,English Language,Year 12,Final Exam,Post Exam Report,2024,"VCEELU3AS1,VCEELU3AS2,VCEELU4AS1,VCEELU4AS2",VCEELERC,C,ExaminerCommentary,Question 8,"Question 8 required students to explore the variations in language that are created and used by individuals or groups within society, and in particular how variations in language reflect those who are accepted within a group and those who are not. Student responses considered how these variations can act to complement a purpose or counteract it, focusing on interactions with others; how connections are made, or not made, and the different types of interactions that result. Ultimately, this question produced responses that explored how our use of language ‘supports’ different purposes as well as how ‘contradicting purposes’ also occur, such as when language does not achieve what we want, particularly when there are unintended effects.",,,10
English,English Language,Year 12,Final Exam,Post Exam Report,2024,"VCEELU3AS1,VCEELU3AS2,VCEELU4AS1,VCEELU4AS2",VCEELERC,C,EnhancedStrategies,Question 8,"Student responses explored how language use reflects and adapts to generational social and cultural expectations. Stimulus A focuses on workplace communication, highlighting the importance of rapport-building and solidarity through language, while acknowledging generational differences in communication styles. It explores potential conflicts between values like “cultural competence” among younger generations and “respect” valued by older ones, emphasising the need for accommodation to maintain effective interactions and meet differing social expectations.",,,11
English,English Language,Year 12,Final Exam,Post Exam Report,2024,"VCEELU3AS1,VCEELU3AS2,VCEELU4AS1,VCEELU4AS2",VCEELERC,C,EnhancedStrategies,Question 8,"Responses also examined the dynamic influence of technology, education and age on language variation and societal norms. Online platforms foster unique linguistic practices that, while sometimes adopted by older generations, can be seen as contrived or ineffective when not authentic. Age and education influence our tolerances for outdated or discriminatory language, with societal shifts normalising once-taboo expressions and rejecting offensive terms. These changes underscore language as a marker of identity and the importance of adapting to evolving social expectations.",,,12
English,English Language,Year 12,Final Exam,Post Exam Report,2024,"VCEELU3AS1,VCEELU3AS2,VCEELU4AS1,VCEELU4AS2",VCEELERC,C,ExaminerCommentary,Question 8,"Some responses highlighted broader linguistic diversity, including the influence of globalisation, technology and AI on language. There is increasing acceptance of linguistic variety in public contexts, though remnants of judgment persist. Commonly used examples such as Fatima Payman’s use of teen slang in Parliament and institutional renaming practices (e.g. “Family Day Stall”) illustrate how language choices can achieve inclusivity or backfire, depending on their alignment with audience expectations. These ideas emphasise the responsibility of individuals and institutions to navigate evolving values and communication norms thoughtfully.",,,13
English,English Language,Year 12,Final Exam,Post Exam Report,2024,"VCEELU3AS1,VCEELU3AS2,VCEELU4AS1,VCEELU4AS2",VCEELERC,C,EnhancedStrategies,Question 8,"The following is an extract of two paragraphs from a high-scoring student response. This response demonstrates a strong ability to analyse language variation in relation to context and audience, effectively highlighting how language choices can support or contradict communicative purposes. The response’s exploration of linguistic features such as jargon, idiom and colloquial language is insightful and well-articulated, showing a clear understanding of how these choices fulfil different functions depending on audience expectations and contextual demands. The response effectively uses contemporary linguistic examples to support the points being made, connecting linguistic theory with how it is demonstrated in Australian society.",,,14
English,English Language,Year 12,Final Exam,Post Exam Report,2024,"VCEELU3AS1,VCEELU3AS2,VCEELU4AS1,VCEELU4AS2",VCEELERC,C,StudentResponse,Question 8,High-scoring student response,,"The use of language in the news illustrates that choices must be made with the audience and other factors of context in mind in order to successfully support purposes. This is clear through an article found under the “economics” section of the ABC News website in March 2024. The heading read “Tepid GDP extends Australia’s per capita recession”. This use of jargon, as illustrated through the initialism “GDP” and adjective “per capita” allow the ABC to effectively establish their expertise in the field of economics. Furthermore, they are able to successfully fulfil the referential function and build rapport with their audience, who also understand economics, and therefore the inference required to understand the jargon. This is ensured through the ABC’s clear understanding of context; because the article is on their website underneath “economics”, readers must actively go out of their way to locate this article, meaning only those who understand economics will read it. This can be held in contrast with the ABC’s use of language in a live TB broadcasted interview with Dr Karl Kruszelnicki regarding the “Aurora Australis” phenomenon of July 2024. Kruszelnicki describes the phenomenon as the sun having a “hissy fit”. The personification of the sun using this idiom demonstrates a starkly different register to that of the economics article, however, this choice effective builds rapport with the audience and fulfils the referential function regardless. Again, this is due to the understanding that viewers of this interview are everyday Australians, who do not necessarily have a scientific background. By explaining complex phenomena in relatable, colloquial terms, Kruszelnicki can build rapport with this specific audience. Therefore, context is the determining factor in whether language choices support purposes or not.
Politicians often show great variation in their language in order to build rapport with certain voting demographics, however, attitudes towards these politicians, as well as the broader context must be assessed for these to be successful. This is clear through leader of the Greens, Adam Bandt, who attempts to use “new slang words and slang phrases (to) earn at least grudging respect” (stimulus b). This is clear through a post on Instagram from August 2024, which reads “fishing for people, not corporations, very demure, very mindful”. The latter adjectival phrase is reflective of current Generation Z slang, allowing Bandt to exploit covert norms in order to successfully build rapport with this audience. Furthermore, this is assisted by his understanding of young people’s political frustrations and attitudes towards the current leading parties who seemingly don’t care about “the people”. Thus, by reflecting Generation Z’s language and reflecting their ideals, Bandt successfully builds rapport. This can be held in contrast with Anthony Albanese, who attempts to do something similar, however fails. In July 2024, he posted an image of a Spotify playlist with a title reading “high voltage power bill relief Thursday morning bangers”, which was an attempt to appeal to the covert norms of Generation Z by reflecting the humorous, incoherent syntax of algorithm generated Spotify playlists. This humour requires inference to understand, supposedly building rapport. However, he is ultimately unsuccessful, clear through a comment reading “no-one thinks you’re cool albo”. Instead of building rapport, he contradicts his purpose, making himself appear as an incompetent leader. This is ineffective due to the audience’s attitudes towards Albanese, who believe he is an incompetent leader, which is reinforced by the fact he is posting “silly memes” on Instagram instead of fixing problems as a PM should be.",15
English,English Language,Year 12,Final Exam,Post Exam Report,2024,"VCEELU3AS1,VCEELU3AS2,VCEELU4AS1,VCEELU4AS2",VCEELERC,C,ExaminerCommentary,Question 9,"In this question, student responses explored how power and status (social standing) are demonstrated and exploited through changes in register and politeness. They explored language used in public contexts, as well as language used in other language forms that are publicly viewed or received. Some responses considered social standing in the more micro sense, such as complying with covert norms when it’s expected, flouting overt norms; this was acceptable. Similarly, responses also considered the various levels of politeness used depending on context and how we can, deliberately or not, manipulate our register to assert or decrease power and authority and achieve various purposes. It was also relevant to consider the various attitudes towards the causes of these variations of language.",,,16
English,English Language,Year 12,Final Exam,Post Exam Report,2024,"VCEELU3AS1,VCEELU3AS2,VCEELU4AS1,VCEELU4AS2",VCEELERC,C,ExaminerCommentary,Question 9,"Some responses explored how shifts in non-discriminatory language and changes in register reflect evolving societal norms and hierarchies. Politeness and register, while traditionally tied to asserting power and authority, have become more informal in Australia, with terms like ‘man’ and ‘bro’ replacing rigid honorifics. A number of students explored this shift through examples like Tasmania’s parliamentary change to ‘Honourable Speaker’ or the backlash to policing language too strictly. Additionally, some responses investigated how breaking politeness conventions, especially through covert norms, can bolster social standing, such as using humour to navigate taboo topics or anger in artistic and political expression to challenge societal norms.",,,17
English,English Language,Year 12,Final Exam,Post Exam Report,2024,"VCEELU3AS1,VCEELU3AS2,VCEELU4AS1,VCEELU4AS2",VCEELERC,C,ExaminerCommentary,Question 9,"Navigating public language involves balancing solidarity, expertise and sensitivity through register and politeness. Satire, parody and euphemism are used to negotiate taboo topics in politics, reportage and bureaucracy, where jargon signals authority but may threaten the audience’s negative face. Student responses explored how politicians like Senator Lidia Thorpe or Leader of the Opposition Peter Dutton gained or lost social standing depending on their linguistic choices, employing obfuscatory language or doublespeak to manipulate perceptions. Broader discussions also addressed how language is used to clarify or obscure meaning, exclude certain groups, or maintain authority in professions where clarity and expertise are critical, such as law or media, alongside issues of informality and misogyny in public discourse.",,,18
English,English Language,Year 12,Final Exam,Post Exam Report,2024,"VCEELU3AS1,VCEELU3AS2,VCEELU4AS1,VCEELU4AS2",VCEELERC,C,EnhancedStrategies,Question 9,"Higher-scoring responses appropriately answered the question ‘To what extent is this true?’. As part of this discussion, responses were required to consider how true it is that register and politeness go hand in hand with social standing. Not all responses did this. Higher-scoring responses argued that register is less important than effective politeness strategies, or that politeness strategies have a reduced importance in some contexts, such as when a register is highly informal or intimate and/or when complying with covert norms.",,,19
English,English Language,Year 12,Final Exam,Post Exam Report,2024,"VCEELU3AS1,VCEELU3AS2,VCEELU4AS1,VCEELU4AS2",VCEELERC,C,EnhancedStrategies,Question 9,"A number of responses struggled to adequately deal with all key words in this topic – ‘register’, ‘politeness’ and ‘social standing’. Nevertheless, there were some very high-scoring responses that were able to do so well and discuss different types of social standing among different groups in society. These responses discussed in some detail how overt and covert prestige can be derived in different contexts.",,,20
English,English Language,Year 12,Final Exam,Post Exam Report,2024,"VCEELU3AS1,VCEELU3AS2,VCEELU4AS1,VCEELU4AS2",VCEELERC,C,LimitedStrategies,Question 9,Some responses demonstrated a good understanding of how contextual factors determine the appropriateness of the language that one should use to reinforce one’s social standing and exemplified what can occur when misjudgments are made related to register and politeness.,,,21
English,English Language,Year 12,Final Exam,Post Exam Report,2024,"VCEELU3AS1,VCEELU3AS2,VCEELU4AS1,VCEELU4AS2",VCEELERC,C,EnhancedStrategies,Question 9,"Below is an example of a high-scoring response. This response demonstrates a sophisticated understanding of linguistic concepts, particularly register, politeness conventions, and their influence on social standing, integrating these ideas competently and with sophistication. By providing detailed examples, such as referring to Breast Cancer Network Australia's use of euphemisms to attend to face needs and the Victorian Government's inclusive language to foster politeness, the response effectively illustrates how language choices impact social perception. The analysis is nuanced, recognising both the benefits and limitations of adhering to politeness conventions, as seen in the discussion of political correctness and person-first language. Furthermore, the formal and coherent writing style reflects a strong grasp of linguistic principles, culminating in a conclusion that synthesises the unpredictable nature of language and its effect on communicative outcomes.",,,22
English,English Language,Year 12,Final Exam,Post Exam Report,2024,"VCEELU3AS1,VCEELU3AS2,VCEELU4AS1,VCEELU4AS2",VCEELERC,C,ExaminerCommentary,Question 9,"Included below is the introduction, one body paragraph and the conclusion.",,,23
English,English Language,Year 12,Final Exam,Post Exam Report,2024,"VCEELU3AS1,VCEELU3AS2,VCEELU4AS1,VCEELU4AS2",VCEELERC,C,StudentResponse,Question 9,High-scoring student response,,"One's formality and ability to adhere to politeness conventions are hallmark characteristics of our language, and undoubtedly influence how one is perceived in the eyes of others, both those they are close to as well as strangers. Whether it be through the success of euphemisms to ensure formality and the attendance to others' positive face needs to better bolster one's social standing, or through the overwhelming backlash towards individuals who do not adhere to such linguistic expectations such as through discriminatory language, there is an obvious need for awareness around one's register and politeness when addressing others. However, in some instances, even when one does employ a degree of circumspection around both of these factors, the fickle and unpredictable nature of language means that often users can end up with unwanted or unexpected outcomes. Ultimately, caution around one's register and politeness is vital to secure one's social standing in contemporary society, however, it should not be relied upon as a guaranteed indicator of success, given the fickleness of language.
[…]
Conversely, a lack of attention to one's register and politeness can be detrimental for the social standing of the user in society. Discriminatory language, such as that of racist and sexist rhetoric is such an example, resulting in immense criticism and backlash for its users. In 2024, three male students at Yarra Valley Grammar were suspended after compiling a highly offensive list rating the attractiveness of female peers, using the term 'unrapable'. Where a tone of respect and slight formality is expected around the taboo subject of rape and female equality, the non-Standard usage of the derivational prefix ""un"" lends an disturbingly relaxed and playful tone to the horrific mindset where women are objectified to mere tools of carnal pleasure for their male counterparts. Such informality serves to normalise the heinous crime of rape as a commonplace standard of consideration of female attractiveness, suggesting that women only exist in society for the pleasure of men and that their consent or autonomy is inconsequential. Such lack of reverence towards their female peers saw the boys receive immense backlash by their classmates and students countrywide on social media for such flagrant undermining of the role of women in society –something that diminished their social standing as previously popular and respected members of their cohort. Traversing beyond the playground, if such lack of adhere to basic politeness remains uncurbed, it intensifies and continues into society among adults, propagating similar prejudicial social attitudes. In 2024, a notable Australian doctor was banned from registering for another year as a GP after sending Indigenous ophthalmologist Rallah Baker a discriminatory email that read ""You are not full blood are you? Half? A quarter? One eight? Like a watered down bottle of Grange"". The pejorative vocatives ""Half? A quarter? One eight?"" engender a dehumanising tone by affronting Baker's positive face needs and qualifying his identity on the sole basis of genetic composition – a metric often used for animals. Likewise, the simile ""Like a watered down bottle of Grange"" takes on a belittling tone, minimising Baker's holistic identity to simply the colour of his skin. In turn, such racist rhetoric undermines Baker's professional prowess and invalidates his identity. Furthermore, it panders to and propagates stereotypical caricatures of Indigenous people where they are considered 'low-intellect' or inherently undeserving of their position in society. Such flagrant lack of respect towards the Indigenous identity of both Baker and other First Nations doctors, in conjunction with an absence of awareness around basic politeness, saw this previously acclaimed Australian doctor, blacklisted and shunned by colleagues, diminishing his once prestigious social standing. Ultimately, when politeness and register are not considered, in preference instead for expressing one's prejudicial attitudes, backlash and a decrease in social standing becomes inevitable.
[…]
Ultimately, one's formality and ability to adhere to politeness conventions have direct correlation with how one is perceived and their social standing, as seen when usage of euphemisms gains its user rapport with a certain demographic, and when usage of discriminatory language causes offense and decreases others respect towards the user. However, the fickle and unpredictable nature of language means that despite such awareness and caution around these factor, users can end up with unwanted or unexpected outcomes. Thus, although an important metric, register and politeness should not be relied upon as a guaranteed indicator for communicative success with all audiences.",24
