SubjectArea,Subject,Band,AssessmentType,AssessmentInformationDetails,AssessmentYears,UnitASCode,ExamReportCode,SectionCode,ExamResponsesSkillType,ExamResponsesSkillHeader,ExamResponsesSkill,ExamResponsesExplanation,ExamResponsesExample,Sequence
English,English Language,Year 12,Final Exam,Post Exam Report,2024,"VCEELU3AS1,VCEELU3AS2,VCEELU4AS1,VCEELU4AS2",VCEELERA,A,ExaminerCommentary,Question 1,This question was invalidated because it does not align with the study design.,,,1
English,English Language,Year 12,Final Exam,Post Exam Report,2024,"VCEELU3AS1,VCEELU3AS2,VCEELU4AS1,VCEELU4AS2",VCEELERA,A,ExaminerCommentary,Question 2,"Students were required to identify when Koslowski’s purpose in the interview was to establish Alcott’s identity and then discuss this using a quoted example with appropriate metalanguage. A wide variety of responses were accepted, the most common referring to the variation of domains in which Alcott has been involved, such as in the declarative listing of ‘sport … politics … healthcare’ (22–23).",,,2
English,English Language,Year 12,Final Exam,Post Exam Report,2024,"VCEELU3AS1,VCEELU3AS2,VCEELU4AS1,VCEELU4AS2",VCEELERA,A,LimitedStrategies,Question 2,"While students approached this question well, more engagement with the text was warranted, particularly by providing specific details of Alcott’s contributions. Metalanguage was by and large accurate; however, occasionally students referred to how Alcott establishes his own contributions, rather than how Koslowski does, which did not answer the question.",,,3
English,English Language,Year 12,Final Exam,Post Exam Report,2024,"VCEELU3AS1,VCEELU3AS2,VCEELU4AS1,VCEELU4AS2",VCEELERA,A,EnhancedStrategies,Question 2,The following is an example of a high-scoring response.,,,4
English,English Language,Year 12,Final Exam,Post Exam Report,2024,"VCEELU3AS1,VCEELU3AS2,VCEELU4AS1,VCEELU4AS2",VCEELERA,A,StudentResponse,Question 2,High-scoring student response,,"Syntactic listing in L21–24 ""and you started with sport and... into politics and healthcare...onto representation"" illustrates the myriad of domains in society Alcott has contributed to with the overall declaration from L18 to L24.",5
English,English Language,Year 12,Final Exam,Post Exam Report,2024,"VCEELU3AS1,VCEELU3AS2,VCEELU4AS1,VCEELU4AS2",VCEELERA,A,ExaminerCommentary,Question 3,"This question had multiple requirements, such as being able to discuss a politeness strategy, such as attending to a positive or negative face need, as well as valid discussions about how a tenor was created by that strategy. Many students neglected to do both of these successfully, and more careful revision of discussion of politeness in particular is warranted.",,,6
English,English Language,Year 12,Final Exam,Post Exam Report,2024,"VCEELU3AS1,VCEELU3AS2,VCEELU4AS1,VCEELU4AS2",VCEELERA,A,EnhancedStrategies,Question 3,"To receive full marks, students needed to accurately identify the type of politeness being addressed, such as the positive politeness strategy of complimenting or the negative politeness strategy of hedging. They were also required to refer to how this strategy influenced the tenor of the conversation; that is, the tenor it contributed to forming.",,,7
English,English Language,Year 12,Final Exam,Post Exam Report,2024,"VCEELU3AS1,VCEELU3AS2,VCEELU4AS1,VCEELU4AS2",VCEELERA,A,EnhancedStrategies,Question 3,"Most students successfully chose to discuss positive politeness, but both positive and negative politeness strategies were used within the interview. Many of the strategies used by both Alcott and Koslowski contributed to a warm, professional tenor that was both respectful and friendly.",,,8
English,English Language,Year 12,Final Exam,Post Exam Report,2024,"VCEELU3AS1,VCEELU3AS2,VCEELU4AS1,VCEELU4AS2",VCEELERA,A,EnhancedStrategies,Question 3,The following is an example of a high-scoring response.,,,9
English,English Language,Year 12,Final Exam,Post Exam Report,2024,"VCEELU3AS1,VCEELU3AS2,VCEELU4AS1,VCEELU4AS2",VCEELERA,A,StudentResponse,Question 3,High-scoring student response,,K employs the positive politeness strategy of offering a compliment as he utters 'thank you for joining us' (line 2) to display his gratitude towards A in choosing to be featured on the podcast. This influences the tenor to be conversational and friendly in nature as A's positive face needs are being met because his contribution as an interlocutor on the podcast is acknowledged and recognised in an inviting manner by K.,10
English,English Language,Year 12,Final Exam,Post Exam Report,2024,"VCEELU3AS1,VCEELU3AS2,VCEELU4AS1,VCEELU4AS2",VCEELERA,A,ExaminerCommentary,Question 4,"This question allowed students to explore the situational context of the text and relate these to how, why and when the function changed. Reference to Jakobson’s functions was usually done well, but these functions were not always specifically related to aspects of the situational context as per the study design. Sometimes, more metalanguage could have been used to analyse language features that contributed to the fulfilment of various functions.",,,11
English,English Language,Year 12,Final Exam,Post Exam Report,2024,"VCEELU3AS1,VCEELU3AS2,VCEELU4AS1,VCEELU4AS2",VCEELERA,A,EnhancedStrategies,Question 4,"Full marks could be achieved in a number of ways, such as by discussing a change from one function to another in detail, with quotes and metalanguage to refer to the situational context, including metalanguage to discuss how that change is made, not just that it has occurred. Similarly, students could also have discussed two or more instances of a change from one function to another, with quotes and metalanguage to tie this to a situational context. They were not required to use additional metalanguage alongside the quoted extracts; it was appropriate to focus on metalanguage in terms of context.",,,12
English,English Language,Year 12,Final Exam,Post Exam Report,2024,"VCEELU3AS1,VCEELU3AS2,VCEELU4AS1,VCEELU4AS2",VCEELERA,A,LimitedStrategies,Question 4,"Students should be guided by the study design when responding to these types of questions. A number of responses did not accurately refer to elements of the situational context, which include setting, field, tenor, mode and audience.",,,13
English,English Language,Year 12,Final Exam,Post Exam Report,2024,"VCEELU3AS1,VCEELU3AS2,VCEELU4AS1,VCEELU4AS2",VCEELERA,A,EnhancedStrategies,Question 4,The following is an example of a high-scoring response.,,,14
English,English Language,Year 12,Final Exam,Post Exam Report,2024,"VCEELU3AS1,VCEELU3AS2,VCEELU4AS1,VCEELU4AS2",VCEELERA,A,StudentResponse,Question 4,High-scoring student response,,"The shift from a phatic function to a referential function reflects the situational context of the text as an interview. The phatic function is reflected in adjacency pair 'Really appreciate you coming in' (3), 'Great to be here' (4), by which A and K adhered to the conventions of an interview. A shift to a referential function occurs when A begins explaining his career, evidence by declarative ""I just wake up every day and try and be myself and in doing that, Try and change perceptions around disability' (28–29). The declarative reflects Alcott's intent to share information about himself and what he is trying to do in the world, as the interview moves into the referential phase.",15
English,English Language,Year 12,Final Exam,Post Exam Report,2024,"VCEELU3AS1,VCEELU3AS2,VCEELU4AS1,VCEELU4AS2",VCEELERA,A,EnhancedStrategies,Question 5,"Alcott and Koslowski both used a variety of strategies to manage their turns, assisting in constructing their identities. Students were able to link to a range of identities for each of the participants, such as Koslowski’s identities as a host, podcaster, media personality and sports fan who is respectful, friendly and encouraging, as well as Alcott’s identities as a sports figure, a motivational speaker, an entrepreneur and a disability advocate who is personable and humble.",,,16
English,English Language,Year 12,Final Exam,Post Exam Report,2024,"VCEELU3AS1,VCEELU3AS2,VCEELU4AS1,VCEELU4AS2",VCEELERA,A,LimitedStrategies,Question 5,"Students require more practice determining the requirements of five-mark questions and ensuring that all aspects of the question are covered in their response. There were some very good examples of an analysis of turn-taking strategies, but the identity aspect of the question was not always fully covered. More careful revision of the difference between topic management and turn taking is required of all students, as this was a particular weakness in many responses.",,,17
English,English Language,Year 12,Final Exam,Post Exam Report,2024,"VCEELU3AS1,VCEELU3AS2,VCEELU4AS1,VCEELU4AS2",VCEELERA,A,ExaminerCommentary,Question 5,"Some students neglected to discuss prosodic features that would be regarded as salient in facilitating turn taking, such as pitch, intonation and tempo. There were a few examples of excellent discussion of how fast-paced tempo facilitated transitions, allowing interlocutors to complete a turn and cede the floor. Very few students considered methods that Alcott and Koslowski used to hold the floor, such as non-fluency features and continuing intonation. Quite a number of students mis-categorised declaratives that employed questioning intonation, referring to them erroneously as interrogatives.",,,18
English,English Language,Year 12,Final Exam,Post Exam Report,2024,"VCEELU3AS1,VCEELU3AS2,VCEELU4AS1,VCEELU4AS2",VCEELERA,A,ExaminerCommentary,Question 5,"This question was marked holistically, with students being awarded marks for discussing both speakers in detail, linking turn taking to elements of their identity, both group and individual, such as Koslowski’s identity as an interviewer who is respectful and Alcott’s identity as an interviewee and friendly person.",,,19
English,English Language,Year 12,Final Exam,Post Exam Report,2024,"VCEELU3AS1,VCEELU3AS2,VCEELU4AS1,VCEELU4AS2",VCEELERA,A,EnhancedStrategies,Question 5,The following is an example of a high-scoring response.,,,20
English,English Language,Year 12,Final Exam,Post Exam Report,2024,"VCEELU3AS1,VCEELU3AS2,VCEELU4AS1,VCEELU4AS2",VCEELERA,A,StudentResponse,Question 5,High-scoring student response,,"Koslowski initiates a question–answer adjacency pair in line 25 with the interrogative “is that … career?”, allowing him to then pass the floor to Alcott. His role as the primary floor and topic manager helps to affirm his individual identity as a podcast host (his occupation), as hosts are generally responsible for managing the floor. In line 5, A holds his turn with rising intonation in the utterance “fan … a while/” (5). This signals he is not finished with his turn yet, as he proceeds to elaborate with the declarative “I love the TDA” (6), this expression constructs A’s individual identity as a fan of the TDA. In line 51, A uses rising intonation in the utterance “… you know … entrepreneur/”. The rising intonation allows A to hold the floor while including K as a member of the wider community of innovative thinkers, as he describes K with the noun “entrepreneur” (51).",21
English,English Language,Year 12,Final Exam,Post Exam Report,2024,"VCEELU3AS1,VCEELU3AS2,VCEELU4AS1,VCEELU4AS2",VCEELERB,B,LimitedStrategies,Question 6,"Most students used a suitable strategy for approaching this task and many responses identified how the text attempts to unite the audience and First Nations Australians and commented on the use of inclusive language. However, responses could have been more specific when discussing usage of personal pronouns and determiners, as well as adverbs. Some responses incorrectly employed the term ‘collective’ when analysing pronouns; students should revise metalanguage carefully, as this term is reserved for a particular category of nouns.",,,1
English,English Language,Year 12,Final Exam,Post Exam Report,2024,"VCEELU3AS1,VCEELU3AS2,VCEELU4AS1,VCEELU4AS2",VCEELERB,B,LimitedStrategies,Question 6,Higher-scoring responses engaged closely with the assigned text and avoided generic and formulaic comments. They provided nuanced analysis of register and shifts in register and focused on salient features of the text. Less confident commentaries resorted to summary or listing and overly relied on pre-prepared structures in their analytical approach. This limited their ability to respond with sophistication and respond to the text at hand.,,,2
English,English Language,Year 12,Final Exam,Post Exam Report,2024,"VCEELU3AS1,VCEELU3AS2,VCEELU4AS1,VCEELU4AS2",VCEELERB,B,EnhancedStrategies,Question 6,"More effective commentaries were able to recognise the primary audience of educators and comment specifically on how language was tailored to appeal to this audience to fulfil certain purposes and intents. They were then able to refer to secondary or wider audiences. Similarly, there were some very good references to the cultural context, with some responses relating the concept of reconciliation to Australia’s history and changing values in society. More successful responses referred to specific language features using precise metalanguage.",,,3
English,English Language,Year 12,Final Exam,Post Exam Report,2024,"VCEELU3AS1,VCEELU3AS2,VCEELU4AS1,VCEELU4AS2",VCEELERB,B,LimitedStrategies,Question 6,"Students across the board appeared to struggle with the multi-modal nature of the text. Higher-scoring responses referred to spoken discourse features and prosody when analysing the content of the narrator’s monologue. For the written component, responses did not always engage with the text – generic discussions of discourse factors such as cohesion and coherence were not considered salient. If considering the inclusion of this type of discussion, students must provide relevant discussions, in particular about the nature of the content itself and how discourse factors are used to complement it.",,,4
English,English Language,Year 12,Final Exam,Post Exam Report,2024,"VCEELU3AS1,VCEELU3AS2,VCEELU4AS1,VCEELU4AS2",VCEELERB,B,ExaminerCommentary,Question 6,"In particular, Question 6 required a sustained analytical commentary of the text, focusing in particular on functions, purposes, intents, contexts, register, tenor and audience. To score highly, all language features analysed needed to be meaningfully linked to one or more of these elements.",,,5
English,English Language,Year 12,Final Exam,Post Exam Report,2024,"VCEELU3AS1,VCEELU3AS2,VCEELU4AS1,VCEELU4AS2",VCEELERB,B,EnhancedStrategies,Question 6,"The following high-scoring response demonstrates a thorough understanding of what was required of the task and critically engages with the text’s linguistic features and their functions. It successfully identifies specific examples of language use, linking these to the broader purposes of the text. The response identifies and discusses specific linguistic features, linking them explicitly to their communicative effects and text functions. This demonstrates a sophisticated understanding of how language choices serve to achieve referential, conative and emotive functions. The response effectively integrates textual evidence with precise metalanguage. This showcases a high level of control over the terminology required for analysing texts in VCE English Language. Further, it consistently relates linguistic choices to the cultural and situational context of the text, particularly in highlighting the incorporation of Indigenous values and terminology to establish credibility and foster trust. This shows an appreciation of how texts reflect broader cultural and ideological underpinnings. The analysis of how the text maintains a moderately formal register that implies authority, solidarity and profundity is nuanced. The response explains how these elements work in concert to reinforce the audience's trust and engagement with the company’s programs.",,,6
English,English Language,Year 12,Final Exam,Post Exam Report,2024,"VCEELU3AS1,VCEELU3AS2,VCEELU4AS1,VCEELU4AS2",VCEELERB,B,StudentResponse,Question 6,High-scoring student response,,"Through their linguistic choices in the written section of the text and peppered throughout the spoken section, RA achieves their referential and conative functions. They employ the imperatives ""Join"" (54) and ""Read"" (65) when referring to webinars they offer and their impact statement. The unhedged nature of these order assists in engendering a didactic tone of command, galvanising audiences to take action and engage with the company further - bolstering the conative function.
RA employs hyperlinks of the noun phrases ""Narragunnawali...Plan"" (11) and ""professional learning"" (14) when referring to their programs. In addition to adhering to the expectations of the text type as a website article, thus bolstering the accessibility of the text and its coherence, such hyperlinks also assist in achieving the referential function by delineating where audiences can access further information to better apprise themselves on the programs that the company offers.
RA employs listing of the common nouns ""principal, teacher, parents, student or community member"" (38–39) when referring to demographics that the company is willing to support in their decision of choosing a program. By layering this common nouns, RA is able to achieve an all encompassing effect throughout this cohesive thread of nouns, ensuring that all demographics of their readers feel supported and guided through this process - something that bolsters the conative function of galvanising them to choose a program.
The function of the text shifts slightly in the spoken section, where RA bolsters their emotive function. RA employs the antithesis of the noun phrases ""some new, some old, some yet to be heard, some yet to be told"" (19) when referring to the multitude of Indigenous stories. By echoing these noun phrases in a cohesive thread, RA is able to highlight the juxtaposing nature of the contrasting adjectives ""new"" and ""old"" and the verbs ""heard"" and ""told"". As such, RA is able to construct a time continuum that catalogues the rich and profound history of the Indigenous community through their numerous traditions and stories, whilst also extending a hand to audiences to encourage them to continue bolstering this rich history through their own contribution. In turn, RA fosters sentiments of empowerment and agency among their audience to shape the future of the not only the Indigenous community, but the alliance between the First Nations people and the broader Australian community. As such, RA induces a paradigm shift towards rectifying injustices against Aboriginal members of their past where they have been shunned by wider society, and disseminates a clarion call to audiences to change this landscape and leave their legacy. By rousing such sentiments, RA achieves their emotive function, as well as their conative function of further compelling audiences to take part in programs that will enact this goal. In conjunction with the pauses “(...)” (19) after each of these noun phrases, RA further engenders a tone of profundity and solemnity, encouraging audiences to recognise the immense gravity of this task so they take it seriously. RA employs the adverb 'Together' (45) in conjunction with the first person pronoun 'we' in ""we're shaping..."" (45) when referring to the legacy that RA aims to leave by collaborating with audiences. The inclusive nature of these lexemes assists in rousing feelings of unity among the audience, as well as bolstering a sense of solidarity and equality with Indigenous people over this shared goal to shape the future legacy of Australia. Furthermore, RA evokes values of patriotism and collective pride for Australia by pandering to Australian values of egalitarianism and concordance, in a common desire to enact change – attending to their emotive function. As such, RA poses the audience as indivisible in their future goals, unifying both the broader Australian audience with Indigenous audiences – achieving their conative function.
RA shapes their discourse to reflect their cultural context. They employ the Indigenous borrowing ""Narragunnawali"" (68, 20, 8) throughout the text. As such, RA is able to establish a degree of credibility in their familiarity with the First Nations community, fostering trust among audiences that their programs are grounded culturally. Furthermore, through the explanation via the positively connoted abstract nouns ""alive, wellbeing"" (71) such language enables them to align their brand ethos with values of the Indigenous community, such as life and community.
Numerous stylistic features coalesce into a moderately formal register that is consistent throughout all modes of the text. RA employs the abstract noun phrases ""professional learning"" and ""curriculum resources"" (14) when referring to the programs they offer. The elevated nature of this lexis raises the formality of the discourse and assists RA in establishing a degree of expertise, experience and credibility as a company, fostering trust and reliance in audiences that their programs are backed by professional insights.",7
English,English Language,Year 12,Final Exam,Post Exam Report,2024,"VCEELU3AS1,VCEELU3AS2,VCEELU4AS1,VCEELU4AS2",VCEELERC,C,ExaminerCommentary,Question 7,"In this question, students explored our perceived national identity and how language helps to demonstrate this. They also explored the circumstances in which language distinguishes key groups within contemporary Australian society and how those groups influence the changing of language in Australia.",,,1
English,English Language,Year 12,Final Exam,Post Exam Report,2024,"VCEELU3AS1,VCEELU3AS2,VCEELU4AS1,VCEELU4AS2",VCEELERC,C,EnhancedStrategies,Question 7,"Some responses explored the changing nature of Australian Englishes, such as SAE and AAE, or how ethnolects have played a role in establishing nuanced cultural communities in Australian society. Others discussed identity in terms of class, education, occupation, social status and aspirations, including other factors of personal variation such as age, gender, sexuality and interests. Core to these explorations was how the use of language changes according to the elements of identity.",,,2
English,English Language,Year 12,Final Exam,Post Exam Report,2024,"VCEELU3AS1,VCEELU3AS2,VCEELU4AS1,VCEELU4AS2",VCEELERC,C,ExaminerCommentary,Question 7,"Student responses explored the range of personal and group identities we hold and the context in which these identities are formed. How we make connections and build community in Australia can be reflected in the language that we use. The language that we use can also work to highlight power dynamics as well as play a role in defining Australian identity through features such as slang, informality and situational variation.",,,3
English,English Language,Year 12,Final Exam,Post Exam Report,2024,"VCEELU3AS1,VCEELU3AS2,VCEELU4AS1,VCEELU4AS2",VCEELERC,C,ExaminerCommentary,Question 7,"This topic allowed for an examination of how linguistic tools, such as jargon, create in-group knowledge and maintain social order. Social media’s influence on personal and shared identity was also relevant, with some responses exploring online language use, generational change and how context-specific features like emojis, punctuation and informal context-specific graphemes mirror spoken language and construct camaraderie.",,,4
English,English Language,Year 12,Final Exam,Post Exam Report,2024,"VCEELU3AS1,VCEELU3AS2,VCEELU4AS1,VCEELU4AS2",VCEELERC,C,ExaminerCommentary,Question 7,"The evolving nature of our language was central to the question, where our perceived national identity may not always match what our actual Australian identities are, with some responses considering imported linguistic elements, such as borrowings, and showing how language intersects with ethnicity, gender and other facets of identity, while addressing the tension between diversity and unity. Similarly, cultural varieties of English, including migrant ethnolects and how second-generation migrants express identity through unique English features, help to show the changing nature of language that is linked to the preservation of cultural strength.",,,5
English,English Language,Year 12,Final Exam,Post Exam Report,2024,"VCEELU3AS1,VCEELU3AS2,VCEELU4AS1,VCEELU4AS2",VCEELERC,C,EnhancedStrategies,Question 7,"Overwhelmingly, this was the most popular topic answered by students, with a large variety of acceptable approaches in responding to the question. Some higher-scoring responses spent meaningful time exploring what it means for language to actually ‘define’ our Australian identity, rather than merely reflect it.",,,6
English,English Language,Year 12,Final Exam,Post Exam Report,2024,"VCEELU3AS1,VCEELU3AS2,VCEELU4AS1,VCEELU4AS2",VCEELERC,C,LimitedStrategies,Question 7,"A notable number of responses did not explore the topic in full, not fully engaging with a discussion of the key verbs within the question – ‘defines’ and ‘changing’. These were fundamental elements of the question and required careful thought.",,,7
