SubjectArea,Subject,SubjectStreamCode,SubjectStreamName,Band,AssessmentType,AssessmentInformationDetails,AssessmentYears,UnitASCode,ExamReportCode,EQCode,SectionCode,SectionName,QuestionNumber,QuestionLabel,Marks,ContentType,Content,StimulusSource,Sequence
Business and Economics,Legal Studies,,,Year 12,Final Exam,Exam Questions,2025,"VCELSU4AS1,VCELSU4AS2",VCELS25ERB,VCELS25EQB2,B,Section B,2,Q2,18,Question,"The Victorian Charter of Human Rights and Responsibilities protects the rights of Victorians to
assemble peacefully - that is, to gather for a common purpose, such as to protest or meet.
Under section 6 of the Summary Offences Act 1966 (Vic), police and protective service officers have
the power to direct a person in a public place to 'move on' or leave the public place, but only in limited
circumstances. This power to 'move on' does not apply in relation to a person who is demonstrating or
protesting in public.
Recently, individuals and groups have called for greater control over the way in which demonstrations
are conducted.
Source
In a radio interview on 3AW with broadcaster Tom Elliott, Victorian Leader of the Opposition Brad
Battin called for the reintroduction of more extensive move-on laws, which were repealed by the
Andrews government in 2015. These laws would allow Victoria Police to move protestors on if they are
obstructing public access or causing a public nuisance. The following is an extract of the transcript of
the interview.
Tom Elliott: 	 Will you impose, perhaps, a permit system or some way of limiting protests so we
don't have to have 80 of them in a row?
Brad Battin: 	I think the most important thing here is to reintroduce our move-on laws and maybe
toughen them as well. But the focus needs to be that if someone wants to go to work,
go into a business legally, go about their normal day, then they shouldn't be disrupted
by protestors. And that includes driving down a road. Move-on laws can be put back
in place to fix that. If you start to make people get out of the way for people going
about their legal duties, then those protestors will have nowhere to protest for that.
Give them a right to protest, but they don't need to block everyone going about their
legal duties ... Let's make sure the police have the powers to move people on. That
will clear the streets, get people out of the way, and let you get back around your
normal day.
Source: Adapted from T Elliott, 'Opposition leader Brad Battin outlines his ""number one priority"" if elected in 2026', radio broadcast excerpt,
3AW Melbourne, 21 January 2025, <www.3aw.com.au/opposition-leader-brad-battin-outlines-his-number-one-priority-if-elected-in-2026>

Source
The following media release was published by the Greens political party on its website. At the time
of publication, the Greens political party held the balance of power in the Senate, holding 11 of the
76 Senate seats.
Greens push back with plan for national laws to protect the right to protest
Following attacks on the right to protest in jurisdictions around the country, the Greens will bring
national law to [the Commonwealth] Parliament to enshrine the right to protest in Australian law
'The right to protest is under assault in states and territories across the country with real impacts on
democracy and the ability to demand changes to unjust laws and policies.
'Our bill is an attempt to rebalance the scales towards justice,' Senator Shoebridge said.
Source: Adapted from Australian Greens media release, 20 December 2022,
<https://greens.org.au/news/media-release/greens-push-back-plan-national-laws-protect-right-protest>
Source
The following is an extract from The Age newspaper.
Protest too much: City leaders call out demonstration disruption
Leading candidates for Melbourne's lord mayoral race have joined calls by CBD business owners
and residents for better management of public demonstrations to reduce the disruption caused by
weekly protests and potential damage to the city's international reputation.
'I strongly support people's right to protest,' said Reece, who is serving as a stand-in lord mayor
before this month's local government elections. 'I also recognise that after 52 weeks of protests, the
disruption is significant. I am particularly worried about small businesses in the city which rely on
weekend trade to make ends meet.'
Source: Adapted from C Le Grand, 'Protest too much: City leaders call out demonstration disruption', The Age, 14 October 2024,
<www.theage.com.au/national/victoria/protest-too-much-city-leaders-call-out-demonstration-disruption-20241013-p5khum.html>
Source
The following letter to the editor appeared in an online newspaper.
Online letter to the editor
The Victorian Chamber of Commerce has called for a specific space for protest activities that would
not impede on allowing small businesses to trade. I think this is a fantastic idea. It would serve the
interests of both the community and the protesters. While I am sympathetic to the cause of many of
these protests, I am sick and tired of the impact on my daily commute. And if I know there is going to
be a protest in the city, I will avoid going in, which I know affects small-business owners.
Bill from Brunswick",,10
Business and Economics,Legal Studies,,,Year 12,Final Exam,Exam Questions,2025,"VCELSU4AS1,VCELSU4AS2",VCELS25ERB,VCELS25EQB2,B,Section B,2a,Q2a,3,SubQuestion,Explain one reason why laws relating to public protests may need to be reformed. ,,11
Business and Economics,Legal Studies,,,Year 12,Final Exam,Exam Questions,2025,"VCELSU4AS1,VCELSU4AS2",VCELS25ERB,VCELS25EQB2,B,Section B,2b,Q2b,4,SubQuestion,"Explain the impact that section 109 of the Australian Constitution will have on state
protest laws if both the Commonwealth Parliament and the Victorian Parliament
legislate on public protests. ",,12
Business and Economics,Legal Studies,,,Year 12,Final Exam,Exam Questions,2025,"VCELSU4AS1,VCELSU4AS2",VCELS25ERB,VCELS25EQB2,B,Section B,2c,Q2c,5,SubQuestion,Analyse the role of the media in influencing law reform relating to protests.,,13
Business and Economics,Legal Studies,,,Year 12,Final Exam,Exam Questions,2025,"VCELSU4AS1,VCELSU4AS2",VCELS25ERB,VCELS25EQB2,B,Section B,2d,Q2d,6,SubQuestion,"Discuss one factor that may affect the ability of parliament to reform laws relating to
protests.",,14
