SubjectArea,Subject,Band,AssessmentType,AssessmentInformationDetails,AssessmentYears,UnitASCode,ExamReportCode,SectionCode,ImplicationsHeader,ImplicationsDescription,ImplicationsStrategy,ImplicationsExample,Sequence
English,English,Year 12,Final Exam,Post Exam Report,2024,"VCEEU3AS1,VCEEU4AS1",VCEEEARA,VCEEEARAIM,Implications,,,,1
English,English,Year 12,Final Exam,Post Exam Report,2024,"VCEEU3AS1,VCEEU4AS1",VCEEEARA,VCEEEARAIM,,"Students who can demonstrate an understanding of the implications of the topics will typically develop responses that achieve higher scores.
There are often multiple implications in a topic. The following table outlines some strategies used in essay topics in 2024.",,,2
English,English,Year 12,Final Exam,Post Exam Report,2024,"VCEEU3AS1,VCEEU4AS1",VCEEEARA,VCEEEARAIM,,,By the use of absolute terms,"‘No one in My Brilliant Career is ever truly satisfied.’
Do you agree?",3
English,English,Year 12,Final Exam,Post Exam Report,2024,"VCEEU3AS1,VCEEU4AS1",VCEEEARA,VCEEEARAIM,,,"By the connotations of verbs, nouns or adjectives",How does Johnson explore different perceptions of truth in High Ground?,4
English,English,Year 12,Final Exam,Post Exam Report,2024,"VCEEU3AS1,VCEEU4AS1",VCEEEARA,VCEEEARAIM,,,By the ‘silence’ in a proposition (or quote),"‘Why should a man suffer so grievously for an offence he had committed inadvertently?’
In Things Fall Apart the consequences of actions are rarely fair.
Do you agree?",5
English,English,Year 12,Final Exam,Post Exam Report,2024,"VCEEU3AS1,VCEEU4AS1",VCEEEARA,VCEEEARAIM,,,By the use of adverbs,"‘You can trust me. I am ready to help.’
In the play, the desire to behave honourably causes suffering.
To what extent do you agree?",6
English,English,Year 12,Final Exam,Post Exam Report,2024,"VCEEU3AS1,VCEEU4AS1",VCEEEARA,VCEEEARAIM,,,By the inclusion of a quote,"‘Paradise is beneath your mother’s feet’
How does Erpenbeck explore what it means to belong?",7
