SubjectArea,Subject,Band,Unit,UnitASCode,AreaofStudy,Outcome,OutcomeCode,ExampleType,ContentType,ExampleText,ParentText,URLTitle,URL,Sequence
Science,Environmental Science,Year 12,Unit 3,VCEESU3AS2,Area of Study 2 - When is development sustainable?,Outcome 2,VCEESU3AS2O2KK,Activity,Bullet,"Case study: Provided with an environmental science case study and with the class divided into varying stakeholders (for example, local residents, council member, construction workers, environmental groups, farmers), discuss whether and how the project should proceed in order to meet the needs and concerns of the each stakeholder group, while meeting sustainability principles and regulatory frameworks. A student or teacher will need to chair whole group discussions to ensure each group has the opportunity to speak, respond and keep to required times.",,,,30
Science,Environmental Science,Year 12,Unit 3,VCEESU3AS2,Area of Study 2 - When is development sustainable?,Outcome 2,VCEESU3AS2O2KK,Activity,Bullet,"Product, process or system development: Devise a new way of measuring human or industrial environmental impact other than 'carbon footprint'.",,,,31
Science,Environmental Science,Year 12,Unit 3,VCEESU3AS2,Area of Study 2 - When is development sustainable?,Outcome 2,VCEESU3AS2O2KS,Activity,Bullet,Classification and identification: Discuss how definitions of 'sustainability' and 'ecologically sustainable development' are heavily reliant upon needs and interests of various stakeholders and that definitions may need to evolve / be adapted according to local contexts and specific development projects.,,,,32
Science,Environmental Science,Year 12,Unit 3,VCEESU3AS2,Area of Study 2 - When is development sustainable?,Outcome 2,VCEESU3AS2O2KK,Activity,Paragraph,Key knowledge: Case study evaluation,,,,33
Science,Environmental Science,Year 12,Unit 3,VCEESU3AS2,Area of Study 2 - When is development sustainable?,Outcome 2,VCEESU3AS2O2KK,Activity,Bullet,Case study: Collate scientific data that provides evidence of an organisation's environmental management strategies. Comment on how validity of the data has been demonstrated. Is there relevant historical data with which to compare this current data?,,,,34
Science,Environmental Science,Year 12,Unit 3,VCEESU3AS2,Area of Study 2 - When is development sustainable?,Outcome 2,VCEESU3AS2O2KK,Activity,Bullet,"Research a waste minimisation plan / strategy produced by your local council . Create a concept map to demonstrate the impacts to, and interactions between, the hydrosphere, lithosphere, atmosphere, and biosphere that occur due to the implementation of the plan / strategy.",,,,35
Science,Environmental Science,Year 12,Unit 3,VCEESU3AS2,Area of Study 2 - When is development sustainable?,Outcome 2,VCEESU3AS2O2KK,Activity,Bullet,Explain how the following guidelines related to sustainable fishing that were provided in a Marine Stewardship Council brochure (April 2009) meet sustainability principles:,,,,36
Science,Environmental Science,Year 12,Unit 3,VCEESU3AS2,Area of Study 2 - When is development sustainable?,Outcome 2,VCEESU3AS2O2KK,Activity,Bullet,Allows target fish populations to recover at healthy levels from past depletion,Explain how the following guidelines related to sustainable fishing that were provided in a Marine Stewardship Council brochure (April 2009) meet sustainability principles:,,,37
Science,Environmental Science,Year 12,Unit 3,VCEESU3AS2,Area of Study 2 - When is development sustainable?,Outcome 2,VCEESU3AS2O2KK,Activity,Bullet,Maintains and seeks to maximise the ecological health and abundance of marine fish,Explain how the following guidelines related to sustainable fishing that were provided in a Marine Stewardship Council brochure (April 2009) meet sustainability principles:,,,38
Science,Environmental Science,Year 12,Unit 3,VCEESU3AS2,Area of Study 2 - When is development sustainable?,Outcome 2,VCEESU3AS2O2KK,Activity,Bullet,Maintains the diversity and structure of the marine ecosystem on which it ultimately depends,Explain how the following guidelines related to sustainable fishing that were provided in a Marine Stewardship Council brochure (April 2009) meet sustainability principles:,,,39
Science,Environmental Science,Year 12,Unit 3,VCEESU3AS2,Area of Study 2 - When is development sustainable?,Outcome 2,VCEESU3AS2O2KK,Activity,Bullet,"Conforms to all local, national and international laws and regulations.",Explain how the following guidelines related to sustainable fishing that were provided in a Marine Stewardship Council brochure (April 2009) meet sustainability principles:,,,40
Science,Environmental Science,Year 12,Unit 3,VCEESU3AS2,Area of Study 2 - When is development sustainable?,Outcome 2,VCEESU3AS2O2KS,Activity,Bullet,Discuss whether carbon mitigation strategies that seek to reduce the amount of carbon in the atmosphere are more or less sustainable than adaptation strategies that seek to help reduce the effects of carbon in the atmosphere.,,,,41
Science,Environmental Science,Year 12,Unit 3,VCEESU3AS2,Area of Study 2 - When is development sustainable?,Outcome 2,VCEESU3AS2O2KK,Activity,Bullet,"Fieldwork: Survey a representative sample of your local community to ascertain the perceived advantages, disadvantages and effects of a completed local environmental science project and use appropriate graphical representations to report your findings.",,,,42
Science,Environmental Science,Year 12,Unit 3,VCEESU3AS2,Area of Study 2 - When is development sustainable?,Outcome 2,VCEESU3AS2O2KS,Activity,Bullet,"Literature review: Research and evaluate contemporary developments in sustainable greenhouses; for example, the New Scientist article Growing tomatoes using sun and seawater. Use a flowchart to summarise the processes and identify how sustainability principles apply to the development.",,,,43
Science,Environmental Science,Year 12,Unit 3,VCEESU3AS2,Area of Study 2 - When is development sustainable?,Outcome 2,VCEESU3AS2O2KK,Activity,Bullet,"Develop criteria to distinguish between strong and weak evidence and/or arguments in the evaluation of an environmental science project; for example, consider quantity and quality of evidence, reasonableness, logic, plausibility, complexity, coherence, emotional overlays, bias, clarity and balance.",,,,44
Science,Environmental Science,Year 12,Unit 3,VCEESU3AS2,Area of Study 2 - When is development sustainable?,Outcome 2,VCEESU3AS2O2KK,Activity,Bullet,"Case study: Access the two-page summary of case studies related to the management of coastal cliff instability 'Living with cliffs, Anglesea: case studies from Victoria's south-west' to discuss how solutions to management problems may be communicated to the community.",,,,45
Science,Environmental Science,Year 12,Unit 3,VCEESU3AS2,Area of Study 2 - When is development sustainable?,Outcome 2,VCEESU3AS2O2KK,Activity,Bullet,"Case study: Explore the effectiveness of environmental management strategies implemented in relation to upholding sustainability principles by looking at a case study; for example, Budj Bim Cultural Landscape and the Gunditjmara peoples' creation, manipulation and modification of local hydrological regimes and ecological systems at and environmental management.",,,,46
Science,Environmental Science,Year 12,Unit 3,VCEESU3AS2,Area of Study 2 - When is development sustainable?,Outcome 2,VCEESU3AS2O2KS,Activity,Bullet,"Case study: Evaluate an environmental science project such as the U.S. Climate Resilience Toolkit in terms of the project aims, proposed strategies to address the environmental concerns, stakeholder involvement, and methods of monitoring and evaluating the outcomes of the project. Suggest other data that could be used to evaluate the project outcomes.",,,,47
Science,Environmental Science,Year 12,Unit 3,VCEESU3AS2,Area of Study 2 - When is development sustainable?,Outcome 2,VCEESU3AS2O2KK,DetailedExample,Paragraph,Evaluation of environmental science case studies in terms of sustainability principles,,,,48
Science,Environmental Science,Year 12,Unit 3,VCEESU3AS2,Area of Study 2 - When is development sustainable?,Outcome 2,VCEESU3AS2O2KK,DetailedExampleStep,Paragraph,Introduction,,,,49
Science,Environmental Science,Year 12,Unit 3,VCEESU3AS2,Area of Study 2 - When is development sustainable?,Outcome 2,VCEESU3AS2O2KK,DetailedExampleStep,Paragraph,"Specific development project / environmental science case studies may be used to explore the sustainability principles included in the study design key knowledge. In addition, organisational aims and objectives can be examined and analysed in terms of their alignment to sustainability principles.",,,,50
Science,Environmental Science,Year 12,Unit 3,VCEESU3AS2,Area of Study 2 - When is development sustainable?,Outcome 2,VCEESU3AS2O2KK,DetailedExampleStep,Paragraph,Science skills,,,,51
Science,Environmental Science,Year 12,Unit 3,VCEESU3AS2,Area of Study 2 - When is development sustainable?,Outcome 2,VCEESU3AS2O2KS,DetailedExampleStep,Paragraph,"Teachers identify and inform students of the relevant key science skills embedded in the task, for example:",,,,52
Science,Environmental Science,Year 12,Unit 3,VCEESU3AS2,Area of Study 2 - When is development sustainable?,Outcome 2,VCEESU3AS2O2KS,DetailedExampleStep,Bullet,"Analyse and evaluate environmental science scenarios, case studies, issues and challenges using the sustainability principles of conservation of biodiversity and ecological integrity, efficiency of resource use, intergenerational equity, intragenerational equity, precautionary principle, and user pays principle",,,,53
Science,Environmental Science,Year 12,Unit 3,VCEESU3AS2,Area of Study 2 - When is development sustainable?,Outcome 2,VCEESU3AS2O2KS,DetailedExampleStep,Bullet,"Identify and explain when judgments or decisions associated with issues related to environmental science may be based on sociocultural, economic, political, legal and / or ethical factors and not solely on scientific evidence",,,,54
Science,Environmental Science,Year 12,Unit 3,VCEESU3AS2,Area of Study 2 - When is development sustainable?,Outcome 2,VCEESU3AS2O2KK,DetailedExampleStep,Bullet,"Use clear, coherent and concise expression to communicate to specific audiences and for specific purposes in appropriate scientific genres, including scientific reports and posters.",,,,55
Science,Environmental Science,Year 12,Unit 3,VCEESU3AS2,Area of Study 2 - When is development sustainable?,Outcome 2,VCEESU3AS2O2KK,DetailedExampleStep,Paragraph,"Health, safety and ethical notes",,,,56
Science,Environmental Science,Year 12,Unit 3,VCEESU3AS2,Area of Study 2 - When is development sustainable?,Outcome 2,VCEESU3AS2O2KK,DetailedExampleStep,Paragraph,"There are no specific health, safety and ethical considerations for this task.",,,,57
Science,Environmental Science,Year 12,Unit 3,VCEESU3AS2,Area of Study 2 - When is development sustainable?,Outcome 2,VCEESU3AS2O2KK,DetailedExampleStep,Paragraph,Prior learning,,,,58
Science,Environmental Science,Year 12,Unit 3,VCEESU3AS2,Area of Study 2 - When is development sustainable?,Outcome 2,VCEESU3AS2O2KK,DetailedExampleStep,Paragraph,Students should be familiar with the following concepts prior to undertaking the activity:,,,,59
Science,Environmental Science,Year 12,Unit 3,VCEESU3AS2,Area of Study 2 - When is development sustainable?,Outcome 2,VCEESU3AS2O2KK,DetailedExampleStep,Bullet,Various definitions of sustainable development,,,,60
Science,Environmental Science,Year 12,Unit 3,VCEESU3AS2,Area of Study 2 - When is development sustainable?,Outcome 2,VCEESU3AS2O2KK,DetailedExampleStep,Bullet,Range of development projects occurring within the local / broader community,,,,61
Science,Environmental Science,Year 12,Unit 3,VCEESU3AS2,Area of Study 2 - When is development sustainable?,Outcome 2,VCEESU3AS2O2KK,DetailedExampleStep,Bullet,"Environmental, social or economic needs and values relevant to these development projects",,,,62
Science,Environmental Science,Year 12,Unit 3,VCEESU3AS2,Area of Study 2 - When is development sustainable?,Outcome 2,VCEESU3AS2O2KK,DetailedExampleStep,Bullet,Variety of stakeholders invested in development projects,,,,63
Science,Environmental Science,Year 12,Unit 3,VCEESU3AS2,Area of Study 2 - When is development sustainable?,Outcome 2,VCEESU3AS2O2KK,DetailedExampleStep,Bullet,Description of the roles and values held by different stakeholders,,,,64
Science,Environmental Science,Year 12,Unit 3,VCEESU3AS2,Area of Study 2 - When is development sustainable?,Outcome 2,VCEESU3AS2O2KK,DetailedExampleStep,Bullet,Examples of regulatory frameworks that might be applicable to the development projects.,,,,65
Science,Environmental Science,Year 12,Unit 3,VCEESU3AS2,Area of Study 2 - When is development sustainable?,Outcome 2,VCEESU3AS2O2KK,DetailedExampleStep,Paragraph,Procedure,,,,66
Science,Environmental Science,Year 12,Unit 3,VCEESU3AS2,Area of Study 2 - When is development sustainable?,Outcome 2,VCEESU3AS2O2KK,DetailedExampleStep,Bullet,The teacher suggests a range of environmental case studies for the class to investigate (refer to useful resources listed below for examples of actual environmental case studies).,,,,67
Science,Environmental Science,Year 12,Unit 3,VCEESU3AS2,Area of Study 2 - When is development sustainable?,Outcome 2,VCEESU3AS2O2KK,DetailedExampleStep,Bullet,Students work in pairs or small groups to:,,,,68
Science,Environmental Science,Year 12,Unit 3,VCEESU3AS2,Area of Study 2 - When is development sustainable?,Outcome 2,VCEESU3AS2O2KK,DetailedExampleStep,Bullet,"Prepare a brief outline of three case studies organised under suitable subheadings, for example: project title; location; short description; aims / objectives; rationale for selected location; current land use; assets/sensitivities of existing environment, such as flora, fauna, landscape; cultural heritage; key stages / steps in project; potential environmental effects of construction and operation; proposed mitigation strategies; roles of key stakeholders; sustainability principles relevant to project.",Students work in pairs or small groups to:,,,69
Science,Environmental Science,Year 12,Unit 3,VCEESU3AS2,Area of Study 2 - When is development sustainable?,Outcome 2,VCEESU3AS2O2KK,DetailedExampleStep,Bullet,"Determine whether the aims / objectives of any sustainable development project generally align with sustainability principles by constructing a matrix to match each aim / objective of the development project with one or more of the following sustainability principles: intergenerational equity, intragenerational equity, conservation of biodiversity and ecological integrity, user pays principle, efficiency of resource use; precautionary principle.",Students work in pairs or small groups to:,,,70
Science,Environmental Science,Year 12,Unit 3,VCEESU3AS2,Area of Study 2 - When is development sustainable?,Outcome 2,VCEESU3AS2O2KK,DetailedExampleStep,Bullet,"Select two of the sustainability principles and explain to what extent they have been fulfilled, identifying specific steps that have been proposed / implemented.",Students work in pairs or small groups to:,,,71
Science,Environmental Science,Year 12,Unit 3,VCEESU3AS2,Area of Study 2 - When is development sustainable?,Outcome 2,VCEESU3AS2O2KK,DetailedExampleStep,Bullet,"Select three stakeholders involved in the development project and explain how their values, knowledge and priorities impact on decision-making associated with the development project.",Students work in pairs or small groups to:,,,72
Science,Environmental Science,Year 12,Unit 3,VCEESU3AS2,Area of Study 2 - When is development sustainable?,Outcome 2,VCEESU3AS2O2KS,DetailedExampleStep,Bullet,Briefly describe how any development project risks were assessed and managed.,Students work in pairs or small groups to:,,,73
Science,Environmental Science,Year 12,Unit 3,VCEESU3AS2,Area of Study 2 - When is development sustainable?,Outcome 2,VCEESU3AS2O2KK,DetailedExampleStep,Paragraph,Useful resource,,,,74
Science,Environmental Science,Year 12,Unit 3,VCEESU3AS2,Area of Study 2 - When is development sustainable?,Outcome 2,VCEESU3AS2O2KK,DetailedExampleStep,Paragraph,"Victorian State Government, Environment, Land, Water and Planning - Environment assessment",,,,75
Science,Environmental Science,Year 12,Unit 3,VCEESU3AS2,Area of Study 2 - When is development sustainable?,Outcome 2,VCEESU3AS2O2KK,DetailedExampleStep,Paragraph,Use the 'Completed projects' tab to access information about completed environmental projects and the 'Browse EES projects' for environmental projects that are currently being assessed.,,,,76
Science,Environmental Science,Year 12,Unit 3,VCEESU3AS2,Area of Study 2 - When is development sustainable?,Outcome 2,VCEESU3AS2O2KK,DetailedExampleStep,Paragraph,Teaching notes,,,,77
Science,Environmental Science,Year 12,Unit 3,VCEESU3AS2,Area of Study 2 - When is development sustainable?,Outcome 2,VCEESU3AS2O2KK,DetailedExampleStep,Bullet,"This activity can be used as a basis for an assessment task, particularly the task requiring students to analyse and evaluate 'a case study, secondary data or a media communication, with reference to sustainability principles and stakeholder perspectives'.",,,,78
Science,Environmental Science,Year 12,Unit 3,VCEESU3AS2,Area of Study 2 - When is development sustainable?,Outcome 2,VCEESU3AS2O2KK,DetailedExampleStep,Bullet,"For an assessment task, the teacher could prepare one case study relating to a specific development project. The format of this task is to be decided by the teacher and could be, for example, a written response to a set of questions, a multimodal presentation or a structured report with subheadings that links some / all of the sustainability principles to the specific development project in the prepared case study under open-book test conditions. The task should be between 50 and 70 minutes for a written response or 10 minutes for a multimodal or oral presentation. The questions or subheadings could be selected / adapted from the preliminary activities described above. While the case study might be completely fictitious or founded on a real-life example of a development project, it must be significantly different from any of the case studies already discussed in class. Students should be informed that the formal assessment task would not relate specifically to any of the environmental case studies investigated in class but rather to the stakeholder perspectives in the case study and the underlying principles of sustainability.",,,,79
Science,Environmental Science,Year 12,Unit 3,VCEESU3AS2,Area of Study 2 - When is development sustainable?,Outcome 2,VCEESU3AS2O2KK,DetailedExampleStep,Bullet,"Beth Conklin, Professor of Anthropology at Vanderbilt University in the US, offers various considerations when teaching about sustainability issues including:",,,,80
Science,Environmental Science,Year 12,Unit 3,VCEESU3AS2,Area of Study 2 - When is development sustainable?,Outcome 2,VCEESU3AS2O2KK,DetailedExampleStep,Bullet,"Investigating global environmental crises can overwhelm students when they consider the immensity of the problems humanity faces and the difficulties involved in coping with them. Teachers can engage students by discussing their definitions of happiness and a quality of life, and whether they necessarily correlate with high levels of consumption and resource use. Students should be informed of environmental policies or movements that have succeeded in mitigating pollution, conserving resources, or promoting ecological resiliency.","Beth Conklin, Professor of Anthropology at Vanderbilt University in the US, offers various considerations when teaching about sustainability issues including:",,,81
Science,Environmental Science,Year 12,Unit 3,VCEESU3AS2,Area of Study 2 - When is development sustainable?,Outcome 2,VCEESU3AS2O2KK,DetailedExampleStep,Bullet,"Providing opportunities for students to wrestle with empirical data for themselves, rather than supplying pre-digested analyses from secondary sources will enable students not only to grapple with methodological and theoretical issues of data analysis and presentation, but also to be empowered to approach environmental issues with greater insight.","Beth Conklin, Professor of Anthropology at Vanderbilt University in the US, offers various considerations when teaching about sustainability issues including:",,,82
Science,Environmental Science,Year 12,Unit 3,VCEESU3AS2,Area of Study 2 - When is development sustainable?,Outcome 2,VCEESU3AS2O2KK,DetailedExampleStep,Bullet,"Allowing time for group discussion can facilitate problem solving, debate, analysis, teamwork and reflection, which are crucial to developing the critical thinking and leadership skills that students need to face complex problems.","Beth Conklin, Professor of Anthropology at Vanderbilt University in the US, offers various considerations when teaching about sustainability issues including:",,,83
Science,Environmental Science,Year 12,Unit 3,VCEESU3AS2,Area of Study 2 - When is development sustainable?,Outcome 2,VCEESU3AS2O2KK,DetailedExampleStep,Paragraph,Adapted from Vanderbilt University's Center for Teaching.,,,,84
Science,Environmental Science,Year 12,Unit 4,VCEESU4,,,,,UnitHeading,Unit 4: : How can climate change and the impacts of human energy use be managed?,,,,1
Science,Environmental Science,Year 12,Unit 4,VCEESU4AS1,Area of Study 1 - How can we respond to climate change?,Outcome 1,,,OutcomeHeading,Outcome 1,,,,1
Science,Environmental Science,Year 12,Unit 4,VCEESU4AS1,Area of Study 1 - How can we respond to climate change?,Outcome 1,,,OutcomeDescription,"On completion of this unit the student should be able to analyse the major factors that affect Earth's climate, explain how past and future climate variability can be measured and modelled, and evaluate options for managing climate change.",,,,2
Science,Environmental Science,Year 12,Unit 4,VCEESU4AS1,Area of Study 1 - How can we respond to climate change?,Outcome 1,,,SectionHeading,Examples of learning activities,,,,3
Science,Environmental Science,Year 12,Unit 4,VCEESU4AS1,Area of Study 1 - How can we respond to climate change?,Outcome 1,VCEESU4AS1O1KK,Activity,Paragraph,Key knowledge: Major factors that affect Earth's climate,,,,4
Science,Environmental Science,Year 12,Unit 4,VCEESU4AS1,Area of Study 1 - How can we respond to climate change?,Outcome 1,VCEESU4AS1O1KK,Activity,Bullet,Explore the concept of 'Earth's energy balance' by:,,,,5
Science,Environmental Science,Year 12,Unit 4,VCEESU4AS1,Area of Study 1 - How can we respond to climate change?,Outcome 1,VCEESU4AS1O1KK,Activity,Bullet,Viewing the animation on NASA's Global Climate Change page,Explore the concept of 'Earth's energy balance' by:,,,6
Science,Environmental Science,Year 12,Unit 4,VCEESU4AS1,Area of Study 1 - How can we respond to climate change?,Outcome 1,VCEESU4AS1O1KK,Activity,Bullet,"Considering the quantitative information about the percentage of energy from the Sun that is absorbed and reflected by Earth's surface (land and oceans) and scattered, reflected and absorbed by Earth's atmosphere by modelling energy balance using the activity at Earth's Energy Budget Activity available as one of many climate-related activities at EarthLabs (note: the diagram at the old website which is not being updated at Earth's Energy Balance is also a useful reference for this activity).",Explore the concept of 'Earth's energy balance' by:,,,7
Science,Environmental Science,Year 12,Unit 4,VCEESU4AS1,Area of Study 1 - How can we respond to climate change?,Outcome 1,VCEESU4AS1O1KK,Activity,Bullet,"Access Lesson 4, Climate: A balancing Act to explore factors that affect Earth's energy balance, including an animation of a volcanic eruption.",Explore the concept of 'Earth's energy balance' by:,,,8
Science,Environmental Science,Year 12,Unit 4,VCEESU4AS1,Area of Study 1 - How can we respond to climate change?,Outcome 1,VCEESU4AS1O1KK,Activity,Bullet,"Use a problem-based approach to investigate the effects that changes in the ozone layer would have on penguin populations by accessing information from The International Symposium on Environmental Issues (Sydney). In groups of three, with each taking on a role of a life scientist, a physical scientist or an Earth scientist, develop a response to the questions, 'Is there a relationship between the ozone layer and phytoplankton?' and 'What effects would changes in the ozone layer have on Antarctica's penguin population?' Groups may present their findings to a 'symposium'.",,,,9
Science,Environmental Science,Year 12,Unit 4,VCEESU4AS1,Area of Study 1 - How can we respond to climate change?,Outcome 1,VCEESU4AS1O1KK,Activity,Bullet,Controlled experiment: Design and perform and experiment to determining which absorbs more heat - land or water.,,,,10
Science,Environmental Science,Year 12,Unit 4,VCEESU4AS1,Area of Study 1 - How can we respond to climate change?,Outcome 1,VCEESU4AS1O1KK,Activity,Bullet,"Calculate absolute change (magnitude), percentage change and average rate of change in carbon dioxide concentrations during students' time at secondary school (for example, approximately five years, from January 2015 to January 2020) using NASA data source.",,,,11
Science,Environmental Science,Year 12,Unit 4,VCEESU4AS1,Area of Study 1 - How can we respond to climate change?,Outcome 1,VCEESU4AS1O1KK,Activity,Bullet,"Use NASA's 'Earth Math' as a source of climate data analysis questions (relevant activities include: 20, 21, 22, 24, 25, 26, with answer schemes provided).",,,,12
Science,Environmental Science,Year 12,Unit 4,VCEESU4AS1,Area of Study 1 - How can we respond to climate change?,Outcome 1,VCEESU4AS1O1KK,Activity,Bullet,Controlled experiment: Design an investigation to measure the albedo effect.,,,,13
