SubjectArea,Subject,Band,Unit,UnitASCode,AreaofStudy,Outcome,OutcomeCode,ExampleType,ContentType,ExampleText,ParentText,URLTitle,URL,Sequence
Science,Environmental Science,,,,,,,,Header,,Science - Environmental Science,Environmental Science - Teaching and Learning,https://www.vcaa.vic.edu.au/curriculum/vce-curriculum/vce-study-designs/environmental-science/teaching-and-learning-0,0
Science,Environmental Science,Year 11,Unit 1,VCEESU1,,,,,UnitHeading,Unit 1: How are Earth's dynamic systems interconnected to support life?,,,,1
Science,Environmental Science,Year 11,Unit 1,VCEESU1AS1,Area of Study 1 - How are Earth's systems organised and connected?,Outcome 1,,,OutcomeHeading,Outcome 1,,,,1
Science,Environmental Science,Year 11,Unit 1,VCEESU1AS1,Area of Study 1 - How are Earth's systems organised and connected?,Outcome 1,,,OutcomeDescription,"On completion of this unit the student should be able to describe the movement of energy and nutrients across Earth's four interrelated systems, and analyse how dynamic interactions among biotic and abiotic components of selected local and regional ecosystems contribute to their capacity to support life and sustain ecological integrity.",,,,2
Science,Environmental Science,Year 11,Unit 1,VCEESU1AS1,Area of Study 1 - How are Earth's systems organised and connected?,Outcome 1,,,SectionHeading,Examples of learning activities,,,,3
Science,Environmental Science,Year 11,Unit 1,VCEESU1AS1,Area of Study 1 - How are Earth's systems organised and connected?,Outcome 1,VCEESU1AS1O1KK,Activity,Paragraph,Key knowledge: Investigation of local ecosystems,,,,4
Science,Environmental Science,Year 11,Unit 1,VCEESU1AS1,Area of Study 1 - How are Earth's systems organised and connected?,Outcome 1,VCEESU1AS1O1KK,Activity,Bullet,"Fieldwork: Conduct a field study on the ecology of a habitat to produce valid data, including the use of quadrats and transects, to assess the abundance and distribution of organisms, including introduced species, and the measurement of specific abiotic factors; for example, solar energy input, climatic factors, topography and oxygen availability.",,,,5
Science,Environmental Science,Year 11,Unit 1,VCEESU1AS1,Area of Study 1 - How are Earth's systems organised and connected?,Outcome 1,VCEESU1AS1O1KK,Activity,Bullet,"Fieldwork: Conduct a nature scavenger hunt/bingo game where students work in pairs to take photographs that illustrate relationships between the biotic and abiotic components of a particular environment, taking safety precautions and following ethical guidelines in observing and handling living things. Relationships to be photographed in a bush environment may include, for example: a sign of insect activity (holes in leaves, anthills, tunneling in logs, empty caterpillar nests, plant galls, insect egg cases); a spider web with a trapped insect; an animal home or shelter; a sign of an animal having eaten something; a flower with a bee or other insect on it; seeds that could be dispersed by the wind; seeds that could be dispersed by animals (stuck to fur or ingested). Students may also take a photograph that illustrates a relationship not included in the scavenger hunt / bingo game. Students should annotate their photographs to explain the ecosystem relationships.",,,,6
Science,Environmental Science,Year 11,Unit 1,VCEESU1AS1,Area of Study 1 - How are Earth's systems organised and connected?,Outcome 1,VCEESU1AS1O1KS,Activity,Bullet,"Compare class observations of a single environmental phenomenon or ecosystem component and discuss why careful observation is important in scientific investigations; comment on the quote from Johann Wolfgang von Goethe (1749-1832) German poet, dramatist: 'We see only what we know'.",,,,7
Science,Environmental Science,Year 11,Unit 1,VCEESU1AS1,Area of Study 1 - How are Earth's systems organised and connected?,Outcome 1,VCEESU1AS1O1KK,Activity,Bullet,Classification and identification: Explore the questions: 'What is an ecosystem?' How are ecosystems different / similar in different parts of Earth - what structures / components (abiotic and biotic) and processes (interrelationships) do they have in common? Which are unique?,,,,8
Science,Environmental Science,Year 11,Unit 1,VCEESU1AS1,Area of Study 1 - How are Earth's systems organised and connected?,Outcome 1,VCEESU1AS1O1KS,Activity,Bullet,Conduct experiments to measure and compare abiotic and biotic factors in two different habitats in your schoolground.,,,,9
Science,Environmental Science,Year 11,Unit 1,VCEESU1AS1,Area of Study 1 - How are Earth's systems organised and connected?,Outcome 1,VCEESU1AS1O1KK,Activity,Bullet,"Record the population growth of duckweed (Lemna major) over a three-week period, generate and graph data, and discuss results in relation to the concept of 'carrying capacity'.",,,,10
Science,Environmental Science,Year 11,Unit 1,VCEESU1AS1,Area of Study 1 - How are Earth's systems organised and connected?,Outcome 1,VCEESU1AS1O1KS,Activity,Bullet,"Controlled experiment: Design and perform experiments to compare the quality of different water samples: pH; temperature; dissolved oxygen content; total dissolved solids; salinity; turbidity; nutrients in terms of nitrates, phosphates, sulfates; biological indicators in terms of various measures of macroinvertebrate or fish diversity.",,,,11
Science,Environmental Science,Year 11,Unit 1,VCEESU1AS1,Area of Study 1 - How are Earth's systems organised and connected?,Outcome 1,VCEESU1AS1O1KK,Activity,Bullet,Investigate changes in an abiotic factor on the survival of an organism.,,,,12
Science,Environmental Science,Year 11,Unit 1,VCEESU1AS1,Area of Study 1 - How are Earth's systems organised and connected?,Outcome 1,VCEESU1AS1O1KS,Activity,Bullet,Analyse and relate the measurement of specific abiotic factors to the distribution of organisms in a selected ecosystem.,,,,13
Science,Environmental Science,Year 11,Unit 1,VCEESU1AS1,Area of Study 1 - How are Earth's systems organised and connected?,Outcome 1,VCEESU1AS1O1KS,Activity,Bullet,Correlational study: Analyse and relate the measurement of specific abiotic factors to the distribution of organisms in a selected ecosystem.,,,,14
Science,Environmental Science,Year 11,Unit 1,VCEESU1AS1,Area of Study 1 - How are Earth's systems organised and connected?,Outcome 1,VCEESU1AS1O1KK,Activity,Bullet,Correlational study: Investigate the distribution patterns of mosses and algae in relation to orientation and altitude.,,,,15
Science,Environmental Science,Year 11,Unit 1,VCEESU1AS1,Area of Study 1 - How are Earth's systems organised and connected?,Outcome 1,VCEESU1AS1O1KS,Activity,Bullet,Classification and identification: Discuss what determines the classification of a plant as a 'weed': use the example of Echium plantagineum which is generally known as 'Paterson's curse' but in South Australia is called 'Salvation Jane'.,,,,16
Science,Environmental Science,Year 11,Unit 1,VCEESU1AS1,Area of Study 1 - How are Earth's systems organised and connected?,Outcome 1,VCEESU1AS1O1KK,Activity,Bullet,Fieldwork: Undertake fieldwork in a local environment involving sampling techniques and the use of quadrats and transects to investigate ecosystem relationships and functioning; for example:,,,,17
Science,Environmental Science,Year 11,Unit 1,VCEESU1AS1,Area of Study 1 - How are Earth's systems organised and connected?,Outcome 1,VCEESU1AS1O1KK,Activity,Bullet,Patterns of growth under trees,Fieldwork: Undertake fieldwork in a local environment involving sampling techniques and the use of quadrats and transects to investigate ecosystem relationships and functioning; for example:,,,18
Science,Environmental Science,Year 11,Unit 1,VCEESU1AS1,Area of Study 1 - How are Earth's systems organised and connected?,Outcome 1,VCEESU1AS1O1KK,Activity,Bullet,Distribution of flowering plants in a field,Fieldwork: Undertake fieldwork in a local environment involving sampling techniques and the use of quadrats and transects to investigate ecosystem relationships and functioning; for example:,,,19
Science,Environmental Science,Year 11,Unit 1,VCEESU1AS1,Area of Study 1 - How are Earth's systems organised and connected?,Outcome 1,VCEESU1AS1O1KK,Activity,Bullet,"Distribution of lichens, algae or moss on trees, rocks and other surfaces",Fieldwork: Undertake fieldwork in a local environment involving sampling techniques and the use of quadrats and transects to investigate ecosystem relationships and functioning; for example:,,,20
Science,Environmental Science,Year 11,Unit 1,VCEESU1AS1,Area of Study 1 - How are Earth's systems organised and connected?,Outcome 1,VCEESU1AS1O1KK,Activity,Bullet,Leaf size in plants growing in different light or soil conditions,Fieldwork: Undertake fieldwork in a local environment involving sampling techniques and the use of quadrats and transects to investigate ecosystem relationships and functioning; for example:,,,21
Science,Environmental Science,Year 11,Unit 1,VCEESU1AS1,Area of Study 1 - How are Earth's systems organised and connected?,Outcome 1,VCEESU1AS1O1KK,Activity,Bullet,Distribution patterns of mosses and algae in relation to orientation and altitude.,Fieldwork: Undertake fieldwork in a local environment involving sampling techniques and the use of quadrats and transects to investigate ecosystem relationships and functioning; for example:,,,22
Science,Environmental Science,Year 11,Unit 1,VCEESU1AS1,Area of Study 1 - How are Earth's systems organised and connected?,Outcome 1,VCEESU1AS1O1KK,Activity,Bullet,"Record the population of duckweed (Lemna major) over a three-week period; generate and graph data, and recognise carrying capacity. Students may set up different environmental conditions (for example, added nitrate, phosphate, sulfate) to compare with a 'control'.",,,,23
Science,Environmental Science,Year 11,Unit 1,VCEESU1AS1,Area of Study 1 - How are Earth's systems organised and connected?,Outcome 1,VCEESU1AS1O1KK,Activity,Bullet,"Explore the ways in which Aboriginal and Torres Strait Islander peoples have managed water as an important abiotic resource in their environment, using the Queensland Government report, How did Aboriginal peoples manage their water resources?",,,,24
Science,Environmental Science,Year 11,Unit 1,VCEESU1AS1,Area of Study 1 - How are Earth's systems organised and connected?,Outcome 1,VCEESU1AS1O1KS,Activity,Bullet,"Controlled experiment: Design and perform experiments to compare the properties of different types of soils: water permeability; water content; pH; salinity; ability for different seeds to germinate; percentage organic matter in terms of nitrate, sulfate or phosphate content.",,,,25
Science,Environmental Science,Year 11,Unit 1,VCEESU1AS1,Area of Study 1 - How are Earth's systems organised and connected?,Outcome 1,VCEESU1AS1O1KS,Activity,Bullet,"Controlled experiment: Design and perform experiments to compare the quality of different soil samples: pH; salinity; available water capacity; infiltration; aggregate stability (for example, capacity of a soil to withstand raindrops); earthworms; soil enzymes; total organic carbon content; particulate organic matter content; nutrients in terms of nitrates, phosphates, sulfates.",,,,26
Science,Environmental Science,Year 11,Unit 1,VCEESU1AS1,Area of Study 1 - How are Earth's systems organised and connected?,Outcome 1,VCEESU1AS1O1KK,Activity,Bullet,"Prepare a soil mixture (for example, using compost, vermiculite, black earth, top soil, mushroom mulch, peat moss, manure, loam and / or sand) for a selected plant species, based on analysis of the requirements for optimal growth for that species (for example, tomato plants, wheat, avocado, banksia, murnong / yam daisy, native raspberry).",,,,27
Science,Environmental Science,Year 11,Unit 1,VCEESU1AS1,Area of Study 1 - How are Earth's systems organised and connected?,Outcome 1,VCEESU1AS1O1KK,Activity,Bullet,Correlational study: Investigate the motion of fallen seeds; explain how the motion is related to survival of the species.,,,,28
Science,Environmental Science,Year 11,Unit 1,VCEESU1AS1,Area of Study 1 - How are Earth's systems organised and connected?,Outcome 1,VCEESU1AS1O1KK,Activity,Bullet,Devise an investigation to test an explanation of how seeds can spread over wide distances.,,,,29
Science,Environmental Science,Year 11,Unit 1,VCEESU1AS1,Area of Study 1 - How are Earth's systems organised and connected?,Outcome 1,VCEESU1AS1O1KS,Activity,Bullet,"Use a hand lens to compare the textures of different rock types; for example, igneous rocks (granite, obsidian, basalt, gabbro); metamorphic (slate, marble, quartzite, gneiss, schist) and sedimentary (limestone, sandstone, conglomerate, shale, gypsum); test the properties of different rocks (for example, porosity; ability to be abraded; hardness) and link to their use in society.",,,,30
Science,Environmental Science,Year 11,Unit 1,VCEESU1AS1,Area of Study 1 - How are Earth's systems organised and connected?,Outcome 1,VCEESU1AS1O1KK,Activity,Bullet,"Fieldwork: Visit a local geological setting (for example, river / stream bed, a rock outcrop) and identify and classify rock samples collected from that area; discuss the importance of replacing rocks in their natural setting after they have been identified and classified as part of fieldwork investigations.",,,,31
Science,Environmental Science,Year 11,Unit 1,VCEESU1AS1,Area of Study 1 - How are Earth's systems organised and connected?,Outcome 1,VCEESU1AS1O1KK,Activity,Bullet,"Controlled experiment: Plan and conduct an investigation to determine the factors that affect the size and form of mineral crystals such as copper(II) sulfate; for example, the temperature of the salt solution, the type of salt that will form the crystal, or the level of saturation of the salt solution.",,,,32
Science,Environmental Science,Year 11,Unit 1,VCEESU1AS1,Area of Study 1 - How are Earth's systems organised and connected?,Outcome 1,VCEESU1AS1O1KK,Activity,Bullet,"As Earth's natural resources are depleted, researchers are studying the feasibility of using space mining to supplement these resources. Potential candidates for space mining include asteroids and other bodies in the solar system that are thought to contain rich sources of minerals. Discuss the environmental, technological, economic, legal and ethical aspects of space mining as a source of minerals and raw materials for Earth.",,,,33
Science,Environmental Science,Year 11,Unit 1,VCEESU1AS1,Area of Study 1 - How are Earth's systems organised and connected?,Outcome 1,VCEESU1AS1O1KK,Activity,Bullet,"Simulation: Use videos and interactives such as the materials found at the National Geographic website to distinguish between terms related to ecological relationships: competition, predation, symbiosis, mutualism, commensalism, and parasitism.",,,,34
Science,Environmental Science,Year 11,Unit 1,VCEESU1AS1,Area of Study 1 - How are Earth's systems organised and connected?,Outcome 1,VCEESU1AS1O1KK,Activity,Bullet,"Classification and identification: How is a habitat different from an ecosystem? Or a biome? Or the biosphere (global ecosystem)? Explain or illustrate the various degrees of scale, both spatial and temporal.",,,,35
Science,Environmental Science,Year 11,Unit 1,VCEESU1AS1,Area of Study 1 - How are Earth's systems organised and connected?,Outcome 1,VCEESU1AS1O1KK,Activity,Bullet,"Construct a table to show the differences and similarities between food chains, food webs, energy pyramids and biomass pyramids: when are each useful? Which of these illustrates dynamic interactions?",,,,36
Science,Environmental Science,Year 11,Unit 1,VCEESU1AS1,Area of Study 1 - How are Earth's systems organised and connected?,Outcome 1,VCEESU1AS1O1KS,Activity,Bullet,Discuss the role of decomposers in ecosystems.,,,,37
Science,Environmental Science,Year 11,Unit 1,VCEESU1AS1,Area of Study 1 - How are Earth's systems organised and connected?,Outcome 1,VCEESU1AS1O1KK,Activity,Bullet,"Fieldwork: Explain how a variety of sampling techniques (for example, quadrat sampling, catch-and-release, core sampling to measure tree rings, counting annuli in scales to measure the age of fish) are used to collect information about ecosystems; plan a field trip that requires the use of sampling techniques to respond to a question of interest about ecosystem functioning or relationships.",,,,38
Science,Environmental Science,Year 11,Unit 1,VCEESU1AS1,Area of Study 1 - How are Earth's systems organised and connected?,Outcome 1,VCEESU1AS1O1KS,Activity,Bullet,"Modelling: Deconstruct an established food web to identify a single food chain; visually represent the selected food chain by creating a mouth-in-mouth collage or string of dangling discs; for example, Food Chain Collage at Pinterest.",,,,39
Science,Environmental Science,Year 11,Unit 1,VCEESU1AS1,Area of Study 1 - How are Earth's systems organised and connected?,Outcome 1,VCEESU1AS1O1KK,Activity,Bullet,Explore applications of the use of food webs at The Nature Education website.,,,,40
Science,Environmental Science,Year 11,Unit 1,VCEESU1AS1,Area of Study 1 - How are Earth's systems organised and connected?,Outcome 1,VCEESU1AS1O1KK,Activity,Bullet,"Modelling: Create a food web for a selected ecosystem (for example, a river using creature cards) and string.",,,,41
Science,Environmental Science,Year 11,Unit 1,VCEESU1AS1,Area of Study 1 - How are Earth's systems organised and connected?,Outcome 1,VCEESU1AS1O1KK,Activity,Bullet,"Simulation: Use an online simulation to explore food web relationships; for example, Australian grassland, and Anyflip worksheets.",,,,42
Science,Environmental Science,Year 11,Unit 1,VCEESU1AS1,Area of Study 1 - How are Earth's systems organised and connected?,Outcome 1,VCEESU1AS1O1KK,Activity,Bullet,Literature review: Investigate the importance of keystone species in ecosystems. Refer to Greentumble's 12 examples.,,,,43
Science,Environmental Science,Year 11,Unit 1,VCEESU1AS1,Area of Study 1 - How are Earth's systems organised and connected?,Outcome 1,VCEESU1AS1O1KK,Activity,Bullet,Investigate mistletoe as a parasitic species on the ABC site: 'Unveiling the misunderstood magical mistletoes of Australia'.,,,,44
Science,Environmental Science,Year 11,Unit 1,VCEESU1AS1,Area of Study 1 - How are Earth's systems organised and connected?,Outcome 1,VCEESU1AS1O1KK,Activity,Bullet,Case study: Use Ecological communities: Networks of Interacting Species as a source of examples of different feeding relationships in food webs.,,,,45
Science,Environmental Science,Year 11,Unit 1,VCEESU1AS1,Area of Study 1 - How are Earth's systems organised and connected?,Outcome 1,VCEESU1AS1O1KK,Activity,Bullet,Biomass pyramids and energy pyramids are two types of ecological 'infographics' used by scientists to represent the relationships among elements in a food chain. Access the resource on the Sciencing website to find out how scientists can use these kinds of biological pyramids to determine the health of plant and animal populations by using pictures to represent concrete measurements of an ecosystem's parts.,,,,46
Science,Environmental Science,Year 11,Unit 1,VCEESU1AS1,Area of Study 1 - How are Earth's systems organised and connected?,Outcome 1,VCEESU1AS1O1KK,Activity,Bullet,Simulation: Access an interactive program such as 'Exploring biomass pyramids' to collect and analyse data from a virtual river to construct biomass and energy pyramids.,,,,47
Science,Environmental Science,Year 11,Unit 1,VCEESU1AS1,Area of Study 1 - How are Earth's systems organised and connected?,Outcome 1,VCEESU1AS1O1KK,Activity,Bullet,Correlational study: Set up two aquaria with leaf litter and place worms into one of these. Observe the changes in the tank over time: Does the leaf litter in each aquarium decompose at the same rate? Where does the matter go? Where does the energy go?,,,,48
Science,Environmental Science,Year 11,Unit 1,VCEESU1AS1,Area of Study 1 - How are Earth's systems organised and connected?,Outcome 1,VCEESU1AS1O1KK,Activity,Bullet,Select an ecosystem and create an infographic to visualise how the E.A.R. conditions / requirements are met:,,,,49
Science,Environmental Science,Year 11,Unit 1,VCEESU1AS1,Area of Study 1 - How are Earth's systems organised and connected?,Outcome 1,VCEESU1AS1O1KK,Activity,Bullet,E: there must be a constant supply of energy,Select an ecosystem and create an infographic to visualise how the E.A.R. conditions / requirements are met:,,,50
Science,Environmental Science,Year 11,Unit 1,VCEESU1AS1,Area of Study 1 - How are Earth's systems organised and connected?,Outcome 1,VCEESU1AS1O1KK,Activity,Bullet,A: there must be living organisms that can convert energy into useable forms,Select an ecosystem and create an infographic to visualise how the E.A.R. conditions / requirements are met:,,,51
Science,Environmental Science,Year 11,Unit 1,VCEESU1AS1,Area of Study 1 - How are Earth's systems organised and connected?,Outcome 1,VCEESU1AS1O1KK,Activity,Bullet,R: there must be a recycling of energy and nutrients among organisms and their environment.,Select an ecosystem and create an infographic to visualise how the E.A.R. conditions / requirements are met:,,,52
Science,Environmental Science,Year 11,Unit 1,VCEESU1AS1,Area of Study 1 - How are Earth's systems organised and connected?,Outcome 1,VCEESU1AS1O1KK,Activity,Bullet,"Product, process or system development: Construct a Winogradsky column - a simple device for constructing a stratified ecosystem-that illustrates different types of microbial metabolism in a colourful way. After construction, the column may be observed once a week over the course of a number of weeks. Students may set up different columns to investigate different questions related to microbial survival in different environments. A single column that is half covered with foil on one side (lengthways on the bottle) to investigate the effects of high and low light intensity may be set up. References such as the Winogradsky Column (1) and Winogradsky Column (2) provide suggested procedures involving the testing of different nutrient environments that are readily adapted to individual schools.",,,,53
Science,Environmental Science,Year 11,Unit 1,VCEESU1AS1,Area of Study 1 - How are Earth's systems organised and connected?,Outcome 1,VCEESU1AS1O1KK,Activity,Bullet,"Controlled experiment: Design and perform tests to investigate the effectiveness of natural products, such as peppermint oil, lemongrass, eucalyptus oil, lavender and thyme, as insect repellants; for example, using raw fruit slices compared with fruit slices covered with the natural products and observing and recording insect behaviour.",,,,54
Science,Environmental Science,Year 11,Unit 1,VCEESU1AS1,Area of Study 1 - How are Earth's systems organised and connected?,Outcome 1,VCEESU1AS1O1KK,Activity,Bullet,Correlational study: Design and conduct an investigation to determine if areas with high plant diversity also have high animal diversity.,,,,55
Science,Environmental Science,Year 11,Unit 1,VCEESU1AS1,Area of Study 1 - How are Earth's systems organised and connected?,Outcome 1,VCEESU1AS1O1KK,Activity,Bullet,"Controlled experiment: Design and perform experiments to investigate ecosystem functioning and relationships, for example:",,,,56
Science,Environmental Science,Year 11,Unit 1,VCEESU1AS1,Area of Study 1 - How are Earth's systems organised and connected?,Outcome 1,VCEESU1AS1O1KK,Activity,Bullet,What is the effect of soil salinity on the germination of food crops?,"Controlled experiment: Design and perform experiments to investigate ecosystem functioning and relationships, for example:",,,57
Science,Environmental Science,Year 11,Unit 1,VCEESU1AS1,Area of Study 1 - How are Earth's systems organised and connected?,Outcome 1,VCEESU1AS1O1KK,Activity,Bullet,"Do particular plants repel insects such as cockroaches, flies, ants or beetles?","Controlled experiment: Design and perform experiments to investigate ecosystem functioning and relationships, for example:",,,58
Science,Environmental Science,Year 11,Unit 1,VCEESU1AS1,Area of Study 1 - How are Earth's systems organised and connected?,Outcome 1,VCEESU1AS1O1KK,Activity,Bullet,Do different wavelengths of light affect the rate of photosynthesis?,"Controlled experiment: Design and perform experiments to investigate ecosystem functioning and relationships, for example:",,,59
Science,Environmental Science,Year 11,Unit 1,VCEESU1AS1,Area of Study 1 - How are Earth's systems organised and connected?,Outcome 1,VCEESU1AS1O1KK,Activity,Bullet,Does fluoridated water affect the rate of photosynthesis in plants?,"Controlled experiment: Design and perform experiments to investigate ecosystem functioning and relationships, for example:",,,60
Science,Environmental Science,Year 11,Unit 1,VCEESU1AS1,Area of Study 1 - How are Earth's systems organised and connected?,Outcome 1,VCEESU1AS1O1KK,Activity,Bullet,"Design a landscaping project for an area in the school or community (for example, a rooftop garden, a plot in a community garden, a landscape that requires restoration), taking into account local conditions (for example, soil composition, prevailing winds, amount of sunlight and rainfall), and propose a course of action to ensure the sustainability of the project over time and its interaction with the surrounding environment (for example, companion planting, the use of natural fertilisers, the use of native and indigenous plant species, the inclusion of plants that attract pollinators).",,,,61
Science,Environmental Science,Year 11,Unit 1,VCEESU1AS1,Area of Study 1 - How are Earth's systems organised and connected?,Outcome 1,VCEESU1AS1O1KK,Activity,Paragraph,Key knowledge: Earth systems thinking,,,,62
Science,Environmental Science,Year 11,Unit 1,VCEESU1AS1,Area of Study 1 - How are Earth's systems organised and connected?,Outcome 1,VCEESU1AS1O1KK,Activity,Bullet,Simulation: Introduce 'systems thinking' by being part of a class 'Triangular Connections' simulation activity. (Detailed example 1),,,,63
